Ticker,Empresa,Resumo,Site,setor_original,Setor,PL,PVP,ROE,DivYield,MarketCap,Preco,Categoria,Score,LucroPorAcao,PrecoJusto,Desconto_%,Ranking,Risco,Risco_num,Farol
BSLI4,BRB BANCO   PN,"O BRB - Banco de Brasília S.A. atua nas atividades de crédito, financiamento e investimento para clientes pessoas físicas e jurídicas no Brasil. A empresa envolvida na distribuição de valores mobiliários e gestão de fundos, cartões de crédito, seguros e prestação de outros serviços relacionados. A empresa era anteriormente conhecida como Banco regional de Brasília SA BRB e mudou seu nome para BRB - Banco de Brasília S.A. em janeiro de 1986. O BRB - Banco de Brasília S.A. foi constituído em 1964 e está sediado em Brasília, Brasil.",https://www.brb.com.br,Financial Services,Serviços Financeiros,1.9405941,0.4782821,0.25134,0.16219999999999998,2019644132.9078102,3.9200000762939453,Small Caps,85,2.019999997059635,30.299999955894528,87.06,58.0,Baixo,,🟢
BSLI3,BRB BANCO   ON,"O BRB - Banco de Brasília S.A. atua nas atividades de crédito, financiamento e investimento para clientes pessoas físicas e jurídicas no Brasil. A empresa envolvida na distribuição de valores mobiliários e gestão de fundos, cartões de crédito, seguros e prestação de outros serviços relacionados. A empresa era anteriormente conhecida como Banco regional de Brasília SA BRB e mudou seu nome para BRB - Banco de Brasília S.A. em janeiro de 1986. O BRB - Banco de Brasília S.A. foi constituído em 1964 e está sediado em Brasília, Brasil.",https://www.brb.com.br,Financial Services,Serviços Financeiros,1.980198,0.48804295,0.25134,0.1456,1944724348.0,4.0,Small Caps,85,2.0200000202000004,30.300000303000004,86.8,58.0,Baixo,,🟢
BNBR3,NORD BRASIL ON,"O Banco do Nordeste do Brasil S.A. atua como um banco de desenvolvimento regional na América Latina. Atua por meio dos segmentos Carteira Própria e FNE. A empresa oferece contas de poupança, depósitos à vista e a prazo e custódia de títulos; crédito especializado; crédito para infra-estruturas e microfinanciamento urbano e rural; e serviços de cobrança e cartões de crédito. Atua também na estruturação e distribuição de valores mobiliários, como debêntures, notas promissórias, certificados de recebíveis imobiliários, fundos de investimento; administração de recursos de terceiros, consistindo na administração de fundos de investimento; operações cambiais; gestão de carteira e análise de crédito; e transferências eletrônicas. Atende empresas corporativas, grandes, médias, pequenas e microempresas; agroindústria, produtores rurais e agricultura familiar; sectores de microfinanças urbanas e rurais; entidades representativas; indivíduos; e instituições da administração pública direta e indireta. A empresa atua por meio de pontos de atendimento físicos, incluindo agências e unidades de microcrédito. O Banco do Nordeste do Brasil S.A. foi fundado em 1952 e está sediado em Fortaleza, Brasil.",https://www.bnb.gov.br,Financial Services,Serviços Financeiros,3.8892446,0.7464154,0.20545,0.0567,11992019625.0,121.5,Mid Caps,100,31.239999664716382,468.59999497074574,74.07,58.0,Baixo,,🟢
BAZA3,AMAZONIA    ON,"O Banco da Amazônia S.A. fornece produtos e serviços bancários na região amazônica do Brasil. A empresa oferece contas poupança, corrente, simplificada e salário; cartões de crédito; produtos de capitalização; vários empréstimos pessoais e empresariais; planos de pensões; fundos de investimento, certificados de depósitos bancários e recibos de depósitos e cartas de crédito do agronegócio; produtos de seguros; e débito direto e serviços financeiros online. Também oferece programas de financiamento para agricultura familiar, máquinas e equipamentos, atividades rurais e de biodiversidade, caminhões, energia verde, negócios e infraestrutura verdes e investimentos rurais e não rurais, bem como atividades de ciência, tecnologia e inovação; fundo de desenvolvimento e marinha mercante; capital de giro; comércio exterior; e serviços de poupança para pessoas jurídicas, cobrança, adiantamento de cartão, cheque comercial, débito automático, mensagens de celular e domicílio bancário. A empresa foi fundada em 1942 e está sediada em Belém, Brasil.",https://www.bancoamazonia.com.br,Financial Services,Serviços Financeiros,3.9503105,0.63639647,0.15239,0.09699999999999999,4634901501.30764,82.68000030517578,Small Caps,85,20.930000389887272,313.9500058483091,73.66,52.0,Baixo,,🟢
SUZB3,SUZANO S.A. ON  ATZ NM,"A Suzano S.A. fabrica e comercializa produtos de celulose e papel no Brasil e internacionalmente. Atua em dois segmentos, Celulose e Papel. A empresa oferece papéis de impressão e escrita revestidos e não revestidos, cartões, papéis tissue e celuloses de mercado e fluff. Também se dedica à pesquisa, desenvolvimento e produção de biocombustíveis; operação de terminais portuários; atividades de pesquisa e desenvolvimento em biotecnologia e polpas nanocristalinas; negócios de geração e distribuição de energia; atividades de transporte rodoviário de cargas; comercialização de equipamentos e peças; pesquisa e desenvolvimento de lignina; industrialização e comercialização de produtos de celulose, microfibras celulósicas, papel e papelão; e industrialização, comercialização e exportação de produtos de celulose. Além disso, a empresa está envolvida em atividades de escritório comercial, capital de risco corporativo e captação de recursos financeiros; produção de bens de consumo através de líquidos à base de celulose; desenvolvimento e produção de fibras, fios e filamentos têxteis à base de celulose; restauração, conservação e preservação de florestas; e pesquisa de matérias-primas para a indústria têxtil. A empresa era anteriormente conhecida como Suzano Papel e Celulose S.A. e mudou seu nome para Suzano S.A. em abril de 2019. A empresa foi fundada em 1924 e está sediada em Salvador, Brasil.",https://www.suzano.com.br,Basic Materials,Materiais Básicos,4.3728027,1.333465,0.35192,0.023799999999999998,58417935056.25248,47.2599983215332,Blue Chips,85,10.807713396612474,162.1157009491871,70.85,46.0,Baixo,,🟢
JHSF3,JHSF PART   ON  ED  NM,"A JHSF Participações S.A., em conjunto com suas subsidiárias, atua no ramo imobiliário no Brasil e internacionalmente. Atua por meio de cinco segmentos: Renda Recorrente; Negócios Imobiliários; Aeroporto, Hotéis e Restaurantes; e Segurando. A empresa atua na construção e operação de shopping centers; compra e venda de imóveis residenciais e comerciais; varejo de artigos de moda; locação de imóveis comerciais; e desenvolvimento e operação de hotéis, atividades turísticas, hotelaria e gastronomia, incluindo bares, cafés e restaurantes. Também se dedica à prestação de serviços de gestão; e soluções de financiamento, serviços e investimentos imobiliários. A JHSF Participações S.A. foi fundada em 1972 e está sediada em São Paulo, Brasil.",https://jhsf.com.br,Real Estate,Imobiliário,4.436823,1.3023206,0.28806,0.06570000000000001,8218472384.020656,12.289999961853027,Small Caps,85,2.7700000567642715,41.55000085146407,70.42,52.0,Baixo,,🟢
BRSR6,BANRISUL    PNB     N1,"O Banco do Estado do Rio Grande do Sul S.A., um banco múltiplo, oferece uma gama de produtos e serviços bancários principalmente no Brasil. A empresa atua em atividades bancárias de varejo, empréstimos, financiamento e investimento, empréstimos hipotecários, desenvolvimento, carteira de arrendamento e câmbio. Também oferece corretagem de valores mobiliários, grupos de consórcios, soluções para o setor de pagamentos, seguros e produtos de previdência e títulos de capitalização. O Banco do Estado do Rio Grande do Sul S.A. foi constituído em 1928 e está sediado em Porto Alegre, Brasil.",https://www.banrisul.com.br,Financial Services,Serviços Financeiros,4.4988065,0.67261374,0.1567,0.0495,7709169047.461382,18.850000381469727,Small Caps,70,4.1900002548386395,62.850003822579595,70.01,46.0,Baixo,,🟢
BRSR5,BANRISUL    PNA     N1,"O Banco do Estado do Rio Grande do Sul S.A., um banco múltiplo, oferece uma gama de produtos e serviços bancários principalmente no Brasil. A empresa atua em atividades bancárias de varejo, empréstimos, financiamento e investimento, empréstimos hipotecários, desenvolvimento, carteira de arrendamento e câmbio. Também oferece corretagem de valores mobiliários, grupos de consórcios, soluções para o setor de pagamentos, seguros e produtos de previdência e títulos de capitalização. O Banco do Estado do Rio Grande do Sul S.A. foi constituído em 1928 e está sediado em Porto Alegre, Brasil.",https://www.banrisul.com.br,Financial Services,Serviços Financeiros,4.534606,0.6779661,0.1567,0.049800000000000004,7770515063.0,19.0,Small Caps,70,4.19000018965264,62.8500028447896,69.77,46.0,Baixo,,🟢
BRSR3,BANRISUL    ON      N1,"O Banco do Estado do Rio Grande do Sul S.A., um banco múltiplo, oferece uma gama de produtos e serviços bancários principalmente no Brasil. A empresa atua em atividades bancárias de varejo, empréstimos, financiamento e investimento, empréstimos hipotecários, desenvolvimento, carteira de arrendamento e câmbio. Também oferece corretagem de valores mobiliários, grupos de consórcios, soluções para o setor de pagamentos, seguros e produtos de previdência e títulos de capitalização. O Banco do Estado do Rio Grande do Sul S.A. foi constituído em 1928 e está sediado em Porto Alegre, Brasil.",https://www.banrisul.com.br,Financial Services,Serviços Financeiros,4.634845,0.69295275,0.1567,0.0473,7942284374.542276,19.420000076293945,Small Caps,70,4.189999897794628,62.84999846691942,69.1,46.0,Baixo,,🟢
AZZA3,AZZAS 2154  ON      NM,"A Azzas 2154 S.A. atua no desenvolvimento e comercialização de calçados, bolsas, acessórios e confecções femininos, masculinos e infantis no Brasil e no exterior. Oferece seus produtos por meio de lojas franqueadas, lojas próprias e canal de web commerce das marcas Arezzo, Schutz, Anacapri, Alexandre Birman, Alme, Vans, Reserva, Reserva Mini, Reserva INK, Reserva Go, Oficina Reserva, Brizza, Troc, Baw, Carol Bassi, ZZMALL, Reversa, Simples Reserva, Paris Texas, Vicenza, Animale, Farm, Farm Global, Fabula, Foxton, Cris Barros, Off Premium, Maria Filo, NV, Marcas Hering e Dzarm. A empresa era anteriormente conhecida como Arezzo Indústria e Comércio S.A. e mudou seu nome para Azzas 2154 S.A. em julho de 2024. Azzas 2154 S.A. foi fundada em 1972 e está sediada em Belo Horizonte, Brasil.",https://ri.azzas2154.com.br,Consumer Cyclical,Consumo Cíclico,4.939052,0.5538399,0.11609,0.11900000000000001,4419165766.61764,21.8799991607666,Small Caps,65,4.429999757193607,66.4499963579041,67.07,40.0,Baixo,,🟢
EVEN3,EVEN        ON      NM,"A Even Construtora e Incorporadora S.A. atua como incorporadora e construtora imobiliária no Brasil. A empresa desenvolve e comercializa projetos residenciais, hotéis e centros de arte. Também está envolvida na prospecção de terrenos; incorporação e venda imobiliária; operação do portal da corretora; e atividades de construção de projetos. A empresa foi fundada em 1974 e está sediada em São Paulo, Brasil.",https://www.even.com.br,Real Estate,Imobiliário,5.056338,0.7484624,0.14028,0.10640000000000001,1405965825.345789,7.179999828338623,Small Caps,65,1.4199999739611202,21.299999609416805,66.29,40.0,Baixo,,🟢
ABCB4,ABC BRASIL  PN      N2,"O Banco ABC Brasil S.A., um banco comercial, fornece diversos produtos e serviços financeiros para médias e grandes empresas no Brasil. A empresa oferece conta corrente; produtos de crédito e financiamento, como capital de giro, rotativo, recebíveis, antecipação a fornecedores, empréstimo consignado para empregados, sobre empréstimos em moeda estrangeira e empréstimos em moeda estrangeira, bem como para agronegócio, comércio exterior, transferências do fundo de defesa da economia cafeeira e imóveis; questões de garantias, tais como garantia de pagamento emitida, garantia de execução emitida, garantia judicial emitida, carta de crédito stand-by, confirmação de cartas de crédito de exportação, garantia de oferta, garantia de execução e carta de crédito de importação; derivativos, como contratos a termo de não entrega, prazo de mercadorias, swap e opções; serviços de câmbio para exportação e importação de câmbio, câmbio à vista de adiantamentos sobre câmbios entregues e câmbio à vista financeiro de remessas; cédulas de crédito do agronegócio e imobiliário, certificado de depósito bancário, fundos de investimento, certificado de operações estruturadas e debêntures. Também fornece serviços de investimentos em operações de fusões e aquisições, mercado de capitais e financiamento de projetos. Além disso, a empresa oferece produtos de seguros, como seguros de vida, seguros de vida e seguros de propriedades e acidentes; e atua como comercializadora de energia. A empresa era anteriormente conhecida como Banco Roma de Investimentos e mudou seu nome para Banco ABC Brasil S.A. em 1997. A empresa foi constituída em 1983 e está sediada em São Paulo, Brasil. O Banco ABC Brasil S.A. é uma subsidiária da Marsau Uruguai Holdings SA.",https://www.abcbrasil.com.br,Financial Services,Serviços Financeiros,5.074766,0.9687779,0.15463,0.1133,6553926041.564386,27.149999618530273,Small Caps,85,5.350000299231585,80.25000448847378,66.17,52.0,Baixo,,🟢
TRIS3,TRISUL      ON      NM,"A Trisul S.A. atua na construção e incorporação de imóveis no Brasil. A empresa atua no loteamento de terrenos; e compra e venda de imóveis. Também desenvolve projetos imobiliários com participação acionária de terceiros. A Trisul S.A. foi fundada em 2007 e está sediada em São Paulo, Brasil.",https://www.trisul-sa.com.br,Real Estate,Imobiliário,5.3211007,0.93442893,0.14368,0.18719999999999998,1355225063.36701,5.800000190734863,Small Caps,65,1.0900000803846588,16.350001205769882,64.53,40.0,Baixo,,🟢
VTRU3,VITRUEDUCA  ON      NM,"A Vitru Educação S.A., em conjunto com suas subsidiárias, presta serviços educacionais no Brasil. Oferece cursos de graduação, pós-graduação e técnicos e profissionalizantes a distância e presenciais, além de serviços de educação digital sob as marcas Uniasselvi e UniCesumar. A empresa era anteriormente conhecida como Vitru Brasil Empreendimentos, Participações e Comércio S.A. e mudou seu nome para Vitru Educação S.A. em dezembro de 2025. A empresa foi constituída em 2014 e está sediada em São Paulo, Brasil.",https://www.vitru.com.br/pt_BR,Consumer Defensive,Consumo Defensivo,5.521569,0.6431867,0.1349,0.19,1881827584.0431213,14.079999923706055,Small Caps,65,2.549999814130015,38.24999721195022,63.19,40.0,Baixo,,🟢
GMAT3,GRUPO MATEUSON      NM,"O Grupo Mateus S.A. opera uma rede de supermercados no Brasil. Atua no atacado, móveis e eletrodomésticos, e-commerce, indústria de panificação e central de fatiamento e porcionamento. A empresa foi fundada em 1986 e está sediada em São Luís, Brasil.",https://www.grupomateus.com.br,Consumer Cyclical,Consumo Cíclico,5.6219516,0.9965413,0.17944999,0.0546,10603219844.509487,4.610000133514404,Mid Caps,100,0.819999968252022,12.29999952378033,62.52,52.0,Baixo,,🟢
CEEB5,COELBA      PNA,"Companhia de Eletricidade do Estado da Bahia - COELBA engages in the distribution of electricity. The company was founded in 1960 and is headquartered in Salvador, Brazil. Companhia de Eletricidade do Estado da Bahia - COELBA operates as a subsidiary of Iberdrola, S.A.",https://www.coelba.com.br,Utilities,Utilidades Públicas,6.0165973,1.4527602,0.25589,0.046,11401179784.5,43.5,Mid Caps,85,7.230000252800699,108.45000379201049,59.89,52.0,Baixo,,🟢
CYRE3,CYRELA REALTON      NM,"Cyrela Brazil Realty S.A. Empreendimentos e Participações atua na incorporação e construção de imóveis residenciais no Brasil. Também presta serviços imobiliários, incluindo gestão de obras e serviços de consultoria técnica. Cyrela Brazil Realty S.A. Empreendimentos e Participações foi fundada em 1962 e está sediada em São Paulo, Brasil.",https://www.cyrela.com.br,Consumer Cyclical,Consumo Cíclico,6.0612693,0.9921204,0.22374001,0.1366,10147808163.00047,27.700000762939453,Mid Caps,100,4.570000010218891,68.55000015328336,59.59,64.0,Baixo,,🟢
BMGB4,BANCO BMG   PN      N1,"O Banco BMG S.A. fornece produtos e serviços comerciais e de crédito, financiamento e investimento principalmente no Brasil. A empresa oferece contas digitais; cartão de crédito conta digital e cartão de crédito consignado; consignado e empréstimo pessoal; produtos de seguros, incluindo seguros de prestamistas, de vida, de vida familiar e protegidos pelo FGTS, além dos serviços do Bmg Med e do Consórcio Bmg. Também oferece produtos de investimento, como certificados de depósitos bancários, cartas de crédito do agronegócio e cartas de crédito imobiliário. Além disso, a empresa oferece serviços bancários comerciais; debêntures; financiamento comercial; e capital de giro; e derivativos, como opções a termo não entregáveis, SWAP. A empresa era anteriormente conhecida como BMG Financeira S.A.Crédito, Financiamento e Investimento e mudou seu nome para Banco BMG S.A. em abril de 1989. O Banco BMG S.A. foi fundado em 1930 e está sediado em São Paulo, Brasil.",https://www.bancobmg.com.br,Financial Services,Serviços Financeiros,6.084211,0.74379104,0.12981,0.0781,3732044106.909548,5.78000020980835,Small Caps,65,0.9499999605221366,14.24999940783205,59.44,40.0,Baixo,,🟢
BEEF3,MINERVA     ON      NM,"A Minerva S.A. produz e comercializa carne bovina in natura, gado e subprodutos na América do Sul e internacionalmente. A empresa também atua no abate, desossa e processamento de carnes; venda de carnes resfriadas, congeladas e processadas, bem como produtos bovinos, suínos e aves; exportação e venda de gado vivo; e criação e venda de gado vivo, cordeiros, porcos e outros animais vivos. Além disso, comercializa eletricidade; comercializa proteínas e produtos alimentícios; vende marcas de terceiros principalmente produtos Swift; e prepara produtos para animais, que incluem farinha de carne e ossos, sangue e sebo. A Minerva S.A. foi fundada em 1957 e está sediada em Barretos, Brasil.",https://ri.minervafoods.com,Consumer Defensive,Consumo Defensivo,6.1594205,3.1978931,0.85664004,0.029300000000000003,4196599243.0,4.25,Small Caps,45,0.6899999764588243,10.349999646882363,58.94,34.0,Médio,,🟡
EUCA3,EUCATEX     ON      N1,"A Eucatex S.A. Indústria e Comércio produz e comercializa painéis de fibra e madeira no Brasil. A empresa fornece pisos laminados e vinílicos, portas, divisórias, painéis de fibra de média densidade (MDF) e aglomerado de média densidade (MDP), placas de fibra, tintas e vernizes, painéis decorativos, folhas de fibra de madeira, lacas e outros produtos. Produz também mudas de eucalipto e rodapés; e atua em consultoria de gestão empresarial, atividades imobiliárias, florestais, colheita, manejo florestal, transporte, logística de coleta de resíduos, material reciclado e eletricidade. A empresa atende principalmente os setores moveleiro e de construção civil. Também exporta seus produtos para os Estados Unidos e América Latina. A Eucatex S.A. Indústria e Comércio foi constituída em 1951 e está sediada em São Paulo, Brasil.",https://www.eucatex.com.br,Industrials,Indústria,6.213873,0.71578383,0.11956,0.048,1980901984.0,21.5,Small Caps,50,3.4599999066604674,51.89999859990701,58.57,34.0,Baixo,,🟢
VLID3,VALID       ON      NM,"A Valid Soluções S.A. fornece soluções de pagamentos digitais no Brasil, Argentina, Estados Unidos, Europa, Oriente Médio, África, Ásia e internacionalmente. Atua por meio de três segmentos: Meio de Pagamento, Identificação e Mobile. O segmento de Meios de Pagamento oferece produtos e soluções integradas, como chips e cartões, tarjas magnéticas, vales-presente, faturas e extratos bancários, além de soluções em identificação por radiofrequência, contactless e cartões, e pagamentos móveis. O segmento de Identificação oferece captura, armazenamento e administração de dados, impressões de segurança, reconhecimento e impressão digital, além de soluções governamentais digitais. Suas soluções são utilizadas na geração de sistemas informatizados para administração de bancos de dados, coleta de dados biométricos, impressão e personalização de documentos oficiais, identificação, soluções para cidades inteligentes, carimbos rastreáveis ​​e serviços de certificação digital. O segmento Mobile oferece serviços de emissão de extratos e tecnologias para uso em celulares; e mobilidade digital, como soluções NFC, TSM e HCE para provedores de serviços móveis. Também desenvolve tecnologias para uso em celulares, como recarga e pagamento, e produção de cartões para telecomunicações. Atende governos estaduais e órgãos públicos, instituições financeiras, empresas de telecomunicações, varejistas, cooperativas agrícolas e profissionais liberais. A empresa era anteriormente conhecida como Valid Soluções e Serviços de Segurança em Meios de Pagamento e Identificação S.A. e mudou seu nome para Valid Soluções S.A. em agosto de 2018. A Valid Soluções S.A. foi constituída em 1957 e está sediada em Sorocaba, Brasil.",https://www.valid.com,Industrials,Indústria,6.25,0.9538038,0.15168001,0.1555,1624709333.75,20.75,Small Caps,85,3.32,49.8,58.33,52.0,Baixo,,🟢
SAPR4,SANEPAR     PN      N2,"A Companhia de Saneamento do Paraná - SANEPAR presta serviços de saneamento no Brasil. A empresa atua na distribuição de água; coleta e tratamento de esgoto e resíduos sólidos; estudo, projeto e obras de novas instalações; expansão das redes de distribuição de água; e redes de coleta e tratamento de esgoto. Presta ainda serviços de consultoria e assistência técnica nas suas áreas de atuação. A Companhia de Saneamento do Paraná - SANEPAR foi fundada em 1963 e está sediada em Curitiba, Brasil.",https://www.sanepar.com.br,Utilities,Utilidades Públicas,6.263566,0.19777745,0.17944999,0.0258,12210540478.224169,8.079999923706055,Mid Caps,85,1.2899999654679226,19.349999482018838,58.24,46.0,Baixo,,🟢
EUCA4,EUCATEX     PN      N1,"A Eucatex S.A. Indústria e Comércio produz e comercializa painéis de fibra e madeira no Brasil. A empresa fornece pisos laminados e vinílicos, portas, divisórias, painéis de fibra de média densidade (MDF) e aglomerado de média densidade (MDP), placas de fibra, tintas e vernizes, painéis decorativos, folhas de fibra de madeira, lacas e outros produtos. Produz também mudas de eucalipto e rodapés; e atua em consultoria de gestão empresarial, atividades imobiliárias, florestais, colheita, manejo florestal, transporte, logística de coleta de resíduos, material reciclado e eletricidade. A empresa atende principalmente os setores moveleiro e de construção civil. Também exporta seus produtos para os Estados Unidos e América Latina. A Eucatex S.A. Indústria e Comércio foi constituída em 1951 e está sediada em São Paulo, Brasil.",https://www.eucatex.com.br,Industrials,Indústria,6.3439307,0.7307654,0.11956,0.0527,2022362793.4934082,21.950000762939453,Small Caps,65,3.460000085268815,51.900001279032224,57.71,34.0,Baixo,,🟢
POMO3,MARCOPOLO   ON      N2,"A Marcopolo S.A. atua na fabricação e comercialização de ônibus, carrocerias e componentes no Brasil, África do Sul, Austrália, China, México, Argentina e internacionalmente. A empresa oferece ônibus intermunicipais, urbanos e microônibus, ônibus elétricos e ônibus híbridos; e família de microônibus Volare, como ônibus completo, com chassi e carroceria, carroceria para transporte escolar, fretamento executivo, transporte urbano e projetos especiais. Também está envolvida no desenvolvimento e produção de novos modelos sobre trilhos; produção de unidades com propulsão, automóveis de passageiros e fabricação de caixas para transporte de pessoas, TRAMs e EMUs; disponibilização de soluções de crédito para aquisição de ônibus e micro-ônibus; montagem, comercialização, importação e exportação de equipamentos de refrigeração e ar condicionado; e negócios de espuma para assentos. A empresa foi fundada em 1949 e está sediada em Caxias Do Sul, Brasil.",https://www.marcopolo.com.br,Industrials,Indústria,6.397959,2.029783,0.30973,0.18239999999999998,8110769047.006851,6.269999980926514,Small Caps,60,0.9800000251527892,14.700000377291838,57.35,46.0,Baixo,,🟢
