Ticker,Empresa,Resumo,Site,setor_original,Setor,PL,PVP,ROE,DivYield,MarketCap,Preco,Categoria,Score,LucroPorAcao,PrecoJusto,Desconto_%,Ranking,Risco,Risco_num,Farol
PETR4,PETROBRAS   PN      N2,"Petróleo Brasileiro S.A. - A Petrobras explora, produz e comercializa petróleo e gás no Brasil e internacionalmente. Atua por meio de três segmentos: Exploração e Produção; Refino, Transporte e Comercialização; e gás e energias de baixo carbono. O segmento de Exploração e Produção explora, desenvolve e produz petróleo bruto, líquidos de gás natural e gás natural principalmente para abastecimento às refinarias nacionais. O segmento de Refino, Transporte e Comercialização atua no refino, logística, transporte, aquisição e exportação de petróleo bruto; comércio de produtos petrolíferos; e produção de fertilizantes, além de participação em empresas petroquímicas. O segmento de Gás e Energias de Baixo Carbono atua na logística e comercialização de gás natural e eletricidade; transporte e comercialização de gás natural liquefeito; geração de energia elétrica por meio de usinas termelétricas; negócios de energia renovável; negócios de baixo carbono; e negócios de processamento de gás natural, bem como produção de biodiesel e seus coprodutos. A empresa também se dedica à prospecção, perfuração, refino, processamento, comercialização e transporte de petróleo bruto proveniente de campos petrolíferos onshore e offshore, e xisto ou outras rochas, bem como produtos petrolíferos, gás natural e outros hidrocarbonetos líquidos. Além disso, atua na pesquisa, desenvolvimento, produção, transporte, distribuição e comercialização de energia. A empresa foi constituída em 1953 e está sediada no Rio de Janeiro, Brasil.",https://petrobras.com.br,Energy,Energia,6.430968,1.5449474,0.28176,0.0797,680988132911.5225,49.84000015258789,Blue Chips,75,7.749999712731877,116.24999569097815,57.13,52.0,Baixo,,🟢
RECV3,PETRORECSA  ON      NM,"A Petroreconcavo S.A. atua na exploração e produção de extração de petróleo e gás no Brasil. A empresa foi fundada em 1999 e está sediada em Mata de São João, Brasil.",https://petroreconcavo.com.br,Energy,Energia,6.444954,0.95048034,0.14904,0.1346,4116339944.281105,14.050000190734863,Small Caps,65,2.18000007303929,32.70000109558935,57.03,40.0,Baixo,,🟢
SHUL4,SCHULZ      PN,"A Schulz S.A., juntamente com suas subsidiárias, fabrica e comercializa compressores de ar no Brasil, América Latina, Estados Unidos, Canadá, Europa e internacionalmente. Atua nos segmentos de Indústria e Comercialização. A empresa oferece compressores de ar, incluindo motor de diafragma, alternativo, parafuso rotativo, booster, scroll, isento de óleo e compressores de pistão; equipamentos de tratamento de ar, como separadores e drenos de condensado, purificadores e separadores de água e óleo, bem como tanques e secadores de ar, e filtros e gerenciadores de ar; e produtos de limpeza que incluem aspiradores de pó e líquidos e lavadoras de alta pressão. Também fornece máquinas e ferramentas, que incluem geradores de energia, máquinas de solda, motores de combustão, equipamentos de coluna e bancada, ferramentas elétricas e sem fio, ferramentas manuais, ferramentas pneumáticas e a bateria, linhas automotivas de 12V, motores e pistolas elétricas, bem como lubrificantes; bombas motorizadas; peças de reposição; e outros acessórios relacionados. Além disso, a empresa oferece serviços pós-venda. Além disso, seus produtos são utilizados para aplicações residenciais, profissionais e industriais. Além disso, a empresa exporta seus produtos. A Schulz S.A. foi fundada em 1963 e está sediada em Joinville, Brasil.",https://www.schulz.com.br,Consumer Cyclical,Consumo Cíclico,6.604938,1.2722949,0.19755,0.10400000000000001,1907565037.64634,5.349999904632568,Small Caps,85,0.8100000188696046,12.150000283044069,55.97,46.0,Baixo,,🟢
MDNE3,MOURA DUBEUXON      NM,"A Moura Dubeux Engenharia S.A. presta serviços de incorporação imobiliária no Brasil. A empresa desenvolve apartamentos, hotéis, resorts e edifícios residenciais, além de oferecer serviços de administração técnica de obras e assessoria técnica aos condomínios. Também atua na compra e venda de imóveis; construção imobiliária; gerenciamento; administração; e serviços de engenharia, bem como serviços de consultoria imobiliária, incluindo compra de terreno; formatação de produtos; e aprovação do projeto. A empresa foi fundada em 1983 e está sediada em Recife, Brasil.",https://www.mouradubeux.com.br,Real Estate,Imobiliário,6.6740894,1.8347247,0.27528998,0.1456,3417769632.1817627,32.970001220703125,Small Caps,60,4.939999937774751,74.09999906662127,55.51,46.0,Baixo,,🟢
CEEB3,COELBA      ON,"Companhia de Eletricidade do Estado da Bahia - COELBA engages in the distribution of electricity. The company was founded in 1960 and is headquartered in Salvador, Brazil. Companhia de Eletricidade do Estado da Bahia - COELBA operates as a subsidiary of Iberdrola, S.A.",https://www.coelba.com.br,Utilities,Utilidades Públicas,6.7786994,1.6367764,0.25589,0.0403,12845328783.95042,49.0099983215332,Mid Caps,60,7.230000244815872,108.45000367223808,54.81,46.0,Baixo,,🟢
POMO4,MARCOPOLO   PN      N2,"A Marcopolo S.A. atua na fabricação e comercialização de ônibus, carrocerias e componentes no Brasil, África do Sul, Austrália, China, México, Argentina e internacionalmente. A empresa oferece ônibus intermunicipais, urbanos e microônibus, ônibus elétricos e ônibus híbridos; e família de microônibus Volare, como ônibus completo, com chassi e carroceria, carroceria para transporte escolar, fretamento executivo, transporte urbano e projetos especiais. Também está envolvida no desenvolvimento e produção de novos modelos sobre trilhos; produção de unidades com propulsão, automóveis de passageiros e fabricação de caixas para transporte de pessoas, TRAMs e EMUs; disponibilização de soluções de crédito para aquisição de ônibus e micro-ônibus; montagem, comercialização, importação e exportação de equipamentos de refrigeração e ar condicionado; e negócios de espuma para assentos. A empresa foi fundada em 1949 e está sediada em Caxias Do Sul, Brasil.",https://www.marcopolo.com.br,Industrials,Indústria,6.795918,2.1560376,0.30973,0.16940000000000002,8262255684.302673,6.659999847412109,Small Caps,60,0.9800000305201018,14.700000457801526,54.69,46.0,Baixo,,🟢
OFSA3,OUROFINO S/AON      NM,"A Ouro Fino Saúde Animal Participações S.A., em conjunto com suas subsidiárias, atua no desenvolvimento, produção e comercialização de medicamentos veterinários, vacinas e outros produtos para animais de produção e de companhia, principalmente no Brasil. A empresa atua através de três segmentos: Animais de Produção; Animais de Companhia; e Operações Internacionais. Fabrica e comercializa medicamentos, incluindo antiinflamatórios, antibióticos, anticoccidianos, antimastíticos, ectoparasiticidas, endectocidas, endoparasiticidas, hemoparasiticidas, inoculantes, terapêuticos, produtos para reprodução animal e vacinas; e aditivos, probióticos e outros produtos veterinários para melhoria de desempenho para bovinos, suínos, aves, ovinos, cavalos e caprinos, bem como serviços de fabricação. A empresa também fabrica soluções veterinárias para cães e gatos, como anestésicos, sedativos, antiinflamatórios, antibióticos, antimicrobianos, dermatológicos, ectoparasiticidas, endoparasiticidas, dermocosméticos e otológicos. Além disso, oferece vacinas e outros produtos veterinários para animais de produção e de companhia. A empresa era anteriormente conhecida como A.H.N.S.P.E. Empreendimentos e Participações S.A. A Ouro Fino Saúde Animal Participações S.A. foi constituída em 1987 e está sediada em Cravinhos, Brasil.",https://www.ourofinosaudeanimal.com,Healthcare,Saúde,6.9031477,1.9237517,0.28625,0.04769999999999999,1532914459.3664284,28.510000228881836,Small Caps,45,4.130000033011294,61.95000049516941,53.98,40.0,Baixo,,🟢
LOGG3,LOG COM PROPON      NM,"A LOG Commercial Properties e Participações S.A. desenvolve, constrói e aluga imóveis residenciais e comerciais no Brasil. Oferece logística e armazéns industriais; aluguel de imóveis próprios; construção de edifícios; construção, marketing, locação e serviços relacionados, incluindo consultoria imobiliária; e fornece e participa de bens e serviços no setor imobiliário comercial. A empresa era anteriormente conhecida como MRV Logística E Participações S.A. A LOG Commercial Properties e Participações S.A. foi constituída em 2008 e está sediada em Belo Horizonte, Brasil.",https://www.logcp.com.br,Real Estate,Imobiliário,7.0147414,0.6887484,0.100439996,0.1389,2495675914.308243,28.549999237060547,Small Caps,65,4.070000247915133,61.050003718727,53.24,40.0,Baixo,,🟢
CEAB3,CEA MODAS   ON      NM,"A C&A Modas S.A. atua como varejista de moda feminina, masculina e infantil no Brasil e internacionalmente. Oferece blusas, calças, vestidos, saias, casacos, moda praia, roupas íntimas, camisetas, camisas, bermudas, jaquetas e casacos, bodys, conjuntos e shorts; produtos de beleza, incluindo perfumes, maquiagem, cuidados com a pele, corpo e banho e acessórios; e calçados, como botas, sapatos e mocassins, sapatilhas, sandálias e tênis. A empresa vende seus produtos em lojas e também online. A empresa foi fundada em 1841 e está sediada em Barueri, Brasil.",https://www.cea.com.br,Consumer Cyclical,Consumo Cíclico,7.0211644,1.0843276,0.16736999,0.0665,4019673350.843178,13.270000457763672,Small Caps,85,1.8899999632202988,28.349999448304484,53.19,46.0,Baixo,,🟢
IGTI3,IGUATEMI S.AON      N1,"A Iguatemi S.A., em conjunto com suas subsidiárias, atua na exploração e planejamento comercial de shopping centers no Brasil. A empresa também atua na compra de estacionamentos e na venda de imóveis. Além disso, presta serviços de assessoria e consultoria econômica, financeira e tributária. A empresa era anteriormente conhecida como Jereissati Participações S.A. e mudou seu nome para Iguatemi S.A. em novembro de 2021. A Iguatemi S.A. foi fundada em 1946 e está sediada em São Paulo, Brasil.",https://iguatemi.com.br,Real Estate,Imobiliário,7.106383,0.21303737,0.13001001,0.0285,4028965163.3044124,3.3399999141693115,Small Caps,50,0.46999998651484326,7.0499997977226485,52.62,28.0,Baixo,,🟢
PETR3,PETROBRAS   ON      N2,"Petróleo Brasileiro S.A. - A Petrobras explora, produz e comercializa petróleo e gás no Brasil e internacionalmente. Atua por meio de três segmentos: Exploração e Produção; Refino, Transporte e Comercialização; e gás e energias de baixo carbono. O segmento de Exploração e Produção explora, desenvolve e produz petróleo bruto, líquidos de gás natural e gás natural principalmente para abastecimento às refinarias nacionais. O segmento de Refino, Transporte e Comercialização atua no refino, logística, transporte, aquisição e exportação de petróleo bruto; comércio de produtos petrolíferos; e produção de fertilizantes, além de participação em empresas petroquímicas. O segmento de Gás e Energias de Baixo Carbono atua na logística e comercialização de gás natural e eletricidade; transporte e comercialização de gás natural liquefeito; geração de energia elétrica por meio de usinas termelétricas; negócios de energia renovável; negócios de baixo carbono; e negócios de processamento de gás natural, bem como produção de biodiesel e seus coprodutos. A empresa também se dedica à prospecção, perfuração, refino, processamento, comercialização e transporte de petróleo bruto proveniente de campos petrolíferos onshore e offshore, e xisto ou outras rochas, bem como produtos petrolíferos, gás natural e outros hidrocarbonetos líquidos. Além disso, atua na pesquisa, desenvolvimento, produção, transporte, distribuição e comercialização de energia. A empresa foi constituída em 1953 e está sediada no Rio de Janeiro, Brasil.",https://petrobras.com.br,Energy,Energia,7.129032,1.7126473,0.28176,0.0724,712102485045.25,55.25,Blue Chips,75,7.750000280542997,116.25000420814496,52.47,52.0,Baixo,,🟢
LAVV3,LAVVI       ON      NM,"A Lavvi Empreendimentos Imobiliários S.A. desenvolve e constrói imóveis residenciais e não residenciais principalmente no Brasil. A empresa oferece imóveis com as marcas Lavvi e Novvo. A empresa foi constituída em 2016 e está sediada em São Paulo, Brasil.",https://www.lavvi.com.br,Real Estate,Imobiliário,7.1556606,1.9801593,0.26358998,0.0676,2964739134.750458,15.170000076293945,Small Caps,60,2.119999944700276,31.799999170504144,52.3,46.0,Baixo,,🟢
CLSC3,CELESC      ON      N2,"A Centrais Elétricas de Santa Catarina S.A., por meio de suas subsidiárias, atua na geração, transmissão e comercialização de energia elétrica no Brasil. A empresa possui principalmente usinas hidrelétricas. A Centrais Elétricas de Santa Catarina S.A. foi fundada em 1955 e tem sede em Florianópolis, Brasil.",https://www.celesc.com.br,Utilities,Utilidades Públicas,7.3103642,1.268297,0.19097,0.0555,5761308860.110565,130.49000549316406,Small Caps,85,17.850000618733066,267.750009280996,51.26,40.0,Baixo,,🟢
CSED3,CRUZEIRO EDUON      NM,"A Cruzeiro do Sul Educacional S.A. presta serviços de educação no Brasil. A empresa oferece ensino superior; educação a distância com a marca Cruzeiro do Sul Virtual; e cursos de medicina. Também opera escolas do Colégio Alto Padrão; Colégio Ceunsp Itu, que oferece serviços de educação infantil, fundamental e médio; O Colégio Ceunsp Salto oferece serviços de educação básica, educação infantil e ensino médio; e o Colégio Cruzeiro do Sul que oferece serviços de educação infantil, ensino médio e escola técnica. A empresa foi fundada em 1965 e está sediada em São Paulo, Brasil.",https://www.cruzeirodosuleducacional.com.br,Consumer Defensive,Consumo Defensivo,7.382716,1.3706166,0.19393998,0.08109999999999999,2179964467.9130974,5.980000019073486,Small Caps,85,0.8100000080015927,12.15000012002389,50.78,46.0,Baixo,,🟢
PINE3,PINE        ON      N2,"O Banco Pine S.A., em conjunto com suas subsidiárias, fornece produtos e serviços bancários no Brasil. A empresa se dedica a negócios comerciais, de investimento, crédito, financiamento, câmbio e leasing. Também está envolvida em consultoria; distribuição de títulos; imobiliária; intermediação de negócios; e comercialização de ativos ambientais. A empresa foi constituída em 1991 e está sediada em São Paulo, Brasil.",https://www.pine.com,Financial Services,Serviços Financeiros,7.4820514,2.6397684,0.33765998,0.0291,3776918402.23048,14.59000015258789,Small Caps,45,1.949999989653625,29.249999844804375,50.12,34.0,Médio,,🟡
WIZC3,WIZ CO      ON      NM,"Wiz Co Participações e Corretagem de Seguros S.A. operates as an insurance broker in Brazil. The company offers bancassurance, consortiums, and credit services. It also involved in-person, remote, and digital solutions for the sale and after-sales of insurance and financial products. The company was formerly known as Wiz Soluções e Corretagem de Seguros S.A. Wiz Co Participações e Corretagem de Seguros S.A. was founded in 1973 and is headquartered in Brasília, Brazil.",https://wiz.co,Financial Services,Serviços Financeiros,7.5476193,2.1791935,0.29974002,0.0649,1520718288.4198723,9.510000228881836,Small Caps,60,1.2599999881925465,18.899999822888198,49.68,42.0,Baixo,,🟢
PINE4,PINE        PN      N2,"O Banco Pine S.A., em conjunto com suas subsidiárias, fornece produtos e serviços bancários no Brasil. A empresa se dedica a negócios comerciais, de investimento, crédito, financiamento, câmbio e leasing. Também está envolvida em consultoria; distribuição de títulos; imobiliária; intermediação de negócios; e comercialização de ativos ambientais. A empresa foi constituída em 1991 e está sediada em São Paulo, Brasil.",https://www.pine.com,Financial Services,Serviços Financeiros,7.579487,2.674145,0.33765998,0.0286,3826103659.5341597,14.779999732971191,Small Caps,45,1.9500000109468083,29.250000164202124,49.47,30.0,Médio,,🟡
BGIP3,BANESE      ON,"O Banco do Estado de Sergipe S.A. oferece diversos produtos e serviços bancários em Sergipe. A empresa oferece contas correntes, únicas e outras; poupança; Produtos CBD/RDB; investimentos; cartões; produtos de seguros; empréstimos e financiamentos, consignado, pagamento, consórcio, capitalização, portabilidade e serviços de internet banking. A empresa era anteriormente conhecida como Banco de Fomento Budget e mudou seu nome para Banco do Estado de Sergipe S.A. em 1967. O Banco do Estado de Sergipe S.A. foi fundado em 1961 e tem sede em Aracaju, Brasil.",https://www.banese.com.br,Financial Services,Serviços Financeiros,7.596649,1.3517542,0.15865,0.06,1289565676.8,58.95,Small Caps,85,7.7600004949550785,116.40000742432618,49.36,36.0,Baixo,,🟢
BBSE3,BBSEGURIDADEON      NM,"A BB Seguridade Participações S.A., por meio de suas subsidiárias, atua nos negócios de seguros, previdência e obrigações no Brasil. A empresa atua por meio de dois segmentos, Segurança e Corretagem. O segmento de Seguridade oferece produtos e serviços relacionados a seguros de vida, riscos rurais, especiais e financeiros, seguros de transporte, cascos, habitacionais e pessoais, planos de previdência, planos complementares, planos odontológicos e planos de capitalização. O segmento Corretora atua na corretagem e administração, implementação, promoção e viabilização de negócios de seguros nos setores básico, vida e capitalização, bem como planos de previdência aberta e planos odontológicos. A BB Seguridade Participações S.A. foi constituída em 2012 e está sediada em Brasília, Brasil. A BB Seguridade Participações S.A. é subsidiária do Banco do Brasil S.A.",https://www.bbseguridaderi.com.br,Financial Services,Serviços Financeiros,7.666667,6.6647973,0.89815,0.1432,69205513555.7102,35.650001525878906,Blue Chips,75,4.64999999685377,69.74999995280656,48.89,48.0,Baixo,,🟢
PLPL3,PLANOEPLANO ON      NM,"A Plano & Plano Desenvolvimento Imobiliário S.A., por meio de suas subsidiárias, desenvolve, constrói e comercializa empreendimentos imobiliários na Região Metropolitana de São Paulo. Também fornece seus serviços online. A empresa foi fundada em 1997 e está sediada em São Paulo, Brasil.",https://www.planoeplano.com.br,Real Estate,Imobiliário,7.727778,2.7582786,0.41075,0.10779999999999999,2822475008.8384247,13.90999984741211,Small Caps,60,1.7999999284933017,26.999998927399524,48.48,42.0,Baixo,,🟢
ECOR3,ECORODOVIAS ON      NM,"A EcoRodovias Infraestrutura e Logística S.A. atua como uma empresa de infraestrutura que opera concessões rodoviárias no Brasil. Opera o Ecopátio Logística Cubatão, plataforma logística intermodal, que é o local regulador de caminhões no Porto de Santos. A empresa também atua na operação portuária e na movimentação e armazenagem de cargas de importação e exportação no Porto de Santos. A empresa foi fundada em 1997 e está sediada em São Paulo, Brasil. A EcoRodovias Infraestrutura e Logística S.A. atua como subsidiária da IGLI S.p.A.",https://www.ecorodovias.com.br,Industrials,Indústria,7.732283,1.6649712,0.21511999,0.0311,6831000227.033249,9.819999694824219,Small Caps,45,1.270000036835721,19.050000552535813,48.45,36.0,Baixo,,🟢
SMTO3,SAO MARTINHOON      NM,"A São Martinho S.A., em conjunto com suas subsidiárias, atua na produção e comercialização de açúcar, etanol e outros subprodutos da cana-de-açúcar no Brasil. A empresa atua nos segmentos de Açúcar, Etanol, Etanol de Cormo, Energia Elétrica, Negócios Imobiliários, Leveduras e Outros Produtos. Oferece uma variedade de açúcar bruto; etanol hidratado, utilizado em tanques de carros movidos a etanol; etanol anidro, utilizado como aditivo à gasolina em veículos movidos a gasolina; e o etanol industrial, utilizado principalmente na produção de tintas, cosméticos e bebidas alcoólicas. A empresa também gera energia elétrica a partir do bagaço da cana-de-açúcar; fornece subprodutos, incluindo leveduras utilizadas na alimentação animal; oferece óleo fúsel usado como solvente e amilaetanol puro; e SMartLiO, substituto do óleo de soja utilizado na produção de biocombustíveis, tintas e produtos químicos, além de Grãos Secos de Destilaria com Solúveis, nutrição animal para ruminantes, porcos, cavalos, pássaros, peixes e animais de estimação. Além disso, atua no cultivo de cana-de-açúcar; desenvolvimento de imóveis; importação e exportação de bens, produtos e matérias-primas; produções agrícolas; e investimento em outras empresas. A empresa foi fundada em 1914 e está sediada em São Paulo, Brasil. A São Martinho S.A. é uma subsidiária da LJN Participações S.A.",https://www.saomartinho.com.br,Basic Materials,Materiais Básicos,7.8922415,0.8163538,0.11124,0.0495,5909978785.830465,18.309999465942383,Small Caps,50,2.319999896853433,34.799998452801496,47.39,30.0,Baixo,,🟢
SEER3,SER EDUCA   ON  ED  NM,"Ser Educacional S.A., together with its subsidiaries, operates on-campus and distance-learning undergraduate, graduate, and professional training courses and other education-related areas in Brazil. It offers undergraduate, post graduate, on-campus and digital learning, and vocational courses. The company operates under the UNINASSAU  Centro Universitário Maurício de Nassau, UNINABUCO  Centro Universitário Nabuco, UNG  Universidade Guarulhos, UNAMA  University of the Amazon, UNIVERITAS  Universus Veritas University Center, UNINORTE - Northern University Center, University Center for Biomedical Sciences of Cacoal UNIFACIMED, UNIJUAZEIRO - Centro Universitário de Juazeiro do Norte, UNESC - Educational Society of Rondônia, UNIFASB - São Francisco de Barreiras University Center, UNI7 - 7 de Setembro University Center, CDMV - Center for the Development of Veterinary Medicine, FAEL University Center, UNINASSAU Colleges, UNINABUCO Colleges, and Joaquim Nabuco and Maurício de Nassau Technical Schools, GOKURSOS, BEDUKA, DELÍNEA, PROVA FÁCIL and Peixe 30, CDO, CDM, DOK, and PLANTÃO VETERINÁRIO brands. It is also involved in the investment business. The company was founded in 1993 and is headquartered in Recife, Brazil.",https://www.sereducacional.com,Consumer Defensive,Consumo Defensivo,7.934524,1.2800077,0.1681,0.0365,1701103101.4737759,13.329999923706055,Small Caps,70,1.6799999500544778,25.199999250817168,47.1,36.0,Baixo,,🟢
CMIG4,CEMIG       PN      N1,"A Companhia Energética de Minas Gerais - CEMIG, por meio de suas subsidiárias, atua na geração, transmissão, distribuição e comercialização de energia no Brasil. Em 31 de dezembro de 2024, a empresa operava 36 usinas hidrelétricas com capacidade total de 4.449,0 MW, 2 parques eólicos com capacidade total de 70,8 MW e 10 usinas fotovoltaicas com capacidade total de 158,99 MW; 357.044 milhas de linhas de distribuição; e 4.754 milhas de linhas de transmissão. Também atua na aquisição, transporte e distribuição de gás e seus subprodutos e derivados; venda e comercialização de energia; construção, implantação, operação e manutenção de transmissão de energia elétrica; comercialização e intermediação de negócios relacionados à energia; instalação, operação, manutenção e aluguel de usinas solares; e atividades de geração distribuída, serviços de conta, cogeração, eficiência energética e gestão de abastecimento e armazenamento. A empresa foi constituída em 1952 e está sediada em Belo Horizonte, Brasil.",https://www.cemig.com.br,Utilities,Utilidades Públicas,7.9532166,1.3614976,0.1751,0.0919,42901899495.36584,13.600000381469727,Mid Caps,100,1.7099999994303847,25.649999991455772,46.98,48.0,Baixo,,🟢
EKTR4,ELEKTRO     PN,"A Elektro Redes S.A. atua na distribuição de energia elétrica no Brasil. A empresa era anteriormente conhecida como Elektro Eletricidade e Serviços S.A. e mudou seu nome para Elektro Redes S.A. em agosto de 2016. A empresa foi constituída em 1998 e está sediada em Campinas, Brasil. A Elektro Redes S.A. é subsidiária da Neoenergia S.A.",https://www.elektro.com.br,Utilities,Utilidades Públicas,8.042553,3.5883803,0.47262,0.10869999999999999,7324100069.173412,37.79999923706055,Small Caps,60,4.70000001704192,70.5000002556288,46.38,42.0,Baixo,,🟢
EZTC3,EZTEC       ON      NM,"A EZTEC Empreendimentos e Participações S.A. atua em atividades de engenharia, construção e incorporação imobiliária no Brasil e internacionalmente. A empresa desenvolve e comercializa imóveis; administra e aluga propriedades; constrói condomínios; e subdivide terras. Atua também na prestação de serviços relacionados à construção, fiscalização, estudos e projetos; e execução de obras e serviços de engenharia civil. A EZTEC Empreendimentos e Participações S.A. foi fundada em 1979 e está sediada em São Paulo, Brasil.",https://www.eztec.com.br,Real Estate,Imobiliário,8.1,0.84854174,0.10949001,0.0814,4269011064.7638273,15.390000343322754,Small Caps,65,1.9000000423855252,28.50000063578288,46.0,36.0,Baixo,,🟢
