Ticker,Empresa,Resumo,Site,setor_original,Setor,PL,PVP,ROE,DivYield,MarketCap,Preco,Categoria,CNPJ,Score,LucroPorAcao,PrecoJusto,Desconto_%,Ranking,Risco,Risco_num,Farol
POMO4,MARCOPOLO   PN      N2,"A Marcopolo S.A. atua na fabricação e comercialização de ônibus, carrocerias e componentes no Brasil, África do Sul, Austrália, China, México, Argentina e internacionalmente. A empresa oferece ônibus intermunicipais, urbanos e microônibus, ônibus elétricos e ônibus híbridos; e família de microônibus Volare, como ônibus completo, com chassi e carroceria, carroceria para transporte escolar, fretamento executivo, transporte urbano e projetos especiais. Também está envolvida no desenvolvimento e produção de novos modelos sobre trilhos; produção de unidades com propulsão, automóveis de passageiros e fabricação de caixas para transporte de pessoas, TRAMs e EMUs; disponibilização de soluções de crédito para aquisição de ônibus e micro-ônibus; montagem, comercialização, importação e exportação de equipamentos de refrigeração e ar condicionado; e negócios de espuma para assentos. A empresa foi fundada em 1949 e está sediada em Caxias Do Sul, Brasil.",https://www.marcopolo.com.br,Industrials,Indústria,6.0918365,1.9326643,0.30973,0.19030000000000002,7406256130.916176,5.96999979019165,Small Caps,Não disponível,60,0.9800000033145424,14.700000049718136,59.39,46.0,Baixo,,🟢
PETR4,PETROBRAS   PN  ATZ N2,"Petróleo Brasileiro S.A. - A Petrobras explora, produz e comercializa petróleo e gás no Brasil e internacionalmente. Atua por meio de três segmentos: Exploração e Produção; Refino, Transporte e Comercialização; e gás e energias de baixo carbono. O segmento de Exploração e Produção explora, desenvolve e produz petróleo bruto, líquidos de gás natural e gás natural principalmente para abastecimento às refinarias nacionais. O segmento de Refino, Transporte e Comercialização atua no refino, logística, transporte, aquisição e exportação de petróleo bruto; comércio de produtos petrolíferos; e produção de fertilizantes, além de participação em empresas petroquímicas. O segmento de Gás e Energias de Baixo Carbono atua na logística e comercialização de gás natural e eletricidade; transporte e comercialização de gás natural liquefeito; geração de energia elétrica por meio de usinas termelétricas; negócios de energia renovável; negócios de baixo carbono; e negócios de processamento de gás natural, bem como produção de biodiesel e seus coprodutos. A empresa também se dedica à prospecção, perfuração, refino, processamento, comercialização e transporte de petróleo bruto proveniente de campos petrolíferos onshore e offshore, e xisto ou outras rochas, bem como produtos petrolíferos, gás natural e outros hidrocarbonetos líquidos. Além disso, atua na pesquisa, desenvolvimento, produção, transporte, distribuição e comercialização de energia. A empresa foi constituída em 1953 e está sediada no Rio de Janeiro, Brasil.",https://petrobras.com.br,Energy,Energia,6.171569,1.5610664,0.28176,0.0791,649076589710.6182,50.36000061035156,Blue Chips,33.000.167/0001-01,75,8.159999606315925,122.39999409473887,58.86,52.0,Baixo,,🟢
CEAB3,CEA MODAS   ON      NM,"A C&A Modas S.A. atua como varejista de moda feminina, masculina e infantil no Brasil e internacionalmente. Oferece blusas, calças, vestidos, saias, casacos, moda praia, roupas íntimas, camisetas, camisas, bermudas, jaquetas e casacos, bodys, conjuntos e shorts; produtos de beleza, incluindo perfumes, maquiagem, cuidados com a pele, corpo e banho e acessórios; e calçados, como botas, sapatos e mocassins, sapatilhas, sandálias e tênis. A empresa vende seus produtos em lojas e também online. A empresa foi fundada em 1841 e está sediada em Barueri, Brasil.",https://www.cea.com.br,Consumer Cyclical,Consumo Cíclico,6.2433863,0.96420985,0.16736999,0.0753,3574389198.976324,11.800000190734863,Small Caps,Não disponível,85,1.8900000134117703,28.350000201176552,58.38,52.0,Baixo,,🟢
SHUL4,SCHULZ      PN  EJ,"A Schulz S.A., juntamente com suas subsidiárias, fabrica e comercializa compressores de ar no Brasil, América Latina, Estados Unidos, Canadá, Europa e internacionalmente. Atua nos segmentos de Indústria e Comercialização. A empresa oferece compressores de ar, incluindo motor de diafragma, alternativo, parafuso rotativo, booster, scroll, isento de óleo e compressores de pistão; equipamentos de tratamento de ar, como separadores e drenos de condensado, purificadores e separadores de água e óleo, bem como tanques e secadores de ar, e filtros e gerenciadores de ar; e produtos de limpeza que incluem aspiradores de pó e líquidos e lavadoras de alta pressão. Também fornece máquinas e ferramentas, que incluem geradores de energia, máquinas de solda, motores de combustão, equipamentos de coluna e bancada, ferramentas elétricas e sem fio, ferramentas manuais, ferramentas pneumáticas e a bateria, linhas automotivas de 12V, motores e pistolas elétricas, bem como lubrificantes; bombas motorizadas; peças de reposição; e outros acessórios relacionados. Além disso, a empresa oferece serviços pós-venda. Seus produtos são utilizados para aplicações residenciais, profissionais e industriais. A empresa exporta seus produtos. A Schulz S.A. foi fundada em 1963 e está sediada em Joinville, Brasil.",https://www.schulz.com.br,Consumer Cyclical,Consumo Cíclico,6.3333335,1.2199763,0.19755,0.1081,1829123184.2743921,5.130000114440918,Small Caps,Não disponível,85,0.8099999967538292,12.149999951307437,57.78,46.0,Baixo,,🟢
SAPR4,SANEPAR     PN      N2,"A Companhia de Saneamento do Paraná - SANEPAR presta serviços de saneamento no Brasil. A empresa atua na distribuição de água; coleta e tratamento de esgoto e resíduos sólidos; estudo, projeto e obras de novas instalações; expansão das redes de distribuição de água; e redes de coleta e tratamento de esgoto. Presta ainda serviços de consultoria e assistência técnica nas suas áreas de atuação. A Companhia de Saneamento do Paraná - SANEPAR foi fundada em 1963 e está sediada em Curitiba, Brasil.",https://www.sanepar.com.br,Utilities,Utilidades Públicas,6.387597,0.20169383,0.17944999,0.0275,12452333130.672506,8.239999771118164,Mid Caps,Não disponível,85,1.2899999438158298,19.34999915723745,57.42,46.0,Baixo,,🟢
PINE4,PINE        PN      N2,"O Banco Pine S.A., em conjunto com suas subsidiárias, fornece produtos e serviços bancários no Brasil. A empresa se dedica a negócios comerciais, de investimento, crédito, financiamento, câmbio e leasing. Também está envolvida em consultoria; distribuição de títulos; imobiliária; intermediação de negócios; e comercialização de ativos ambientais. A empresa foi constituída em 1991 e está sediada em São Paulo, Brasil.",https://www.pine.com,Financial Services,Serviços Financeiros,6.4102564,2.2616248,0.33765998,0.0334,3235879337.5,12.5,Small Caps,Não disponível,45,1.95000000312,29.2500000468,57.26,40.0,Baixo,,🟢
ECOR3,ECORODOVIAS ON      NM,"A EcoRodovias Infraestrutura e Logística S.A. atua como uma empresa de infraestrutura que opera concessões rodoviárias no Brasil. Opera o Ecopátio Logística Cubatão, plataforma logística intermodal, que é o local regulador de caminhões no Porto de Santos. A empresa também atua na operação portuária e na movimentação e armazenagem de cargas de importação e exportação no Porto de Santos. A empresa foi fundada em 1997 e está sediada em São Paulo, Brasil. A EcoRodovias Infraestrutura e Logística S.A. atua como subsidiária da IGLI S.p.A.",https://www.ecorodovias.com.br,Industrials,Indústria,6.4803147,1.3953882,0.21511999,0.038599999999999995,5724962371.549873,8.229999542236328,Small Caps,Não disponível,70,1.269999980438655,19.049999706579825,56.8,46.0,Baixo,,🟢
RECV3,PETRORECSA  ON      NM,"A Petroreconcavo S.A. atua na exploração e produção de petróleo e gás natural no Brasil. A empresa foi fundada em 1999 e está sediada em Mata de São João, Brasil.",https://petroreconcavo.com.br,Energy,Energia,6.4862385,0.9078069,0.13571,0.15130000000000002,4142708002.505989,14.140000343322754,Small Caps,Não disponível,65,2.1800000637230275,32.70000095584541,56.76,40.0,Baixo,,🟢
LAVV3,LAVVI       ON      NM,"A Lavvi Empreendimentos Imobiliários S.A. desenvolve e constrói imóveis residenciais e não residenciais principalmente no Brasil. A empresa oferece imóveis com as marcas Lavvi e Novvo. A empresa foi constituída em 2016 e está sediada em São Paulo, Brasil.",https://www.lavvi.com.br,Real Estate,Imobiliário,6.4952836,1.7974156,0.26358998,0.0751,2691131116.5027466,13.770000457763672,Small Caps,Não disponível,60,2.1199998808002274,31.79999821200341,56.7,46.0,Baixo,,🟢
LOGG3,LOG COM PROPON      NM,"A LOG Commercial Properties e Participações S.A. desenvolve, constrói e aluga imóveis residenciais e comerciais no Brasil. Oferece logística e armazéns industriais; aluguel de imóveis próprios; construção de edifícios; construção, marketing, locação e serviços relacionados, incluindo consultoria imobiliária; e fornece e participa de bens e serviços no setor imobiliário comercial. A empresa era anteriormente conhecida como MRV Logística E Participações S.A. A LOG Commercial Properties e Participações S.A. foi constituída em 2008 e está sediada em Belo Horizonte, Brasil.",https://www.logcp.com.br,Real Estate,Imobiliário,6.545454,0.64267105,0.100439996,0.14880000000000002,2328714767.446594,26.639999389648438,Small Caps,Não disponível,65,4.070000245918531,61.05000368877797,56.36,40.0,Baixo,,🟢
CEEB3,COELBA      ON,"Companhia de Eletricidade do Estado da Bahia - COELBA engages in the distribution of electricity. The company was founded in 1960 and is headquartered in Salvador, Brazil. Companhia de Eletricidade do Estado da Bahia - COELBA operates as a subsidiary of Iberdrola, S.A.",https://www.coelba.com.br,Utilities,Utilidades Públicas,6.6307054,1.6010419,0.25589,0.0417,12564886410.779999,47.94,Mid Caps,Não disponível,60,7.229999993665832,108.44999990498748,55.8,46.0,Baixo,,🟢
IGTI3,IGUATEMI S.AON      N1,"A Iguatemi S.A., em conjunto com suas subsidiárias, atua na exploração e planejamento comercial de shopping centers no Brasil. A empresa também atua na compra de estacionamentos e na venda de imóveis. Além disso, presta serviços de assessoria e consultoria econômica, financeira e tributária. A empresa era anteriormente conhecida como Jereissati Participações S.A. e mudou seu nome para Iguatemi S.A. em novembro de 2021. A Iguatemi S.A. foi fundada em 1946 e está sediada em São Paulo, Brasil.",https://iguatemi.com.br,Real Estate,Imobiliário,6.6595745,0.1996428,0.13001001,0.0317,3775647229.42745,3.130000114440918,Small Caps,Não disponível,50,0.47000001493202276,7.050000223980342,55.6,34.0,Baixo,,🟢
CSED3,CRUZEIRO EDUON      NM,"A Cruzeiro do Sul Educacional S.A. presta serviços de educação no Brasil. Oferece serviços de educação acadêmica e profissional, incluindo cursos de ensino fundamental, graduação, pós-graduação e extensão nas modalidades presencial e a distância; e cursos de medicina. A empresa foi fundada em 1965 e está sediada em São Paulo, Brasil.",https://www.cruzeirodosuleducacional.com.br,Consumer Defensive,Consumo Defensivo,6.740741,1.2514325,0.16102,0.0447,1990402353.2861948,5.460000038146973,Small Caps,Não disponível,70,0.8099999745053211,12.149999617579818,55.06,40.0,Baixo,,🟢
OFSA3,OUROFINO S/AON      NM,"A Ouro Fino Saúde Animal Participações S.A., em conjunto com suas subsidiárias, atua no desenvolvimento, produção e comercialização de medicamentos veterinários, vacinas e outros produtos para animais de produção e de companhia, principalmente no Brasil. A empresa atua através de três segmentos: Animais de Produção; Animais de Companhia; e Operações Internacionais. Fabrica e comercializa medicamentos, incluindo antiinflamatórios, antibióticos, anticoccidianos, antimastíticos, ectoparasiticidas, endectocidas, endoparasiticidas, hemoparasiticidas, inoculantes, terapêuticos, produtos para reprodução animal e vacinas; e aditivos, probióticos e outros produtos veterinários para melhoria de desempenho para bovinos, suínos, aves, ovinos, cavalos e caprinos, bem como serviços de fabricação. A empresa também fabrica soluções veterinárias para cães e gatos, como anestésicos, sedativos, antiinflamatórios, antibióticos, antimicrobianos, dermatológicos, ectoparasiticidas, endoparasiticidas, dermocosméticos e otológicos. Além disso, oferece vacinas e outros produtos veterinários para animais de produção e de companhia. A empresa era anteriormente conhecida como A.H.N.S.P.E. Empreendimentos e Participações S.A. A Ouro Fino Saúde Animal Participações S.A. foi constituída em 1987 e está sediada em Cravinhos, Brasil.",https://www.ourofinosaudeanimal.com,Healthcare,Saúde,6.763285,1.8893387,0.28625,0.049400000000000006,1505492968.0,28.0,Small Caps,Não disponível,45,4.1400000147857146,62.10000022178572,54.91,40.0,Baixo,,🟢
PETR3,PETROBRAS   ON      N2,"Petróleo Brasileiro S.A. - A Petrobras explora, produz e comercializa petróleo e gás no Brasil e internacionalmente. Atua por meio de três segmentos: Exploração e Produção; Refino, Transporte e Comercialização; e gás e energias de baixo carbono. O segmento de Exploração e Produção explora, desenvolve e produz petróleo bruto, líquidos de gás natural e gás natural principalmente para abastecimento às refinarias nacionais. O segmento de Refino, Transporte e Comercialização atua no refino, logística, transporte, aquisição e exportação de petróleo bruto; comércio de produtos petrolíferos; e produção de fertilizantes, além de participação em empresas petroquímicas. O segmento de Gás e Energias de Baixo Carbono atua na logística e comercialização de gás natural e eletricidade; transporte e comercialização de gás natural liquefeito; geração de energia elétrica por meio de usinas termelétricas; negócios de energia renovável; negócios de baixo carbono; e negócios de processamento de gás natural, bem como produção de biodiesel e seus coprodutos. A empresa também se dedica à prospecção, perfuração, refino, processamento, comercialização e transporte de petróleo bruto proveniente de campos petrolíferos onshore e offshore, e xisto ou outras rochas, bem como produtos petrolíferos, gás natural e outros hidrocarbonetos líquidos. Além disso, atua na pesquisa, desenvolvimento, produção, transporte, distribuição e comercialização de energia. A empresa foi constituída em 1953 e está sediada no Rio de Janeiro, Brasil.",https://petrobras.com.br,Energy,Energia,6.811506,1.7250466,0.28176,0.07200000000000001,717257997816.2954,55.650001525878906,Blue Chips,Não disponível,75,8.169999633837056,122.54999450755585,54.59,52.0,Baixo,,🟢
WIZC3,WIZ CO      ON      NM,"A Wiz Co Participações e Corretagem de Seguros S.A. atua como corretora de seguros no Brasil. A empresa oferece produtos financeiros e de seguros, incluindo seguros individuais e empresariais, consórcios, capitalização e planos de previdência privada. Atua na prospecção, ativação, suporte, seguros e produtos financeiros por meio de redes de concessionárias de veículos e treinamento para comercialização de produtos de crédito e seguros relacionados a crédito. A empresa era anteriormente conhecida como Wiz Soluções e Corretagem de Seguros S.A. Wiz Co Participações e Corretagem de Seguros S.A. foi fundada em 1973 e está sediada em Brasília, Brasil.",https://wiz.co,Financial Services,Serviços Financeiros,6.8571434,1.9798352,0.29974002,0.0732,1381598980.0198088,8.640000343322754,Small Caps,Não disponível,60,1.2599999503179056,18.899999254768584,54.29,46.0,Baixo,,🟢
EZTC3,EZTEC       ON      NM,"A EZTEC Empreendimentos e Participações S.A. atua em atividades de engenharia, construção e incorporação imobiliária no Brasil e internacionalmente. A empresa desenvolve e comercializa imóveis; administra e aluga propriedades; constrói condomínios; e subdivide terras. Atua também na prestação de serviços relacionados à construção, fiscalização, estudos e projetos; e execução de obras e serviços de engenharia civil. A EZTEC Empreendimentos e Participações S.A. foi fundada em 1979 e está sediada em São Paulo, Brasil.",https://www.eztec.com.br,Real Estate,Imobiliário,7.0740743,0.7371671,0.10949001,0.0913,3708685911.245391,13.369999885559082,Small Caps,Não disponível,65,1.889999923461234,28.34999885191851,52.84,40.0,Baixo,,🟢
TEND3,TENDA       ON      NM,"A Construtora Tenda S.A. atua como construtora de residências no Brasil. Atua nos segmentos On-Site e Off-Site. A empresa também atua na execução e gerenciamento de obras de construção civil; desenvolvimento de imóveis; compra e venda de imóveis e terrenos; prestação de serviços de gestão de construção civil; e intermediação e comercialização de cotas de consórcio. A Construtora Tenda S.A. foi fundada em 1969 e está sediada em São Paulo, Brasil.",https://www.tenda.com,Real Estate,Imobiliário,7.126214,2.9659562,0.44829,0.04190000000000001,3557900540.5235596,29.360000610351562,Small Caps,Não disponível,45,4.119999849899479,61.79999774849218,52.49,40.0,Baixo,,🟢
PLPL3,PLANOEPLANO ON      NM,"A Plano & Plano Desenvolvimento Imobiliário S.A., por meio de suas subsidiárias, desenvolve, constrói e comercializa empreendimentos imobiliários na Região Metropolitana de São Paulo. Também fornece seus serviços online. A empresa foi fundada em 1997 e está sediada em São Paulo, Brasil.",https://www.planoeplano.com.br,Real Estate,Imobiliário,7.1611114,2.556018,0.41075,0.115,2615507133.8635445,12.890000343322754,Small Caps,Não disponível,60,1.7999999753282365,26.999999629923547,52.26,46.0,Baixo,,🟢
CMIG4,CEMIG       PN  EJ  N1,"A Companhia Energética de Minas Gerais - CEMIG, por meio de suas subsidiárias, atua na geração, transmissão, distribuição e comercialização de energia no Brasil. Em 31 de dezembro de 2024, a empresa operava 36 usinas hidrelétricas com capacidade total de 4.449,0 MW, 2 parques eólicos com capacidade total de 70,8 MW e 10 usinas fotovoltaicas com capacidade total de 158,99 MW; 357.044 milhas de linhas de distribuição; e 4.754 milhas de linhas de transmissão. Também atua na aquisição, transporte e distribuição de gás e seus subprodutos e derivados; venda e comercialização de energia; construção, implantação, operação e manutenção de transmissão de energia elétrica; comercialização e intermediação de negócios relacionados à energia; instalação, operação, manutenção e aluguel de usinas solares; e atividades de geração distribuída, serviços de conta, cogeração, eficiência energética e gestão de abastecimento e armazenamento. A empresa foi constituída em 1952 e está sediada em Belo Horizonte, Brasil.",https://www.cemig.com.br,Utilities,Utilidades Públicas,7.204678,1.2333566,0.1751,0.15259999999999999,38864071607.70733,12.319999694824219,Mid Caps,Não disponível,100,1.7100000436971947,25.65000065545792,51.97,52.0,Baixo,,🟢
CLSC3,CELESC      ON  EJ  N2,"A Centrais Elétricas de Santa Catarina S.A., por meio de suas subsidiárias, atua na geração, transmissão e comercialização de energia elétrica no Brasil. Possui principalmente usinas hidrelétricas. A empresa foi fundada em 1955 e está sediada em Florianópolis, Brasil.",https://www.celesc.com.br,Utilities,Utilidades Públicas,7.282913,1.2635344,0.19097,0.056799999999999996,5739674460.0,130.0,Small Caps,Não disponível,85,17.850000405057703,267.75000607586554,51.45,40.0,Baixo,,🟢
BBSE3,BBSEGURIDADEON      NM,"A BB Seguridade Participações S.A., por meio de suas subsidiárias, atua nos negócios de seguros, previdência e obrigações no Brasil. A empresa atua por meio de dois segmentos, Segurança e Corretagem. O segmento de Seguridade oferece produtos e serviços relacionados a seguros de vida, riscos rurais, especiais e financeiros, seguros de transporte, cascos, habitacionais e pessoais, planos de previdência, planos complementares, planos odontológicos e planos de capitalização. O segmento Corretora atua na corretagem e administração, implementação, promoção e viabilização de negócios de seguros nos setores básico, vida e capitalização, bem como planos de previdência aberta e planos odontológicos. A BB Seguridade Participações S.A. foi constituída em 2012 e está sediada em Brasília, Brasil. A BB Seguridade Participações S.A. é subsidiária do Banco do Brasil S.A.",https://www.bbseguridaderi.com.br,Financial Services,Serviços Financeiros,7.3956985,6.429239,0.89815,0.1516,66758379535.68645,34.38999938964844,Blue Chips,Não disponível,75,4.650000184519209,69.75000276778813,50.7,52.0,Baixo,,🟢
ISAE4,ISA ENERGIA PN      N1,"ISA Energía Brasil S.A. engages in the electric power transmission business in Brazil. As of December 31, 2024, it had a total installed transformation capacity of 85,000 MVA together with transmission lines of 23, 0000 kilometers; and 136 substations. It operates in the states of Alagoas, Bahia, Espírito Santo, Goiás, Maranhão, Mato Grosso, Mato Grosso do Sul, Minas Gerais, Paraíba, Paraná, Pernambuco, Piauí, Rio de Janeiro, Rio Grande do Sul, Rondônia, Santa Catarina, São Paulo, and Tocantins. ISA Energía Brasil S.A. was incorporated in 1999 and is headquartered in São Paulo, Brazil.",https://www.isacteep.com.br,Utilities,Utilidades Públicas,7.6064687,0.8790729,0.12099,0.0943,18593686386.46074,28.219999313354492,Mid Caps,Não disponível,80,3.710000057366238,55.65000086049357,49.29,42.0,Baixo,,🟢
LEVE3,METAL LEVE  ON      NM,"A MAHLE Metal Leve S.A., empresa de peças automotivas, fabrica e comercializa componentes para motores de combustão interna e filtros automotivos na América do Sul, Europa, América Central e do Norte, África e internacionalmente. Atua nos segmentos de Powertrain e Carregamento e Sistemas Térmicos e Fluidos. A empresa oferece sistemas de acionamento e eletrônica de potência para motores elétricos; sistemas de pistão, componentes de cilindros, trens de válvulas, ar condicionado, refrigeração de motor, gerenciamento de ar, resfriamento de motor, gerenciamento de óleo; e eletrônica de potência para acionamentos de tração para automóveis de passageiros, bem como acionamento elétrico e sistemas mecatrônicos para aplicações industriais, máquinas agrícolas e de construção, veículos comerciais, veículos industriais, veículos de transporte elétrico e indústria automotiva, bem como veículos industriais e especiais; e equipamentos de motores grandes e pequenos. Ela fornece túneis de vento climáticos, testes de motores, engenharia, testes de módulos, gerenciamento térmico e serviços de transmissão. Além disso, disponibiliza túneis de vento climáticos; testes de motores; teste de módulo; gestão térmica industrial; transmissões; e serviços de engenharia. Além disso, a empresa oferece produtos para pistões, anéis de pistão, válvulas, bielas, rolamentos, buchas, arruelas de encosto, camisas de cilindro, anéis de pistão, árvores de cames, pistões, pinos, suportes de anéis e compressores mecânicos, bem como filtros de combustível, filtros de ar, filtros de óleo, filtros de ar condicionado, filtros de carvão ativado, separadores de óleo, tampas de válvulas, sistemas de admissão de ar, pré-filtros de diesel e coletores de admissão, ar condicionado e radiadores e condensadores. Além disso, também exporta seus produtos. A empresa foi fundada em 1920 e está sediada em Mogi Guaçu, Brasil. A MAHLE Metal Leve S.A. atua como subsidiária da Mahle Indústria E Comercio Ltda.",https://www.mahle.com,Consumer Cyclical,Consumo Cíclico,7.643653,5.3996224,0.74492997,0.0833,4651698438.63678,34.31999969482422,Small Caps,Não disponível,60,4.489999702344445,67.34999553516667,49.04,42.0,Baixo,,🟢
BLAU3,BLAU        ON  EJ  NM,"Blau Farmacêutica S.A., uma empresa farmacêutica fornece medicamentos no Brasil, Argentina, Chile, Colômbia, Uruguai, Equador, Peru e Estados Unidos. Seus produtos abrangem diversas áreas, como imunologia, hematologia, oncologia, nefrologia, infectologia e anestesiologia. A empresa oferece estimuladores uterinos, antirreumáticos, anestésicos, antibióticos, cuidados com a saúde feminina, biofarmacêuticos, oncológicos, produtos hospitalares, antivirais e antirretrovirais, biológicos, inibidores de bomba de ácido, hemoderivados, antitrombóticos e trombolíticos. A Blau Farmacêutica S.A. foi constituída em 1987 e está sediada em Cotia, Brasil.",https://www.blau.com,Healthcare,Saúde,7.664063,0.9974581,0.1347,0.0678,2265917575.6732225,9.8100004196167,Small Caps,Não disponível,65,1.2799999712445866,19.1999995686688,48.91,36.0,Baixo,,🟢
SAPR3,SANEPAR     ON      N2,"A Companhia de Saneamento do Paraná - SANEPAR presta serviços de saneamento no Brasil. A empresa atua na distribuição de água; coleta e tratamento de esgoto e resíduos sólidos; estudo, projeto e obras de novas instalações; expansão das redes de distribuição de água; e redes de coleta e tratamento de esgoto. Presta ainda serviços de consultoria e assistência técnica nas suas áreas de atuação. A Companhia de Saneamento do Paraná - SANEPAR foi fundada em 1963 e está sediada em Curitiba, Brasil.",https://www.sanepar.com.br,Utilities,Utilidades Públicas,7.7751937,0.24550839,0.17944999,0.0204,15157390952.034592,10.029999732971191,Mid Caps,Não disponível,85,1.2899999819903125,19.349999729854687,48.17,42.0,Baixo,,🟢
