Ticker,Empresa,Resumo,Site,setor_original,Setor,PL,PVP,ROE,DivYield,MarketCap,Preco,Categoria,CNPJ,Score,LucroPorAcao,PrecoJusto,Desconto_%,Ranking,Risco,Risco_num,Farol
BGIP3,BANESE      ON,"O Banco do Estado de Sergipe S.A. oferece diversos produtos e serviços bancários em Sergipe. A empresa oferece contas correntes, únicas e outras; poupança; Produtos CBD/RDB; investimentos; cartões; produtos de seguros; empréstimos e financiamentos, consignado, pagamento, consórcio, capitalização, portabilidade e serviços de internet banking. A empresa era anteriormente conhecida como Banco de Fomento Budget e mudou seu nome para Banco do Estado de Sergipe S.A. em 1967. O Banco do Estado de Sergipe S.A. foi fundado em 1961 e tem sede em Aracaju, Brasil.",https://www.banese.com.br,Financial Services,Serviços Financeiros,7.899484,1.4056408,0.15865,0.083,1330724429.6,61.3,Small Caps,Não disponível,85,7.7600005266166745,116.40000789925011,47.34,42.0,Baixo,,🟢
BPAC5,BTGP BANCO  PNA     N2,"O Banco BTG Pactual S.A. fornece produtos e serviços financeiros relativos a carteiras comerciais, de investimentos, de crédito, de financiamento, de arrendamento mercantil, de seguros e de câmbio no Brasil e internacionalmente. A empresa também oferece serviços de investimento pessoal para uma carteira de investimentos customizada; serviços de contas bancárias internacionais, incluindo cartão de débito, transferência, pagamento e recebimento, e serviços de suporte ao cliente. Também fornece serviços de gestão de patrimônio, como execução, pesquisa de mercado, recursos e análises educacionais e gestão de relacionamento; gestão do patrimônio familiar; contas correntes e de poupança, certificados de depósito, contas de aposentadoria e contas do mercado monetário; financiamento imobiliário; bem como empréstimos corporativos, empréstimos a prazo, linhas de crédito e financiamento de credores. O Banco BTG Pactual S.A. foi fundado em 1983 e está sediado no Rio de Janeiro, Brasil. O Banco BTG Pactual S.A. opera como subsidiária do BTG Pactual Holding Financeira Ltda.",https://www.btgpactual.com,Financial Services,Serviços Financeiros,7.9142857,0.7620882,0.23868,0.04190000000000001,128391212815.21211,11.079999923706055,Blue Chips,Não disponível,85,1.3999999928870466,20.9999998933057,47.24,54.0,Baixo,,🟢
TGMA3,TEGMA       ON      NM,"A Tegma Gestão Logística S.A., em conjunto com suas subsidiárias, presta serviços logísticos no Brasil. Atua nos segmentos de Logística Automotiva e Logística Integrada. O segmento de Logística Automotiva atua no transporte e distribuição de veículos novos e usados; transferências portuárias; e gerenciamento de pátio e estoque para montadoras, além de serviços de pré-entrega de veículos. O segmento de Logística Integrada fornece serviços de transporte, armazenamento e gerenciamento de estoque para produtos químicos, eletrodomésticos e bens de consumo. A empresa também oferece logística e centro automotivo, gerenciamento de pátio, transporte e armazenamento de veículos, logística integrada, gerenciamento da cadeia de suprimentos de produtos químicos, gerenciamento de embalagens, intralogística e serviços de projetos especiais. Atende indústrias de alimentos e bebidas, automotiva, cosmética, eletrodomésticos, farmacêutica e química e petroquímica. A empresa foi fundada em 1969 e está sediada em São Bernardo do Campo, Brasil.",https://www.tegma.com.br,Industrials,Indústria,7.9918475,2.2233143,0.27091998,0.1512,1939229864.4586945,29.40999984741211,Small Caps,Não disponível,60,3.680000131060072,55.20000196590108,46.72,42.0,Baixo,,🟢
NEOE3,NEOENERGIA  ON      NM,"A Neoenergia S.A. gera, transmite, distribui, comercializa e comercializa energia elétrica no Brasil. Opera através de Redes, Renováveis, Liberalizadas e Outros. A empresa fornece soluções para o mercado livre de energia, como gestão de energia, sistemas de medição e cobrança, certificados de energia renovável e contratos de longo prazo; hidrogênio verde, que inclui amônia verde, aço e metanol; soluções de gases industriais; usina solar; e soluções de frota eletrificada para empresas. Também oferece cobrança de energia solar, seguros e serviços para clientes residenciais. A empresa foi fundada em 1997 e está sediada no Rio de Janeiro, Brasil. A Neoenergia S.A. é uma subsidiária da Iberdrola Energía, S.A.U.",https://www.neoenergia.com,Utilities,Utilidades Públicas,8.053141,1.1101861,0.14588,0.043899999999999995,40468000433.53076,33.34000015258789,Mid Caps,Não disponível,65,4.13999955453256,62.0999933179884,46.31,30.0,Baixo,,🟢
CLSC4,CELESC      PN  EJ  N2,"A Centrais Elétricas de Santa Catarina S.A., por meio de suas subsidiárias, atua na geração, transmissão e comercialização de energia elétrica no Brasil. Possui principalmente usinas hidrelétricas. A empresa foi fundada em 1955 e está sediada em Florianópolis, Brasil.",https://www.celesc.com.br,Utilities,Utilidades Públicas,8.0992155,1.40437,0.19097,0.0556,5573209395.4700775,144.49000549316406,Small Caps,Não disponível,85,17.84000012015535,267.6000018023302,46.01,36.0,Baixo,,🟢
EKTR4,ELEKTRO     PN,"A Elektro Redes S.A. atua na distribuição de energia elétrica no Brasil. A empresa era anteriormente conhecida como Elektro Eletricidade e Serviços S.A. e mudou seu nome para Elektro Redes S.A. em agosto de 2016. A empresa foi constituída em 1998 e está sediada em Campinas, Brasil. A Elektro Redes S.A. é subsidiária da Neoenergia S.A.",https://www.elektro.com.br,Utilities,Utilidades Públicas,8.170214,3.645339,0.47262,0.1099,7440356071.653175,38.400001525878906,Small Caps,Não disponível,60,4.699999476865466,70.49999215298199,45.53,42.0,Baixo,,🟢
SBFG3,GRUPO SBF   ON      NM,"O Grupo SBF S.A. comercializa no varejo e atacado produtos esportivos e de lazer no Brasil. Oferece calçados, roupas, equipamentos esportivos e acessórios. Também presta serviços de logística; e organização de corridas e eventos esportivos sob as marcas Xterra e Uphill. Além disso, a empresa atua nos negócios de filmes publicitários e produção audiovisual. Além disso, opera uma plataforma de dança e uma rede de canais de esportes. A empresa comercializa seus produtos esportivos e de lazer por meio de lojas físicas e canais de comércio eletrônico. O Grupo SBF S.A. foi fundado em 1981 e está sediado em São Paulo, Brasil.",https://ri.gruposbf.com.br,Consumer Cyclical,Consumo Cíclico,8.321428,0.8223336,0.10802,0.0467,2682595468.6106014,11.649999618530273,Small Caps,Não disponível,50,1.400000050295487,21.000000754432307,44.52,30.0,Baixo,,🟢
WHRL3,WHIRLPOOL   ON,"A Whirlpool S.A. fabrica, vende, importa e exporta eletrodomésticos no Brasil. A empresa oferece geladeiras, freezers, condicionadores de ar, máquinas de fazer gelo, fogões, lava-louças, trituradores de lixo, compactadores de lixo, aspiradores de pó, máquinas de lavar, secadoras de roupas e fornos de micro-ondas. Comercializa seus produtos com as marcas Brastemp, Consul, KitchenAind, Compra Certa, B.blend, Jenn-Air, KitchenAid, Whirlpool e Maytag. A empresa foi fundada em 1957 e está sediada em São Paulo, Brasil. A Whirlpool S.A. opera como subsidiária da Whirlpool Corporation.",https://www.whirlpool.com.br,Consumer Cyclical,Consumo Cíclico,8.553191,2.8190744,0.30252,0.1209,6104167411.277872,4.019999980926514,Small Caps,Não disponível,60,0.47000002466056395,7.050000369908459,42.98,42.0,Baixo,,🟢
RANI3,IRANI       ON      NM,"A Irani Papel e Embalagem S.A. fabrica e comercializa papelão ondulado e papéis para embalagens no Brasil e no exterior. Atua por meio de três segmentos: Embalagens Sustentáveis; Segmento Papel para Embalagens Sustentáveis; e RS Florestal. A empresa oferece caixas e folhas de papelão leve, corrugado e pesado; e papéis kraft de baixa e alta densidade e papéis reciclados. Também presta serviços florestais e de reflorestamento; e cultivo de pinus para comercialização de madeira em tora. A Irani Papel e Embalagem S.A. foi fundada em 1941 e está sediada em Porto Alegre, Brasil.",https://irani.com.br,Consumer Cyclical,Consumo Cíclico,8.581818,1.4986506,0.18021,0.0483,2175931410.6378393,9.4399995803833,Small Caps,Não disponível,70,1.0999999744090705,16.49999961613606,42.79,36.0,Baixo,,🟢
ALUP4,ALUPAR      PN      N2,"A Alupar Investimento S.A., em conjunto com suas subsidiárias, atua na transmissão, geração e comercialização de energia no Brasil, Colômbia, Peru e Chile. Atua nos segmentos de Transmissão e Geração. A empresa detém participação em concessões de 44 sistemas de transmissão de energia elétrica, totalizando 9.999 quilômetros de linhas de transmissão; e opera linhas aéreas e subestações. Também atua na geração de energia renovável por meio de hidrelétricas, parques eólicos e usinas fotovoltaicas, que possuem capacidade instalada de 798,5 MW. A empresa foi constituída em 2006 e está sediada em São Paulo, Brasil. A Alupar Investimento S.A. é uma subsidiária da Guarupart Participações Ltda.",https://www.alupar.com.br,Utilities,Utilidades Públicas,8.709678,0.38847524,0.14265001,0.0232,10679910679.414005,10.800000190734863,Mid Caps,Não disponível,65,1.2399999392325254,18.59999908848788,41.94,30.0,Baixo,,🟢
KEPL3,KEPLER WEBERON      NM,"A Kepler Weber S.A. fornece equipamentos para armazenamento de grãos e soluções pós-colheita de grãos no Brasil, nas Américas, na África, na Europa e na Ásia. Atua em cinco segmentos: Fazendas, Agroindústria, Portos e Terminais, Reposição e Serviços e Negócios Internacionais. A empresa oferece sistemas de armazenamento e preservação de grãos, como silos, secadores e transportadores, além de máquinas de limpeza. Também fornece equipamentos para commodities agrícolas, como etanol de milho, óleo de soja, ração animal, moinhos de trigo, indústrias de arroz, complexos cooperativos, produtores de cereais e canteiros; equipamentos industriais; e terminais portuários. Além disso, a empresa oferece peças de reposição e serviços de assistência técnica; serviços de engenharia técnica e processamento de dados; serviços de seguros contra riscos de engenharia; e serviços de monitoramento de temperatura e umidade de grãos no processo de processamento e armazenamento. Além disso, importa e exporta matérias-primas e produtos acabados e semiacabados. A empresa foi fundada em 1925 e está sediada em São Paulo, Brasil.",https://www.kepler.com.br,Industrials,Indústria,8.822223,1.7774793,0.20629999,0.0658,1376254898.918128,7.940000057220459,Small Caps,Não disponível,60,0.8999999271408645,13.499998907112968,41.19,42.0,Baixo,,🟢
TAEE3,TAESA       ON      N2,"A Transmissora Aliança de Energia Elétrica S.A., em conjunto com suas subsidiárias, atua na construção, operação e manutenção de linhas de transmissão de energia elétrica no Brasil. Opera uma extensão total de aproximadamente 15.319 quilômetros (km) de linhas de transmissão, que incluem 14.677 km de linhas de transmissão em operação e 735 km de linhas em construção; 113 subestações com tensão entre 230 e 525KV; e um centro de operação do sistema localizado no Rio de Janeiro. A empresa foi fundada em 2000 e está sediada no Rio de Janeiro, Brasil.",https://institucional.taesa.com.br/,Utilities,Utilidades Públicas,8.908497,0.61710507,0.21719,0.0787,14086560425.504314,13.630000114440918,Mid Caps,Não disponível,100,1.5299999668227893,22.94999950234184,40.61,60.0,Baixo,,🟢
BEES3,BANESTES    ON  EJ,"O Banestes S.A - Banco do Estado do Espírito Santo S.A., em conjunto com suas subsidiárias, atua como banco múltiplo no Brasil. Opera através do Financeiro; e Seguros e Outros segmentos. A empresa atua por meio de suas carteiras de comércio, rural, industrial, imobiliário, câmbio, arrendamento, investimento e administração de cartões de crédito; e nas áreas de seguros e distribuição, intermediação e administração de recursos de terceiros. Também fornece gestão de ativos e fundos; administração e intermediação de valores mobiliários, seguros, previdência e capitalização; fundos de investimento; cartões de crédito e débito; banco pela internet; conta corrente, poupança, especial, cheque fiduciário, jovem e universitário, conta mais fácil, simplificada, salário e judicial; títulos de capitalização; seguro de carro, vida, casa, acidentes pessoais, proteção financeira de cartão e seguro empresarial; cobranças e convênios; transferência de fundos e recursos; coleção; custódia; opções de crédito e financiamento; empréstimos e garantias; e outros serviços. Além disso, a empresa opera um serviço público de loteria. Banestes S.A - Banco do Estado do Espírito Santo S.A. foi fundado em 1935 e está sediado em Vitória, Brasil.",https://www.banestes.com.br,Financial Services,Serviços Financeiros,8.918367,1.2534059,0.14352,0.039599999999999996,3037186156.502613,8.739999771118164,Small Caps,Não disponível,50,0.9800000124594742,14.700000186892114,40.54,24.0,Baixo,,🟢
SANB3,SANTANDER BRON,"O Banco Santander (Brasil) S.A., em conjunto com suas subsidiárias, fornece diversos produtos e serviços bancários para pessoas físicas, pequenas e médias empresas e clientes corporativos no Brasil e internacionalmente. Atua em dois segmentos, Banco Comercial e Banco Global de Atacado. A empresa oferece produtos de pagamento e fidelidade, incluindo cartões de crédito e débito; crédito consignado e imobiliário; soluções de financiamento de home equity; programas de microfinanciamento; consórcios; produtos do agronegócio, como crédito, valores mobiliários e outros produtos; call center e soluções digitais; ativos inadimplentes; e produtos de seguros que abrangem seguros de vida, acidentes pessoais, automóveis, patrimoniais e de crédito, bem como seguros de viagens e transações bancárias. Também oferece soluções emergenciais para residências, carros, motocicletas, animais de estimação e telemedicina; financiamento ao consumo; e serviços bancários corporativos e de investimento, que incluem gestão de caixa, soluções estruturadas de comércio e capital de giro, comércio e empréstimos, fusões e aquisições, mercados de capitais acionários, dívida com grau de investimento e de mercados emergentes e finanças estruturadas, bem como mercados de vendas, criação de mercado, comércio de energia, ações, pesquisa e mobilização e securitização de dívida privada. Além disso, a empresa oferece soluções de gestão de caixa, como cobranças, pagamentos, pagamentos instantâneos e serviços de folha de pagamento e custódia; programa advance, plataforma não financeira de apoio a empreendedores em conteúdos educacionais, cursos certificados, eventos com foco em gestão, inovação, internacionalização e desenvolvimento de equipes; financiamento de clientes através de depósitos e outros instrumentos de financiamento bancário; e vários investimentos. Oferece seus produtos e serviços por meio de agências, miniagências e caixas eletrônicos; centrais de atendimento; correspondentes bancários e fornecedores terceirizados; e plataformas bancárias online e móveis. A empresa foi fundada em 1970 e está sediada em São Paulo, Brasil.",https://www.santander.com.br,Financial Services,Serviços Financeiros,8.920245,0.43392622,0.10524,0.059000000000000004,108900333663.75037,14.539999961853027,Blue Chips,Não disponível,80,1.6300000685915048,24.45000102887257,40.53,36.0,Baixo,,🟢
TAEE4,TAESA       PN      N2,"A Transmissora Aliança de Energia Elétrica S.A., em conjunto com suas subsidiárias, atua na construção, operação e manutenção de linhas de transmissão de energia elétrica no Brasil. Opera uma extensão total de aproximadamente 15.319 quilômetros (km) de linhas de transmissão, que incluem 14.677 km de linhas de transmissão em operação e 735 km de linhas em construção; 113 subestações com tensão entre 230 e 525KV; e um centro de operação do sistema localizado no Rio de Janeiro. A empresa foi fundada em 2000 e está sediada no Rio de Janeiro, Brasil.",https://institucional.taesa.com.br/,Utilities,Utilidades Públicas,9.078432,0.62887675,0.21719,0.07730000000000001,14355269809.51294,13.890000343322754,Mid Caps,Não disponível,100,1.5299999320722737,22.949998981084107,39.48,60.0,Baixo,,🟢
BEES4,BANESTES    PN  EJ,"O Banestes S.A - Banco do Estado do Espírito Santo S.A., em conjunto com suas subsidiárias, atua como banco múltiplo no Brasil. Opera através do Financeiro; e Seguros e Outros segmentos. A empresa atua por meio de suas carteiras de comércio, rural, industrial, imobiliário, câmbio, arrendamento, investimento e administração de cartões de crédito; e nas áreas de seguros e distribuição, intermediação e administração de recursos de terceiros. Também fornece gestão de ativos e fundos; administração e intermediação de valores mobiliários, seguros, previdência e capitalização; fundos de investimento; cartões de crédito e débito; banco pela internet; conta corrente, poupança, especial, cheque fiduciário, jovem e universitário, conta mais fácil, simplificada, salário e judicial; títulos de capitalização; seguro de carro, vida, casa, acidentes pessoais, proteção financeira de cartão e seguro empresarial; cobranças e convênios; transferência de fundos e recursos; coleção; custódia; opções de crédito e financiamento; empréstimos e garantias; e outros serviços. Além disso, a empresa opera um serviço público de loteria. Banestes S.A - Banco do Estado do Espírito Santo S.A. foi fundado em 1935 e está sediado em Vitória, Brasil.",https://www.banestes.com.br,Financial Services,Serviços Financeiros,9.132652,1.2835221,0.14352,0.0395,3123524291.684079,8.949999809265137,Small Caps,Não disponível,50,0.9800000929921711,14.700001394882566,39.12,24.0,Baixo,,🟢
SANB4,SANTANDER BRPN,"O Banco Santander (Brasil) S.A., em conjunto com suas subsidiárias, fornece diversos produtos e serviços bancários para pessoas físicas, pequenas e médias empresas e clientes corporativos no Brasil e internacionalmente. Atua em dois segmentos, Banco Comercial e Banco Global de Atacado. A empresa oferece produtos de pagamento e fidelidade, incluindo cartões de crédito e débito; crédito consignado e imobiliário; soluções de financiamento de home equity; programas de microfinanciamento; consórcios; produtos do agronegócio, como crédito, valores mobiliários e outros produtos; call center e soluções digitais; ativos inadimplentes; e produtos de seguros que abrangem seguros de vida, acidentes pessoais, automóveis, patrimoniais e de crédito, bem como seguros de viagens e transações bancárias. Também oferece soluções emergenciais para residências, carros, motocicletas, animais de estimação e telemedicina; financiamento ao consumo; e serviços bancários corporativos e de investimento, que incluem gestão de caixa, soluções estruturadas de comércio e capital de giro, comércio e empréstimos, fusões e aquisições, mercados de capitais acionários, dívida com grau de investimento e de mercados emergentes e finanças estruturadas, bem como mercados de vendas, criação de mercado, comércio de energia, ações, pesquisa e mobilização e securitização de dívida privada. Além disso, a empresa oferece soluções de gestão de caixa, como cobranças, pagamentos, pagamentos instantâneos e serviços de folha de pagamento e custódia; programa advance, plataforma não financeira de apoio a empreendedores em conteúdos educacionais, cursos certificados, eventos com foco em gestão, inovação, internacionalização e desenvolvimento de equipes; financiamento de clientes através de depósitos e outros instrumentos de financiamento bancário; e vários investimentos. Oferece seus produtos e serviços por meio de agências, miniagências e caixas eletrônicos; centrais de atendimento; correspondentes bancários e fornecedores terceirizados; e plataformas bancárias online e móveis. A empresa foi fundada em 1970 e está sediada em São Paulo, Brasil.",https://www.santander.com.br,Financial Services,Serviços Financeiros,9.220859,0.4485496,0.10524,0.0617,112570288183.00256,15.029999732971191,Blue Chips,Não disponível,80,1.6299999526043278,24.449999289064916,38.53,42.0,Baixo,,🟢
SMTO3,SAO MARTINHOON      NM,"A São Martinho S.A., em conjunto com suas subsidiárias, atua na produção e comercialização de açúcar, etanol e outros subprodutos da cana-de-açúcar no Brasil. A empresa atua nos segmentos de Açúcar, Etanol, Etanol de Cormo, Energia Elétrica, Negócios Imobiliários, Leveduras e Outros Produtos. Oferece uma variedade de açúcar bruto; etanol hidratado, utilizado em tanques de carros movidos a etanol; etanol anidro, utilizado como aditivo à gasolina em veículos movidos a gasolina; e o etanol industrial, utilizado principalmente na produção de tintas, cosméticos e bebidas alcoólicas. A empresa também gera energia elétrica a partir do bagaço da cana-de-açúcar; fornece subprodutos, incluindo leveduras utilizadas na alimentação animal; oferece óleo fúsel usado como solvente e amilaetanol puro; e SMartLiO, substituto do óleo de soja utilizado na produção de biocombustíveis, tintas e produtos químicos, além de Grãos Secos de Destilaria com Solúveis, nutrição animal para ruminantes, porcos, cavalos, pássaros, peixes e animais de estimação. Além disso, atua no cultivo de cana-de-açúcar; desenvolvimento de imóveis; importação e exportação de bens, produtos e matérias-primas; produções agrícolas; e investimento em outras empresas. A empresa foi fundada em 1914 e está sediada em São Paulo, Brasil. A São Martinho S.A. é uma subsidiária da LJN Participações S.A.",https://www.saomartinho.com.br,Basic Materials,Materiais Básicos,9.224138,0.9541218,0.11124,0.044800000000000006,6900892690.697874,21.3799991607666,Small Caps,Não disponível,50,2.3178316673890396,34.7674750108356,38.51,30.0,Baixo,,🟢
ISAE3,ISA ENERGIA ON      N1,"ISA Energía Brasil S.A. engages in the electric power transmission business in Brazil. As of December 31, 2024, it had a total installed transformation capacity of 85,000 MVA together with transmission lines of 23, 0000 kilometers; and 136 substations. It operates in the states of Alagoas, Bahia, Espírito Santo, Goiás, Maranhão, Mato Grosso, Mato Grosso do Sul, Minas Gerais, Paraíba, Paraná, Pernambuco, Piauí, Rio de Janeiro, Rio Grande do Sul, Rondônia, Santa Catarina, São Paulo, and Tocantins. ISA Energía Brasil S.A. was incorporated in 1999 and is headquartered in São Paulo, Brazil.",https://www.isacteep.com.br,Utilities,Utilidades Públicas,9.370968,1.0859137,0.12099,0.0771,22968672379.590454,34.86000061035156,Mid Caps,Não disponível,80,3.71999996268812,55.7999994403218,37.53,36.0,Baixo,,🟢
PSSA3,PORTO SEGUROON      NM,"A Porto Seguro S.A., em conjunto com suas subsidiárias, oferece uma gama de produtos e serviços de seguros no Brasil e no Uruguai. Oferece produtos de seguros de automóveis, residenciais, viagens, celular, vida, motocicleta, notebook e tablet, foto e vídeo, smart e games, bicicleta, imobiliário, green card, fiança e mudança, além de resseguros, proteção combinada, responsabilidade civil profissional, máquinas e equipamentos, eventos, agronegócio e táxi. A empresa também atua na gestão e comercialização de títulos de capitalização; concessão de empréstimos e financiamentos para consumo e capital de giro; operação de cartões de crédito; gestão de grupos de consórcios para aquisição de bens móveis e imóveis; distribuição de cotas de fundos de investimento; manutenção, desenvolvimento e licenciamento de programas; instalação de sistemas de aquecimento, gás natural e gás liquefeito de petróleo; operação de centros de oncologia, hematologia e radioterapia; venda e distribuição de peças automotivas; e administração e gestão de carteiras de valores mobiliários, fundos de investimento e recursos financeiros. Além disso, presta serviços técnicos de corretagem de seguros; serviços de obtenção de crédito e financiamento ao consumo; suporte técnico para software e outros serviços de tecnologia da informação; serviços de intermediação e agência para serviços e empresas; serviços de cobrança de dívidas e informações de crédito; serviços de assessoria administrativa para médicos e seguradoras de saúde; serviços de consultoria e assessoria em saúde ocupacional, segurança no trabalho, ergonomia e serviços ambulatoriais; serviços relacionados com protecção e monitorização electrónica; e telemarketing e atendimento geral ao cliente. A empresa foi fundada em 1945 e está sediada em São Paulo, Brasil. A Porto Seguro S.A. opera como subsidiária da Porto Seguro Itaú Unibanco Participações S.A.",https://www.portoseguro.com.br,Financial Services,Serviços Financeiros,9.408829,1.994142,0.22815001,0.0513,31487596212.40075,49.02000045776367,Mid Caps,Não disponível,75,5.210000145370233,78.1500021805535,37.27,42.0,Baixo,,🟢
