Ticker,Empresa,Resumo,Site,setor_original,Setor,PL,PVP,ROE,DivYield,MarketCap,Preco,Categoria,Score,LucroPorAcao,PrecoJusto,Desconto_%,Ranking,Risco,Risco_num,Farol
NEOE3,NEOENERGIA  ON,"A Neoenergia S.A. gera, transmite, distribui, comercializa e comercializa energia elétrica no Brasil. Opera através de Redes, Renováveis, Liberalizadas e Outros. A empresa fornece soluções para o mercado livre de energia, como gestão de energia, sistemas de medição e faturamento, certificados de energia renovável e contratos de longo prazo; hidrogênio verde, que inclui amônia verde, aço e metanol; soluções de gases industriais; usina solar; e soluções de frota eletrificada para empresas. Também oferece cobrança de energia solar, seguros e serviços para clientes residenciais. A empresa foi fundada em 1997 e está sediada no Rio de Janeiro, Brasil. A Neoenergia S.A. é uma subsidiária da Iberdrola Energía, S.A.U.",https://www.neoenergia.com,Utilities,Utilidades Públicas,8.113527,1.1185108,0.14588,0.0436,40771449745.53076,33.59000015258789,Mid Caps,65,4.139999799419893,62.0999969912984,45.91,30.0,Baixo,,🟢
TEND3,TENDA       ON      NM,"A Construtora Tenda S.A. atua como construtora de residências no Brasil. Atua nos segmentos On-Site e Off-Site. A empresa também atua na execução e gerenciamento de obras de construção civil; desenvolvimento de imóveis; compra e venda de imóveis e terrenos; prestação de serviços de gestão de construção civil; e intermediação e comercialização de cotas de consórcio. A Construtora Tenda S.A. foi fundada em 1969 e está sediada em São Paulo, Brasil.",https://www.tenda.com,Real Estate,Imobiliário,8.237864,3.428629,0.44829,0.0365,4112913383.821991,33.939998626708984,Small Caps,45,4.119999872140276,61.799998082104146,45.08,36.0,Baixo,,🟢
LEVE3,METAL LEVE  ON      NM,"A MAHLE Metal Leve S.A., empresa de peças automotivas, fabrica e comercializa componentes para motores de combustão interna e filtros automotivos na América do Sul, Europa, América Central e do Norte, África e internacionalmente. Atua nos segmentos de Powertrain e Carregamento e Sistemas Térmicos e Fluidos. A empresa oferece sistemas de acionamento e eletrônica de potência para motores elétricos; sistemas de pistão, componentes de cilindros, trens de válvulas, ar condicionado, refrigeração de motor, gerenciamento de ar, resfriamento de motor, gerenciamento de óleo; e eletrônica de potência para acionamentos de tração para automóveis de passageiros, bem como acionamento elétrico e sistemas mecatrônicos para aplicações industriais, máquinas agrícolas e de construção, veículos comerciais, veículos industriais, veículos de transporte elétrico e indústria automotiva, bem como veículos industriais e especiais; e equipamentos de motores grandes e pequenos. Ela fornece túneis de vento climáticos, testes de motores, engenharia, testes de módulos, gerenciamento térmico e serviços de transmissão. Além disso, disponibiliza túneis de vento climáticos; testes de motores; teste de módulo; gestão térmica industrial; transmissões; e serviços de engenharia. Além disso, a empresa oferece produtos para pistões, anéis de pistão, válvulas, bielas, rolamentos, buchas, arruelas de encosto, camisas de cilindro, anéis de pistão, árvores de cames, pistões, pinos, suportes de anéis e compressores mecânicos, bem como filtros de combustível, filtros de ar, filtros de óleo, filtros de ar condicionado, filtros de carvão ativado, separadores de óleo, tampas de válvulas, sistemas de admissão de ar, pré-filtros de diesel e coletores de admissão, ar condicionado e radiadores e condensadores. Além disso, exporta seus produtos. A empresa foi fundada em 1920 e está sediada em Mogi Guaçu, Brasil. A MAHLE Metal Leve S.A. atua como subsidiária da Mahle Indústria E Comercio Ltda.",https://www.mahle.com,Consumer Cyclical,Consumo Cíclico,8.251671,5.829138,0.74492997,0.077,5021719846.591949,37.04999923706055,Small Caps,60,4.489999569427883,67.34999354141824,44.99,42.0,Baixo,,🟢
CLSC4,CELESC      PN      N2,"A Centrais Elétricas de Santa Catarina S.A., por meio de suas subsidiárias, atua na geração, transmissão e comercialização de energia elétrica no Brasil. A empresa possui principalmente usinas hidrelétricas. A Centrais Elétricas de Santa Catarina S.A. foi fundada em 1955 e tem sede em Florianópolis, Brasil.",https://www.celesc.com.br,Utilities,Utilidades Públicas,8.314285,1.4424703,0.19097,0.054000000000000006,5724409961.563385,148.41000366210938,Small Caps,85,17.850001973965213,267.7500296094782,44.57,36.0,Baixo,,🟢
ISAE4,ISA ENERGIA PN  ED  N1,"A ISA Energía Brasil S.A. atua no negócio de transmissão de energia elétrica no Brasil. Em 31 de dezembro de 2025, possuía capacidade total instalada de transformação de 84.910 MVA juntamente com linhas de transmissão de 23 mil quilômetros. Atua nos estados da Bahia, Espírito Santo, Minas Gerais, Rio de Janeiro e São Paulo. A ISA Energía Brasil S.A. foi constituída em 1999 e está sediada em São Paulo, Brasil.",https://www.isacteep.com.br,Utilities,Utilidades Públicas,8.361186,0.9662949,0.12099,0.0858,20438560391.69284,31.020000457763672,Mid Caps,80,3.710000047572638,55.65000071358957,44.26,42.0,Baixo,,🟢
RANI3,IRANI       ON      NM,"A Irani Papel e Embalagem S.A. fabrica e comercializa papelão ondulado e papéis para embalagens no Brasil e no exterior. Atua por meio de três segmentos: Embalagens Sustentáveis; Segmento Papel para Embalagens Sustentáveis; e RS Florestal. A empresa oferece caixas e folhas de papelão leve, corrugado e pesado; e papéis kraft de baixa e alta densidade e papéis reciclados. Também presta serviços florestais e de reflorestamento; e cultivo de pinus para comercialização de madeira em tora. A Irani Papel e Embalagem S.A. foi fundada em 1941 e está sediada em Porto Alegre, Brasil.",https://irani.com.br,Consumer Cyclical,Consumo Cíclico,8.70909,1.5208764,0.18021,0.04769999999999999,2208201660.4341526,9.579999923706055,Small Caps,45,1.100000106062293,16.500001590934396,41.94,30.0,Baixo,,🟢
BLAU3,BLAU        ON      NM,"Blau Farmacêutica S.A., uma empresa farmacêutica fornece medicamentos no Brasil, Argentina, Chile, Colômbia, Uruguai, Equador, Peru e Estados Unidos. Seus produtos abrangem diversas áreas, como imunologia, hematologia, oncologia, nefrologia, infectologia e anestesiologia. A empresa oferece estimuladores uterinos, antirreumáticos, anestésicos, antibióticos, cuidados com a saúde feminina, biofarmacêuticos, oncológicos, produtos hospitalares, antivirais e antirretrovirais, biológicos, inibidores de bomba de ácido, hemoderivados, antitrombóticos e trombolíticos. A Blau Farmacêutica S.A. foi constituída em 1987 e está sediada em Cotia, Brasil.",https://www.blau.com,Healthcare,Saúde,8.7421875,1.1377732,0.1347,0.059000000000000004,2584670299.3267775,11.1899995803833,Small Caps,65,1.2799999520009495,19.199999280014243,41.72,24.0,Baixo,,🟢
WHRL3,WHIRLPOOL   ON,"A Whirlpool S.A. fabrica, vende, importa e exporta eletrodomésticos no Brasil. A empresa oferece geladeiras, freezers, condicionadores de ar, máquinas de fazer gelo, fogões, lava-louças, trituradores de lixo, compactadores de lixo, aspiradores de pó, máquinas de lavar, secadoras de roupas e fornos de micro-ondas. Comercializa seus produtos com as marcas Brastemp, Consul, KitchenAind, Compra Certa, B.blend, Jenn-Air, KitchenAid, Whirlpool e Maytag. A empresa foi fundada em 1957 e está sediada em São Paulo, Brasil. A Whirlpool S.A. opera como subsidiária da Whirlpool Corporation.",https://www.whirlpool.com.br,Consumer Cyclical,Consumo Cíclico,8.787234,2.8962133,0.19904,0.1285,6206506376.76021,4.130000114440918,Small Caps,60,0.47000001529957186,7.050000229493578,41.42,36.0,Baixo,,🟢
BEES3,BANESTES    ON  EJ,"O Banestes S.A - Banco do Estado do Espírito Santo S.A., em conjunto com suas subsidiárias, atua como banco múltiplo no Brasil. Opera através do Financeiro; e Seguros e Outros segmentos. A empresa atua por meio de suas carteiras de comércio, rural, industrial, imobiliário, câmbio, arrendamento, investimento e administração de cartões de crédito; e nas áreas de seguros e distribuição, intermediação e administração de recursos de terceiros. Também fornece gestão de ativos e fundos; administração e intermediação de valores mobiliários, seguros, previdência e capitalização; fundos de investimento; cartões de crédito e débito; banco pela internet; conta corrente, poupança, especial, cheque fiduciário, jovem e universitário, conta mais fácil, simplificada, salário e judicial; títulos de capitalização; seguro de carro, vida, casa, acidentes pessoais, proteção financeira de cartão e seguro empresarial; cobranças e convênios; transferência de fundos e recursos; coleção; custódia; opções de crédito e financiamento; empréstimos e garantias; e outros serviços. Além disso, a empresa opera um serviço público de loteria. Banestes S.A - Banco do Estado do Espírito Santo S.A. foi fundado em 1935 e está sediado em Vitória, Brasil.",https://www.banestes.com.br,Financial Services,Serviços Financeiros,9.020408,1.267747,0.14352,0.0391,3071936703.6649246,8.84000015258789,Small Caps,50,0.9800000346534093,14.70000051980114,39.86,24.0,Baixo,,🟢
SBFG3,GRUPO SBF   ON      NM,"O Grupo SBF S.A. atua na comercialização de artigos esportivos e produtos de lazer no Brasil. A empresa oferece calçados, roupas, entretenimento em geral, equipamentos e acessórios. Também oferece aulas semanais gratuitas de Yoga e FitDance; promove diversos eventos e aulas esportivas gratuitas; atividades gratuitas, como aulas de diversas modalidades e eventos esportivos; e empréstimo de futebol, basquete, vôlei, raquetes e tapetes de ioga. A empresa comercializa seus produtos por meio de loja física, site e aplicativo das marcas Oxer, Nord e Adams, além das marcas das coleções Go Equal, Farm, Asics, Confederação Brasileira de Futebol (CBF). Além disso, atua na prestação de serviços logísticos; e negócios de comércio esportivo e produção de audiovisão. O Grupo SBF S.A. foi fundado em 1981 e está sediado em São Paulo, Brasil.",https://ri.gruposbf.com.br,Consumer Cyclical,Consumo Cíclico,9.028572,0.89221436,0.10802,0.0421,2910558691.3754587,12.640000343322754,Small Caps,50,1.3999999494186626,20.999999241279937,39.81,30.0,Baixo,,🟢
BEES4,BANESTES    PN  EJ,"O Banestes S.A - Banco do Estado do Espírito Santo S.A., em conjunto com suas subsidiárias, atua como banco múltiplo no Brasil. Opera através do Financeiro; e Seguros e Outros segmentos. A empresa atua por meio de suas carteiras de comércio, rural, industrial, imobiliário, câmbio, arrendamento, investimento e administração de cartões de crédito; e nas áreas de seguros e distribuição, intermediação e administração de recursos de terceiros. Também fornece gestão de ativos e fundos; administração e intermediação de valores mobiliários, seguros, previdência e capitalização; fundos de investimento; cartões de crédito e débito; banco pela internet; conta corrente, poupança, especial, cheque fiduciário, jovem e universitário, conta mais fácil, simplificada, salário e judicial; títulos de capitalização; seguro de carro, vida, casa, acidentes pessoais, proteção financeira de cartão e seguro empresarial; cobranças e convênios; transferência de fundos e recursos; coleção; custódia; opções de crédito e financiamento; empréstimos e garantias; e outros serviços. Além disso, a empresa opera um serviço público de loteria. Banestes S.A - Banco do Estado do Espírito Santo S.A. foi fundado em 1935 e está sediado em Vitória, Brasil.",https://www.banestes.com.br,Financial Services,Serviços Financeiros,9.142857,1.2849562,0.14352,0.0383,3127014342.913184,8.960000038146973,Small Caps,50,0.9800000194848255,14.700000292272383,39.05,24.0,Baixo,,🟢
KEPL3,KEPLER WEBERON      NM,"A Kepler Weber S.A. fornece equipamentos para armazenamento de grãos e soluções pós-colheita de grãos no Brasil, nas Américas, na África, na Europa e na Ásia. Atua em cinco segmentos: Fazendas, Agroindústria, Portos e Terminais, Reposição e Serviços e Negócios Internacionais. A empresa oferece sistemas de armazenamento e preservação de grãos, como silos, secadores e transportadores, além de máquinas de limpeza. Também fornece equipamentos para commodities agrícolas, como etanol de milho, óleo de soja, ração animal, moinhos de trigo, indústrias de arroz, complexos cooperativos, produtores de cereais e canteiros; equipamentos industriais; e terminais portuários. Além disso, a empresa oferece peças de reposição e serviços de assistência técnica; serviços de engenharia técnica e processamento de dados; serviços de seguros contra riscos de engenharia; e serviços de monitoramento de temperatura e umidade de grãos no processo de processamento e armazenamento. Além disso, importa e exporta matérias-primas e produtos acabados e semiacabados. A empresa foi fundada em 1925 e está sediada em São Paulo, Brasil.",https://www.kepler.com.br,Industrials,Indústria,9.177778,1.8491157,0.20629999,0.0654,1431721120.672512,8.260000228881836,Small Caps,60,0.9000000031469312,13.500000047203967,38.81,42.0,Baixo,,🟢
ALUP4,ALUPAR      PN      N2,"A Alupar Investimento S.A., em conjunto com suas subsidiárias, atua na transmissão, geração e comercialização de energia no Brasil, Colômbia, Peru e Chile. Atua nos segmentos de Transmissão e Geração. A empresa detém participação em concessões de 44 sistemas de transmissão de energia elétrica, totalizando 9.999 quilômetros de linhas de transmissão; e opera linhas aéreas e subestações. Também atua na geração de energia renovável por meio de hidrelétricas, parques eólicos e usinas fotovoltaicas, que possuem capacidade instalada de 798,5 MW. A empresa foi constituída em 2006 e está sediada em São Paulo, Brasil. A Alupar Investimento S.A. é uma subsidiária da Guarupart Participações Ltda.",https://www.alupar.com.br,Utilities,Utilidades Públicas,9.209678,1.2323297,0.14265001,0.022000000000000002,11293016538.865602,11.420000076293945,Mid Caps,65,1.2399999301054765,18.599998951582148,38.6,24.0,Baixo,,🟢
WHRL4,WHIRLPOOL   PN,"A Whirlpool S.A. fabrica, vende, importa e exporta eletrodomésticos no Brasil. A empresa oferece geladeiras, freezers, condicionadores de ar, máquinas de fazer gelo, fogões, lava-louças, trituradores de lixo, compactadores de lixo, aspiradores de pó, máquinas de lavar, secadoras de roupas e fornos de micro-ondas. Comercializa seus produtos com as marcas Brastemp, Consul, KitchenAind, Compra Certa, B.blend, Jenn-Air, KitchenAid, Whirlpool e Maytag. A empresa foi fundada em 1957 e está sediada em São Paulo, Brasil. A Whirlpool S.A. opera como subsidiária da Whirlpool Corporation.",https://www.whirlpool.com.br,Consumer Cyclical,Consumo Cíclico,9.234043,3.0434785,0.19904,0.1278,6522091495.346947,4.340000152587891,Small Caps,60,0.4699999937825599,7.049999906738399,38.44,36.0,Baixo,,🟢
TGMA3,TEGMA       ON      NM,"A Tegma Gestão Logística S.A., em conjunto com suas subsidiárias, presta serviços logísticos no Brasil. Atua nos segmentos de Logística Automotiva e Logística Integrada. O segmento de Logística Automotiva atua no transporte e distribuição de veículos novos e usados; transferências portuárias; e gerenciamento de pátio e estoque para montadoras, além de serviços de pré-entrega de veículos. O segmento de Logística Integrada fornece serviços de transporte, armazenamento e gerenciamento de estoque para produtos químicos, eletrodomésticos e bens de consumo. A empresa também oferece logística e centro automotivo, gerenciamento de pátio, transporte e armazenamento de veículos, logística integrada, gerenciamento da cadeia de suprimentos de produtos químicos, gerenciamento de embalagens, intralogística e serviços de projetos especiais. Atende indústrias de alimentos e bebidas, automotiva, cosmética, eletrodomésticos, farmacêutica e química e petroquímica. A empresa foi fundada em 1969 e está sediada em São Bernardo do Campo, Brasil.",https://www.tegma.com.br,Industrials,Indústria,9.375,2.608104,0.27091998,0.1266,2274853134.0,34.5,Small Caps,60,3.68,55.2,37.5,42.0,Baixo,,🟢
ISAE3,ISA ENERGIA ON  ED  N1,"A ISA Energía Brasil S.A. atua no negócio de transmissão de energia elétrica no Brasil. Em 31 de dezembro de 2025, possuía capacidade total instalada de transformação de 84.910 MVA juntamente com linhas de transmissão de 23 mil quilômetros. Atua nos estados da Bahia, Espírito Santo, Minas Gerais, Rio de Janeiro e São Paulo. A ISA Energía Brasil S.A. foi constituída em 1999 e está sediada em São Paulo, Brasil.",https://www.isacteep.com.br,Utilities,Utilidades Públicas,9.460916,1.0933897,0.12099,0.0761,23126802965.023865,35.099998474121094,Mid Caps,80,3.710000012062373,55.65000018093559,36.93,36.0,Baixo,,🟢
DIRR3,DIRECIONAL  ON      NM,"A Direcional Engenharia S.A. atua no desenvolvimento e construção de projetos imobiliários residenciais de médio e baixo custo, principalmente no Brasil. A empresa tem como foco a incorporação, construção e comercialização de unidades habitacionais para famílias de baixa e média renda. A empresa foi fundada em 1981 e está sediada em Belo Horizonte, Brasil.",https://direcional.com.br,Real Estate,Imobiliário,9.4800005,3.850528,0.43120998,0.18420000000000003,7399389382.36867,14.220000267028809,Small Caps,60,1.4999999490536746,22.49999923580512,36.8,42.0,Baixo,,🟢
INTB3,INTELBRAS   ON      NM,"A Intelbras S.A. - Indústria de Telecomunicações Eletrônica Brasileira atua na fabricação, desenvolvimento e comercialização de equipamentos de segurança eletrônica e serviços de vigilância e monitoramento eletrônicos no Brasil. A empresa atua por meio de três segmentos: Segurança, Tecnologia da Informação e Comunicação (TIC) e Energia. Oferece produtos e soluções de segurança eletrônica, inclusive Oferece produtos e soluções de segurança eletrônica, incluindo alarmes, armazenamento, câmeras, comunicação condominial, controle de acesso corporativo, fechaduras, gravadores de vídeo digital, produtos contra incêndio e intercomunicação, monitoramento de veículos, sensores, sinalização de emergência, produtos de software e aplicativos e acessórios; e os produtos e soluções de redes incluem produtos 5G e Wi-Fi corporativo, racks, roteadores, switches, rádios externos, fibra óptica e produtos passivos, injetores PoE, adaptadores USB, software e aplicativos e cabos. A empresa também fornece produtos e soluções relacionados à comunicação, como webcams, projetores, mouses e teclados sem fio, soluções em nuvem, antenas e conversores, centrais telefônicas, produtos para eletrodomésticos e conferências, gateways, fones de ouvido, rádios comunicadores, caixas e controles inteligentes, alto-falantes inteligentes, software e aplicativos e telefones; e produtos e soluções relacionados à energia que incluem carregadores de veículos elétricos, UPS, baterias, smart, fontes, protetores eletrônicos, protetores contra surtos, acessórios USB e sensores de presença de iluminação. Além disso, oferece soluções on grid, que incluem painéis solares, estruturas de fixação, inversores on grid, string boxes e acessórios; e soluções fora da rede, como produtos de iluminação, estruturas de montagem, gabinetes externos, acionamentos e painéis solares, bombas solares e geradores e inversores fora da rede. A Intelbras S.A. - Indústria de Telecomunicações Eletrônica Brasileira foi constituída em 1974 e está sediada em São José, Brasil.",https://www.intelbras.com,Technology,Tecnologia,9.506757,1.5393872,0.16176,0.10060000000000001,4604438860.650543,14.069999694824219,Small Caps,60,1.4799999300312627,22.19999895046894,36.62,36.0,Baixo,,🟢
TAEE3,TAESA       ON      N2,"A Transmissora Aliança de Energia Elétrica S.A., em conjunto com suas subsidiárias, atua na construção, operação e manutenção de linhas de transmissão de energia elétrica no Brasil. Opera uma extensão total de aproximadamente 15.319 quilômetros (km) de linhas de transmissão, que incluem 14.677 km de linhas de transmissão em operação e 642 km de linhas em construção; 113 subestações com tensão entre 230 e 525KV; e um centro de operação do sistema localizado no Rio de Janeiro. A empresa foi fundada em 2000 e está sediada no Rio de Janeiro, Brasil.",https://institucional.taesa.com.br/,Utilities,Utilidades Públicas,9.601307,0.6650971,0.21719,0.073,15182066397.817516,14.6899995803833,Mid Caps,100,1.5299999865000984,22.949999797501476,35.99,60.0,Baixo,,🟢
SANB3,SANTANDER BRON,"O Banco Santander (Brasil) S.A., em conjunto com suas subsidiárias, fornece diversos produtos e serviços bancários para pessoas físicas, pequenas e médias empresas e clientes corporativos no Brasil e internacionalmente. Atua em dois segmentos, Banco Comercial e Banco Global de Atacado. A empresa oferece produtos de pagamento e fidelidade, incluindo cartões de crédito e débito; crédito consignado e imobiliário; soluções de financiamento de home equity; programas de microfinanciamento; consórcios; produtos do agronegócio, como crédito, valores mobiliários e outros produtos; call center e soluções digitais; ativos inadimplentes; e produtos de seguros que abrangem seguros de vida, acidentes pessoais, automóveis, patrimoniais e de crédito, bem como seguros de viagens e transações bancárias. Também oferece soluções emergenciais para residências, carros, motocicletas, animais de estimação e telemedicina; financiamento ao consumo; e serviços bancários corporativos e de investimento, que incluem gestão de caixa, soluções estruturadas de comércio e capital de giro, comércio e empréstimos, fusões e aquisições, mercados de capitais acionários, dívida com grau de investimento e de mercados emergentes e finanças estruturadas, bem como mercados de vendas, criação de mercado, comércio de energia, ações, pesquisa e mobilização e securitização de dívida privada. Além disso, a empresa oferece soluções de gestão de caixa, como cobranças, pagamentos, pagamentos instantâneos e serviços de folha de pagamento e custódia; programa advance, plataforma não financeira de apoio a empreendedores em conteúdos educacionais, cursos certificados, eventos com foco em gestão, inovação, internacionalização e desenvolvimento de equipes; financiamento de clientes através de depósitos e outros instrumentos de financiamento bancário; e vários investimentos. Oferece seus produtos e serviços por meio de agências, miniagências e caixas eletrônicos; centrais de atendimento; correspondentes bancários e fornecedores terceirizados; e plataformas bancárias online e móveis. A empresa foi fundada em 1970 e está sediada em São Paulo, Brasil.",https://www.santander.com.br,Financial Services,Serviços Financeiros,9.631902,0.46854484,0.10524,0.053200000000000004,117588392175.75183,15.699999809265137,Blue Chips,80,1.6299999532039608,24.449999298059414,35.79,36.0,Baixo,,🟢
TAEE4,TAESA       PN      N2,"A Transmissora Aliança de Energia Elétrica S.A., em conjunto com suas subsidiárias, atua na construção, operação e manutenção de linhas de transmissão de energia elétrica no Brasil. Opera uma extensão total de aproximadamente 15.319 quilômetros (km) de linhas de transmissão, que incluem 14.677 km de linhas de transmissão em operação e 642 km de linhas em construção; 113 subestações com tensão entre 230 e 525KV; e um centro de operação do sistema localizado no Rio de Janeiro. A empresa foi fundada em 2000 e está sediada no Rio de Janeiro, Brasil.",https://institucional.taesa.com.br/,Utilities,Utilidades Públicas,9.836601,0.6813963,0.21719,0.0799,15554125848.173855,15.050000190734863,Mid Caps,100,1.5300000671710547,22.95000100756582,34.42,60.0,Baixo,,🟢
