Ticker,Empresa,Resumo,Site,setor_original,Setor,PL,PVP,ROE,DivYield,MarketCap,Preco,Categoria,CNPJ,Score,LucroPorAcao,PrecoJusto,Desconto_%,Ranking,Risco,Risco_num,Farol
BSLI4,BRB BANCO   PN,"O BRB - Banco de Brasília S.A. atua nas atividades de crédito, financiamento e investimento para clientes pessoas físicas e jurídicas no Brasil. A empresa envolvida na distribuição de valores mobiliários e gestão de fundos, cartões de crédito, seguros e prestação de outros serviços relacionados. A empresa era anteriormente conhecida como Banco regional de Brasília SA BRB e mudou seu nome para BRB - Banco de Brasília S.A. em janeiro de 1986. O BRB - Banco de Brasília S.A. foi constituído em 1964 e está sediado em Brasília, Brasil.",https://www.brb.com.br,Financial Services,Serviços Financeiros,1.980198,0.48804295,0.25134,0.1582,2060861320.0,4.0,Small Caps,Não disponível,85,2.0200000202000004,30.300000303000004,86.8,58.0,Baixo,,🟢
BSLI3,BRB BANCO   ON,"O BRB - Banco de Brasília S.A. atua nas atividades de crédito, financiamento e investimento para clientes pessoas físicas e jurídicas no Brasil. A empresa envolvida na distribuição de valores mobiliários e gestão de fundos, cartões de crédito, seguros e prestação de outros serviços relacionados. A empresa era anteriormente conhecida como Banco regional de Brasília SA BRB e mudou seu nome para BRB - Banco de Brasília S.A. em janeiro de 1986. O BRB - Banco de Brasília S.A. foi constituído em 1964 e está sediado em Brasília, Brasil.",https://www.brb.com.br,Financial Services,Serviços Financeiros,2.1633663,0.5331869,0.25134,0.1386,2124611294.55099,4.369999885559082,Small Caps,Não disponível,85,2.019999981306486,30.29999971959729,85.58,58.0,Baixo,,🟢
BAZA3,AMAZONIA    ON,"O Banco da Amazônia S.A. fornece produtos e serviços bancários na região amazônica do Brasil. A empresa oferece contas poupança, corrente, simplificada e salário; cartões de crédito; produtos de capitalização; vários empréstimos pessoais e empresariais; planos de pensões; fundos de investimento, certificados de depósitos bancários e recibos de depósitos e cartas de crédito do agronegócio; produtos de seguros; e débito direto e serviços financeiros online. Também oferece programas de financiamento para agricultura familiar, máquinas e equipamentos, atividades rurais e de biodiversidade, caminhões, energia verde, negócios e infraestrutura verdes e investimentos rurais e não rurais, bem como atividades de ciência, tecnologia e inovação; fundo de desenvolvimento e marinha mercante; capital de giro; comércio exterior; e serviços de poupança para pessoas jurídicas, cobrança, adiantamento de cartão, cheque comercial, débito automático, mensagens de celular e domicílio bancário. A empresa foi fundada em 1942 e está sediada em Belém, Brasil.",https://www.bancoamazonia.com.br,Financial Services,Serviços Financeiros,3.931677,0.63339466,0.15239,0.0974,4613038792.67292,82.29000091552734,Small Caps,Não disponível,85,20.93000033205356,313.9500049808034,73.79,52.0,Baixo,,🟢
BNBR3,NORD BRASIL ON  ERJ,"O Banco do Nordeste do Brasil S.A. atua como um banco de desenvolvimento regional na América Latina. Atua por meio dos segmentos Carteira Própria e FNE. A empresa oferece contas de poupança, depósitos à vista e a prazo e custódia de títulos; crédito especializado; crédito para infra-estruturas e microfinanciamento urbano e rural; e serviços de cobrança e cartões de crédito. Atua também na estruturação e distribuição de bonds e títulos locais de curto e longo prazo, como debêntures, notas, notas promissórias, certificados de recebíveis imobiliários, fundos de investimento; administração de recursos de terceiros, consistindo na administração de fundos de investimento; operações de câmbio; gestão de carteira e análise de crédito; e transferências eletrônicas. Atende empresas corporativas, grandes, médias, pequenas e microempresas; agroindústria, produtores rurais e agricultura familiar; sectores de microfinanças urbanas e rurais; entidades representativas; indivíduos; e instituições da administração pública direta e indireta. A empresa atua por meio de pontos de atendimento físicos, incluindo agências e unidades de microcrédito. O Banco do Nordeste do Brasil S.A. foi fundado em 1952 e está sediado em Fortaleza, Brasil.",https://www.bnb.gov.br,Financial Services,Serviços Financeiros,3.93726,0.7821542,0.19412,0.055999999999999994,12140069250.0,123.0,Mid Caps,Não disponível,100,31.239999390439035,468.5999908565855,73.75,52.0,Baixo,,🟢
BRSR6,BANRISUL    PNB     N1,"O Banco do Estado do Rio Grande do Sul S.A., um banco múltiplo, oferece uma gama de produtos e serviços bancários principalmente no Brasil. A empresa atua em atividades bancárias de varejo, empréstimos, financiamento e investimento, empréstimos hipotecários, desenvolvimento, carteira de arrendamento e câmbio. Também oferece corretagem de valores mobiliários, grupos de consórcios, soluções para o setor de pagamentos, seguros e produtos de previdência e títulos de capitalização. O Banco do Estado do Rio Grande do Sul S.A. foi constituído em 1928 e está sediado em Porto Alegre, Brasil.",https://www.banrisul.com.br,Financial Services,Serviços Financeiros,3.9904532,0.5966101,0.1567,0.0643,6838052974.619513,16.719999313354492,Small Caps,Não disponível,85,4.190000101581067,62.850001523716,73.4,52.0,Baixo,,🟢
BRSR3,BANRISUL    ON      N1,"O Banco do Estado do Rio Grande do Sul S.A., um banco múltiplo, oferece uma gama de produtos e serviços bancários principalmente no Brasil. A empresa atua em atividades bancárias de varejo, empréstimos, financiamento e investimento, empréstimos hipotecários, desenvolvimento, carteira de arrendamento e câmbio. Também oferece corretagem de valores mobiliários, grupos de consórcios, soluções para o setor de pagamentos, seguros e produtos de previdência e títulos de capitalização. O Banco do Estado do Rio Grande do Sul S.A. foi constituído em 1928 e está sediado em Porto Alegre, Brasil.",https://www.banrisul.com.br,Financial Services,Serviços Financeiros,4.4248214,0.66155225,0.1567,0.0582,7582387178.007317,18.540000915527344,Small Caps,Não disponível,85,4.1899998303948145,62.84999745592222,70.5,46.0,Baixo,,🟢
JHSF3,JHSF PART   ON      NM,"A JHSF Participações S.A., em conjunto com suas subsidiárias, atua no ramo imobiliário no Brasil e internacionalmente. Atua por meio de cinco segmentos: Renda Recorrente; Negócios Imobiliários; Aeroporto, Hotéis e Restaurantes; e Holding. A empresa atua na construção e operação de shopping centers; compra e venda de imóveis residenciais e comerciais; varejo de artigos de moda; locação de imóveis comerciais; e desenvolvimento e operação de hotéis, atividades turísticas e gastronômicas, incluindo bares, cafés e restaurantes. Também se dedica à operação e gestão do aeródromo; prestação de serviços de gestão; e soluções de financiamento, serviços e investimentos imobiliários. A empresa foi fundada em 1972 e está sediada em São Paulo, Brasil.",https://jhsf.com.br,Real Estate,Imobiliário,4.5052633,0.90706795,0.20974001,0.0964,5724176344.522788,8.5600004196167,Small Caps,Não disponível,85,1.900000033209313,28.500000498139695,69.96,58.0,Baixo,,🟢
ABCB4,ABC BRASIL  PN      N2,"O Banco ABC Brasil S.A., um banco comercial, fornece diversos produtos e serviços financeiros para médias e grandes empresas no Brasil. A empresa oferece conta corrente; produtos de crédito e financiamento, como capital de giro, rotativo, recebíveis, antecipação a fornecedores, empréstimo consignado para empregados, sobre empréstimos em moeda estrangeira e empréstimos em moeda estrangeira, bem como para agronegócio, comércio exterior, transferências do fundo de defesa da economia cafeeira e imóveis; questões de garantias, tais como garantia de pagamento emitida, garantia de execução emitida, garantia judicial emitida, carta de crédito stand-by, confirmação de cartas de crédito de exportação, garantia de oferta, garantia de execução e carta de crédito de importação; derivativos, como contratos a termo de não entrega, prazo de mercadorias, swap e opções; serviços de câmbio para exportação e importação de câmbio, câmbio à vista de adiantamentos sobre câmbios entregues e câmbio à vista financeiro de remessas; cédulas de crédito do agronegócio e imobiliário, certificado de depósito bancário, fundos de investimento, certificado de operações estruturadas e debêntures. Também fornece serviços de investimentos em operações de fusões e aquisições, mercado de capitais e financiamento de projetos. Além disso, a empresa oferece produtos de seguros, como seguros de vida, seguros de vida e seguros de propriedades e acidentes; e atua como comercializadora de energia. A empresa era anteriormente conhecida como Banco Roma de Investimentos e mudou seu nome para Banco ABC Brasil S.A. em 1997. A empresa foi constituída em 1983 e está sediada em São Paulo, Brasil. O Banco ABC Brasil S.A. é uma subsidiária da Marsau Uruguai Holdings SA.",https://www.abcbrasil.com.br,Financial Services,Serviços Financeiros,4.624299,0.88278323,0.15463,0.1235,5972159522.888632,24.739999771118164,Small Caps,Não disponível,85,5.350000026191681,80.25000039287522,69.17,52.0,Baixo,,🟢
BRSR5,BANRISUL    PNA     N1,"O Banco do Estado do Rio Grande do Sul S.A., um banco múltiplo, oferece uma gama de produtos e serviços bancários principalmente no Brasil. A empresa atua em atividades bancárias de varejo, empréstimos, financiamento e investimento, empréstimos hipotecários, desenvolvimento, carteira de arrendamento e câmbio. Também oferece corretagem de valores mobiliários, grupos de consórcios, soluções para o setor de pagamentos, seguros e produtos de previdência e títulos de capitalização. O Banco do Estado do Rio Grande do Sul S.A. foi constituído em 1928 e está sediado em Porto Alegre, Brasil.",https://www.banrisul.com.br,Financial Services,Serviços Financeiros,4.634845,0.69295275,0.1567,0.0554,7942284343.340001,19.42,Small Caps,Não disponível,85,4.18999988133368,62.849998220005205,69.1,46.0,Baixo,,🟢
SUZB3,SUZANO S.A. ON      NM,"A Suzano S.A. fabrica e comercializa produtos de celulose e papel no Brasil e internacionalmente. Atua em dois segmentos, Celulose e Papel. A empresa oferece papéis de impressão e escrita revestidos e não revestidos, cartões, papéis tissue e celuloses de mercado e fluff. Também se dedica à pesquisa, desenvolvimento e produção de biocombustíveis; operação de terminais portuários; atividades de pesquisa e desenvolvimento em biotecnologia e polpas nanocristalinas; negócios de geração e distribuição de energia; atividades de transporte rodoviário de cargas; comercialização de equipamentos e peças; pesquisa e desenvolvimento de lignina; industrialização e comercialização de produtos de celulose, microfibras celulósicas, papel e papelão; e industrialização, comercialização e exportação de produtos de celulose. Além disso, a empresa está envolvida em atividades de escritório comercial, capital de risco corporativo e captação de recursos financeiros; produção de bens de consumo através de líquidos à base de celulose; desenvolvimento e produção de fibras, fios e filamentos têxteis à base de celulose; restauração, conservação e preservação de florestas; e pesquisa de matérias-primas para a indústria têxtil. A empresa era anteriormente conhecida como Suzano Papel e Celulose S.A. e mudou seu nome para Suzano S.A. em abril de 2019. A empresa foi fundada em 1924 e está sediada em Salvador, Brasil.",https://www.suzano.com.br,Basic Materials,Materiais Básicos,4.6475487,1.4172473,0.35192,0.0222,62101507818.74752,50.2400016784668,Blue Chips,Não disponível,85,10.810000049804062,162.15000074706091,69.02,46.0,Baixo,,🟢
EVEN3,EVEN        ON      NM,"A Even Construtora e Incorporadora S.A. atua como incorporadora e construtora imobiliária no Brasil. A empresa desenvolve e comercializa empreendimentos residenciais e comerciais sob as marcas Open e Even. Também está envolvida na prospecção de terrenos; incorporação e venda imobiliária; operação do portal da corretora; e atividades de construção de projetos. A empresa foi fundada em 1974 e está sediada em São Paulo, Brasil.",https://www.even.com.br,Real Estate,Imobiliário,4.93662,0.73074114,0.14028,0.1104,1372677011.5289478,7.010000228881836,Small Caps,Não disponível,65,1.4199999653369788,21.299999480054684,67.09,40.0,Baixo,,🟢
TRIS3,TRISUL      ON      NM,"A Trisul S.A. atua na construção e incorporação de imóveis no Brasil. A empresa atua no loteamento de terrenos; e compra e venda de imóveis. Também desenvolve projetos imobiliários com participação acionária de terceiros. A Trisul S.A. foi fundada em 2007 e está sediada em São Paulo, Brasil.",https://www.trisul-sa.com.br,Real Estate,Imobiliário,5.1009173,0.89576286,0.14368,0.196,1299146728.789897,5.559999942779541,Small Caps,Não disponível,65,1.0900000168164932,16.350000252247398,65.99,40.0,Baixo,,🟢
BMGB4,BANCO BMG   PN      N1,"O Banco BMG S.A. fornece produtos e serviços comerciais e de crédito, financiamento e investimento principalmente no Brasil. A empresa oferece contas digitais; cartão de crédito conta digital e cartão de crédito consignado; consignado e empréstimo pessoal; produtos de seguros, incluindo seguros de prestamistas, de vida, de vida familiar e protegidos pelo FGTS, além dos serviços do Bmg Med e do Consórcio Bmg. Também oferece produtos de investimento, como certificados de depósitos bancários, cartas de crédito do agronegócio e cartas de crédito imobiliário. Além disso, a empresa oferece serviços bancários comerciais; debêntures; financiamento comercial; e capital de giro; e derivativos, como opções a termo não entregáveis, SWAP. A empresa era anteriormente conhecida como BMG Financeira S.A.Crédito, Financiamento e Investimento e mudou seu nome para Banco BMG S.A. em abril de 1989. O Banco BMG S.A. foi fundado em 1930 e está sediado em São Paulo, Brasil.",https://www.bancobmg.com.br,Financial Services,Serviços Financeiros,5.157895,0.6305495,0.12981,0.09119999999999999,2938935708.599744,4.900000095367432,Small Caps,Não disponível,65,0.9499999700202179,14.249999550303269,65.61,40.0,Baixo,,🟢
VTRU3,VITRUEDUCA  ON      NM,"A Vitru Educação S.A., em conjunto com suas subsidiárias, presta serviços educacionais no Brasil. A empresa opera como uma instituição privada de ensino digital para educação e medicina no campus. As marcas da empresa incluem UNIASSELVI e UniCesumar, que atuam como instituições de ensino superior oferecendo cursos de graduação, pós-graduação, técnicos e profissionalizantes a distância e presenciais. Também oferece educação continuada e cursos preparatórios. A empresa opera campi e por meio de centros de sistema de educação digital. Além disso, opera uma plataforma que disponibiliza conteúdo gratuito por meio de um ecossistema que inclui blogs, cursos preparatórios gratuitos e perfis em redes sociais. A empresa era anteriormente conhecida como Vitru Brasil Empreendimentos, Participações e Comércio S.A. e mudou seu nome para Vitru Educação S.A. em dezembro de 2025. A Vitru Educação S.A. foi constituída em 2014 e está sediada em São Paulo, Brasil.",https://investors.vitru.com.br,Consumer Defensive,Consumo Defensivo,5.282353,0.61532134,0.1349,0.16,1800299587.8490753,13.470000267028809,Small Caps,Não disponível,65,2.5500000221546744,38.25000033232011,64.78,40.0,Baixo,,🟢
GMAT3,GRUPO MATEUSON      NM,"O Grupo Mateus S.A. opera uma rede de supermercados no Brasil. A empresa opera lojas de atacado, atacado, móveis e eletrodomésticos; e centros de fatiamento e porcionamento, bem como em e-commerce, indústria de panificação e centros de fatiamento e porcionamento. O Grupo Mateus S.A. foi fundado em 1986 e está sediado em São Luís, Brasil.",https://www.grupomateus.com.br,Consumer Cyclical,Consumo Cíclico,5.426829,0.9619541,0.17333001,0.055,10235211474.750732,4.449999809265137,Mid Caps,Não disponível,100,0.8200000053926771,12.300000080890158,63.82,52.0,Baixo,,🟢
AZZA3,AZZAS 2154  ON      NM,"A Azzas 2154 S.A. atua no desenvolvimento e comercialização de calçados, bolsas, acessórios e confecções femininos, masculinos e infantis no Brasil e no exterior. Oferece seus produtos por meio de lojas franqueadas, lojas próprias e canal de web commerce das marcas Arezzo, Schutz, Anacapri, Alexandre Birman, Alme, Vans, Reserva, Reserva Mini, Reserva INK, Reserva Go, Oficina Reserva, Brizza, Troc, Baw, Carol Bassi, ZZMALL, Reversa, Simples Reserva, Paris Texas, Vicenza, Animale, Farm, Farm Global, Fabula, Foxton, Cris Barros, Off Premium, Maria Filo, NV, Marcas Hering e Dzarm. A empresa era anteriormente conhecida como Arezzo Indústria e Comércio S.A. e mudou seu nome para Azzas 2154 S.A. em julho de 2024. Azzas 2154 S.A. foi fundada em 1972 e está sediada em Belo Horizonte, Brasil.",https://ri.azzas2154.com.br,Consumer Cyclical,Consumo Cíclico,5.4875846,0.6147116,0.11609,0.1016,4909959851.324862,24.309999465942383,Small Caps,Não disponível,65,4.429999943133885,66.44999914700828,63.42,40.0,Baixo,,🟢
CEEB5,COELBA      PNA,"Companhia de Eletricidade do Estado da Bahia - COELBA engages in the distribution of electricity. The company was founded in 1960 and is headquartered in Salvador, Brazil. Companhia de Eletricidade do Estado da Bahia - COELBA operates as a subsidiary of Iberdrola, S.A.",https://www.coelba.com.br,Utilities,Utilidades Públicas,5.6500688,1.3642586,0.25589,0.0489,10706625153.95,40.85,Mid Caps,Não disponível,85,7.230000455923652,108.45000683885478,62.33,52.0,Baixo,,🟢
CYRE3,CYRELA REALTON      NM,"Cyrela Brazil Realty S.A. Empreendimentos e Participações atua na incorporação e construção de imóveis residenciais no Brasil. A empresa também presta serviços imobiliários, como gestão de obras e serviços de consultoria técnica. Cyrela Brazil Realty S.A. Empreendimentos e Participações foi fundada em 1962 e está sediada em São Paulo, Brasil.",https://www.cyrela.com.br,Consumer Cyclical,Consumo Cíclico,5.676149,0.9290831,0.22374001,0.1465,9503037614.350328,25.940000534057617,Small Caps,Não disponível,85,4.56999993024454,68.54999895366811,62.16,58.0,Baixo,,🟢
EUCA4,EUCATEX     PN      N1,"A Eucatex S.A. Indústria e Comércio produz e comercializa painéis compensados, madeira e materiais relacionados no Brasil. A empresa fornece pisos laminados e vinílicos, sistemas Eucafix, portas, divisórias, painéis de MDF e MDP, painéis T-HDF, painéis de madeira, placas de fibra, tintas e vernizes, chapas de fibra de madeira, lacas e outros produtos. Também produz mudas de eucalipto; e atua em consultoria de gestão empresarial, atividades imobiliárias, florestais, colheita, manejo florestal, transporte, logística de coleta de resíduos e materiais reciclados e eletricidade. A empresa atende principalmente indústrias moveleiras e de construção. Também exporta seus produtos para os Estados Unidos e América Latina. A Eucatex S.A. Indústria e Comércio foi constituída em 1951 e está sediada em São Paulo, Brasil.",https://www.eucatex.com.br,Industrials,Indústria,5.864162,0.6755002,0.11956,0.0547,1869418747.3920898,20.290000915527344,Small Caps,Não disponível,65,3.460000067448229,51.90000101172344,60.91,34.0,Baixo,,🟢
EUCA3,EUCATEX     ON      N1,"A Eucatex S.A. Indústria e Comércio produz e comercializa painéis compensados, madeira e materiais relacionados no Brasil. A empresa fornece pisos laminados e vinílicos, sistemas Eucafix, portas, divisórias, painéis de MDF e MDP, painéis T-HDF, painéis de madeira, placas de fibra, tintas e vernizes, chapas de fibra de madeira, lacas e outros produtos. Também produz mudas de eucalipto; e atua em consultoria de gestão empresarial, atividades imobiliárias, florestais, colheita, manejo florestal, transporte, logística de coleta de resíduos e materiais reciclados e eletricidade. A empresa atende principalmente indústrias moveleiras e de construção. Também exporta seus produtos para os Estados Unidos e América Latina. A Eucatex S.A. Indústria e Comércio foi constituída em 1951 e está sediada em São Paulo, Brasil.",https://www.eucatex.com.br,Industrials,Indústria,6.0260115,0.6941439,0.11956,0.049,1921014249.6000001,20.85,Small Caps,Não disponível,50,3.4600000348489215,51.90000052273382,59.83,34.0,Baixo,,🟢
MDNE3,MOURA DUBEUXON      NM,"A Moura Dubeux Engenharia S.A. presta serviços de incorporação imobiliária no Brasil. A empresa desenvolve apartamentos, hotéis, resorts e edifícios residenciais, além de oferecer serviços de administração técnica de obras e assessoria técnica aos condomínios. Também atua na compra e venda de imóveis; construção imobiliária; gerenciamento; administração; e serviços de engenharia, bem como serviços de consultoria imobiliária, incluindo compra de terreno; formatação de produtos; e aprovação do projeto. A empresa foi fundada em 1983 e está sediada em Recife, Brasil.",https://www.mouradubeux.com.br,Real Estate,Imobiliário,6.0384617,1.6599889,0.27528998,0.1563,3092267640.05114,29.829999923706055,Small Caps,Não disponível,60,4.939999855212472,74.09999782818707,59.74,46.0,Baixo,,🟢
PINE3,PINE        ON      N2,"O Banco Pine S.A., em conjunto com suas subsidiárias, fornece produtos e serviços bancários no Brasil. A empresa se dedica a negócios comerciais, de investimento, crédito, financiamento, câmbio e leasing. Também está envolvida em consultoria; distribuição de títulos; imobiliária; intermediação de negócios; e comercialização de ativos ambientais. A empresa foi constituída em 1991 e está sediada em São Paulo, Brasil.",https://www.pine.com,Financial Services,Serviços Financeiros,6.0666666,2.1404016,0.33765998,0.035699999999999996,3062436185.25976,11.829999923706055,Small Caps,Não disponível,45,1.9500000088526466,29.250000132789697,59.56,40.0,Baixo,,🟢
BEEF3,MINERVA     ON      NM,"A Minerva S.A. produz e comercializa carne bovina in natura, gado e subprodutos na América do Sul e internacionalmente. A empresa também atua no abate, desossa e processamento de carnes; venda de carnes resfriadas, congeladas e processadas, bem como produtos bovinos, suínos e aves; exportação e venda de gado vivo; e criação e venda de gado vivo, cordeiros, porcos e outros animais vivos. Além disso, comercializa eletricidade; comercializa proteínas e produtos alimentícios; vende marcas de terceiros principalmente produtos Swift; e prepara produtos para animais, que incluem farinha de carne e ossos, sangue e sebo. A empresa foi fundada em 1957 e está sediada em Barretos, Brasil.",https://ri.minervafoods.com,Consumer Defensive,Consumo Defensivo,6.072464,3.1527464,0.85664004,0.1617,4137353192.5414906,4.190000057220459,Small Caps,Não disponível,60,0.6899999830744915,10.349999746117373,59.52,46.0,Baixo,,🟢
VLID3,VALID       ON      NM,"A Valid Soluções S.A. fornece soluções de pagamentos digitais no Brasil e internacionalmente. Atua por meio de três segmentos: Meio de Pagamento, Identificação e Mobile. O segmento de Meios de Pagamento oferece produtos e soluções integradas, como cartões com chip e tarja magnética, vale-presente, impressão de cheques, faturas e extratos bancários, além de soluções em identificação por radiofrequência, cartões sem contato e pagamentos móveis. O segmento de Identificação fornece captura, armazenamento e administração de dados, formulários de segurança, reconhecimento e impressões digitais. Suas soluções são utilizadas na geração de sistemas informatizados para gerenciamento de bancos de dados, coleta de dados biométricos, impressão e customização de documentos oficiais de identificação, soluções para cidades inteligentes, carimbos rastreáveis ​​e serviços de certificação digital. O segmento Mobile oferece serviços de emissão de extratos e tecnologias para uso em celulares e mobilidade digital, como soluções NFC, TSM e HCE para operadoras de telefonia móvel. Também desenvolve tecnologias para uso em celulares, como recarga e pagamento e produção de cartões destinados a telecomunicações. Atende governos estaduais e agências governamentais, grandes instituições financeiras, empresas de telecomunicações, varejistas, cooperativas agrícolas e profissionais independentes. A empresa era anteriormente conhecida como Valid Soluções e Serviços de Segurança em Meios de Pagamento e Identificação S.A. e mudou seu nome para Valid Soluções S.A. em agosto de 2018. A Valid Soluções S.A. foi fundada em 1957 e está sediada em Sorocaba, Brasil.",https://www.valid.com,Industrials,Indústria,6.0722895,0.926045,0.15168001,0.1607,1578512767.2524834,20.15999984741211,Small Caps,Não disponível,85,3.3199997871333555,49.79999680700033,59.52,52.0,Baixo,,🟢
