Ticker,Empresa,Resumo,Site,setor_original,Setor,PL,PVP,ROE,DivYield,MarketCap,Preco,Categoria,Score,LucroPorAcao,PrecoJusto,Desconto_%,Ranking,Risco,Risco_num,Farol
ENMT3,ENERGISA MT ON,"Energisa Mato Grosso - Distribuidora de Energia S/A operates as an electricity distributor in Mato Grosso. The company was formerly known as Centrais Elétricas Matogrossenses and changed its name to Energisa Mato Grosso - Distribuidora de Energia S/A in February 2015. The company was founded in 1905 and is headquartered in Cuiabá, Brazil. Energisa Mato Grosso - Distribuidora de Energia S/A is a subsidiary of Rede Energia Participações S.A.",https://www.energisa.com.br,Utilities,Utilidades Públicas,13.502674,2.811491,0.21270001,0.0604,11056567919.5,50.5,Mid Caps,50,3.739999943714852,56.099999155722784,9.98,40.0,Baixo,,🟢
FIQE3,UNIFIQUE    ON      NM,"A Unifique Telecomunicações S.A. fornece serviços de telecomunicações no Brasil. A empresa oferece armazenamento de dados, hospedagem de dados e serviços de Internet. Também fornece serviços de comunicação multimídia SCM; acesso a redes de comunicação, portais, provedores de conteúdo e serviços de informação na Internet; TV paga via satélite, cabo e micro-ondas; e serviços de hospedagem de internet e telefonia fixa comutada. Além disso, a empresa atua no comércio varejista de hospedagem de internet e telefonia fixa comutada; equipamentos e suprimentos para informática e telefonia móvel; publicação de livros e venda a retalho de livros; e planos de saúde. A Unifique Telecomunicações S.A. foi constituída em 1997 e está sediada em Timbó, Brasil.",https://unifique.com.br,Communication Services,Comunicação,13.555555,2.5487466,0.18061,0.114,2849138376.2151647,7.320000171661377,Small Caps,35,0.5400000347946932,8.100000521920398,9.63,28.0,Baixo,,🟢
CXSE3,CAIXA SEGURION      NM,"A Caixa Seguridade Participações S.A., em conjunto com suas subsidiárias, oferece produtos de seguros no Brasil e internacionalmente. A empresa atua em três segmentos: Escoamento/Mar Aberto, Segurança e Distribuição. Oferece produtos de seguros de vida, residencial e habitacional, acidentes pessoais e isenção de dívidas para pessoas físicas; e produtos de seguros de vida, residenciais e habitacionais, automóveis e credores para empresas. A empresa também oferece seguridade social, incluindo planos de previdência privada e corporativa; capitalização; consórcio; e corretagem e intermediação de produtos de segurança. Além disso, atua na aquisição de participação societária ou holding; administração, comercialização e prestação de planos privados de saúde e odontológicos; estruturação, administração e comercialização de cartas de crédito; e operações de resseguro e retrocessão. A empresa foi constituída em 2015 e está sediada em Brasília, Brasil. A Caixa Seguridade Participações S.A. atua como subsidiária da Caixa Econômica Federal.",https://www.caixaseguridade.com.br,Financial Services,Serviços Financeiros,13.587413,4.3015275,0.32463002,0.0669,58290000915.52734,19.43000030517578,Blue Chips,50,1.4299999790376419,21.449999685564627,9.42,40.0,Baixo,,🟢
ENMT4,ENERGISA MT PN,"Energisa Mato Grosso - Distribuidora de Energia S/A operates as an electricity distributor in Mato Grosso. The company was formerly known as Centrais Elétricas Matogrossenses and changed its name to Energisa Mato Grosso - Distribuidora de Energia S/A in February 2015. The company was founded in 1905 and is headquartered in Cuiabá, Brazil. Energisa Mato Grosso - Distribuidora de Energia S/A is a subsidiary of Rede Energia Participações S.A.",https://www.energisa.com.br,Utilities,Utilidades Públicas,13.672922,2.8393276,0.21270001,0.059800000000000006,11166038889.0,51.0,Mid Caps,50,3.730000068749021,55.95000103123532,8.85,34.0,Baixo,,🟢
MOVI3,MOVIDA      ON      NM,"A Movida Participações S.A. presta serviços de aluguel de automóveis no Brasil. Atua em dois segmentos, Rent-a-Car e Gestão e Terceirização de Frotas (GTF). A empresa oferece serviços de aluguel de veículos leves; e serviços de gestão e terceirização de frotas. Também vende carros usados. A empresa era anteriormente conhecida como H.L.C.S.P.E Empreendimentos e Participações S.A. e mudou seu nome para Movida Participações S.A. em dezembro de 2014. A empresa foi fundada em 2006 e tem sede em São Paulo, Brasil. A Movida Participações S.A. atua como subsidiária da Simpar S.A.",https://ri.movida.com.br,Industrials,Indústria,13.835165,1.4386927,0.116610005,0.10880000000000001,4328171669.61644,12.59000015258789,Small Caps,40,0.9100000001870516,13.650000002805774,7.77,22.0,Baixo,,🟢
ALPA3,ALPARGATAS  ON      N1,"A Alpargatas S.A. fabrica e comercializa calçados e acessórios no Brasil e no exterior. A empresa oferece seus produtos com as marcas Havaianas, ioasys e Rothys. A empresa era anteriormente conhecida como São Paulo Alpargatas S.A. e mudou seu nome para Alpargatas S.A. em 2010. A empresa foi fundada em 1907 e está sediada em São Paulo, Brasil.",https://www.alpargatas.com.br,Consumer Cyclical,Consumo Cíclico,14.189873,2.2858891,0.15432,0.0437,7599155008.269479,11.210000038146973,Small Caps,20,0.7900000259443458,11.850000389165187,5.4,22.0,Baixo,,🟢
MULT3,MULTIPLAN   ON  EJ  N2,"A Multiplan Empreendimentos Imobiliários S.A. atua no planejamento, implantação, desenvolvimento e comercialização de empreendimentos imobiliários no Brasil. A empresa desenvolve imóveis residenciais ou comerciais, inclusive shoppings urbanos. Atua também na compra e venda de imóveis, bem como na aquisição e alienação de direitos imobiliários, e na sua operação através de locação. Além disso, a empresa presta serviços de gestão e administração de shopping centers próprios ou de terceiros; serviços de assessoria e suporte técnico relacionados a questões imobiliárias; e construção civil, execução de obras e serviços de engenharia e correlatos. Além disso, atua no planejamento, desenvolvimento, gestão, promoção e intermediação de projetos imobiliários; importação e exportação de bens e serviços relacionados às suas atividades; geração de energia elétrica; serviços de fabricação e estacionamento de veículos; serviços de entretenimento; administrar e operar teatros; e serviços de administração e promoção. Adicionalmente, a empresa atua na promoção, organização, produção, agenciamento, programação e execução de eventos, shows e espetáculos esportivos, artísticos e culturais; administra eventos esportivos, artísticos e culturais; e aluguel de equipamentos de som, luz e quaisquer outros. A Multiplan Empreendimentos Imobiliários S.A. foi fundada em 1974 e está sediada no Rio de Janeiro, Brasil.",https://www.multiplan.com.br,Real Estate,Imobiliário,14.613044,2.610891,0.19108,0.0341,16482607398.401184,33.61000061035156,Mid Caps,35,2.299999959649171,34.499999394737564,2.58,24.0,Baixo,,🟢
ODPV3,ODONTOPREV  ON      NM,"A Odontoprev S.A. oferece planos privados de assistência odontológica no Brasil. A empresa atua nos segmentos Corporativo, Pequena e Média Empresa (PME), Pessoa Física e Outros. A empresa administra e vende planos de assistência odontológica para empresas e/ou pessoas físicas. Também atua em serviços de assessoria comercial, consultoria e gestão empresarial; desenvolve e licencia programas de software; comércio atacadista e varejista de produtos e equipamentos, saneantes, medicamentos, medicamentos, insumos farmacêuticos e correlatos; prestação de serviços de armazenamento, carregamento, organização, arrumação, guarda de mercadorias, serviços de programação técnica e administrativa, bem como gestão geral de bens e negócios. Além disso, a empresa atua na integração de tecnologias para desenvolver soluções odontológicas; e prestar serviços especializados relacionados a acidentes e doenças, além de serviços atuariais, financeiros, administrativos, comerciais e de gerenciamento de riscos. A Odontoprev S.A. foi fundada em 1987 e está sediada em Barueri, Brasil. A Odontoprev S.A. é subsidiária da Bradesco Saúde S.A.",https://www.odontoprev.com.br,Healthcare,Saúde,14.644859,6.662415,0.46408,0.0647,8541610281.87731,15.670000076293945,Small Caps,35,1.0700000646161185,16.05000096924178,2.37,30.0,Baixo,,🟢
BPAC5,BTGP BANCO  PNA     N2,"O Banco BTG Pactual S.A. fornece produtos e serviços financeiros relativos a carteiras comerciais, de investimentos, de crédito, de financiamento, de arrendamento mercantil, de seguros e de câmbio no Brasil e internacionalmente. A empresa também oferece serviços de investimento pessoal para uma carteira de investimentos customizada; serviços de contas bancárias internacionais, incluindo cartão de débito, transferência, pagamento e recebimento, e serviços de suporte ao cliente. Também fornece serviços de gestão de patrimônio, como execução, pesquisa de mercado, recursos e análises educacionais e gestão de relacionamento; gestão do patrimônio familiar; contas correntes e de poupança, certificados de depósito, contas de aposentadoria e contas do mercado monetário; financiamento imobiliário; bem como empréstimos corporativos, empréstimos a prazo, linhas de crédito e financiamento de credores. O Banco BTG Pactual S.A. foi fundado em 1983 e está sediado no Rio de Janeiro, Brasil. O Banco BTG Pactual S.A. opera como subsidiária do BTG Pactual Holding Financeira Ltda.",https://www.btgpactual.com,Financial Services,Serviços Financeiros,14.728572,1.4182545,0.23868,0.0231,238937448937.6668,20.6200008392334,Blue Chips,60,1.4000000026637611,21.00000003995642,1.81,30.0,Baixo,,🟢
UNIP3,UNIPAR      ON,"A Unipar Carbocloro S.A. produz e comercializa cloro e soda cáustica na América do Sul. A empresa oferece hipoclorito de sódio, ácido clorídrico, dicloroetano e monômero de cloreto de vinila. Seus produtos são utilizados nas indústrias de construção, saneamento, alimentos, serviços públicos, mineração, siderurgia, automotiva, saúde e papel e celulose. A Unipar Carbocloro S.A. foi constituída em 1969 e está sediada em São Paulo, Brasil.",https://www.unipar.com,Basic Materials,Materiais Básicos,14.95122,3.7933168,0.20807,0.14800000000000002,6842437893.739056,61.29999923706055,Small Caps,35,4.099999815203077,61.499997228046155,0.33,30.0,Baixo,,🟢
BMOB3,BEMOBI TECH ON      NM,"Bemobi Mobile Tech S.A., uma empresa de tecnologia, fornece soluções e plataformas móveis para pagamentos digitais, engajamento de clientes, microfinanças e serviços digitais no Brasil e internacionalmente. A empresa oferece Bemobi Pay, que inclui checkouts inteligentes que oferecem solução white-label e customizável, orquestração de meios de pagamento e múltiplos métodos de pagamento; Smart POS, que aceita pagamentos; Orquestração de pagamentos que otimiza pagamentos e conecta negócios a vários provedores, aumenta as taxas de aprovação e reduz fraudes; e simplificar o gerenciamento de pagamentos. Ele também fornece Grace, uma plataforma de pagamentos conversacionais com IA; soluções de engajamento digital para ISPs de telecomunicações e MNOS de telecomunicações; e Agenda Edu SuperApp, ferramenta de comunicação, engajamento e finanças escolares. Além disso, a empresa oferece soluções de microfinanças e assinaturas digitais para telecomunicações MNOS; e Wave, plataforma digital nativa para telecomunicações; e soluções de pontuação móvel para empresas de telecomunicações e finanças. Atende MNOs e ISPs de telecomunicações, serviços públicos, educação, saúde e setores financeiros. A Bemobi Mobile Tech S.A. foi constituída em 2007 e está sediada no Rio de Janeiro, Brasil.",https://www.bemobi.com.br,Communication Services,Comunicação,15.010811,2.454915,0.15047,0.0793,2357019055.3533554,27.770000457763672,Small Caps,35,1.8500000071790705,27.75000010768606,-0.07,24.0,Baixo,,🟢
ENGI3,ENERGISA    ON      N2,"A Energisa S.A., por meio de suas subsidiárias, atua na geração, transmissão e distribuição de energia elétrica no Brasil. A empresa gera eletricidade por meio de projetos hidráulicos, solares e eólicos. Também fornece gás natural para empresas e gás natural veicular, bem como serviços de valor agregado. Além disso, a empresa desenvolve atividades de inspeção termográfica aérea e corretagem de seguros. A empresa foi fundada em 1905 e está sediada em Cataguases, Brasil. A Energisa S.A. atua como subsidiária da Gipar S.A.",https://www.energisa.com.br,Utilities,Utilidades Públicas,15.114942,0.23805645,0.14495,0.050199999999999995,33065927940.987007,13.149999618530273,Mid Caps,55,0.8700000051955392,13.050000077933088,-0.77,24.0,Baixo,,🟢
FLRY3,FLEURY      ON      NM,"Fleury S.A., em conjunto com suas subsidiárias, presta serviços de diagnóstico por imagem, análises clínicas, fertilidade e infusões no Brasil. Atua em dois segmentos, Medicina Diagnóstica e Medicina Integrada. A empresa também presta serviços de gestão em saúde, como telemedicina; serviços de medicina ortopédica; apoio laboratorial; exame toxicológico; soluções preventivas, integradas e pesquisas clínicas em oncologia; soluções integradas, pesquisa, desenvolvimento de processos e serviços em genômica; e serviços de análises laboratoriais. Além disso, opera plataforma de saúde, centro de infusão de imunobiológicos e centros de atendimento oftalmológico. Fleury S.A. foi fundada em 1926 e está sediada em São Paulo, Brasil.",https://ri.fleury.com.br,Healthcare,Saúde,15.214287,1.856816,0.113970004,0.1117,9302562159.009247,17.040000915527344,Small Caps,15,1.1199999655276216,16.799999482914323,-1.43,12.0,Baixo,,🟢
TIMS3,TIM         ON      NM,"A TIM S.A. atua no setor de telecomunicações no Brasil. Oferece serviços de telefonia fixa comutada nas modalidades de longa distância local, nacional e internacional, bem como serviços de comunicação pessoal móvel e multimídia. A empresa está sediada no Rio de Janeiro, Brasil. A TIM S.A. é uma subsidiária da TIM Brasil Serviços e Participações S.A.",https://www.tim.com.br,Communication Services,Comunicação,15.308989,2.7146842,0.17117001,0.0928,65091211774.5,27.25,Blue Chips,50,1.779999972565138,26.69999958847707,-2.06,30.0,Baixo,,🟢
ALPA4,ALPARGATAS  PN      N1,"A Alpargatas S.A. fabrica e comercializa calçados e acessórios no Brasil e no exterior. A empresa oferece seus produtos com as marcas Havaianas, ioasys e Rothys. A empresa era anteriormente conhecida como São Paulo Alpargatas S.A. e mudou seu nome para Alpargatas S.A. em 2010. A empresa foi fundada em 1907 e está sediada em São Paulo, Brasil.",https://www.alpargatas.com.br,Consumer Cyclical,Consumo Cíclico,15.481011,2.4938827,0.15432,0.0528,8290603207.516254,12.229999542236328,Small Caps,35,0.790000055050431,11.850000825756466,-3.21,18.0,Baixo,,🟢
UNIP5,UNIPAR      PNA,"A Unipar Carbocloro S.A. produz e comercializa cloro e soda cáustica na América do Sul. A empresa oferece hipoclorito de sódio, ácido clorídrico, dicloroetano e monômero de cloreto de vinila. Seus produtos são utilizados nas indústrias de construção, saneamento, alimentos, serviços públicos, mineração, siderurgia, automotiva, saúde e papel e celulose. A Unipar Carbocloro S.A. foi constituída em 1969 e está sediada em São Paulo, Brasil.",https://www.unipar.com,Basic Materials,Materiais Básicos,15.609756,3.960396,0.20807,0.15839999999999999,7143817792.0,64.0,Small Caps,35,4.1000000256249995,61.50000038437499,-4.07,30.0,Baixo,,🟢
UNIP6,UNIPAR      PNB,"A Unipar Carbocloro S.A. produz e comercializa cloro e soda cáustica na América do Sul. A empresa oferece hipoclorito de sódio, ácido clorídrico, dicloroetano e monômero de cloreto de vinila. Seus produtos são utilizados nas indústrias de construção, saneamento, alimentos, serviços públicos, mineração, siderurgia, automotiva, saúde e papel e celulose. A Unipar Carbocloro S.A. foi constituída em 1969 e está sediada em São Paulo, Brasil.",https://www.unipar.com,Basic Materials,Materiais Básicos,15.941463,4.0445547,0.20807,0.154,7295623988.2087555,65.36000061035156,Small Caps,35,4.100000144927198,61.500002173907966,-6.28,30.0,Baixo,,🟢
GGPS3,GPS         ON      NM,"A GPS Participações e Empreendimentos S.A., em conjunto com suas subsidiárias, atua no fornecimento de instalações, segurança, logística interna, engenharia de utilidades, serviços industriais, alimentos, trabalho temporário, marketing de campo e serviços de infraestrutura no Brasil. A empresa presta serviços de segurança patrimonial; serviços de higiene e limpeza; serviços de segurança eletrônica, implantação, operação e manutenção predial; serviços de hotéis marítimos; serviços de cozinha e venda de refeições; manutenção industrial; serviços de manutenção de rodovias; participação em sociedades mediante aquisição de ações ou quotas de capital; administração e gestão trabalhista; e consultoria financeira e assessoria empresarial, na área de planejamento de eventos promocionais. Também atua na venda e distribuição de brindes promocionais; corretagem de seguros gerais, seguros de vida, seguros de saúde, seguros de pensões e capitalização; manutenção de redes telefónicas, manutenção de acessos e instalação de sistemas de telecomunicações; e construção de rede de distribuição de energia e manutenção de rede energizada. A GPS Participações e Empreendimentos S.A. foi constituída em 2007 e está sediada em São Paulo, Brasil.",https://gpssa.com.br,Industrials,Indústria,16.0,3.0377822,0.18594,0.033,12037607808.0,16.0,Mid Caps,35,1.0,15.0,-6.67,24.0,Baixo,,🟢
ABEV3,AMBEV S/A   ON  ATZ,"A Ambev S.A., por meio de suas subsidiárias, atua na produção, distribuição e comercialização de cerveja, chope, refrigerantes, malte e alimentos e outras bebidas no Brasil, América Central e Caribe, América Latina Sul e Canadá. A empresa oferece cervejas, coquetéis e spritzers prontos, refrigerantes, águas, chás e isotônicos das marcas Brahma, Skol, Antarctica, Original, Quilmes, Andes Origen, Patricia, Paceha, Huari, Pilsen, Presidente, Balboa, Guaraná Antarctica e Beats. Vende seus produtos para distribuidores, supermercados e varejistas dentro de uma ampla rede de distribuição. A empresa foi fundada em 1853 e está sediada em São Paulo, Brasil. A Ambev S.A. opera como subsidiária da Interbrew International B.V.",https://www.ambev.com.br,Consumer Defensive,Consumo Defensivo,16.050505,2.82238,0.16976999,0.14800000000000002,248182647790.35748,15.890000343322754,Blue Chips,50,0.9900000245053194,14.850000367579792,-7.0,30.0,Baixo,,🟢
EGIE3,ENGIE BRASILON      NM,"A Engie Brasil Energia S.A., em conjunto com suas subsidiárias, desenvolve atividades de geração, comercialização, comercialização e transmissão no Brasil. A empresa também atua no negócio de transporte de gás. Em 31 de dezembro de 2025, opera um parque gerador de 12.384,5 MW composto por 133 usinas, sendo 13 hidrelétricas e 120 complementares, além de uma usina de biomassa, 88 eólicas, duas hidrelétricas e 29 solares. A empresa foi fundada em 2005 e está sediada em Florianópolis, Brasil. A Engie Brasil Energia S.A. é uma subsidiária da ENGIE Brasil Participações Ltda.",https://www.engie.com.br,Utilities,Utilidades Públicas,16.141592,3.2664754,0.2182,0.0508,41673705194.183914,36.47999954223633,Mid Caps,50,2.2600001005003922,33.900001507505884,-7.61,30.0,Baixo,,🟢
KLBN3,KLABIN S/A  ON      N2,"A Klabin S.A., em conjunto com suas subsidiárias, produz e exporta papéis para embalagens e soluções sustentáveis ​​para embalagens de papel no Brasil e internacionalmente. A empresa atua nos segmentos Florestal, Celulose, Papel e Embalagens. Atua no plantio e cultivo de pinus e eucaliptos e no manejo florestal. A empresa também atua na comercialização de madeira comercial. Além disso, produz e comercializa madeiras nobres (eucalipto), macias (pinus) e celulose fluff, além de papel cartão, papel Kraftliner, papel reciclado, caixas de papelão ondulado, papelão ondulado e sacos industriais. A Klabin S.A. foi fundada em 1899 e está sediada em São Paulo, Brasil.",https://www.klabin.com.br,Basic Materials,Materiais Básicos,16.521738,0.5912556,0.14569001,0.0861,23344308446.66753,3.799999952316284,Mid Caps,55,0.23000001285072336,3.45000019276085,-10.14,30.0,Baixo,,🟢
CMIN3,CSNMINERACAOON      N2,"A CSN Mineração S.A. atua no negócio de mineração de minério de ferro no Brasil, Ásia e Europa. A empresa opera as minas de Casa de Pedra, Engenho e Pires. Também opera uma usina hidrelétrica. A empresa foi fundada em 1913 e está sediada em São Paulo, Brasil. A CSN Mineração S.A. atua como subsidiária da Companhia Siderúrgica Nacional.",https://ri.csnmineracao.com.br,Basic Materials,Materiais Básicos,16.599998,4.0487804,0.19459,0.1245,27051581902.848026,4.980000019073486,Mid Caps,50,0.30000003729358804,4.500000559403821,-10.67,30.0,Baixo,,🟢
KLBN4,KLABIN S/A  PN      N2,"A Klabin S.A., em conjunto com suas subsidiárias, produz e exporta papéis para embalagens e soluções sustentáveis ​​para embalagens de papel no Brasil e internacionalmente. A empresa atua nos segmentos Florestal, Celulose, Papel e Embalagens. Atua no plantio e cultivo de pinus e eucaliptos e no manejo florestal. A empresa também atua na comercialização de madeira comercial. Além disso, produz e comercializa madeiras nobres (eucalipto), macias (pinus) e celulose fluff, além de papel cartão, papel Kraftliner, papel reciclado, caixas de papelão ondulado, papelão ondulado e sacos industriais. A Klabin S.A. foi fundada em 1899 e está sediada em São Paulo, Brasil.",https://www.klabin.com.br,Basic Materials,Materiais Básicos,16.608696,0.5943675,0.14569001,0.0857,23467173112.33454,3.819999933242798,Mid Caps,55,0.22999999116383357,3.4499998674575036,-10.72,30.0,Baixo,,🟢
SLCE3,SLC AGRICOLAON      NM,"A SLC Agrícola S.A. produz e comercializa produtos agrícolas no Brasil e internacionalmente. A empresa oferece culturas de soja, milho, algodão, trigo, milheto, crotalária, sorgo, gergelim, milho caroço, pipoca, feijão mungo e braquiária. Está envolvida na pecuária e no negócio pecuário. A empresa foi fundada em 1977 e está sediada em Porto Alegre, Brasil.",https://www.slcagricola.com.br,Consumer Defensive,Consumo Defensivo,17.044643,1.8850598,0.11582,0.06860000000000001,9482110285.231262,19.09000015258789,Small Caps,15,1.1199999995651355,16.799999993477034,-13.63,12.0,Baixo,,🟢
SMFT3,SMART FIT   ON      NM,"Smartfit Escola de Ginástica e Dança S.A. operates a network of Smart Fit gyms in Latin America. The company offers digital fitness services under the Queima Diária brand. It operates through owned and franchised units in Brazil, Mexico, Colombia, Chile, Peru, Argentina, Paraguay, Uruguay, Panama, Costa Rica, Dominican Republic, Ecuador, Guatemala, El Salvador and Honduras under the Smart Fit and Bio Ritmo brands. Smartfit Escola de Ginástica e Dança S.A. was founded in 1996 and is based in São Paulo, Brazil.",https://www.smartfit.com.br,Consumer Cyclical,Consumo Cíclico,17.971155,1.971727,0.11505,0.0584,11479653577.355482,18.690000534057617,Mid Caps,30,1.0399999629438184,15.599999444157275,-19.81,12.0,Baixo,,🟢
CPLE3,COPEL       ON      NM,"A Companhia Paranaense de Energia - COPEL, em conjunto com suas subsidiárias, atua na pesquisa, estudo, planejamento, construção, produção, transformação, transporte, distribuição e comercialização de energia elétrica no Brasil. A empresa atua por meio de três segmentos: Geração e Transmissão de Energia Elétrica; Distribuição de Energia Elétrica; e Comercialização. Produz eletricidade a partir de energia hidrelétrica e eólica; e constrói, opera e mantém subestações, bem como linhas de transmissão de energia. A empresa era anteriormente conhecida como Companhia Paranaense de Energia Elétrica e mudou seu nome para Companhia Paranaense de Energia - COPEL em outubro de 1979. A Companhia Paranaense de Energia - COPEL foi fundada em 1954 e está sediada em Curitiba, Brasil.",https://www.copel.com,Utilities,Utilidades Públicas,18.466667,2.1340525,0.10955,0.07339999999999999,49362583543.02283,16.6200008392334,Mid Caps,30,0.9000000292003639,13.50000043800546,-23.11,18.0,Médio,,🟡
