Ticker,Empresa,Resumo,Site,setor_original,Setor,PL,PVP,ROE,DivYield,MarketCap,Preco,Categoria,Score,LucroPorAcao,PrecoJusto,Desconto_%,Ranking,Risco,Risco_num,Farol,Preco_antigo,Variacao_%
PINE3,PINE,"O Banco Pine S.A., em conjunto com suas subsidiárias, fornece produtos e serviços bancários no Brasil. A empresa se dedica a negócios comerciais, de investimento, crédito, financiamento, câmbio e leasing. Também está envolvida em consultoria; distribuição de títulos; imobiliária; intermediação de negócios; e comercialização de ativos ambientais. A empresa foi constituída em 1991 e está sediada em São Paulo, Brasil.",https://www.pine.com,Financial Services,Serviços Financeiros,5.5555553,1.7785681,0.36492002,0.0919,3063904176.0,12.0,Small Caps,60,2.1600000993600044,32.400001490400065,62.96,46.0,Baixo,,🟢,11.600000381469728,3.4482724601392767
POMO4,MARCOPOLO,"A Marcopolo S.A. atua na fabricação e comercialização de ônibus, carrocerias e componentes no Brasil, África do Sul, Austrália, China, México, Argentina e internacionalmente. A empresa oferece ônibus intermunicipais, urbanos e microônibus, ônibus elétricos e ônibus híbridos; e família de microônibus Volare, como ônibus completo, com chassi e carroceria, carroceria para transporte escolar, fretamento executivo, transporte urbano e projetos especiais. Também está envolvida no desenvolvimento e produção de novos modelos sobre trilhos; produção de unidades com propulsão, automóveis de passageiros e fabricação de caixas para transporte de pessoas, TRAMs e EMUs; disponibilização de soluções de crédito para aquisição de ônibus e micro-ônibus; montagem, comercialização, importação e exportação de equipamentos de refrigeração e ar condicionado; e negócio de espuma para assentos. A empresa foi fundada em 1949 e está sediada em Caxias Do Sul, Brasil.",https://www.marcopolo.com.br,Industrials,Indústria,5.69,1.7389976,0.30911,0.1837,7063567968.740001,5.69,Small Caps,60,1.0,15.0,62.07,46.0,Baixo,,🟢,6.389999866485596,-10.954614727880813
PINE4,PINE,"O Banco Pine S.A., em conjunto com suas subsidiárias, fornece produtos e serviços bancários no Brasil. A empresa se dedica a negócios comerciais, de investimento, crédito, financiamento, câmbio e leasing. Também está envolvida em consultoria; distribuição de títulos; imobiliária; intermediação de negócios; e comercialização de ativos ambientais. A empresa foi constituída em 1991 e está sediada em São Paulo, Brasil.",https://www.pine.com,Financial Services,Serviços Financeiros,5.694444,1.8230324,0.36492002,0.0883,3140501780.4,12.3,Small Caps,60,2.160000168585379,32.40000252878069,62.04,46.0,Baixo,,🟢,11.960000038146973,2.842809036526609
VLID3,VALID,"A Valid Soluções S.A. fornece soluções de pagamentos digitais no Brasil, Argentina, Estados Unidos, Europa, Oriente Médio, África, Ásia e internacionalmente. Atua por meio de três segmentos: Meio de Pagamento, Identificação e Mobile. O segmento de Meios de Pagamento oferece produtos e soluções integradas, como chips e cartões, tarjas magnéticas, vales-presente, faturas e extratos bancários, além de soluções em identificação por radiofrequência, contactless e cartões, e pagamentos móveis. O segmento de Identificação oferece captura, armazenamento e administração de dados, impressões de segurança, reconhecimento e impressão digital, além de soluções governamentais digitais. Suas soluções são utilizadas na geração de sistemas informatizados para administração de bancos de dados, coleta de dados biométricos, impressão e personalização de documentos oficiais, identificação, soluções para cidades inteligentes, carimbos rastreáveis ​​e serviços de certificação digital. O segmento Mobile oferece serviços de emissão de extratos e tecnologias para uso em celulares; e mobilidade digital, como soluções NFC, TSM e HCE para provedores de serviços móveis. Também desenvolve tecnologias para uso em celulares, como recarga e pagamento, e produção de cartões para telecomunicações. Atende governos estaduais e órgãos públicos, instituições financeiras, empresas de telecomunicações, varejistas, cooperativas agrícolas e profissionais liberais. A empresa era anteriormente conhecida como Valid Soluções e Serviços de Segurança em Meios de Pagamento e Identificação S.A. e mudou seu nome para Valid Soluções S.A. em agosto de 2018. A Valid Soluções S.A. foi constituída em 1957 e está sediada em Sorocaba, Brasil.",https://www.valid.com,Industrials,Indústria,5.6967745,0.80584073,0.14403,0.0981,1381772739.82,17.66,Small Caps,65,3.099999833238967,46.499997498584506,62.02,40.0,Baixo,,🟢,21.06999969482422,-16.184146863855318
SHUL4,SCHULZ,"A Schulz S.A., juntamente com suas subsidiárias, fabrica e comercializa compressores de ar no Brasil, América Latina, Estados Unidos, Canadá, Europa e internacionalmente. Atua nos segmentos de Indústria e Comercialização. A empresa oferece compressores de ar, incluindo motor de diafragma, alternativo, parafuso rotativo, booster, scroll, isento de óleo e compressores de pistão; equipamentos de tratamento de ar, como separadores e drenos de condensado, purificadores e separadores de água e óleo, bem como tanques e secadores de ar, e filtros e gerenciadores de ar; e produtos de limpeza que incluem aspiradores de pó e líquidos e lavadoras de alta pressão. Também fornece máquinas e ferramentas, que incluem geradores de energia, máquinas de solda, motores de combustão, equipamentos de coluna e bancada, ferramentas elétricas e sem fio, ferramentas manuais, ferramentas pneumáticas e a bateria, linhas automotivas de 12V, motores e pistolas elétricas, bem como lubrificantes; bombas motorizadas; peças de reposição; e outros acessórios relacionados. Além disso, a empresa oferece serviços pós-venda. Além disso, seus produtos são utilizados para aplicações residenciais, profissionais e industriais. Além disso, a empresa exporta seus produtos. A Schulz S.A. foi fundada em 1963 e está sediada em Joinville, Brasil.",https://www.schulz.com.br,Consumer Cyclical,Consumo Cíclico,5.896104,1.0590156,0.18205,0.06860000000000001,1618756154.26,4.54,Small Caps,85,0.7699999864317183,11.549999796475774,60.69,46.0,Baixo,,🟢,5.349999904632568,-15.140185403203258
IGTI3,IGUATEMI S.A,"A Iguatemi S.A., em conjunto com suas subsidiárias, atua na exploração e planejamento comercial de shopping centers no Brasil. A empresa também atua na compra de estacionamentos e na venda de imóveis. Além disso, presta serviços de assessoria e consultoria econômica, financeira e tributária. A empresa era anteriormente conhecida como Jereissati Participações S.A. e mudou seu nome para Iguatemi S.A. em novembro de 2021. A Iguatemi S.A. foi fundada em 1946 e está sediada em São Paulo, Brasil.",https://iguatemi.com.br,Real Estate,Imobiliário,5.948276,0.20959905,0.15361,0.028399999999999998,4152961739.7000003,3.45,Small Caps,70,0.579999986550725,8.699999798260876,60.34,40.0,Baixo,,🟢,3.259999990463257,5.828221168483614
OFSA3,OUROFINO S/A,"A Ouro Fino Saúde Animal Participações S.A., em conjunto com suas subsidiárias, atua no desenvolvimento, produção e comercialização de medicamentos veterinários, vacinas e outros produtos para animais de produção e de companhia, principalmente no Brasil. A empresa atua através de três segmentos: Animais de Produção; Animais de Companhia; e Operações Internacionais. Fabrica e comercializa medicamentos, incluindo antiinflamatórios, antibióticos, anticoccidianos, antimastíticos, ectoparasiticidas, endectocidas, endoparasiticidas, hemoparasiticidas, inoculantes, terapêuticos, produtos para reprodução animal e vacinas; e aditivos, probióticos e outros produtos veterinários para melhoria de desempenho para bovinos, suínos, aves, ovinos, cavalos e caprinos, bem como serviços de fabricação. A empresa também fabrica soluções veterinárias para cães e gatos, como anestésicos, sedativos, antiinflamatórios, antibióticos, antimicrobianos, dermatológicos, ectoparasiticidas, endoparasiticidas, dermocosméticos e otológicos. Além disso, oferece vacinas e outros produtos veterinários para animais de produção e de companhia. A empresa era anteriormente conhecida como A.H.N.S.P.E. Empreendimentos e Participações S.A. A Ouro Fino Saúde Animal Participações S.A. foi constituída em 1987 e está sediada em Cravinhos, Brasil.",https://www.ourofinosaudeanimal.com,Healthcare,Saúde,6.0155907,1.778729,0.33279,0.0519,1452263038.0600002,27.01,Small Caps,60,4.4899996271355365,67.34999440703305,59.9,40.0,Baixo,,🟢,26.21999931335449,3.0129698982987625
EZTC3,EZTEC,"A EZTEC Empreendimentos e Participações S.A. atua em atividades de engenharia, construção e incorporação imobiliária no Brasil e internacionalmente. A empresa desenvolve e comercializa imóveis; administra e aluga propriedades; constrói condomínios; e subdivide terras. Atua também na prestação de serviços relacionados à construção, fiscalização, estudos e projetos; e execução de obras e serviços de engenharia civil. A EZTEC Empreendimentos e Participações S.A. foi fundada em 1979 e está sediada em São Paulo, Brasil.",https://www.eztec.com.br,Real Estate,Imobiliário,6.057143,0.68501264,0.11286,0.0331,3528006823.44,12.72,Small Caps,50,2.0999999504716995,31.499999257075494,59.62,34.0,Baixo,,🟢,14.9399995803833,-14.85943535967853
CMIG4,CEMIG,"A Companhia Energética de Minas Gerais - CEMIG, por meio de suas subsidiárias, atua na geração, transmissão, distribuição e comercialização de energia no Brasil. Em 31 de dezembro de 2025, a empresa operava 32 usinas hidrelétricas com capacidade total de 4.434 MW, 2 parques eólicos com capacidade total de 71 MW e 12 usinas fotovoltaicas com capacidade total de 169 MW; 365.577 milhas de linhas de distribuição; e 4.865 milhas de linhas de transmissão. Também atua na aquisição, transporte e distribuição de gás e seus subprodutos e derivados; venda e comercialização de energia; construção, implantação, operação e manutenção de transmissão de energia elétrica; comercialização e intermediação de negócios relacionados à energia; instalação, operação, manutenção e aluguel de usinas solares; e atividades de geração distribuída, serviços de conta, cogeração, eficiência energética e gestão de abastecimento e armazenamento. A empresa foi constituída em 1952 e está sediada em Belo Horizonte, Brasil.",https://www.cemig.com.br,Utilities,Utilidades Públicas,6.479532,1.097247,0.17038,0.1186,31696355263.64,11.08,Mid Caps,100,1.7100000432129976,25.650000648194965,56.8,52.0,Baixo,,🟢,11.93000030517578,-7.124897597923869
LEVE3,METAL LEVE,"A MAHLE Metal Leve S.A., empresa de peças automotivas, fabrica e comercializa componentes para motores de combustão interna e filtros automotivos na América do Sul, Europa, América Central e do Norte, África e internacionalmente. Atua nos segmentos de Powertrain e Carregamento e Sistemas Térmicos e Fluidos. A empresa oferece sistemas de acionamento e eletrônica de potência para motores elétricos; sistemas de pistão, componentes de cilindros, trens de válvulas, ar condicionado, refrigeração de motor, gerenciamento de ar, resfriamento de motor, gerenciamento de óleo; e eletrônica de potência para acionamentos de tração para automóveis de passageiros, bem como acionamento elétrico e sistemas mecatrônicos para aplicações industriais, máquinas agrícolas e de construção, veículos comerciais, veículos industriais, veículos de transporte elétrico e indústria automotiva, bem como veículos industriais e especiais; e equipamentos de motores grandes e pequenos. Ela fornece túneis de vento climáticos, testes de motores, engenharia, testes de módulos, gerenciamento térmico e serviços de transmissão. Além disso, disponibiliza túneis de vento climáticos; testes de motores; teste de módulo; gestão térmica industrial; transmissões; e serviços de engenharia. Além disso, a empresa oferece produtos para pistões, anéis de pistão, válvulas, bielas, rolamentos, buchas, arruelas de encosto, camisas de cilindro, anéis de pistão, árvores de cames, pistões, pinos, porta-anéis e compressores mecânicos, bem como filtros de combustível, filtros de ar, filtros de óleo, filtros de ar condicionado, filtros de carvão ativado, separadores de óleo, tampas de válvulas, sistemas de admissão de ar, pré-filtros de diesel e coletores de admissão, ar condicionado e radiadores e condensadores. Além disso, exporta seus produtos. A empresa foi fundada em 1920 e está sediada em Mogi Guaçu, Brasil. A MAHLE Metal Leve S.A. atua como subsidiária da Mahle Indústria E Comercio Ltda.",https://www.mahle.com,Consumer Cyclical,Consumo Cíclico,6.553061,4.063014,0.67706,0.08960000000000001,4352157290.0,32.11,Small Caps,60,4.900000167860486,73.50000251790729,56.31,46.0,Baixo,,🟢,35.689998626708984,-10.030817496389185
BMEB3,MERCANTIL,"O Banco Mercantil do Brasil S.A., em conjunto com suas subsidiárias, presta serviços financeiros a clientes pessoas físicas e jurídicas no Brasil. Atua nos segmentos Financeiro, de Seguros e Intermediação Empresarial, Marketplace e Outros. A empresa oferece produtos de Conta Corrente, Empréstimos, Cartões, Investimentos, Cartões a Receber, Cheque Especial, Previdência Privada, Transferência de Benefícios, Limite Especial e Mercado de Capitais. Também oferece internet, WhatsApp, aplicativo Mercantil e serviços bancários de autoatendimento. Além disso, a empresa atua em atividades imobiliárias, securitização e tecnologia. A empresa era anteriormente conhecida como Banco Industrial de Minas Gerais e mudou seu nome para Banco Mercantil do Brasil S.A. em 1974. O Banco Mercantil do Brasil S.A. foi fundado em 1940 e está sediado em Belo Horizonte, Brasil.",https://bancomercantil.com.br,Financial Services,Serviços Financeiros,6.591784,2.119711,0.32384998,0.0335,6633522402.0,51.35,Small Caps,45,7.790000400498561,116.85000600747841,56.05,40.0,Baixo,,🟢,73.63999938964844,-30.26887503312736
SBFG3,GRUPO SBF,"O Grupo SBF S.A. atua na comercialização de artigos esportivos e produtos de lazer no Brasil. A empresa oferece calçados, roupas, entretenimento em geral, equipamentos e acessórios. Também oferece aulas semanais gratuitas de Yoga e FitDance; promove diversos eventos e aulas esportivas gratuitas; atividades gratuitas, como aulas de diversas modalidades e eventos esportivos; e empréstimo de futebol, basquete, vôlei, raquetes e tapetes de ioga. A empresa comercializa seus produtos por meio de loja física, site e aplicativo das marcas Oxer, Nord e Adams, além das marcas das coleções Go Equal, Farm, Asics, Confederação Brasileira de Futebol (CBF). Além disso, atua na prestação de serviços logísticos; e negócios de comércio esportivo e produção de audiovisão. O Grupo SBF S.A. foi fundado em 1981 e está sediado em São Paulo, Brasil.",https://ri.gruposbf.com.br,Consumer Cyclical,Consumo Cíclico,6.7847223,0.68336016,0.111719996,0.056799999999999996,2253587221.38,9.77,Small Caps,65,1.4399999834923234,21.59999975238485,54.77,34.0,Baixo,,🟢,12.3100004196167,-20.63363389954936
ECOR3,ECORODOVIAS,"A EcoRodovias Infraestrutura e Logística S.A. atua como uma empresa de infraestrutura que opera concessões rodoviárias no Brasil. Opera o Ecopátio Logística Cubatão, plataforma logística intermodal, que é o local regulador de caminhões no Porto de Santos. A empresa também atua na operação portuária e na movimentação e armazenagem de cargas de importação e exportação no Porto de Santos. A empresa foi fundada em 1997 e está sediada em São Paulo, Brasil. A EcoRodovias Infraestrutura e Logística S.A. atua como subsidiária da IGLI S.p.A.",https://www.ecorodovias.com.br,Industrials,Indústria,6.915888,1.2576479,0.17334,0.0421,5147597072.400001,7.4,Small Caps,70,1.0699999768648654,16.049999652972982,53.89,40.0,Baixo,,🟢,9.960000038146973,-25.70281152953944
TEND3,TENDA,"A Construtora Tenda S.A. atua como construtora de residências no Brasil. Atua nos segmentos On-Site e Off-Site. A empresa também atua na execução e gerenciamento de obras de construção civil; desenvolvimento de imóveis; compra e venda de imóveis e terrenos; prestação de serviços de gestão de construção civil; e intermediação e comercialização de cotas de consórcio. A Construtora Tenda S.A. foi fundada em 1969 e está sediada em São Paulo, Brasil.",https://www.tenda.com,Real Estate,Imobiliário,7.010163,3.113378,0.47064,0.0371,4225473507.96,34.49,Small Caps,45,4.91999972040593,73.79999580608896,53.27,40.0,Baixo,,🟢,30.670000076293945,12.455167636790081
WIZC3,WIZ CO,"Wiz Co Participações e Corretagem de Seguros S.A. operates as an insurance broker in Brazil. The company offers bancassurance, consortiums, and credit services. It also involved in-person, remote, and digital solutions for the sale and after-sales of insurance and financial products. The company was formerly known as Wiz Soluções e Corretagem de Seguros S.A. Wiz Co Participações e Corretagem de Seguros S.A. was founded in 1973 and is headquartered in Brasília, Brazil.",https://wiz.co,Financial Services,Serviços Financeiros,7.024793,1.9477544,0.28619,0.0762,1359211897.0,8.5,Small Caps,60,1.2100000669058861,18.150001003588294,53.17,46.0,Baixo,,🟢,9.6899995803833,-12.280697955780807
INTB3,INTELBRAS,"A Intelbras S.A. - Indústria de Telecomunicações Eletrônica Brasileira atua na fabricação, desenvolvimento e comercialização de equipamentos de segurança eletrônica e serviços de vigilância e monitoramento eletrônicos no Brasil. A empresa atua por meio de três segmentos: Segurança, Tecnologia da Informação e Comunicação (TIC) e Energia. Oferece produtos e soluções de segurança eletrônica, inclusive Oferece produtos e soluções de segurança eletrônica, incluindo alarmes, armazenamento, câmeras, comunicação condominial, controle de acesso corporativo, fechaduras, gravadores de vídeo digital, produtos contra incêndio e intercomunicação, monitoramento de veículos, sensores, sinalização de emergência, produtos de software e aplicativos e acessórios; e os produtos e soluções de redes incluem produtos 5G e Wi-Fi corporativo, racks, roteadores, switches, rádios externos, fibra óptica e produtos passivos, injetores PoE, adaptadores USB, software e aplicativos e cabos. A empresa também fornece produtos e soluções relacionados à comunicação, como webcams, projetores, mouses e teclados sem fio, soluções em nuvem, antenas e conversores, centrais telefônicas, produtos para eletrodomésticos e conferências, gateways, fones de ouvido, rádios comunicadores, caixas e controles inteligentes, alto-falantes inteligentes, software e aplicativos e telefones; e produtos e soluções relacionados à energia que incluem carregadores de veículos elétricos, UPS, baterias, smart, fontes, protetores eletrônicos, protetores contra surtos, acessórios USB e sensores de presença de iluminação. Além disso, oferece soluções on grid, que incluem painéis solares, estruturas de fixação, inversores on grid, string boxes e acessórios; e soluções fora da rede, como produtos de iluminação, estruturas de montagem, gabinetes externos, acionamentos e painéis solares, bombas solares e geradores e inversores fora da rede. A Intelbras S.A. - Indústria de Telecomunicações Eletrônica Brasileira foi constituída em 1974 e está sediada em São José, Brasil.",https://www.intelbras.com,Industrials,Indústria,7.3295455,1.3427708,0.18765,0.1096,4221023319.0,12.9,Small Caps,85,1.7599999890852713,26.39999983627907,51.14,46.0,Baixo,,🟢,13.970000267028809,-7.659271629036124
PGMN3,PAGUE MENOS,"A Empreendimentos Pague Menos S.A. atua no comércio varejista de medicamentos, perfumarias e produtos de higiene pessoal e beleza no Brasil. A empresa oferece medicamentos e produtos para saúde; produtos de higiene pessoal, incluindo desodorantes, cuidados íntimos e higiene bucal; produtos para cuidados com os pés, cabelos, rosto e mãos; produtos dermo e de beleza; e repelentes, fraldas, panos e produtos alimentícios, além de outros acessórios para mamães e bebês. A empresa também oferece vacinas, exames de análises clínicas e serviços básicos de saúde; roupas e acessórios, suplementos, primeiros socorros, alimentos e bebidas, chocolates, sorvetes, picolés, brinquedos, produtos para animais de estimação e para casa, acessórios para notebooks, utilidades e outros; e cereais, fibras, vitaminas e minerais, primeiros socorros, fitoterápicos e produtos naturais. Ela vende seus produtos em lojas de varejo e online. A Empreendimentos Pague Menos S.A. foi constituída em 1981 e está sediada em Fortaleza, Brasil.",https://www.paguemenos.com.br,Healthcare,Saúde,7.469388,0.7862513,0.10118,0.1409,2639381787.9,3.66,Small Caps,65,0.48999998393442673,7.349999759016401,50.2,40.0,Baixo,,🟢,3.66,0.0
KEPL3,KEPLER WEBER,"A Kepler Weber S.A. fornece equipamentos para armazenamento de grãos e soluções pós-colheita de grãos no Brasil, nas Américas, na África, na Europa e na Ásia. Atua em cinco segmentos: Fazendas, Agroindústria, Portos e Terminais, Reposição e Serviços e Negócios Internacionais. A empresa oferece sistemas de armazenamento e preservação de grãos, como silos, secadores e transportadores, além de máquinas de limpeza. Também fornece equipamentos para commodities agrícolas, como etanol de milho, óleo de soja, ração animal, moinhos de trigo, indústrias de arroz, complexos cooperativos, produtores de cereais e canteiros; equipamentos industriais; e terminais portuários. Além disso, a empresa oferece peças de reposição e serviços de assistência técnica; serviços de engenharia técnica e processamento de dados; serviços de seguros contra riscos de engenharia; e serviços de monitoramento de temperatura e umidade de grãos no processo de processamento e armazenamento. Além disso, importa e exporta matérias-primas e produtos acabados e semiacabados. A empresa foi fundada em 1925 e está sediada em São Paulo, Brasil.",https://www.kepler.com.br,Industrials,Indústria,7.5058823,1.3966726,0.19634001,0.0855,1106340813.3799999,6.38,Small Caps,85,0.8500000059952979,12.750000089929468,49.96,42.0,Baixo,,🟢,8.369999885559082,-23.775387249317248
BMEB4,MERCANTIL,"O Banco Mercantil do Brasil S.A., em conjunto com suas subsidiárias, presta serviços financeiros a clientes pessoas físicas e jurídicas no Brasil. Atua nos segmentos Financeiro, de Seguros e Intermediação Empresarial, Marketplace e Outros. A empresa oferece produtos de Conta Corrente, Empréstimos, Cartões, Investimentos, Cartões a Receber, Cheque Especial, Previdência Privada, Transferência de Benefícios, Limite Especial e Mercado de Capitais. Também oferece internet, WhatsApp, aplicativo Mercantil e serviços bancários de autoatendimento. Além disso, a empresa atua em atividades imobiliárias, securitização e tecnologia. A empresa era anteriormente conhecida como Banco Industrial de Minas Gerais e mudou seu nome para Banco Mercantil do Brasil S.A. em 1974. O Banco Mercantil do Brasil S.A. foi fundado em 1940 e está sediado em Belo Horizonte, Brasil.",https://bancomercantil.com.br,Financial Services,Serviços Financeiros,7.575096,2.435913,0.32384998,0.0313,7280661235.26,59.01,Small Caps,45,7.790000285144901,116.85000427717351,49.5,36.0,Baixo,,🟢,87.25,-32.36676217765043
EQPA3,EQTL PARA,"Equatorial Pará Distribuidora de Energia S.A. engages in the distribution of electricity in the state of Pará, Brazil. It serves residential, industrial, commercial, rural, public authority, public lighting service, and public service customers. The company was formerly known as Centrais Elétricas do Pará S.A. and changed its name to Equatorial Pará Distribuidora de Energia S.A. in December 2019. The company was founded in 1962 and is headquartered in Belém, Brazil. Equatorial Pará Distribuidora de Energia S.A. is a subsidiary of Equatorial Energia Distribuição S.A.",https://pa.equatorialenergia.com.br,Utilities,Utilidades Públicas,7.6000004,2.1119492,0.28202,0.0605,11752273717.24,5.32,Mid Caps,75,0.6999999631578967,10.49999944736845,49.33,48.0,Baixo,,🟢,6.389999866485596,-16.744912188457985
BEEF3,MINERVA,"A Minerva S.A. produz e comercializa carne bovina in natura, gado e subprodutos na América do Sul e internacionalmente. A empresa também atua no abate, desossa e processamento de carnes; venda de carnes resfriadas, congeladas e processadas, bem como produtos bovinos, suínos e aves; exportação e venda de gado vivo; e criação e venda de gado vivo, cordeiros, porcos e outros animais vivos. Além disso, comercializa eletricidade; comercializa proteínas e produtos alimentícios; vende marcas de terceiros principalmente produtos Swift; e prepara produtos para animais, que incluem farinha de carne e ossos, sangue e sebo. A Minerva S.A. foi fundada em 1957 e está sediada em Barretos, Brasil.",https://ri.minervafoods.com,Consumer Defensive,Consumo Defensivo,7.6382976,2.8134794,0.83755,0.0361,3544906530.5499997,3.59,Small Caps,45,0.4700000167576608,7.050000251364912,49.08,36.0,Baixo,,🟢,4.099999904632568,-12.439022353544992
