Ticker,Empresa,Resumo,Site,setor_original,Setor,PL,PVP,ROE,DivYield,MarketCap,Preco,Categoria,Score,LucroPorAcao,PrecoJusto,Desconto_%,Ranking,Risco,Risco_num,Farol,Preco_antigo,Variacao_%
UGPA3,ULTRAPAR,"A Ultrapar Participações S.A., por meio de suas subsidiárias, atua nos setores de energia, mobilidade e infraestrutura logística no Brasil, no resto da Europa, nos Estados Unidos, no Canadá, em outros países da América Latina, na Oceania e internacionalmente. Atua nos segmentos Ultragaz, Ipiranga, Ultracargo e Hidrovias. A empresa distribui e vende produtos derivados de petróleo, biocombustíveis, gasolina, etanol, diesel, óleo combustível, querosene, gás natural para veículos e combustíveis aditivos sob a marca Ipimax para transportadoras, revendedores e varejistas; opera postos de abastecimento da marca Ipiranga e lojas de conveniência da marca AmPm; e produz e vende lubrificantes sob a marca ICONIC. Atua também na distribuição de gás liquefeito de petróleo a granel e envasado para os setores residencial, condominial, comércio, serviços, industrial e agronegócio; operação de rede de gasodutos de gás natural; e fornecimento de eletricidade renovável para empresas e residências, bem como gás natural comprimido e biometano para clientes corporativos. Além disso, a empresa opera terminais de armazenamento de granéis líquidos em centros logísticos; infraestrutura hidroviária e multimodal; e operações portuárias. Além disso, a empresa oferece soluções logísticas para movimentação de grãos, minérios e fertilizantes; serviços automotivos através das unidades Jet Oil; e programas de fidelidade da marca Km de Vantagens (KMV). Também exporta seus produtos e serviços. A Ultrapar Participações S.A. foi fundada em 1937 e está sediada em São Paulo, Brasil.",https://www.ultra.com.br,Energy,Energia,9.021052,1.7538712,0.19181,0.0681,27478006793.004295,25.709999084472656,Mid Caps,75,2.8500000980454008,42.75000147068101,39.86,42.0,Baixo,,🟢,27.229999542236328,-5.582080364731575
ALUP4,ALUPAR,"A Alupar Investimento S.A., em conjunto com suas subsidiárias, atua na transmissão, geração e comercialização de energia no Brasil, Colômbia, Peru e Chile. Atua nos segmentos de Transmissão e Geração. A empresa detém participação em concessões de 44 sistemas de transmissão de energia elétrica, totalizando 9.999 quilômetros de linhas de transmissão; e opera linhas aéreas e subestações. Também atua na geração de energia renovável por meio de hidrelétricas, parques eólicos e usinas fotovoltaicas, que possuem capacidade instalada de 798,5 MW. A empresa foi constituída em 2006 e está sediada em São Paulo, Brasil. A Alupar Investimento S.A. é uma subsidiária da Guarupart Participações Ltda.",https://www.alupar.com.br,Utilities,Utilidades Públicas,9.098214,1.0850428,0.12679,0.0275,10076692909.239185,10.1899995803833,Mid Caps,65,1.119999989050961,16.799999835764417,39.35,24.0,Baixo,,🟢,10.989999771118164,-7.27934674609614
CMIG3,CEMIG,"A Companhia Energética de Minas Gerais - CEMIG, por meio de suas subsidiárias, atua na geração, transmissão, distribuição e comercialização de energia no Brasil. Em 31 de dezembro de 2025, a empresa operava 32 usinas hidrelétricas com capacidade total de 4.434 MW, 2 parques eólicos com capacidade total de 71 MW e 12 usinas fotovoltaicas com capacidade total de 169 MW; 365.577 milhas de linhas de distribuição; e 4.865 milhas de linhas de transmissão. Também atua na aquisição, transporte e distribuição de gás e seus subprodutos e derivados; venda e comercialização de energia; construção, implantação, operação e manutenção de transmissão de energia elétrica; comercialização e intermediação de negócios relacionados à energia; instalação, operação, manutenção e aluguel de usinas solares; e atividades de geração distribuída, serviços de conta, cogeração, eficiência energética e gestão de abastecimento e armazenamento. A empresa foi constituída em 1952 e está sediada em Belo Horizonte, Brasil.",https://www.cemig.com.br,Utilities,Utilidades Públicas,9.104046,1.5597149,0.17038,0.08789999999999999,45055739657.25,15.75,Mid Caps,75,1.7300000461333345,25.950000692000017,39.31,42.0,Baixo,,🟢,15.520000457763672,1.481955769667996
MOVI3,MOVIDA,"A Movida Participações S.A. presta serviços de aluguel de automóveis no Brasil. Atua em dois segmentos, Rent-a-Car e Gestão e Terceirização de Frotas (GTF). A empresa oferece serviços de aluguel de veículos leves; e serviços de gestão e terceirização de frotas. Também vende carros usados. A empresa era anteriormente conhecida como H.L.C.S.P.E Empreendimentos e Participações S.A. e mudou seu nome para Movida Participações S.A. em dezembro de 2014. A empresa foi fundada em 2006 e tem sede em São Paulo, Brasil. A Movida Participações S.A. atua como subsidiária da Simpar S.A.",https://ri.movida.com.br,Industrials,Indústria,9.352381,1.0858028,0.12866999,0.0931,3938075600.2365646,9.819999694824219,Small Caps,65,1.0499999620229565,15.749999430344348,37.65,30.0,Baixo,,🟢,12.93000030517578,-24.05259502667337
ISAE3,ISA ENERGIA,"A ISA Energía Brasil S.A. atua no negócio de transmissão de energia elétrica no Brasil. Em 31 de dezembro de 2025, possuía capacidade total instalada de transformação de 84.910 MVA juntamente com linhas de transmissão de 23 mil quilômetros. Atua nos estados da Bahia, Espírito Santo, Minas Gerais, Rio de Janeiro e São Paulo. A ISA Energía Brasil S.A. foi constituída em 1999 e está sediada em São Paulo, Brasil.",https://www.isacteep.com.br,Utilities,Utilidades Públicas,9.494382,1.0393924,0.11273,0.078,22270255172.511932,33.79999923706055,Mid Caps,80,3.559999928069099,53.399998921036484,36.7,36.0,Baixo,,🟢,32.0099983215332,5.592005652568891
ITUB4,ITAUUNIBANCO,"O Itaú Unibanco Holding S.A. fornece diversos produtos e serviços financeiros para clientes pessoas físicas e jurídicas no Brasil e internacionalmente. Atua por meio de três segmentos: Negócios Varejo, Negócios Atacado e Atividades com Mercado + Corporação. A empresa oferece contas correntes; gestão de fundos; pagamentos e cobranças; empréstimos; cartões de crédito e débito; serviços bancários comerciais e de investimento; serviços de empréstimo e financiamento imobiliário; assessoria econômica, financeira e corretagem; e serviços de leasing e câmbio. A empresa também oferece produtos de seguros não vida que cobrem perdas, danos ou responsabilidade civil por objetos ou pessoas, bem como produtos de seguros de vida que cobrem morte e acidentes pessoais. Atende clientes de varejo, correntistas e não correntistas, pessoas físicas e jurídicas, clientes de alta renda, microempresas e pequenas empresas, bem como empresas de médio porte e clientes institucionais de alto patrimônio. A empresa era anteriormente conhecida como Itaú Unibanco Banco Múltiplo S.A. e mudou seu nome para Itaú Unibanco Holding S.A. em abril de 2009. A empresa foi constituída em 1924 e está sediada em São Paulo, Brasil. O Itaú Unibanco Holding S.A. é uma subsidiária da IUPAR - Itaú Unibanco Participações S.A.",https://www.itau.com.br,Financial Services,Serviços Financeiros,9.601942,2.0791507,0.21816,0.0226,436014301270.05695,39.560001373291016,Blue Chips,60,4.120000034710793,61.80000052066189,35.99,36.0,Médio,,🟡,39.560001373291016,0.0
BEES3,BANESTES,"O Banestes S.A - Banco do Estado do Espírito Santo S.A., em conjunto com suas subsidiárias, atua como banco múltiplo no Brasil. Opera através do Financeiro; e Seguros e Outros segmentos. A empresa atua por meio de suas carteiras de comércio, rural, industrial, imobiliário, câmbio, arrendamento, investimento e administração de cartões de crédito; e nas áreas de seguros e distribuição, intermediação e administração de recursos de terceiros. Também fornece gestão de ativos e fundos; administração e intermediação de valores mobiliários, seguros, previdência e capitalização; fundos de investimento; cartões de crédito e débito; banco pela internet; conta corrente, poupança, especial, cheque fiduciário, jovem e universitário, conta mais fácil, simplificada, salário e judicial; títulos de capitalização; seguro de carro, vida, casa, acidentes pessoais, proteção financeira de cartão e seguro empresarial; cobranças e convênios; transferência de fundos e recursos; coleção; custódia; opções de crédito e financiamento; empréstimos e garantias; e outros serviços. Além disso, a empresa opera um serviço público de loteria. Banestes S.A - Banco do Estado do Espírito Santo S.A. foi fundado em 1935 e está sediado em Vitória, Brasil.",https://www.banestes.com.br,Financial Services,Serviços Financeiros,9.65934,1.2424029,0.13748999,0.0393,3054561430.083769,8.789999961853027,Small Caps,50,0.9100000581668134,13.6500008725022,35.6,24.0,Baixo,,🟢,8.630000114440918,1.8539958898074096
BEES4,BANESTES,"O Banestes S.A - Banco do Estado do Espírito Santo S.A., em conjunto com suas subsidiárias, atua como banco múltiplo no Brasil. Opera através do Financeiro; e Seguros e Outros segmentos. A empresa atua por meio de suas carteiras de comércio, rural, industrial, imobiliário, câmbio, arrendamento, investimento e administração de cartões de crédito; e nas áreas de seguros e distribuição, intermediação e administração de recursos de terceiros. Também fornece gestão de ativos e fundos; administração e intermediação de valores mobiliários, seguros, previdência e capitalização; fundos de investimento; cartões de crédito e débito; banco pela internet; conta corrente, poupança, especial, cheque fiduciário, jovem e universitário, conta mais fácil, simplificada, salário e judicial; títulos de capitalização; seguro de carro, vida, casa, acidentes pessoais, proteção financeira de cartão e seguro empresarial; cobranças e convênios; transferência de fundos e recursos; coleção; custódia; opções de crédito e financiamento; empréstimos e garantias; e outros serviços. Além disso, a empresa opera um serviço público de loteria. Banestes S.A - Banco do Estado do Espírito Santo S.A. foi fundado em 1935 e está sediado em Vitória, Brasil.",https://www.banestes.com.br,Financial Services,Serviços Financeiros,9.780219,1.2579505,0.13748999,0.0388,3106074368.3681583,8.899999618530273,Small Caps,50,0.9100000335913002,13.650000503869503,34.8,24.0,Baixo,,🟢,8.800000190734863,1.1363571094088747
BMEB4,MERCANTIL,"O Banco Mercantil do Brasil S.A., em conjunto com suas subsidiárias, presta serviços financeiros a clientes pessoas físicas e jurídicas no Brasil. Atua nos segmentos Financeiro, de Seguros e Intermediação Empresarial, Marketplace e Outros. A empresa oferece produtos de Conta Corrente, Empréstimos, Cartões, Investimentos, Cartões a Receber, Cheque Especial, Previdência Privada, Transferência de Benefícios, Limite Especial e Mercado de Capitais. Também oferece internet, WhatsApp, aplicativo Mercantil e serviços bancários de autoatendimento. Além disso, a empresa atua em atividades imobiliárias, securitização e tecnologia. A empresa era anteriormente conhecida como Banco Industrial de Minas Gerais e mudou seu nome para Banco Mercantil do Brasil S.A. em 1974. O Banco Mercantil do Brasil S.A. foi fundado em 1940 e está sediado em Belo Horizonte, Brasil.",https://bancomercantil.com.br,Financial Services,Serviços Financeiros,9.826701,3.1599588,0.32384998,0.0242,9444749021.826263,76.55000305175781,Small Caps,45,7.790000230164509,116.85000345246763,34.49,30.0,Médio,,🟡,87.25,-12.263606817469556
FIQE3,UNIFIQUE,"A Unifique Telecomunicações S.A. fornece serviços de telecomunicações no Brasil. A empresa oferece armazenamento de dados, hospedagem de dados e serviços de Internet. Também fornece serviços de comunicação multimídia SCM; acesso a redes de comunicação, portais, provedores de conteúdo e serviços de informação na Internet; TV paga via satélite, cabo e micro-ondas; e serviços de hospedagem de internet e telefonia fixa comutada. Além disso, a empresa atua no comércio varejista de hospedagem de internet e telefonia fixa comutada; equipamentos e suprimentos para informática e telefonia móvel; publicação de livros e venda a retalho de livros; e planos de saúde. A Unifique Telecomunicações S.A. foi constituída em 1997 e está sediada em Timbó, Brasil.",https://unifique.com.br,Communication Services,Comunicação,10.193548,2.2005572,0.18061,0.1343,2460069831.219456,6.320000171661377,Small Caps,35,0.6200000403845037,9.300000605767556,32.04,36.0,Baixo,,🟢,5.510000228881836,14.700542815474932
VAMO3,VAMOS,"A Vamos Locação de Caminhões, Máquinas e Equipamentos S.A., em conjunto com suas subsidiárias, atua na locação, revenda e venda de caminhões, máquinas, equipamentos e peças no Brasil. A empresa aluga tratores, empilhadeiras, máquinas e implementos agrícolas, ônibus e outros veículos; vende peças e acessórios automotivos; comercializa tratores, máquinas, pneus, câmaras de ar, implementos, veículos automotores e ônibus novos e usados; e presta serviços de manutenção e reparação de automóveis, assistência técnica e serviços correlatos, bem como atua na logística e no transporte rodoviário de cargas. Oferece também construção civil, peças, lubrificantes, prestação de serviços de reparação e manutenção de veículos e similares, transporte rodoviário de cargas em geral, comércio atacadista de máquinas, aparelhos e equipamentos para uso agrícola, partes e peças, e atividades de intermediação e agenciamento de serviços e negócios em geral, exceto imobiliário; representantes comerciais e agentes do comércio de veículos automotores. Além disso, a empresa comercializa fertilizantes, herbicidas e sementes; e presta serviços de engenharia relacionados à customização de caminhões e ônibus, bem como à prestação de atividades agrícolas. Além disso, a empresa fabrica e vende reboques de caminhões, carrocerias de caminhões, implementos rodoviários, cabines e máquinas e equipamentos industriais; e realiza instalação, reforma, reparo e manutenção de equipamentos e veículos; prestação de serviços de logística e transporte rodoviário de cargas; serviços de tecnologia da informação; análises técnicas de veículos automotores; serviços de operador de empilhadeira; e terceirização e gestão de recursos humanos. A Vamos Locação de Caminhões, Máquinas e Equipamentos S.A. foi constituída em 2015 e está sediada em São Paulo, Brasil. A Vamos Locação de Caminhões, Máquinas e Equipamentos S.A. é uma subsidiária da SIMPAR S.A.",https://grupovamos.com.br,Industrials,Indústria,10.24138,1.235955,0.12076,0.0472,3628825824.0067472,2.9700000286102295,Small Caps,25,0.28999998326497306,4.349999748974596,31.72,24.0,Baixo,,🟢,4.079999923706055,-27.20588029049668
LREN3,LOJAS RENNER,"A Lojas Renner S.A., em conjunto com suas subsidiárias, atua como empresa de moda e estilo de vida no Brasil, Argentina e Uruguai. Atua nos segmentos de Varejo e Produtos Financeiros. A empresa comercializa roupas e produtos esportivos, calçados, acessórios, perfumaria, eletrodomésticos, móveis, relógios, artigos para casa e decoração, entregas urbanas e soluções de gestão logística, além de cosméticos. Atua também na concessão de empréstimos a pessoas físicas e jurídicas, financiamento de compras, seguros e prática de recebíveis e contas a pagar inerentes a empresas de crédito, financiamento e investimento, comissões de intermediação de vendas, bem como na concessão de empréstimos pessoais. Oferece seus produtos por meio de lojas e canais digitais das marcas Renner, Youcom, Camicado, Realize, Ashua, Uello, Realize e Repasse. A Lojas Renner S.A. foi constituída em 1965 e está sediada em Porto Alegre, Brasil.",https://www.lojasrennersa.com.br/en/,Consumer Cyclical,Consumo Cíclico,10.416107,1.4618067,0.14479999,0.0574,15152568466.606236,15.520000457763672,Mid Caps,55,1.490000098670614,22.35000148005921,30.56,30.0,Baixo,,🟢,15.470000267028809,0.323207432914068
CURY3,CURY S/A,"A Cury Construtora e Incorporadora S.A. atua no ramo imobiliário no Brasil. A empresa atua na venda de unidades imobiliárias; serviços de análise de crédito; empreendimentos imobiliários residenciais; aluguel de imóveis próprios; e prestação de serviços relativos a construção, fiscalização, estudos e projetos, além da execução de quaisquer obras de construção e engenharia civil. Também presta serviços de construção, administração, administração imobiliária e instalações elétricas e hidráulicas. A empresa foi fundada em 1963 e está sediada em São Paulo, Brasil.",https://cury.net,Real Estate,Imobiliário,10.513423,7.245606,0.73689,0.13949999999999999,9651131096.517834,31.329999923706055,Small Caps,35,2.979999941380277,44.699999120704156,29.91,38.0,Baixo,,🟢,36.77999877929688,-14.817833160610599
ALUP3,ALUPAR,"A Alupar Investimento S.A., em conjunto com suas subsidiárias, atua na transmissão, geração e comercialização de energia no Brasil, Colômbia, Peru e Chile. Atua nos segmentos de Transmissão e Geração. A empresa detém participação em concessões de 44 sistemas de transmissão de energia elétrica, totalizando 9.999 quilômetros de linhas de transmissão; e opera linhas aéreas e subestações. Também atua na geração de energia renovável por meio de hidrelétricas, parques eólicos e usinas fotovoltaicas, que possuem capacidade instalada de 798,5 MW. A empresa foi constituída em 2006 e está sediada em São Paulo, Brasil. A Alupar Investimento S.A. é uma subsidiária da Guarupart Participações Ltda.",https://www.alupar.com.br,Utilities,Utilidades Públicas,10.663717,1.2830979,0.12679,0.0232,11916011430.664005,12.050000190734863,Mid Caps,40,1.129999998193394,16.94999997290091,28.91,20.0,Baixo,,🟢,12.960000038146973,-7.021603740228241
TTEN3,3TENTOS,"A Três Tentos Agroindustrial S/A, em conjunto com suas subsidiárias, atua no setor do agronegócio. Atua por meio de três segmentos: Insumos, Grãos e Industrial. A empresa comercializa e distribui produtos agrícolas, incluindo produtos para proteção e nutrição de cultivos e sementes para soja, milho e trigo. Também se dedica ao armazenamento, comercialização e comércio de produtos agrícolas; e atividades de industrialização de grãos. Além disso, a empresa oferece soluções de digitalização que incluem o 3tentos, aplicativo com foco na comodidade e gestão do produtor rural; App 3tentos + Nota Fiscal Eletrônica; certificado digital; Portal do Parceiro, possibilita certificado digital do agricultor para uso no App 3tentos e consulta relatórios e informações para o manejo da lavoura; e Terra3, plataforma de monitoramento agronômico remoto. Além disso, oferece serviços de assistência técnica. A empresa opera na África, América Central, América do Sul, América do Norte, Ásia e Europa. A Três Tentos Agroindustrial S/A foi fundada em 1954 e está sediada em Santa Bárbara do Sul, Brasil.",https://www.3tentos.com.br,Basic Materials,Materiais Básicos,10.778572,1.60549,0.18494,0.022099999999999998,7546364921.537746,15.09000015258789,Small Caps,20,1.3999999399352614,20.99999909902892,28.14,20.0,Baixo,,🟢,15.84000015258789,-4.73484843923734
CGAS5,COMGAS A,"Companhia de Gás de São Paulo  COMGÁS operates as a piped natural gas distributor in Brazil. The company's concession area covers approximately 180 municipalities in the São Paulo and Greater São Paulo regions. It serves industrial, residential, commercial, automotive, thermogeneration, and cogeneration categories markets. The company was formerly known as Companhia Municipal de Gás (Comgás) and changed its name to Companhia de Gás de São Paulo - COMGÁS in 1974. The company was incorporated in 1872 and is headquartered in São Paulo, Brazil. Companhia de Gás de São Paulo  COMGÁS is a subsidiary of Compass Gas e Energia S.A.",https://www.comgas.com.br,Utilities,Utilidades Públicas,10.853251,9.505888,0.9799,0.0786,16367617983.464516,123.51000213623047,Mid Caps,50,11.380000530369239,170.70000795553858,27.64,44.0,Baixo,,🟢,123.51000213623048,-1.1505833106154068e-14
SBSP3,SABESP,"Companhia de Saneamento Básico do Estado de São Paulo - SABESP provides basic and environmental sanitation services in the São Paulo State, Brazil. The company supplies treated water and sewage services on a wholesale basis. As of December 31, 2024, it provided water services through 9.5 million water connections; and sewage services through 8.2 million sewage connections in the 375 municipalities of the São Paulo State. Companhia de Saneamento Básico do Estado de São Paulo - SABESP was founded in 1954 and is headquartered in São Paulo, Brazil.",https://www.sabesp.com.br,Utilities,Utilidades Públicas,10.901575,2.2219548,0.21233,0.0512,97098527620.73132,27.690000534057617,Blue Chips,50,2.5400000031241006,38.10000004686151,27.32,38.0,Baixo,,🟢,149.4199981689453,-81.46834367997432
BLAU3,BLAU,"Blau Farmacêutica S.A., uma empresa farmacêutica fornece medicamentos no Brasil, Argentina, Chile, Colômbia, Uruguai, Equador, Peru e Estados Unidos. Seus produtos abrangem diversas áreas, como imunologia, hematologia, oncologia, nefrologia, infectologia e anestesiologia. A empresa oferece estimuladores uterinos, antirreumáticos, anestésicos, antibióticos, cuidados com a saúde feminina, biofarmacêuticos, oncológicos, produtos hospitalares, antivirais e antirretrovirais, biológicos, inibidores de bomba de ácido, hemoderivados, antitrombóticos e trombolíticos. A Blau Farmacêutica S.A. foi constituída em 1987 e está sediada em Cotia, Brasil.",https://www.blau.com,Healthcare,Saúde,11.212766,1.06143,0.108610004,0.0635,2434581480.128623,10.539999961853027,Small Caps,40,0.9399999930305356,14.099999895458033,25.25,26.0,Baixo,,🟢,10.699999809265137,-1.4953257034038956
CEBR5,CEB A,"A Companhia Energética de Brasília - CEB, por meio de suas subsidiárias, gera e distribui energia elétrica e gás no Brasil. A empresa atua nos segmentos de Geração de Energia, Comercialização de Energia Elétrica, Iluminação Pública e Outros. A empresa produz energia elétrica a partir de usinas hidráulicas; distribui gás canalizado; serviços de iluminação pública; e fornece serviços de manutenção e expansão. Atua também na prestação de serviços de elaboração de estudos; projetos de engenharia; execução de obras de implantação, ampliação, reforma ou manutenção de redes aéreas e subterrâneas de transmissão e distribuição de energia elétrica; e instalação de sistemas de iluminação pública e elétrica predial. A empresa era anteriormente conhecida como Companhia de Eletricidade de Brasília e mudou seu nome para Companhia Energética de Brasília CEB em 1992. A Companhia Energética de Brasília CEB foi fundada em 1968 e está sediada em Brasília, Brasil.",https://www.ceb.com.br,Utilities,Utilidades Públicas,11.486486,2.0094564,0.16638,0.1545,1838088832.5,25.5,Small Caps,35,2.2200000940235336,33.300001410353005,23.42,32.0,Baixo,,🟢,30.06999969482422,-15.197870772212967
CMIN3,CSINERACAO,"A CSN Mineração S.A. atua no negócio de mineração de minério de ferro no Brasil, Ásia e Europa. A empresa opera as minas de Casa de Pedra, Engenho e Pires. Também opera uma usina hidrelétrica. A empresa foi fundada em 1913 e está sediada em São Paulo, Brasil. A CSN Mineração S.A. atua como subsidiária da Companhia Siderúrgica Nacional.",https://ri.csnmineracao.com.br,Basic Materials,Materiais Básicos,11.658537,3.886179,0.25741,0.1308,25965174031.3283,4.78000020980835,Mid Caps,50,0.4100000034145236,6.150000051217853,22.28,44.0,Baixo,,🟢,5.269999980926514,-9.297908404015168
VBBR3,VIBRA,"A Vibra Energia S.A. fabrica, processa, distribui, comercializa, transporta, importa e exporta produtos à base de petróleo, lubrificantes e outros combustíveis. Atua nos segmentos de Rede de Postos de Gasolina, B2B e Renováveis. A empresa comercializa combustíveis derivados de petróleo, lubrificantes, gás natural veicular, biocombustíveis e produtos de conveniência. Também vende combustíveis e lubrificantes e presta serviços associados ao seu mercado consumidor, bem como comercializa produtos e serviços de aviação nas instalações aeroportuárias do Brasil. A empresa foi constituída em 1971 e está sediada no Rio de Janeiro, Brasil.",https://www.vibraenergia.com.br,Consumer Cyclical,Consumo Cíclico,11.723736,1.6535864,0.13962,0.0616,35944464885.99194,30.1299991607666,Mid Caps,30,2.56999979876437,38.54999698146555,21.84,26.0,Baixo,,🟢,30.1299991607666,0.0
ALPA3,ALPARGATAS,"A Alpargatas S.A. fabrica e comercializa calçados e acessórios no Brasil e no exterior. A empresa oferece seus produtos com as marcas Havaianas, ioasys e Rothys. A empresa era anteriormente conhecida como São Paulo Alpargatas S.A. e mudou seu nome para Alpargatas S.A. em 2010. A empresa foi fundada em 1907 e está sediada em São Paulo, Brasil.",https://www.alpargatas.com.br,Consumer Cyclical,Consumo Cíclico,11.755814,1.9819643,0.16464001,0.048600000000000004,6866731339.774521,10.109999656677246,Small Caps,20,0.8599999673929211,12.899999510893815,21.63,26.0,Baixo,,🟢,11.020000457763672,-8.257720175005288
