Ticker,Empresa,Resumo,Site,setor_original,Setor,PL,PVP,ROE,DivYield,MarketCap,Preco,Categoria,Score,LucroPorAcao,PrecoJusto,Desconto_%,Ranking,Risco,Risco_num,Farol,Preco_antigo,Variacao_%
SEER3,SER EDUCA,"Ser Educacional S.A., together with its subsidiaries, operates on-campus and distance-learning undergraduate, graduate, and professional training courses and other education-related areas in Brazil. It offers undergraduate, post graduate, on-campus and digital learning, and vocational courses. The company operates under the UNINASSAU  Centro Universitário Maurício de Nassau, UNINABUCO  Centro Universitário Nabuco, UNG  Universidade Guarulhos, UNAMA  University of the Amazon, UNIVERITAS  Universus Veritas University Center, UNINORTE - Northern University Center, University Center for Biomedical Sciences of Cacoal UNIFACIMED, UNIJUAZEIRO - Centro Universitário de Juazeiro do Norte, UNESC - Educational Society of Rondônia, UNIFASB - São Francisco de Barreiras University Center, UNI7 - 7 de Setembro University Center, CDMV - Center for the Development of Veterinary Medicine, FAEL University Center, UNINASSAU Colleges, UNINABUCO Colleges, and Joaquim Nabuco and Maurício de Nassau Technical Schools, GOKURSOS, BEDUKA, DELÍNEA, PROVA FÁCIL and Peixe 30, CDO, CDM, DOK, and PLANTÃO VETERINÁRIO brands. It is also involved in the investment business. The company was founded in 1993 and is headquartered in Recife, Brazil.",https://www.sereducacional.com,Consumer Defensive,Consumo Defensivo,1.5700549,1.097561,0.1681,0.0382,1462614122.9611282,11.430000305175781,Small Caps,70,7.280000403282575,109.20000604923862,89.53,40.0,Baixo,,🟢,13.479999542236328,-15.207709990177436
BSLI4,BRB BANCO,"O BRB - Banco de Brasília S.A. atua nas atividades de crédito, financiamento e investimento para clientes pessoas físicas e jurídicas no Brasil. A empresa envolvida na distribuição de valores mobiliários e gestão de fundos, cartões de crédito, seguros e prestação de outros serviços relacionados. A empresa era anteriormente conhecida como Banco regional de Brasília SA BRB e mudou seu nome para BRB - Banco de Brasília S.A. em janeiro de 1986. O BRB - Banco de Brasília S.A. foi constituído em 1964 e está sediado em Brasília, Brasil.",https://www.brb.com.br,Financial Services,Serviços Financeiros,1.6534653,0.40751585,0.25134,0.1918,1623844788.8507426,3.3399999141693115,Small Caps,85,2.0200000049407216,30.300000074110823,88.98,58.0,Baixo,,🟢,4.300000190734863,-22.325586836811027
BSLI3,BRB BANCO,"O BRB - Banco de Brasília S.A. atua nas atividades de crédito, financiamento e investimento para clientes pessoas físicas e jurídicas no Brasil. A empresa envolvida na distribuição de valores mobiliários e gestão de fundos, cartões de crédito, seguros e prestação de outros serviços relacionados. A empresa era anteriormente conhecida como Banco regional de Brasília SA BRB e mudou seu nome para BRB - Banco de Brasília S.A. em janeiro de 1986. O BRB - Banco de Brasília S.A. foi constituído em 1964 e está sediado em Brasília, Brasil.",https://www.brb.com.br,Financial Services,Serviços Financeiros,1.6584158,0.40873596,0.25134,0.17379999999999998,1628706595.0841584,3.3499999046325684,Small Caps,85,2.0199999931456083,30.299999897184126,88.94,58.0,Baixo,,🟢,4.789999961853027,-30.062631914163735
VTRU3,VITRUEDUCA,"A Vitru Educação S.A., em conjunto com suas subsidiárias, presta serviços educacionais no Brasil. Oferece cursos de graduação, pós-graduação e técnicos e profissionalizantes a distância e presenciais, além de serviços de educação digital sob as marcas Uniasselvi e UniCesumar. A empresa era anteriormente conhecida como Vitru Brasil Empreendimentos, Participações e Comércio S.A. e mudou seu nome para Vitru Educação S.A. em dezembro de 2025. A empresa foi constituída em 2014 e está sediada em São Paulo, Brasil.",https://www.vitru.com.br/pt_BR,Consumer Defensive,Consumo Defensivo,1.7246753,0.60664195,0.1349,0.17,1955708814.9154062,13.279999732971191,Small Caps,65,7.699999955337212,115.49999933005819,88.5,40.0,Baixo,,🟢,14.15999984741211,-6.214690140704679
EVEN3,EVEN,"A Even Construtora e Incorporadora S.A. atua como incorporadora e construtora imobiliária no Brasil. A empresa desenvolve e comercializa projetos residenciais, hotéis e centros de arte. Também está envolvida na prospecção de terrenos; incorporação e venda imobiliária; operação do portal da corretora; e atividades de construção de projetos. A empresa foi fundada em 1974 e está sediada em São Paulo, Brasil.",https://www.even.com.br,Real Estate,Imobiliário,2.914573,0.5892512,0.121929996,0.15810000000000002,1136069538.9600105,5.800000190734863,Small Caps,65,1.9899999728038595,29.849999592057895,80.57,40.0,Baixo,,🟢,7.710000038146973,-24.77301994762584
JHSF3,JHSF PART,"A JHSF Participações S.A., em conjunto com suas subsidiárias, atua no ramo imobiliário no Brasil e internacionalmente. Atua por meio de cinco segmentos: Renda Recorrente; Negócios Imobiliários; Aeroporto, Hotéis e Restaurantes; e Segurando. A empresa atua na construção e operação de shopping centers; compra e venda de imóveis residenciais e comerciais; varejo de artigos de moda; locação de imóveis comerciais; e desenvolvimento e operação de hotéis, atividades turísticas, hotelaria e gastronomia, incluindo bares, cafés e restaurantes. Também se dedica à prestação de serviços de gestão; e soluções de financiamento, serviços e investimentos imobiliários. A JHSF Participações S.A. foi fundada em 1972 e está sediada em São Paulo, Brasil.",https://jhsf.com.br,Real Estate,Imobiliário,3.341772,1.0214742,0.27879998,0.0786,7040480647.123554,10.5600004196167,Small Caps,85,3.160000269203494,47.40000403805241,77.72,52.0,Baixo,,🟢,9.260000228881836,14.03887860261793
BNBR3,NORD BRASIL,"O Banco do Nordeste do Brasil S.A. atua como um banco de desenvolvimento regional na América Latina. Atua por meio dos segmentos Carteira Própria e FNE. A empresa oferece contas de poupança, depósitos à vista e a prazo e custódia de títulos; crédito especializado; crédito para infra-estruturas e microfinanciamento urbano e rural; e serviços de cobrança e cartões de crédito. Atua também na estruturação e distribuição de valores mobiliários, como debêntures, notas promissórias, certificados de recebíveis imobiliários, fundos de investimento; administração de recursos de terceiros, consistindo na administração de fundos de investimento; operações cambiais; gestão de carteira e análise de crédito; e transferências eletrônicas. Atende empresas corporativas, grandes, médias, pequenas e microempresas; agroindústria, produtores rurais e agricultura familiar; sectores de microfinanças urbanas e rurais; entidades representativas; indivíduos; e instituições da administração pública direta e indireta. A empresa atua por meio de pontos de atendimento físicos, incluindo agências e unidades de microcrédito. O Banco do Nordeste do Brasil S.A. foi fundado em 1952 e está sediado em Fortaleza, Brasil.",https://www.bnb.gov.br,Financial Services,Serviços Financeiros,3.3924205,0.6605491,0.19412,0.062,10955672139.0,111.0,Mid Caps,100,32.720000365520725,490.8000054828109,77.38,58.0,Baixo,,🟢,119.75,-7.306889352818372
BRSR6,BANRISUL B,"O Banco do Estado do Rio Grande do Sul S.A., um banco múltiplo, oferece uma gama de produtos e serviços bancários principalmente no Brasil. A empresa atua em atividades bancárias de varejo, empréstimos, financiamento e investimento, empréstimos hipotecários, desenvolvimento, carteira de arrendamento e câmbio. Também oferece corretagem de valores mobiliários, grupos de consórcios, soluções para o setor de pagamentos, seguros e produtos de previdência e títulos de capitalização. O Banco do Estado do Rio Grande do Sul S.A. foi constituído em 1928 e está sediado em Porto Alegre, Brasil.",https://www.banrisul.com.br,Financial Services,Serviços Financeiros,3.399072,0.5227475,0.1559,0.0633,5991475932.038618,14.649999618530273,Small Caps,85,4.309999793629047,64.64999690443571,77.34,52.0,Baixo,,🟢,18.030000686645508,-18.746538765352014
BRSR3,BANRISUL,"O Banco do Estado do Rio Grande do Sul S.A., um banco múltiplo, oferece uma gama de produtos e serviços bancários principalmente no Brasil. A empresa atua em atividades bancárias de varejo, empréstimos, financiamento e investimento, empréstimos hipotecários, desenvolvimento, carteira de arrendamento e câmbio. Também oferece corretagem de valores mobiliários, grupos de consórcios, soluções para o setor de pagamentos, seguros e produtos de previdência e títulos de capitalização. O Banco do Estado do Rio Grande do Sul S.A. foi constituído em 1928 e está sediado em Porto Alegre, Brasil.",https://www.banrisul.com.br,Financial Services,Serviços Financeiros,4.0533643,0.62337196,0.1559,0.053,7144783832.369513,17.469999313354492,Small Caps,85,4.30999979778637,64.64999696679554,72.98,46.0,Baixo,,🟢,18.799999237060547,-7.074467966382776
BAZA3,AMAZIA,"O Banco da Amazônia S.A. fornece produtos e serviços bancários no Brasil. A empresa oferece contas corrente, poupança, simplificada e salário; e cartões de crédito. Também oferece soluções de empréstimo; produtos de investimento, como capitalização, certificados de depósitos bancários e recibos de depósitos bancários, cédula de crédito do agronegócio e Amazonia Prev Plus; automóveis, residências, viagens, vida e acidentes pessoais, credores pessoais, aviação, veículos de frota e diversos produtos de seguros de máquinas e equipamentos. Além disso, a empresa oferece produtos de investimento; capital de giro, renegociação de dívidas, Amazônia rural verde, fundo de marinha mercante, adiantamento de cartão, passeio ao produtor rural e energia verde para não rurais; faturamento e pagamento; cobrança de exportação, ordem de pagamento e carta de crédito de exportação; e produtos e serviços agrícolas. A empresa foi constituída em 1942 e está sediada em Belém, Brasil.",https://www.bancoamazonia.com.br,Financial Services,Serviços Financeiros,4.2137265,0.53872025,0.15239,0.10710000000000001,3923521347.0965195,69.98999786376953,Small Caps,85,16.610000165831725,249.15000248747586,71.91,52.0,Baixo,,🟢,85.54000091552734,-18.17863325383149
ABCB4,ABC BRASIL,"O Banco ABC Brasil S.A., um banco comercial, fornece diversos produtos e serviços financeiros para médias e grandes empresas no Brasil. A empresa oferece conta corrente; produtos de crédito e financiamento, como capital de giro, rotativo, recebíveis, antecipação a fornecedores, empréstimo consignado para empregados, sobre empréstimos em moeda estrangeira e empréstimos em moeda estrangeira, bem como para agronegócio, comércio exterior, transferências do fundo de defesa da economia cafeeira e imóveis; questões de garantias, tais como garantia de pagamento emitida, garantia de execução emitida, garantia judicial emitida, carta de crédito stand-by, confirmação de cartas de crédito de exportação, garantia de oferta, garantia de execução e carta de crédito de importação; derivativos, como contratos a termo de não entrega, prazo de mercadorias, swap e opções; serviços de câmbio para exportação e importação de câmbio, câmbio à vista de adiantamentos sobre câmbios entregues e câmbio à vista financeiro de remessas; cédulas de crédito do agronegócio e imobiliário, certificado de depósito bancário, fundos de investimento, certificado de operações estruturadas e debêntures. Também fornece serviços de investimentos em operações de fusões e aquisições, mercado de capitais e financiamento de projetos. Além disso, a empresa oferece produtos de seguros, como seguros de vida, seguros de vida e seguros de propriedades e acidentes; e atua como comercializadora de energia. A empresa era anteriormente conhecida como Banco Roma de Investimentos e mudou seu nome para Banco ABC Brasil S.A. em 1997. A empresa foi constituída em 1983 e está sediada em São Paulo, Brasil. O Banco ABC Brasil S.A. é uma subsidiária da Marsau Uruguai Holdings SA.",https://www.abcbrasil.com.br,Financial Services,Serviços Financeiros,4.5064692,0.86993754,0.15,0.10679999999999999,6288688497.644299,24.3799991607666,Small Caps,65,5.410000175029844,81.15000262544766,69.96,40.0,Baixo,,🟢,26.959999084472656,-9.569732979672022
SUZB3,SUZANO S.A.,"A Suzano S.A. fabrica e comercializa produtos de celulose e papel no Brasil e internacionalmente. Atua em dois segmentos, Celulose e Papel. A empresa oferece papéis de impressão e escrita revestidos e não revestidos, cartões, papéis tissue e celuloses de mercado e fluff. Também se dedica à pesquisa, desenvolvimento e produção de biocombustíveis; operação de terminais portuários; atividades de pesquisa e desenvolvimento em biotecnologia e polpas nanocristalinas; negócios de geração e distribuição de energia; atividades de transporte rodoviário de cargas; comercialização de equipamentos e peças; pesquisa e desenvolvimento de lignina; industrialização e comercialização de produtos de celulose, microfibras celulósicas, papel e papelão; e industrialização, comercialização e exportação de produtos de celulose. Além disso, a empresa está envolvida em atividades de escritório comercial, capital de risco corporativo e captação de recursos financeiros; produção de bens de consumo através de líquidos à base de celulose; desenvolvimento e produção de fibras, fios e filamentos têxteis à base de celulose; restauração, conservação e preservação de florestas; e pesquisa de matérias-primas para a indústria têxtil. A empresa era anteriormente conhecida como Suzano Papel e Celulose S.A. e mudou seu nome para Suzano S.A. em abril de 2019. A empresa foi fundada em 1924 e está sediada em Salvador, Brasil.",https://www.suzano.com.br,Basic Materials,Materiais Básicos,4.537541,1.1763378,0.26295,0.0269,51543099210.427895,41.70000076293945,Blue Chips,85,9.189999773652612,137.8499966047892,69.75,46.0,Baixo,,🟢,55.81999969482422,-25.295591202222827
CYRE3,CYRELA REALT,"Cyrela Brazil Realty S.A. Empreendimentos e Participações atua na incorporação e construção de imóveis residenciais no Brasil. Também presta serviços imobiliários, incluindo gestão de obras e serviços de consultoria técnica. Cyrela Brazil Realty S.A. Empreendimentos e Participações foi fundada em 1962 e está sediada em São Paulo, Brasil.",https://www.cyrela.com.br,Consumer Cyclical,Consumo Cíclico,4.7222223,0.87183064,0.21141,0.1788,7784870690.0,21.25,Small Caps,85,4.499999925882354,67.49999888823531,68.52,58.0,Baixo,,🟢,29.0,-26.72413793103448
MDNE3,MOURA DUBEUX,"A Moura Dubeux Engenharia S.A. presta serviços de incorporação imobiliária no Brasil. A empresa desenvolve apartamentos, hotéis, resorts e edifícios residenciais, além de oferecer serviços de administração técnica de obras e assessoria técnica aos condomínios. Também atua na compra e venda de imóveis; construção imobiliária; gerenciamento; administração; e serviços de engenharia, bem como serviços de consultoria imobiliária, incluindo compra de terreno; formatação de produtos; e aprovação do projeto. A empresa foi fundada em 1983 e está sediada em Recife, Brasil.",https://www.mouradubeux.com.br,Real Estate,Imobiliário,4.7671957,1.5041738,0.2716,0.1751,2789847785.230751,27.030000686645508,Small Caps,60,5.670000223956719,85.05000335935078,68.22,46.0,Baixo,,🟢,33.20000076293945,-18.58433715212863
AZZA3,AZZAS 2154,"A Azzas 2154 S.A. atua no desenvolvimento e comercialização de calçados, bolsas, acessórios e confecções femininos, masculinos e infantis no Brasil e no exterior. Oferece seus produtos por meio de lojas franqueadas, lojas próprias e canal de web commerce das marcas Arezzo, Schutz, Anacapri, Alexandre Birman, Alme, Vans, Reserva, Reserva Mini, Reserva INK, Reserva Go, Oficina Reserva, Brizza, Troc, Baw, Carol Bassi, ZZMALL, Reversa, Simples Reserva, Paris Texas, Vicenza, Animale, Farm, Farm Global, Fabula, Foxton, Cris Barros, Off Premium, Maria Filo, NV, Marcas Hering e Dzarm. A empresa era anteriormente conhecida como Arezzo Indústria e Comércio S.A. e mudou seu nome para Azzas 2154 S.A. em julho de 2024. Azzas 2154 S.A. foi fundada em 1972 e está sediada em Belo Horizonte, Brasil.",https://ri.azzas2154.com.br,Consumer Cyclical,Consumo Cíclico,5.116049,0.52447724,0.11609,0.12140000000000001,4185954442.4805546,20.719999313354492,Small Caps,65,4.050000168754148,60.75000253131223,65.89,40.0,Baixo,,🟢,27.520000457763672,-24.709306073033986
BMGB4,BANCO BMG EJ,"O Banco BMG S.A. fornece produtos e serviços comerciais e de crédito, financiamento e investimento principalmente no Brasil. A empresa oferece contas digitais; cartão de crédito conta digital e cartão de crédito consignado; consignado e empréstimo pessoal; produtos de seguros, incluindo seguros de prestamistas, de vida, de vida familiar e protegidos pelo FGTS, além dos serviços do Bmg Med e do Consórcio Bmg. Também oferece produtos de investimento, como certificados de depósitos bancários, cartas de crédito do agronegócio e cartas de crédito imobiliário. Além disso, a empresa oferece serviços bancários comerciais; debêntures; financiamento comercial; e capital de giro; e derivativos, como opções a termo não entregáveis, SWAP. A empresa era anteriormente conhecida como BMG Financeira S.A.Crédito, Financiamento e Investimento e mudou seu nome para Banco BMG S.A. em abril de 1989. O Banco BMG S.A. foi fundado em 1930 e está sediado em São Paulo, Brasil.",https://www.bancobmg.com.br,Financial Services,Serviços Financeiros,5.17,0.72714484,0.1351,0.0857,3350944984.70006,5.170000076293945,Small Caps,65,1.0000000147570494,15.00000022135574,65.53,40.0,Baixo,,🟢,4.949999809265137,4.4444500102206925
PETR4,PETROBRAS,"Petróleo Brasileiro S.A. - A Petrobras explora, produz e vende petróleo e gás no Brasil, China, Estados Unidos, Américas, Ásia, Europa, Cingapura e internacionalmente. Atua por meio de três segmentos: Exploração e Produção; Refino, Transporte e Comercialização; e gás e energias de baixo carbono. O segmento de Exploração e Produção explora, desenvolve e produz petróleo bruto, líquidos de gás natural e gás natural principalmente para abastecimento às refinarias nacionais. Seu segmento de Refino, Transporte e Comercialização atua no refino, logística, transporte, aquisição e exportação de petróleo bruto; comércio de produtos petrolíferos; e produção de fertilizantes, além de participação em empresas petroquímicas. O segmento de Gás e Energias de Baixo Carbono atua na logística e comercialização de gás natural e eletricidade; transporte e comercialização de gás natural liquefeito; geração de energia elétrica por meio de usinas termelétricas; negócios de energia renovável; negócios de baixo carbono; e negócios de processamento de gás natural, bem como produção de biodiesel e seus coprodutos. Também se dedica à prospecção, perfuração, refinação, processamento, comercialização e transporte de petróleo bruto proveniente de campos petrolíferos onshore e offshore, e xisto ou outras rochas, bem como produtos petrolíferos, gás natural e outros hidrocarbonetos líquidos. Além disso, a empresa se dedica à pesquisa, desenvolvimento, produção, transporte, distribuição e comercialização de energia. A Petróleo Brasileiro S.A. - Petrobras foi constituída em 1953 e está sediada no Rio de Janeiro, Brasil.",https://petrobras.com.br,Energy,Energia,5.4710946,1.3787973,0.25601,0.0872,607751840839.4326,44.47999954223633,Blue Chips,100,8.130000081196975,121.95000121795462,63.53,58.0,Baixo,,🟢,42.34000015258789,5.05432069422805
LOGG3,LOG COM PROP ED,"A LOG Commercial Properties e Participações S.A. desenvolve, constrói e aluga imóveis residenciais e comerciais no Brasil. Oferece logística e armazéns industriais; aluguel de imóveis próprios; construção de edifícios; construção, marketing, locação e serviços relacionados, incluindo consultoria imobiliária; e fornece e participa de bens e serviços no setor imobiliário comercial. A empresa era anteriormente conhecida como MRV Logística E Participações S.A. A LOG Commercial Properties e Participações S.A. foi constituída em 2008 e está sediada em Belo Horizonte, Brasil.",https://www.logcp.com.br,Real Estate,Imobiliário,5.4847827,0.6086558,0.11023,0.057699999999999994,2205460730.5849457,25.229999542236328,Small Caps,65,4.59999983996382,68.9999975994573,63.43,34.0,Baixo,,🟢,28.200000762939453,-10.531918937414753
PLPL3,PLANOEPLANO,"A Plano & Plano Desenvolvimento Imobiliário S.A., por meio de suas subsidiárias, desenvolve, constrói e comercializa empreendimentos imobiliários na Região Metropolitana de São Paulo. Também fornece seus serviços online. A empresa foi fundada em 1997 e está sediada em São Paulo, Brasil.",https://www.planoeplano.com.br,Real Estate,Imobiliário,5.5535717,1.8500892,0.41075,0.1421,1893148231.9192123,9.329999923706055,Small Caps,60,1.6799999041528635,25.19999856229295,62.98,46.0,Baixo,,🟢,14.449999809265137,-35.43252562727516
GMAT3,GRUPO MATEUS,"O Grupo Mateus S.A. opera uma rede de supermercados no Brasil. Atua no atacado, móveis e eletrodomésticos, e-commerce, indústria de panificação e central de fatiamento e porcionamento. A empresa foi fundada em 1986 e está sediada em São Luís, Brasil.",https://www.grupomateus.com.br,Consumer Cyclical,Consumo Cíclico,5.5569615,0.94898397,0.16014999,0.056799999999999996,10097208753.490513,4.389999866485596,Mid Caps,100,0.7900000506545881,11.850000759818823,62.95,52.0,Baixo,,🟢,5.460000038146973,-19.597072604133462
VLID3,VALID ED,"A Valid Soluções S.A. fornece soluções de pagamentos digitais no Brasil, Argentina, Estados Unidos, Europa, Oriente Médio, África, Ásia e internacionalmente. Atua por meio de três segmentos: Meio de Pagamento, Identificação e Mobile. O segmento de Meios de Pagamento oferece produtos e soluções integradas, como chips e cartões, tarjas magnéticas, vales-presente, faturas e extratos bancários, além de soluções em identificação por radiofrequência, contactless e cartões, e pagamentos móveis. O segmento de Identificação oferece captura, armazenamento e administração de dados, impressões de segurança, reconhecimento e impressão digital, além de soluções governamentais digitais. Suas soluções são utilizadas na geração de sistemas informatizados para administração de bancos de dados, coleta de dados biométricos, impressão e personalização de documentos oficiais, identificação, soluções para cidades inteligentes, carimbos rastreáveis ​​e serviços de certificação digital. O segmento Mobile oferece serviços de emissão de extratos e tecnologias para uso em celulares; e mobilidade digital, como soluções NFC, TSM e HCE para provedores de serviços móveis. Também desenvolve tecnologias para uso em celulares, como recarga e pagamento, e produção de cartões para telecomunicações. Atende governos estaduais e órgãos públicos, instituições financeiras, empresas de telecomunicações, varejistas, cooperativas agrícolas e profissionais liberais. A empresa era anteriormente conhecida como Valid Soluções e Serviços de Segurança em Meios de Pagamento e Identificação S.A. e mudou seu nome para Valid Soluções S.A. em agosto de 2018. A Valid Soluções S.A. foi constituída em 1957 e está sediada em Sorocaba, Brasil.",https://www.valid.com,Industrials,Indústria,5.580645,0.7905318,0.14403,0.0975,1355514780.9210548,17.299999237060547,Small Caps,65,3.099999952883681,46.499999293255215,62.8,40.0,Baixo,,🟢,21.06999969482422,-17.892740922486873
CSED3,CRUZEIRO EDU,"A Cruzeiro do Sul Educacional S.A. presta serviços de educação no Brasil. A empresa oferece ensino superior; educação a distância com a marca Cruzeiro do Sul Virtual; e cursos de medicina. Também opera escolas do Colégio Alto Padrão; Colégio Ceunsp Itu, que oferece serviços de educação infantil, fundamental e médio; O Colégio Ceunsp Salto oferece serviços de educação básica, educação infantil e ensino médio; e o Colégio Cruzeiro do Sul que oferece serviços de educação infantil, ensino médio e escola técnica. A empresa foi fundada em 1965 e está sediada em São Paulo, Brasil.",https://www.cruzeirodosuleducacional.com.br,Consumer Defensive,Consumo Defensivo,5.613333,0.9289497,0.16947001,0.1153,1534724157.8261948,4.210000038146973,Small Caps,85,0.7500000513325992,11.250000769988988,62.58,52.0,Baixo,,🟢,6.559999942779541,-35.82316959040778
LAVV3,LAVVI,"A Lavvi Empreendimentos Imobiliários S.A. desenvolve e constrói imóveis residenciais e não residenciais principalmente no Brasil. A empresa oferece imóveis com as marcas Lavvi e Novvo. A empresa foi constituída em 2016 e está sediada em São Paulo, Brasil.",https://www.lavvi.com.br,Real Estate,Imobiliário,5.669951,1.502415,0.26358998,0.0852,2249449436.2513733,11.510000228881836,Small Caps,60,2.029999946892281,30.449999203384216,62.2,46.0,Baixo,,🟢,17.790000915527344,-35.30073279065569
