Ticker,Empresa,Resumo,Site,setor_original,Setor,PL,PVP,ROE,DivYield,MarketCap,Preco,Categoria,Score,LucroPorAcao,PrecoJusto,Desconto_%,Ranking,Risco,Risco_num,Farol,Preco_antigo,Variacao_%
BSLI3,BRB BANCO,"O BRB - Banco de Brasília S.A. atua nas atividades de crédito, financiamento e investimento para clientes pessoas físicas e jurídicas no Brasil. A empresa envolvida na distribuição de valores mobiliários e gestão de fundos, cartões de crédito, seguros e prestação de outros serviços relacionados. A empresa era anteriormente conhecida como Banco regional de Brasília SA BRB e mudou seu nome para BRB - Banco de Brasília S.A. em janeiro de 1986. O BRB - Banco de Brasília S.A. foi constituído em 1964 e está sediado em Brasília, Brasil.",https://www.brb.com.br,Financial Services,Serviços Financeiros,1.5099009,0.37213275,0.25134,0.19469999999999998,1482852315.35,3.05,Small Caps,85,2.020000120537712,30.300001808065677,89.93,58.0,Baixo,,🟢,4.789999961853027,-36.325677989773986
SEER3,SER EDUCA,"Ser Educacional S.A., together with its subsidiaries, operates on-campus and distance-learning undergraduate, graduate, and professional training courses and other education-related areas in Brazil. It offers undergraduate, post graduate, on-campus and digital learning, and vocational courses. The company operates under the UNINASSAU  Centro Universitário Maurício de Nassau, UNINABUCO  Centro Universitário Nabuco, UNG  Universidade Guarulhos, UNAMA  University of the Amazon, UNIVERITAS  Universus Veritas University Center, UNINORTE - Northern University Center, University Center for Biomedical Sciences of Cacoal UNIFACIMED, UNIJUAZEIRO - Centro Universitário de Juazeiro do Norte, UNESC - Educational Society of Rondônia, UNIFASB - São Francisco de Barreiras University Center, UNI7 - 7 de Setembro University Center, CDMV - Center for the Development of Veterinary Medicine, FAEL University Center, UNINASSAU Colleges, UNINABUCO Colleges, and Joaquim Nabuco and Maurício de Nassau Technical Schools, GOKURSOS, BEDUKA, DELÍNEA, PROVA FÁCIL and Peixe 30, CDO, CDM, DOK, and PLANTÃO VETERINÁRIO brands. It is also involved in the investment business. The company was founded in 1993 and is headquartered in Recife, Brazil.",https://www.sereducacional.com,Consumer Defensive,Consumo Defensivo,1.6277473,1.0696877,0.18484,0.0416,1517279569.5,11.85,Small Caps,70,7.279999788664985,109.19999682997478,89.15,40.0,Baixo,,🟢,13.479999542236328,-12.091985145319315
VTRU3,VITRUEDUCA,"A Vitru Educação S.A., em conjunto com suas subsidiárias, presta serviços educacionais no Brasil. Oferece cursos de graduação, pós-graduação e técnicos e profissionalizantes a distância e presenciais, além de serviços de educação digital sob as marcas Uniasselvi e UniCesumar. A empresa era anteriormente conhecida como Vitru Brasil Empreendimentos, Participações e Comércio S.A. e mudou seu nome para Vitru Educação S.A. em dezembro de 2025. A empresa foi constituída em 2014 e está sediada em São Paulo, Brasil.",https://www.vitru.com.br/pt_BR,Consumer Defensive,Consumo Defensivo,1.7194805,0.4753698,0.35219002,0.19,2157115626.84,13.24,Small Caps,85,7.700000087235651,115.50000130853476,88.54,58.0,Baixo,,🟢,14.15999984741211,-6.497174133658263
EVEN3,EVEN,"A Even Construtora e Incorporadora S.A. atua como incorporadora e construtora imobiliária no Brasil. A empresa desenvolve e comercializa projetos residenciais, hotéis e centros de arte. Também está envolvida na prospecção de terrenos; incorporação e venda imobiliária; operação do portal da corretora; e atividades de construção de projetos. A empresa foi fundada em 1974 e está sediada em São Paulo, Brasil.",https://www.even.com.br,Real Estate,Imobiliário,2.718593,0.54962915,0.121929996,0.1739,1073362026.12,5.41,Small Caps,65,1.9899999742513867,29.8499996137708,81.88,40.0,Baixo,,🟢,7.710000038146973,-29.831388155216615
BRSR6,BANRISUL B,"O Banco do Estado do Rio Grande do Sul S.A., um banco múltiplo, oferece uma gama de produtos e serviços bancários principalmente no Brasil. A empresa atua em atividades bancárias de varejo, empréstimos, financiamento e investimento, empréstimos hipotecários, desenvolvimento, carteira de arrendamento e câmbio. Também oferece corretagem de valores mobiliários, grupos de consórcios, soluções para o setor de pagamentos, seguros e produtos de previdência e títulos de capitalização. O Banco do Estado do Rio Grande do Sul S.A. foi constituído em 1928 e está sediado em Porto Alegre, Brasil.",https://www.banrisul.com.br,Financial Services,Serviços Financeiros,3.2923434,0.5125149,0.1559,0.06309999999999999,5803347828.63,14.19,Small Caps,85,4.309999983598309,64.64999975397464,78.05,52.0,Baixo,,🟢,18.030000686645508,-21.29783993568967
JHSF3,JHSF PART ED,"A JHSF Participações S.A., em conjunto com suas subsidiárias, atua no ramo imobiliário no Brasil e internacionalmente. Atua por meio de cinco segmentos: Renda Recorrente; Negócios Imobiliários; Aeroporto, Hotéis e Restaurantes; e Segurando. A empresa atua na construção e operação de shopping centers; compra e venda de imóveis residenciais e comerciais; varejo de artigos de moda; locação de imóveis comerciais; e desenvolvimento e operação de hotéis, atividades turísticas, hotelaria e gastronomia, incluindo bares, cafés e restaurantes. Também se dedica à prestação de serviços de gestão; e soluções de financiamento, serviços e investimentos imobiliários. A JHSF Participações S.A. foi fundada em 1972 e está sediada em São Paulo, Brasil.",https://jhsf.com.br,Real Estate,Imobiliário,3.392405,1.0120846,0.27879998,0.0802,7147154312.320001,10.72,Small Caps,85,3.160000058955225,47.40000088432837,77.38,52.0,Baixo,,🟢,9.260000228881836,15.76673579947052
BAZA3,AMAZIA,"O Banco da Amazônia S.A. fornece produtos e serviços bancários no Brasil. A empresa oferece contas corrente, poupança, simplificada e salário; e cartões de crédito. Também oferece soluções de empréstimo; produtos de investimento, como capitalização, certificados de depósitos bancários e recibos de depósitos bancários, cédula de crédito do agronegócio e Amazonia Prev Plus; automóveis, residências, viagens, vida e acidentes pessoais, credores pessoais, aviação, veículos de frota e diversos produtos de seguros de máquinas e equipamentos. Além disso, a empresa oferece produtos de investimento; capital de giro, renegociação de dívidas, Amazônia rural verde, fundo de marinha mercante, adiantamento de cartão, passeio ao produtor rural e energia verde para não rurais; faturamento e pagamento; cobrança de exportação, ordem de pagamento e carta de crédito de exportação; e produtos e serviços agrícolas. A empresa foi constituída em 1942 e está sediada em Belém, Brasil.",https://www.bancoamazonia.com.br,Financial Services,Serviços Financeiros,3.642384,0.47217304,0.121879995,0.19640000000000002,3391528057.5,60.5,Small Caps,65,16.610000483200015,249.1500072480002,75.72,40.0,Baixo,,🟢,85.54000091552734,-29.272855561756312
BRSR3,BANRISUL,"O Banco do Estado do Rio Grande do Sul S.A., um banco múltiplo, oferece uma gama de produtos e serviços bancários principalmente no Brasil. A empresa atua em atividades bancárias de varejo, empréstimos, financiamento e investimento, empréstimos hipotecários, desenvolvimento, carteira de arrendamento e câmbio. Também oferece corretagem de valores mobiliários, grupos de consórcios, soluções para o setor de pagamentos, seguros e produtos de previdência e títulos de capitalização. O Banco do Estado do Rio Grande do Sul S.A. foi constituído em 1928 e está sediado em Porto Alegre, Brasil.",https://www.banrisul.com.br,Financial Services,Serviços Financeiros,4.046404,0.62989855,0.1559,0.049699999999999994,7132514878.88,17.44,Small Caps,70,4.309999693555068,64.64999540332602,73.02,46.0,Baixo,,🟢,18.799999237060547,-7.234038788573837
SUZB3,SUZANO S.A.,"A Suzano S.A. fabrica e comercializa produtos de celulose e papel no Brasil e internacionalmente. Atua em dois segmentos, Celulose e Papel. A empresa oferece papéis de impressão e escrita revestidos e não revestidos, cartões, papéis tissue e celuloses de mercado e fluff. Também se dedica à pesquisa, desenvolvimento e produção de biocombustíveis; operação de terminais portuários; atividades de pesquisa e desenvolvimento em biotecnologia e polpas nanocristalinas; negócios de geração e distribuição de energia; atividades de transporte rodoviário de cargas; comercialização de equipamentos e peças; pesquisa e desenvolvimento de lignina; industrialização e comercialização de produtos de celulose, microfibras celulósicas, papel e papelão; e industrialização, comercialização e exportação de produtos de celulose. Além disso, a empresa está envolvida em atividades de escritório comercial, capital de risco corporativo e captação de recursos financeiros; produção de bens de consumo através de líquidos à base de celulose; desenvolvimento e produção de fibras, fios e filamentos têxteis à base de celulose; restauração, conservação e preservação de florestas; e pesquisa de matérias-primas para a indústria têxtil. A empresa era anteriormente conhecida como Suzano Papel e Celulose S.A. e mudou seu nome para Suzano S.A. em abril de 2019. A empresa foi fundada em 1924 e está sediada em Salvador, Brasil.",https://www.suzano.com.br,Basic Materials,Materiais Básicos,4.4646354,1.0558143,0.26295,0.0275,50650990203.66,41.03,Blue Chips,85,9.190000150964176,137.85000226446263,70.24,46.0,Baixo,,🟢,55.81999969482422,-26.495879211184565
MDNE3,MOURA DUBEUX,"A Moura Dubeux Engenharia S.A. presta serviços de incorporação imobiliária no Brasil. A empresa desenvolve apartamentos, hotéis, resorts e edifícios residenciais, além de oferecer serviços de administração técnica de obras e assessoria técnica aos condomínios. Também atua na compra e venda de imóveis; construção imobiliária; gerenciamento; administração; e serviços de engenharia, bem como serviços de consultoria imobiliária, incluindo compra de terreno; formatação de produtos; e aprovação do projeto. A empresa foi fundada em 1983 e está sediada em Recife, Brasil.",https://www.mouradubeux.com.br,Real Estate,Imobiliário,4.4850087,1.2406089,0.2716,0.1867,2637430795.66,25.43,Small Caps,85,5.67000014960952,85.0500022441428,70.1,52.0,Baixo,,🟢,33.20000076293945,-23.403616218024194
ABCB4,ABC BRASIL EJS,"O Banco ABC Brasil S.A., um banco comercial, fornece diversos produtos e serviços financeiros para médias e grandes empresas no Brasil. A empresa oferece conta corrente; produtos de crédito e financiamento, como capital de giro, rotativo, recebíveis, antecipação a fornecedores, empréstimo consignado para empregados, sobre empréstimos em moeda estrangeira e empréstimos em moeda estrangeira, bem como para agronegócio, comércio exterior, transferências do fundo de defesa da economia cafeeira e imóveis; questões de garantias, tais como garantia de pagamento emitida, garantia de execução emitida, garantia judicial emitida, carta de crédito stand-by, confirmação de cartas de crédito de exportação, garantia de oferta, garantia de execução e carta de crédito de importação; derivativos, como contratos a termo de não entrega, prazo de mercadorias, swap e opções; serviços de câmbio para exportação e importação de câmbio, câmbio à vista de adiantamentos sobre câmbios entregues e câmbio à vista financeiro de remessas; cédulas de crédito do agronegócio e imobiliário, certificado de depósito bancário, fundos de investimento, certificado de operações estruturadas e debêntures. Também fornece serviços de investimentos em operações de fusões e aquisições, mercado de capitais e financiamento de projetos. Além disso, a empresa oferece produtos de seguros, como seguros de vida, seguros de vida e seguros de propriedades e acidentes; e atua como comercializadora de energia. A empresa era anteriormente conhecida como Banco Roma de Investimentos e mudou seu nome para Banco ABC Brasil S.A. em 1997. A empresa foi constituída em 1983 e está sediada em São Paulo, Brasil. O Banco ABC Brasil S.A. é uma subsidiária da Marsau Uruguai Holdings SA.",https://www.abcbrasil.com.br,Financial Services,Serviços Financeiros,4.5489836,0.8332769,0.15,0.09720000000000001,6341515997.55,24.61,Small Caps,65,5.40999971949778,81.1499957924667,69.67,40.0,Baixo,,🟢,26.959999084472656,-8.716614110814698
AZZA3,AZZAS 2154,"A Azzas 2154 S.A. atua no desenvolvimento e comercialização de calçados, bolsas, acessórios e confecções femininos, masculinos e infantis no Brasil e no exterior. Oferece seus produtos por meio de lojas franqueadas, lojas próprias e canal de web commerce das marcas Arezzo, Schutz, Anacapri, Alexandre Birman, Alme, Vans, Reserva, Reserva Mini, Reserva INK, Reserva Go, Oficina Reserva, Brizza, Troc, Baw, Carol Bassi, ZZMALL, Reversa, Simples Reserva, Paris Texas, Vicenza, Animale, Farm, Farm Global, Fabula, Foxton, Cris Barros, Off Premium, Maria Filo, NV, Marcas Hering e Dzarm. A empresa era anteriormente conhecida como Arezzo Indústria e Comércio S.A. e mudou seu nome para Azzas 2154 S.A. em julho de 2024. Azzas 2154 S.A. foi fundada em 1972 e está sediada em Belo Horizonte, Brasil.",https://ri.azzas2154.com.br,Consumer Cyclical,Consumo Cíclico,4.5580244,0.46576172,0.10524999,0.1383,3730828653.2400002,18.46,Small Caps,65,4.050000258884091,60.750003883261364,69.61,40.0,Baixo,,🟢,27.520000457763672,-32.92151274368076
PLPL3,PLANOEPLANO,"A Plano & Plano Desenvolvimento Imobiliário S.A., por meio de suas subsidiárias, desenvolve, constrói e comercializa empreendimentos imobiliários na Região Metropolitana de São Paulo. Também fornece seus serviços online. A empresa foi fundada em 1997 e está sediada em São Paulo, Brasil.",https://www.planoeplano.com.br,Real Estate,Imobiliário,4.803571,1.5386082,0.37973,0.1931,1637772444.6000001,8.07,Small Caps,60,1.6800001498884893,25.20000224832734,67.98,46.0,Baixo,,🟢,14.449999809265137,-44.152248397777626
PETR4,PETROBRAS,"Petróleo Brasileiro S.A. - A Petrobras explora, produz e vende petróleo e gás no Brasil, China, Estados Unidos, Américas, Ásia, Europa, Cingapura e internacionalmente. Atua por meio de três segmentos: Exploração e Produção; Refino, Transporte e Comercialização; e gás e energias de baixo carbono. O segmento de Exploração e Produção explora, desenvolve e produz petróleo bruto, líquidos de gás natural e gás natural principalmente para abastecimento às refinarias nacionais. Seu segmento de Refino, Transporte e Comercialização atua no refino, logística, transporte, aquisição e exportação de petróleo bruto; comércio de produtos petrolíferos; e produção de fertilizantes, além de participação em empresas petroquímicas. O segmento de Gás e Energias de Baixo Carbono atua na logística e comercialização de gás natural e eletricidade; transporte e comercialização de gás natural liquefeito; geração de energia elétrica por meio de usinas termelétricas; negócios de energia renovável; negócios de baixo carbono; e negócios de processamento de gás natural, bem como produção de biodiesel e seus coprodutos. Também se dedica à prospecção, perfuração, refinação, processamento, comercialização e transporte de petróleo bruto proveniente de campos petrolíferos onshore e offshore, e xisto ou outras rochas, bem como produtos petrolíferos, gás natural e outros hidrocarbonetos líquidos. Além disso, a empresa se dedica à pesquisa, desenvolvimento, produção, transporte, distribuição e comercialização de energia. A Petróleo Brasileiro S.A. - Petrobras foi constituída em 1953 e está sediada no Rio de Janeiro, Brasil.",https://petrobras.com.br,Energy,Energia,4.822878,1.1351726,0.25601,0.0983,535745277080.91003,39.21,Blue Chips,100,8.13000038566184,121.95000578492758,67.85,58.0,Baixo,,🟢,42.34000015258789,-7.392536942153456
CYRE3,CYRELA REALT ATZ,"Cyrela Brazil Realty S.A. Empreendimentos e Participações atua na incorporação e construção de imóveis residenciais no Brasil. Também presta serviços imobiliários, incluindo gestão de obras e serviços de consultoria técnica. Cyrela Brazil Realty S.A. Empreendimentos e Participações foi fundada em 1962 e está sediada em São Paulo, Brasil.",https://www.cyrela.com.br,Consumer Cyclical,Consumo Cíclico,4.9266667,0.90957576,0.21141,0.1784,8121909797.52,22.17,Small Caps,85,4.499999969553451,67.49999954330175,67.16,58.0,Baixo,,🟢,29.0,-23.55172413793103
GMAT3,GRUPO MATEUS,"O Grupo Mateus S.A. opera uma rede de supermercados no Brasil. Atua no atacado, móveis e eletrodomésticos, e-commerce, indústria de panificação e central de fatiamento e porcionamento. A empresa foi fundada em 1986 e está sediada em São Luís, Brasil.",https://www.grupomateus.com.br,Consumer Cyclical,Consumo Cíclico,4.9746833,0.8264984,0.16014999,0.0667,9050739711.720001,3.93,Small Caps,85,0.7900000387964397,11.850000581946595,66.84,52.0,Baixo,,🟢,5.460000038146973,-28.021978524861463
POMO3,MARCOPOLO,"A Marcopolo S.A. atua na fabricação e comercialização de ônibus, carrocerias e componentes no Brasil, África do Sul, Austrália, China, México, Argentina e internacionalmente. A empresa oferece ônibus intermunicipais, urbanos e microônibus, ônibus elétricos e ônibus híbridos; e família de microônibus Volare, como ônibus completo, com chassi e carroceria, carroceria para transporte escolar, fretamento executivo, transporte urbano e projetos especiais. Também está envolvida no desenvolvimento e produção de novos modelos sobre trilhos; produção de unidades com propulsão, automóveis de passageiros e fabricação de caixas para transporte de pessoas, TRAMs e EMUs; disponibilização de soluções de crédito para aquisição de ônibus e micro-ônibus; montagem, comercialização, importação e exportação de equipamentos de refrigeração e ar condicionado; e negócio de espuma para assentos. A empresa foi fundada em 1949 e está sediada em Caxias Do Sul, Brasil.",https://www.marcopolo.com.br,Industrials,Indústria,5.24,1.6014669,0.30911,0.19870000000000002,6504937813.04,5.24,Small Caps,60,1.0,15.0,65.07,46.0,Baixo,,🟢,6.010000228881836,-12.811983353702713
EUCA4,EUCATEX,"A Eucatex S.A. Indústria e Comércio produz e comercializa painéis de fibra e madeira no Brasil. A empresa fornece pisos laminados e vinílicos, portas, divisórias, painéis de fibra de média densidade (MDF) e aglomerado de média densidade (MDP), placas de fibra, tintas e vernizes, painéis decorativos, folhas de fibra de madeira, lacas e outros produtos. Produz também mudas de eucalipto e rodapés; e atua em consultoria de gestão empresarial, atividades imobiliárias, florestais, colheita, manejo florestal, transporte, logística de coleta de resíduos, material reciclado e eletricidade. A empresa atende principalmente os setores moveleiro e de construção civil. Também exporta seus produtos para os Estados Unidos e América Latina. A Eucatex S.A. Indústria e Comércio foi constituída em 1951 e está sediada em São Paulo, Brasil.",https://www.eucatex.com.br,Industrials,Indústria,5.252252,0.72966206,0.14633,0.048600000000000004,2148587640.32,23.32,Small Caps,50,4.440000213241863,66.60000319862795,64.98,34.0,Baixo,,🟢,20.86000061035156,11.79290181049991
LAVV3,LAVVI,"A Lavvi Empreendimentos Imobiliários S.A. desenvolve e constrói imóveis residenciais e não residenciais principalmente no Brasil. A empresa oferece imóveis com as marcas Lavvi e Novvo. A empresa foi constituída em 2016 e está sediada em São Paulo, Brasil.",https://www.lavvi.com.br,Real Estate,Imobiliário,5.2807884,1.5318663,0.26556998,0.0984,2095056253.44,10.72,Small Caps,60,2.0299999144067202,30.449998716100804,64.79,46.0,Baixo,,🟢,17.790000915527344,-39.741430869497904
BMGB4,BANCO BMG,"O Banco BMG S.A. fornece produtos e serviços comerciais e de crédito, financiamento e investimento principalmente no Brasil. A empresa oferece contas digitais; cartão de crédito conta digital e cartão de crédito consignado; consignado e empréstimo pessoal; produtos de seguros, incluindo seguros de prestamistas, de vida, de vida familiar e protegidos pelo FGTS, além dos serviços do Bmg Med e do Consórcio Bmg. Também oferece produtos de investimento, como certificados de depósitos bancários, cartas de crédito do agronegócio e cartas de crédito imobiliário. Além disso, a empresa oferece serviços bancários comerciais; debêntures; financiamento comercial; e capital de giro; e derivativos, como opções a termo não entregáveis, SWAP. A empresa era anteriormente conhecida como BMG Financeira S.A.Crédito, Financiamento e Investimento e mudou seu nome para Banco BMG S.A. em abril de 1989. O Banco BMG S.A. foi fundado em 1930 e está sediado em São Paulo, Brasil.",https://www.bancobmg.com.br,Financial Services,Serviços Financeiros,5.31,0.6909564,0.1351,0.0849,3433455690.7499995,5.31,Small Caps,65,1.0,15.0,64.6,40.0,Baixo,,🟢,4.949999809265137,7.272731406191863
PETR3,PETROBRAS,"Petróleo Brasileiro S.A. - A Petrobras explora, produz e vende petróleo e gás no Brasil, China, Estados Unidos, Américas, Ásia, Europa, Cingapura e internacionalmente. Atua por meio de três segmentos: Exploração e Produção; Refino, Transporte e Comercialização; e gás e energias de baixo carbono. O segmento de Exploração e Produção explora, desenvolve e produz petróleo bruto, líquidos de gás natural e gás natural principalmente para abastecimento às refinarias nacionais. Seu segmento de Refino, Transporte e Comercialização atua no refino, logística, transporte, aquisição e exportação de petróleo bruto; comércio de produtos petrolíferos; e produção de fertilizantes, além de participação em empresas petroquímicas. O segmento de Gás e Energias de Baixo Carbono atua na logística e comercialização de gás natural e eletricidade; transporte e comercialização de gás natural liquefeito; geração de energia elétrica por meio de usinas termelétricas; negócios de energia renovável; negócios de baixo carbono; e negócios de processamento de gás natural, bem como produção de biodiesel e seus coprodutos. Também se dedica à prospecção, perfuração, refinação, processamento, comercialização e transporte de petróleo bruto proveniente de campos petrolíferos onshore e offshore, e xisto ou outras rochas, bem como produtos petrolíferos, gás natural e outros hidrocarbonetos líquidos. Além disso, a empresa se dedica à pesquisa, desenvolvimento, produção, transporte, distribuição e comercialização de energia. A Petróleo Brasileiro S.A. - Petrobras foi constituída em 1953 e está sediada no Rio de Janeiro, Brasil.",https://petrobras.com.br,Energy,Energia,5.3542433,1.2602414,0.25601,0.0883,561046537086.33,43.53,Blue Chips,100,8.130000368119244,121.95000552178867,64.31,58.0,Baixo,,🟢,46.220001220703125,-5.819993833098826
CSED3,CRUZEIRO EDU,"A Cruzeiro do Sul Educacional S.A. presta serviços de educação no Brasil. A empresa oferece ensino superior; educação a distância com a marca Cruzeiro do Sul Virtual; e cursos de medicina. Também opera escolas do Colégio Alto Padrão; Colégio Ceunsp Itu, que oferece serviços de educação infantil, fundamental e médio; O Colégio Ceunsp Salto oferece serviços de educação básica, educação infantil e ensino médio; e o Colégio Cruzeiro do Sul que oferece serviços de educação infantil, ensino médio e escola técnica. A empresa foi fundada em 1965 e está sediada em São Paulo, Brasil.",https://www.cruzeirodosuleducacional.com.br,Consumer Defensive,Consumo Defensivo,5.36,0.8870256,0.16947001,0.1255,1465461059.04,4.02,Small Caps,85,0.7499999999999999,11.249999999999998,64.27,52.0,Baixo,,🟢,6.559999942779541,-38.719511660594875
RECV3,PETRORECSA,"A Petroreconcavo S.A. atua na exploração e produção de extração de petróleo e gás no Brasil. A empresa foi fundada em 1999 e está sediada em Mata de São João, Brasil.",https://petroreconcavo.com.br,Energy,Energia,5.4699454,0.69897354,0.12347,0.1341,2933020790.7,10.01,Small Caps,65,1.829999985008991,27.449999775134863,63.53,40.0,Baixo,,🟢,12.600000381469728,-20.555557960765853
CEAB3,CEA MODAS,"A C&A Modas S.A. atua como varejista de moda feminina, masculina e infantil no Brasil e internacionalmente. Oferece blusas, calças, vestidos, saias, casacos, moda praia, roupas íntimas, camisetas, camisas, bermudas, jaquetas e casacos, bodys, conjuntos e shorts; produtos de beleza, incluindo perfumes, maquiagem, cuidados com a pele, corpo e banho e acessórios; e calçados, como botas, sapatos e mocassins, sapatilhas, sandálias, papetes e tênis. A empresa vende seus produtos em lojas e também online. A empresa foi fundada em 1841 e está sediada em Barueri, Brasil.",https://www.cea.com.br,Consumer Cyclical,Consumo Cíclico,5.489362,0.8427241,0.16788,0.0892,3109976726.88,10.32,Small Caps,85,1.8799998979845018,28.19999846976753,63.4,52.0,Baixo,,🟢,12.140000343322754,-14.991765171767813
