Ticker,Empresa,Resumo,Site,setor_original,Setor,PL,PVP,ROE,DivYield,MarketCap,Preco,Categoria,Score,LucroPorAcao,PrecoJusto,Desconto_%,Ranking,Risco,Risco_num,Farol,Preco_antigo,Variacao_%
BEES4,BANESTES EJ,"O Banestes S.A - Banco do Estado do Espírito Santo S.A., em conjunto com suas subsidiárias, atua como banco múltiplo no Brasil. Opera através do Financeiro; e Seguros e Outros segmentos. A empresa atua por meio de suas carteiras de comércio, rural, industrial, imobiliário, câmbio, arrendamento, investimento e administração de cartões de crédito; e nas áreas de seguros e distribuição, intermediação e administração de recursos de terceiros. Também fornece gestão de ativos e fundos; administração e intermediação de valores mobiliários, seguros, previdência e capitalização; fundos de investimento; cartões de crédito e débito; banco pela internet; conta corrente, poupança, especial, cheque fiduciário, jovem e universitário, conta mais fácil, simplificada, salário e judicial; títulos de capitalização; seguro de carro, vida, casa, acidentes pessoais, proteção financeira de cartão e seguro empresarial; cobranças e convênios; transferência de fundos e recursos; coleção; custódia; opções de crédito e financiamento; empréstimos e garantias; e outros serviços. Além disso, a empresa opera um serviço público de loteria. Banestes S.A - Banco do Estado do Espírito Santo S.A. foi fundado em 1935 e está sediado em Vitória, Brasil.",https://www.banestes.com.br,Financial Services,Serviços Financeiros,9.560439,1.229682,0.13748999,0.0397,3036275074.4999995,8.7,Small Caps,50,0.9100000533448306,13.650000800172458,36.26,24.0,Baixo,,🟢,8.800000190734863,-1.1363657791752075
LREN3,LOJAS RENNER,"A Lojas Renner S.A., em conjunto com suas subsidiárias, atua como empresa de moda e estilo de vida no Brasil, Argentina e Uruguai. Atua nos segmentos de Varejo e Produtos Financeiros. A empresa comercializa roupas e produtos esportivos, calçados, acessórios, perfumaria, eletrodomésticos, móveis, relógios, artigos para casa e decoração, entregas urbanas e soluções de gestão logística, além de cosméticos. Atua também na concessão de empréstimos a pessoas físicas e jurídicas, financiamento de compras, seguros e prática de recebíveis e contas a pagar inerentes a empresas de crédito, financiamento e investimento, comissões de intermediação de vendas, bem como na concessão de empréstimos pessoais. Oferece seus produtos por meio de lojas e canais digitais das marcas Renner, Youcom, Camicado, Realize, Ashua, Uello, Realize e Repasse. A Lojas Renner S.A. foi constituída em 1965 e está sediada em Porto Alegre, Brasil.",https://www.lojasrennersa.com.br/en/,Consumer Cyclical,Consumo Cíclico,9.56081,1.3327682,0.14479999,0.0669,13602157548.85,14.15,Mid Caps,80,1.4800001255123783,22.200001882685672,36.26,36.0,Baixo,,🟢,15.470000267028809,-8.532645405586212
VAMO3,VAMOS,"A Vamos Locação de Caminhões, Máquinas e Equipamentos S.A., em conjunto com suas subsidiárias, atua na locação, revenda e venda de caminhões, máquinas, equipamentos e peças no Brasil. A empresa aluga tratores, empilhadeiras, máquinas e implementos agrícolas, ônibus e outros veículos; vende peças e acessórios automotivos; comercializa tratores, máquinas, pneus, câmaras de ar, implementos, veículos automotores e ônibus novos e usados; e presta serviços de manutenção e reparação de automóveis, assistência técnica e serviços correlatos, bem como atua na logística e no transporte rodoviário de cargas. Oferece também construção civil, peças, lubrificantes, prestação de serviços de reparação e manutenção de veículos e similares, transporte rodoviário de cargas em geral, comércio atacadista de máquinas, aparelhos e equipamentos para uso agrícola, partes e peças, e atividades de intermediação e agenciamento de serviços e negócios em geral, exceto imobiliário; representantes comerciais e agentes do comércio de veículos automotores. Além disso, a empresa comercializa fertilizantes, herbicidas e sementes; e presta serviços de engenharia relacionados à customização de caminhões e ônibus, bem como à prestação de atividades agrícolas. Além disso, a empresa fabrica e vende reboques de caminhões, carrocerias de caminhões, implementos rodoviários, cabines e máquinas e equipamentos industriais; e realiza instalação, reforma, reparo e manutenção de equipamentos e veículos; prestação de serviços de logística e transporte rodoviário de cargas; serviços de tecnologia da informação; análises técnicas de veículos automotores; serviços de operador de empilhadeira; e terceirização e gestão de recursos humanos. A Vamos Locação de Caminhões, Máquinas e Equipamentos S.A. foi constituída em 2015 e está sediada em São Paulo, Brasil. A Vamos Locação de Caminhões, Máquinas e Equipamentos S.A. é uma subsidiária da SIMPAR S.A.",https://grupovamos.com.br,Industrials,Indústria,10.206897,1.211625,0.12076,0.0499,3616351980.64,2.96,Small Caps,25,0.28999998726351406,4.3499998089527105,31.95,24.0,Baixo,,🟢,4.079999923706055,-27.450979035526707
ITUB4,ITAUUNIBANCO EJ,"O Itaú Unibanco Holding S.A. fornece diversos produtos e serviços financeiros para clientes pessoas físicas e jurídicas no Brasil e internacionalmente. Atua por meio de três segmentos: Negócios Varejo, Negócios Atacado e Atividades com Mercado + Corporação. A empresa oferece contas correntes; gestão de fundos; pagamentos e cobranças; empréstimos; cartões de crédito e débito; serviços bancários comerciais e de investimento; serviços de empréstimo e financiamento imobiliário; assessoria econômica, financeira e corretagem; e serviços de leasing e câmbio. A empresa também oferece produtos de seguros não vida que cobrem perdas, danos ou responsabilidade civil por objetos ou pessoas, bem como produtos de seguros de vida que cobrem morte e acidentes pessoais. Atende clientes de varejo, correntistas e não correntistas, pessoas físicas e jurídicas, clientes de alta renda, microempresas e pequenas empresas, bem como empresas de médio porte e clientes institucionais de alto patrimônio. A empresa era anteriormente conhecida como Itaú Unibanco Banco Múltiplo S.A. e mudou seu nome para Itaú Unibanco Holding S.A. em abril de 2009. A empresa foi constituída em 1924 e está sediada em São Paulo, Brasil. O Itaú Unibanco Holding S.A. é uma subsidiária da IUPAR - Itaú Unibanco Participações S.A.",https://www.itau.com.br,Financial Services,Serviços Financeiros,10.3373785,2.238398,0.21816,0.0213,469421551563.78,42.59,Blue Chips,35,4.120000056107068,61.80000084160603,31.08,36.0,Médio,,🟡,42.59,0.0
ALUP3,ALUPAR,"A Alupar Investimento S.A., em conjunto com suas subsidiárias, atua na transmissão, geração e comercialização de energia no Brasil, Colômbia, Peru e Chile. Atua nos segmentos de Transmissão e Geração. A empresa detém participação em concessões de 44 sistemas de transmissão de energia elétrica, totalizando 9.999 quilômetros de linhas de transmissão; e opera linhas aéreas e subestações. Também atua na geração de energia renovável por meio de hidrelétricas, parques eólicos e usinas fotovoltaicas, que possuem capacidade instalada de 798,5 MW. A empresa foi constituída em 2006 e está sediada em São Paulo, Brasil. A Alupar Investimento S.A. é uma subsidiária da Guarupart Participações Ltda.",https://www.alupar.com.br,Utilities,Utilidades Públicas,10.421053,1.264996,0.12679,0.0242,11747901539.880001,11.88,Mid Caps,40,1.1399999596969712,17.099999395454567,30.53,24.0,Baixo,,🟢,12.960000038146973,-8.33333360314859
UGPA3,ULTRAPAR,"A Ultrapar Participações S.A., por meio de suas subsidiárias, atua nos setores de energia, mobilidade e infraestrutura logística no Brasil, no resto da Europa, nos Estados Unidos, no Canadá, em outros países da América Latina, na Oceania e internacionalmente. Atua nos segmentos Ultragaz, Ipiranga, Ultracargo e Hidrovias. A empresa distribui e vende produtos derivados de petróleo, biocombustíveis, gasolina, etanol, diesel, óleo combustível, querosene, gás natural para veículos e combustíveis aditivos sob a marca Ipimax para transportadoras, revendedores e varejistas; opera postos de abastecimento da marca Ipiranga e lojas de conveniência da marca AmPm; e produz e vende lubrificantes sob a marca ICONIC. Atua também na distribuição de gás liquefeito de petróleo a granel e envasado para os setores residencial, condominial, comércio, serviços, industrial e agronegócio; operação de rede de gasodutos de gás natural; e fornecimento de eletricidade renovável para empresas e residências, bem como gás natural comprimido e biometano para clientes corporativos. Além disso, a empresa opera terminais de armazenamento de granéis líquidos em centros logísticos; infraestrutura hidroviária e multimodal; e operações portuárias. Além disso, a empresa oferece soluções logísticas para movimentação de grãos, minérios e fertilizantes; serviços automotivos através das unidades Jet Oil; e programas de fidelidade da marca Km de Vantagens (KMV). Também exporta seus produtos e serviços. A Ultrapar Participações S.A. foi fundada em 1937 e está sediada em São Paulo, Brasil.",https://www.ultra.com.br,Energy,Energia,10.561404,1.9531504,0.19181,0.0596,32171518902.600002,30.1,Mid Caps,50,2.8499998674418667,42.749998011628,29.59,32.0,Baixo,,🟢,27.229999542236328,10.539847616640715
ALPA3,ALPARGATAS,"A Alpargatas S.A. fabrica e comercializa calçados e acessórios no Brasil e no exterior. A empresa oferece seus produtos com as marcas Havaianas, ioasys e Rothys. A empresa era anteriormente conhecida como São Paulo Alpargatas S.A. e mudou seu nome para Alpargatas S.A. em 2010. A empresa foi fundada em 1907 e está sediada em São Paulo, Brasil.",https://www.alpargatas.com.br,Consumer Cyclical,Consumo Cíclico,10.755814,1.81337,0.16464001,0.0548,6282623920.5,9.25,Small Caps,35,0.859999996281081,12.899999944216216,28.29,26.0,Baixo,,🟢,11.020000457763672,-16.061709475853004
TTEN3,3TENTOS,"A Três Tentos Agroindustrial S/A, em conjunto com suas subsidiárias, atua no setor do agronegócio. Atua por meio de três segmentos: Insumos, Grãos e Industrial. A empresa comercializa e distribui produtos agrícolas, incluindo produtos para proteção e nutrição de cultivos e sementes para soja, milho e trigo. Também se dedica ao armazenamento, comercialização e comércio de produtos agrícolas; e atividades de industrialização de grãos. Além disso, a empresa oferece soluções de digitalização que incluem o 3tentos, aplicativo com foco na comodidade e gestão do produtor rural; App 3tentos + Nota Fiscal Eletrônica; certificado digital; Portal do Parceiro, possibilita certificado digital do agricultor para uso no App 3tentos e consulta relatórios e informações para o manejo da lavoura; e Terra3, plataforma de monitoramento agronômico remoto. Além disso, oferece serviços de assistência técnica. A empresa opera na África, América Central, América do Sul, América do Norte, Ásia e Europa. A Três Tentos Agroindustrial S/A foi fundada em 1954 e está sediada em Santa Bárbara do Sul, Brasil.",https://www.3tentos.com.br,Basic Materials,Materiais Básicos,10.842857,1.5896953,0.15687001,0.0254,7595926985.46,15.18,Small Caps,20,1.400000018445323,21.000000276679845,27.71,20.0,Baixo,,🟢,15.84000015258789,-4.1666675898362415
BLAU3,BLAU,"Blau Farmacêutica S.A., uma empresa farmacêutica fornece medicamentos no Brasil, Argentina, Chile, Colômbia, Uruguai, Equador, Peru e Estados Unidos. Seus produtos abrangem diversas áreas, como imunologia, hematologia, oncologia, nefrologia, infectologia e anestesiologia. A empresa oferece estimuladores uterinos, antirreumáticos, anestésicos, antibióticos, cuidados com a saúde feminina, biofarmacêuticos, oncológicos, produtos hospitalares, antivirais e antirretrovirais, biológicos, inibidores de bomba de ácido, hemoderivados, antitrombóticos e trombolíticos. A Blau Farmacêutica S.A. foi constituída em 1987 e está sediada em Cotia, Brasil.",https://www.blau.com,Healthcare,Saúde,11.010639,1.042296,0.108610004,0.0292,2390694346.35,10.35,Small Caps,25,0.9399999400579748,14.099999100869622,26.6,14.0,Médio,,🟡,10.699999809265137,-3.2710263131226602
MULT3,MULTIPLAN EJ,"A Multiplan Empreendimentos Imobiliários S.A. atua no planejamento, implantação, desenvolvimento e comercialização de empreendimentos imobiliários no Brasil. A empresa desenvolve imóveis residenciais ou comerciais, inclusive shoppings urbanos. Atua também na compra e venda de imóveis, bem como na aquisição e alienação de direitos imobiliários, e na sua operação através de locação. Além disso, a empresa presta serviços de gestão e administração de shopping centers próprios ou de terceiros; serviços de assessoria e suporte técnico relacionados a questões imobiliárias; e construção civil, execução de obras e serviços de engenharia e correlatos. Além disso, atua no planejamento, desenvolvimento, gestão, promoção e intermediação de projetos imobiliários; importação e exportação de bens e serviços relacionados às suas atividades; geração de energia elétrica; serviços de fabricação e estacionamento de veículos; serviços de entretenimento; administrar e operar teatros; e serviços de administração e promoção. Adicionalmente, a empresa atua na promoção, organização, produção, agenciamento, programação e execução de eventos, shows e espetáculos esportivos, artísticos e culturais; administra eventos esportivos, artísticos e culturais; e aluguel de equipamentos de som, luz e quaisquer outros. A Multiplan Empreendimentos Imobiliários S.A. foi fundada em 1974 e está sediada no Rio de Janeiro, Brasil.",https://www.multiplan.com.br,Real Estate,Imobiliário,11.732793,2.1947894,0.20018,0.04,14230530120.24,28.98,Mid Caps,35,2.4700001099482454,37.05000164922368,21.78,38.0,Baixo,,🟢,33.130001068115234,-12.526413927916385
CMIN3,CSINERACAO,"A CSN Mineração S.A. atua no negócio de mineração de minério de ferro no Brasil, Ásia e Europa. A empresa opera as minas de Casa de Pedra, Engenho e Pires. Também opera uma usina hidrelétrica. A empresa foi fundada em 1913 e está sediada em São Paulo, Brasil. A CSN Mineração S.A. atua como subsidiária da Companhia Siderúrgica Nacional.",https://ri.csnmineracao.com.br,Basic Materials,Materiais Básicos,11.780488,3.926829,0.25741,0.1341,26236775118.54,4.83,Mid Caps,50,0.40999999320910985,6.149999898136648,21.46,44.0,Baixo,,🟢,5.269999980926514,-8.349145778348896
SBSP3,SABESP,"Companhia de Saneamento Básico do Estado de São Paulo - SABESP provides basic and environmental sanitation services in the São Paulo State, Brazil. It supplies treated water and sewage services on a wholesale basis. Companhia de Saneamento Básico do Estado de São Paulo - SABESP was founded in 1954 and is headquartered in São Paulo, Brazil.",https://www.sabesp.com.br,Utilities,Utilidades Públicas,11.811024,2.4073184,0.21233,0.048499999999999995,105204914280.0,30.0,Blue Chips,35,2.5399999187200026,38.09999878080004,21.26,38.0,Baixo,,🟢,149.4199981689453,-79.92236623769746
REDE3,REDE ENERGIA,"A Rede Energia Participações S.A. atua na geração, distribuição e comercialização de energia elétrica no Brasil. A empresa atua na construção, operação, manutenção e serviços relacionados à geração e distribuição de energia elétrica. Oferece eletricidade a clientes residenciais, industriais, comerciais, rurais, governamentais e do setor público. A empresa foi constituída em 1929 e está sediada em Cataguases, Brasil.",https://www.energisa.com.br,Utilities,Utilidades Públicas,11.86,2.3834405,0.23211999,0.07719999999999999,15229451137.269999,5.93,Mid Caps,50,0.5,7.5,20.93,44.0,Baixo,,🟢,6.289999961853027,-5.723369857493163
ENMT4,ENERGISA MT,"Energisa Mato Grosso - Distribuidora de Energia S/A operates as an electricity distributor in Mato Grosso. The company was formerly known as Centrais Elétricas Matogrossenses and changed its name to Energisa Mato Grosso - Distribuidora de Energia S/A in February 2015. The company was founded in 1905 and is headquartered in Cuiabá, Brazil. Energisa Mato Grosso - Distribuidora de Energia S/A is a subsidiary of Rede Energia Participações S.A.",https://www.energisa.com.br,Utilities,Utilidades Públicas,11.913462,2.0815365,0.18423,0.0818,8138071872.63,37.17,Small Caps,35,3.119999879128334,46.79999818692501,20.58,32.0,Baixo,,🟢,52.0,-28.519230769230763
ENMT3,ENERGISA MT,"Energisa Mato Grosso - Distribuidora de Energia S/A operates as an electricity distributor in Mato Grosso. The company was formerly known as Centrais Elétricas Matogrossenses and changed its name to Energisa Mato Grosso - Distribuidora de Energia S/A in February 2015. The company was founded in 1905 and is headquartered in Cuiabá, Brazil. Energisa Mato Grosso - Distribuidora de Energia S/A is a subsidiary of Rede Energia Participações S.A.",https://www.energisa.com.br,Utilities,Utilidades Públicas,12.108974,2.115697,0.18423,0.08130000000000001,8271626455.42,37.78,Small Caps,35,3.1200000924933855,46.80000138740078,19.27,32.0,Baixo,,🟢,50.0,-24.439999999999998
PNVL3,DIMED EJ,"A Dimed S.A. Distribuidora de Medicamentos comercializa medicamentos, perfumarias, produtos de higiene pessoal e beleza, cosméticos e dermocosméticos no Brasil. Vende seus produtos em lojas físicas do setor varejista. A Dimed S.A. Distribuidora de Medicamentos foi fundada em 1920 e está sediada em Eldorado do Sul, Brasil.",https://www.grupopanvel.com.br,Healthcare,Saúde,12.318182,1.2424068,0.10398,0.0358,1615420842.92,10.84,Small Caps,25,0.8799999870110703,13.199999805166055,17.88,20.0,Baixo,,🟢,10.84,0.0
BMOB3,BEMOBI TECH,"Bemobi Mobile Tech S.A., uma empresa de tecnologia, fornece soluções e plataformas móveis para pagamentos digitais, engajamento de clientes, microfinanças e serviços digitais no Brasil e internacionalmente. A empresa oferece Bemobi Pay, que inclui checkouts inteligentes que oferecem solução white-label e customizável, orquestração de meios de pagamento e múltiplos métodos de pagamento; Smart POS, que aceita pagamentos; Orquestração de pagamentos que otimiza pagamentos e conecta negócios a vários provedores, aumenta as taxas de aprovação e reduz fraudes; e simplificar o gerenciamento de pagamentos. Ele também fornece Grace, uma plataforma de pagamentos conversacionais com IA; soluções de engajamento digital para ISPs de telecomunicações e MNOS de telecomunicações; e Agenda Edu SuperApp, ferramenta de comunicação, engajamento e finanças escolares. Além disso, a empresa oferece soluções de microfinanças e assinaturas digitais para telecomunicações MNOS; e Wave, plataforma digital nativa para telecomunicações; e soluções de pontuação móvel para empresas de telecomunicações e finanças. Atende MNOs e ISPs de telecomunicações, serviços públicos, educação, saúde e setores financeiros. A Bemobi Mobile Tech S.A. foi constituída em 2007 e está sediada no Rio de Janeiro, Brasil.",https://www.bemobi.com.br,Communication Services,Comunicação,12.43617,2.03694,0.15548,0.0775,1946592871.58,23.38,Small Caps,35,1.8800000321642434,28.20000048246365,17.09,32.0,Baixo,,🟢,24.540000915527344,-4.726979919521398
TIMS3,TIM,"A TIM S.A. atua no setor de telecomunicações no Brasil. Oferece serviços de telefonia fixa comutada nas modalidades de longa distância local, nacional e internacional, bem como serviços de comunicação pessoal móvel e multimídia. A empresa está sediada no Rio de Janeiro, Brasil. A TIM S.A. é uma subsidiária da TIM Brasil Serviços e Participações S.A.",https://www.tim.com.br,Communication Services,Comunicação,12.452515,2.1803777,0.17724001,0.0712,53243416897.38,22.29,Blue Chips,50,1.7899998514356337,26.849997771534504,16.98,38.0,Baixo,,🟢,27.26000022888184,-18.23184221259158
VBBR3,VIBRA,"A Vibra Energia S.A. fabrica, processa, distribui, comercializa, transporta, importa e exporta produtos à base de petróleo, lubrificantes e outros combustíveis. Atua nos segmentos de Rede de Postos de Gasolina, B2B e Renováveis. A empresa comercializa combustíveis derivados de petróleo, lubrificantes, gás natural veicular, biocombustíveis e produtos de conveniência. Também vende combustíveis e lubrificantes e presta serviços associados ao seu mercado consumidor, bem como comercializa produtos e serviços de aviação nas instalações aeroportuárias do Brasil. A empresa foi constituída em 1971 e está sediada no Rio de Janeiro, Brasil.",https://www.vibraenergia.com.br,Consumer Cyclical,Consumo Cíclico,12.4902725,1.7617034,0.13962,0.0493,38294635080.6,32.1,Mid Caps,15,2.569999973979751,38.54999960969627,16.73,20.0,Baixo,,🟢,32.1,0.0
BPAC5,BTGP BANCO A,"O Banco BTG Pactual S.A. fornece produtos e serviços financeiros relativos a carteiras comerciais, de investimentos, de crédito, de financiamento, de arrendamento mercantil, de seguros e de câmbio no Brasil e internacionalmente. A empresa também oferece serviços de investimento pessoal para uma carteira de investimentos customizada; serviços de contas bancárias internacionais, incluindo cartão de débito, transferência, pagamento e recebimento, e serviços de suporte ao cliente. Também fornece serviços de gestão de patrimônio, como execução, pesquisa de mercado, recursos e análises educacionais e gestão de relacionamento; gestão do patrimônio familiar; contas correntes e de poupança, certificados de depósito, contas de aposentadoria e contas do mercado monetário; financiamento imobiliário; bem como empréstimos corporativos, empréstimos a prazo, linhas de crédito e financiamento de credores. O Banco BTG Pactual S.A. foi fundado em 1983 e está sediado no Rio de Janeiro, Brasil. O Banco BTG Pactual S.A. opera como subsidiária do BTG Pactual Holding Financeira Ltda.",https://www.btgpactual.com,Financial Services,Serviços Financeiros,12.582782,1.2292961,0.2484,0.0255,220165438654.0,19.0,Blue Chips,60,1.5099999348315818,22.649999022473725,16.11,38.0,Baixo,,🟢,11.380000114440918,66.95957652838248
CEBR6,CEB B,"A Companhia Energética de Brasília - CEB, por meio de suas subsidiárias, gera e distribui energia elétrica e gás no Brasil. A empresa atua nos segmentos de Geração de Energia, Comercialização de Energia Elétrica, Iluminação Pública e Outros. A empresa produz energia elétrica a partir de usinas hidráulicas; distribui gás canalizado; serviços de iluminação pública; e fornece serviços de manutenção e expansão. Atua também na prestação de serviços de elaboração de estudos; projetos de engenharia; execução de obras de implantação, ampliação, reforma ou manutenção de redes aéreas e subterrâneas de transmissão e distribuição de energia elétrica; e instalação de sistemas de iluminação pública e elétrica predial. A empresa era anteriormente conhecida como Companhia de Eletricidade de Brasília e mudou seu nome para Companhia Energética de Brasília CEB em 1992. A Companhia Energética de Brasília CEB foi fundada em 1968 e está sediada em Brasília, Brasil.",https://www.ceb.com.br,Utilities,Utilidades Públicas,12.914798,2.195122,0.16638,0.1881,2075959152.0,28.8,Small Caps,35,2.2300000356180565,33.45000053427085,13.9,28.0,Baixo,,🟢,31.200000762939453,-7.692309949524952
GGPS3,GPS,"A GPS Participações e Empreendimentos S.A., em conjunto com suas subsidiárias, fornece facilities, segurança, logística interna, engenharia de utilidades, serviços industriais, alimentação, mão de obra temporária, marketing de campo e serviços de infraestrutura no Brasil. A empresa oferece serviços de segurança patrimonial; serviços de higiene e limpeza; serviços de catering; serviços de segurança eletrônica, implantação, operação e manutenção predial; serviços de hotéis marítimos; serviços de cozinha e venda de refeições; manutenção industrial; serviços de manutenção de rodovias; participação em sociedades mediante aquisição de ações ou quotas de capital; administração e gestão trabalhista; e consultoria financeira e assessoria empresarial na área de planejamento de eventos promocionais. Também atua na venda e distribuição de brindes promocionais; corretagem de seguros gerais, seguros de vida, seguros de saúde, seguros de pensões e capitalização; manutenção de redes telefônicas, manutenção de acessos e instalação de sistemas de telecomunicações; e construção de rede de distribuição de energia e manutenção de atividades de redes energizadas. A GPS Participações e Empreendimentos S.A. foi fundada em 1962 e está sediada em São Paulo, Brasil.",https://gpssa.com.br,Industrials,Indústria,13.170213,2.2595365,0.17129,0.0441,9314099029.060001,12.38,Small Caps,20,0.9399999832956385,14.099999749434577,12.2,22.0,Baixo,,🟢,18.31999969482422,-32.42357966033369
