Ticker,Empresa,Resumo,Site,setor_original,Setor,PL,PVP,ROE,DivYield,MarketCap,Preco,Categoria,Score,LucroPorAcao,PrecoJusto,Desconto_%,Ranking,Risco,Risco_num,Farol,Preco_antigo,Variacao_%
CPLE3,COPEL,"A Companhia Paranaense de Energia - COPEL, em conjunto com suas subsidiárias, atua na pesquisa, estudo, planejamento, construção, produção, transformação, transporte, distribuição e comercialização de energia elétrica no Brasil. A empresa atua por meio de três segmentos: Geração e Transmissão de Energia Elétrica; Distribuição de Energia Elétrica; e Comercialização. Produz eletricidade a partir de energia hidrelétrica e eólica; e constrói, opera e mantém subestações, bem como linhas de transmissão de energia. A empresa era anteriormente conhecida como Companhia Paranaense de Energia Elétrica e mudou seu nome para Companhia Paranaense de Energia - COPEL em outubro de 1979. A Companhia Paranaense de Energia - COPEL foi fundada em 1954 e está sediada em Curitiba, Brasil.",https://www.copel.com,Utilities,Utilidades Públicas,18.422222,2.1289163,0.10955,0.07339999999999999,49243777981.36156,16.579999923706055,Mid Caps,30,0.9000000067150452,13.500000100725678,-22.81,18.0,Médio,,🟡,15.119999885559082,9.656084981464847
FRAS3,"FRAS,LE","A Frasle Mobility S.A. fornece materiais de fricção para sistemas de freios e outros produtos no Brasil, Inglaterra, Argentina, Estados Unidos, China, Índia, Uruguai, Holanda, Chile, Colômbia, Alemanha, América do Sul e internacionalmente. Atua nos segmentos de Montadoras e Reposição. A empresa oferece lonas de freio para veículos comerciais, pastilhas de freio para veículos comerciais, automóveis, motocicletas e pequenas aeronaves, lonas de freio para automóveis, sapatas ferroviárias, sapatas de freio para veículos comerciais e automóveis, lonas de embreagem, lonas moldadas e placas universais e produtos industriais; disco de freio, tambor, cilindro mestre, servos, cilindro de roda, cubos de roda, reparos, atuadores e válvulas de retenção. Também atende aos setores de veículos pesados, automóveis, motocicletas, ferroviário, aéreo e agrícola. A empresa vende seus produtos sob as marcas FRAS-LE, Controil, FREMAX e NAKATA. Também exporta seus produtos. A empresa era anteriormente conhecida como Fras-le S.A. e mudou seu nome para Frasle Mobility S.A. em dezembro de 2025. A Frasle Mobility S.A. foi fundada em 1954 e está sediada em Caxias Do Sul, Brasil. A Frasle Mobilidade S.A. atua como subsidiária da Randon S.A. Implementos e Participações.",https://ri.fraslemobility.com,Consumer Cyclical,Consumo Cíclico,22.09,2.4904172,0.11966,0.0338,6126332224.597977,22.09000015258789,Small Caps,0,1.000000006907555,15.000000103613324,-47.27,6.0,Médio,,🟡,24.690000534057617,-10.530580499110407
B3SA3,B3 EJ,"B3 S.A. - Brasil, Bolsa, Balcão, empresa de infraestrutura para o mercado financeiro, presta serviços de negociação em ambiente de bolsa e balcão. Atua por meio de mercados, soluções de análise de dados, soluções de mercado de capitais e segmentos de tecnologia e plataformas. A empresa organizou mercados de títulos, como ações, contratos financeiros, índices, taxas, moedas, energia, transporte, commodities e transações de liquidação à vista e futura. Também fornece soluções tecnológicas para os mercados de seguros, resseguros, previdência e títulos de capitalização; serviços de processamento e análise de dados, incluindo padronização, cotações e estatísticas; apoia operações de crédito, financiamento e leasing nos setores automotivo, imobiliário, energia e agronegócio; e opera sistemas de negociação e câmaras de compensação. Além disso, a empresa organizou um mercado de balcão e atua como câmara de compensação e liquidação. A empresa era anteriormente conhecida como BM&FBOVESPA S.A. - Bolsa de Valores, Mercadorias e Futuros e mudou sua razão social para B3 S.A. - Brasil, Bolsa, Balcão em junho de 2017. B3 S.A. - Brasil, Bolsa, Balcão foi constituída em 2007 e está sediada em São Paulo, Brasil.",https://www.b3.com.br,Financial Services,Serviços Financeiros,22.738096,5.513857,0.25591,0.0311,95704985919.14262,19.100000381469727,Blue Chips,35,0.8399999886300826,12.599999829451239,-51.59,30.0,Médio,,🟡,18.459999084472656,3.4669627775626357
IGTI4,IGUATEMI S.A,"A Iguatemi S.A., em conjunto com suas subsidiárias, atua na exploração e planejamento comercial de shopping centers no Brasil. A empresa também atua na compra de estacionamentos e na venda de imóveis. Além disso, presta serviços de assessoria e consultoria econômica, financeira e tributária. A empresa era anteriormente conhecida como Jereissati Participações S.A. e mudou seu nome para Iguatemi S.A. em novembro de 2021. A Iguatemi S.A. foi fundada em 1946 e está sediada em São Paulo, Brasil.",https://iguatemi.com.br,Real Estate,Imobiliário,27.468084,0.8234468,0.13001001,0.0222,15573036221.596733,12.90999984741211,Mid Caps,40,0.4700000133759642,7.050000200639463,-83.12,18.0,Médio,,🟡,11.899999618530272,8.487397153434358
=======
BSLI4,BRB BANCO,"O BRB - Banco de Brasília S.A. atua nas atividades de crédito, financiamento e investimento para clientes pessoas físicas e jurídicas no Brasil. A empresa envolvida na distribuição de valores mobiliários e gestão de fundos, cartões de crédito, seguros e prestação de outros serviços relacionados. A empresa era anteriormente conhecida como Banco regional de Brasília SA BRB e mudou seu nome para BRB - Banco de Brasília S.A. em janeiro de 1986. O BRB - Banco de Brasília S.A. foi constituído em 1964 e está sediado em Brasília, Brasil.",https://www.brb.com.br,Financial Services,Serviços Financeiros,1.9554455,0.48194242,0.25134,0.16219999999999998,2035100578.0673814,3.950000047683716,Small Caps,85,2.020000070410408,30.300001056156123,86.96,58.0,Baixo,,🟢,4.300000190734863,-8.13953784944677
BSLI3,BRB BANCO,"O BRB - Banco de Brasília S.A. atua nas atividades de crédito, financiamento e investimento para clientes pessoas físicas e jurídicas no Brasil. A empresa envolvida na distribuição de valores mobiliários e gestão de fundos, cartões de crédito, seguros e prestação de outros serviços relacionados. A empresa era anteriormente conhecida como Banco regional de Brasília SA BRB e mudou seu nome para BRB - Banco de Brasília S.A. em janeiro de 1986. O BRB - Banco de Brasília S.A. foi constituído em 1964 e está sediado em Brasília, Brasil.",https://www.brb.com.br,Financial Services,Serviços Financeiros,1.980198,0.48804295,0.25134,0.1456,1944724348.0,4.0,Small Caps,85,2.0200000202000004,30.300000303000004,86.8,58.0,Baixo,,🟢,4.789999961853027,-16.492692445605222
BNBR3,NORD BRASIL,"O Banco do Nordeste do Brasil S.A. atua como um banco de desenvolvimento regional na América Latina. Atua por meio dos segmentos Carteira Própria e FNE. A empresa oferece contas de poupança, depósitos à vista e a prazo e custódia de títulos; crédito especializado; crédito para infra-estruturas e microfinanciamento urbano e rural; e serviços de cobrança e cartões de crédito. Atua também na estruturação e distribuição de valores mobiliários, como debêntures, notas promissórias, certificados de recebíveis imobiliários, fundos de investimento; administração de recursos de terceiros, consistindo na administração de fundos de investimento; operações cambiais; gestão de carteira e análise de crédito; e transferências eletrônicas. Atende empresas corporativas, grandes, médias, pequenas e microempresas; agroindústria, produtores rurais e agricultura familiar; sectores de microfinanças urbanas e rurais; entidades representativas; indivíduos; e instituições da administração pública direta e indireta. A empresa atua por meio de pontos de atendimento físicos, incluindo agências e unidades de microcrédito. O Banco do Nordeste do Brasil S.A. foi fundado em 1952 e está sediado em Fortaleza, Brasil.",https://www.bnb.gov.br,Financial Services,Serviços Financeiros,3.8892446,0.7464154,0.20545,0.0567,11992019625.0,121.5,Mid Caps,100,31.239999664716382,468.59999497074574,74.07,58.0,Baixo,,🟢,119.75,1.4613778705636742
BAZA3,AMAZIA,"O Banco da Amazônia S.A. fornece produtos e serviços bancários na região amazônica do Brasil. A empresa oferece contas poupança, corrente, simplificada e salário; cartões de crédito; produtos de capitalização; vários empréstimos pessoais e empresariais; planos de pensões; fundos de investimento, certificados de depósitos bancários e recibos de depósitos e cartas de crédito do agronegócio; produtos de seguros; e débito direto e serviços financeiros online. Também oferece programas de financiamento para agricultura familiar, máquinas e equipamentos, atividades rurais e de biodiversidade, caminhões, energia verde, negócios e infraestrutura verdes e investimentos rurais e não rurais, bem como atividades de ciência, tecnologia e inovação; fundo de desenvolvimento e marinha mercante; capital de giro; comércio exterior; e serviços de poupança para pessoas jurídicas, cobrança, adiantamento de cartão, cheque comercial, débito automático, mensagens de celular e domicílio bancário. A empresa foi fundada em 1942 e está sediada em Belém, Brasil.",https://www.bancoamazonia.com.br,Financial Services,Serviços Financeiros,3.9483993,0.6360886,0.15239,0.09699999999999999,4632659117.38472,82.63999938964844,Small Caps,85,20.930000516829296,313.95000775243943,73.68,52.0,Baixo,,🟢,85.54000091552734,-3.390228542015942
SUZB3,SUZANO S.A. ATZ,"A Suzano S.A. fabrica e comercializa produtos de celulose e papel no Brasil e internacionalmente. Atua em dois segmentos, Celulose e Papel. A empresa oferece papéis de impressão e escrita revestidos e não revestidos, cartões, papéis tissue e celuloses de mercado e fluff. Também se dedica à pesquisa, desenvolvimento e produção de biocombustíveis; operação de terminais portuários; atividades de pesquisa e desenvolvimento em biotecnologia e polpas nanocristalinas; negócios de geração e distribuição de energia; atividades de transporte rodoviário de cargas; comercialização de equipamentos e peças; pesquisa e desenvolvimento de lignina; industrialização e comercialização de produtos de celulose, microfibras celulósicas, papel e papelão; e industrialização, comercialização e exportação de produtos de celulose. Além disso, a empresa está envolvida em atividades de escritório comercial, capital de risco corporativo e captação de recursos financeiros; produção de bens de consumo através de líquidos à base de celulose; desenvolvimento e produção de fibras, fios e filamentos têxteis à base de celulose; restauração, conservação e preservação de florestas; e pesquisa de matérias-primas para a indústria têxtil. A empresa era anteriormente conhecida como Suzano Papel e Celulose S.A. e mudou seu nome para Suzano S.A. em abril de 2019. A empresa foi fundada em 1924 e está sediada em Salvador, Brasil.",https://www.suzano.com.br,Basic Materials,Materiais Básicos,4.362627,1.3303618,0.35192,0.023799999999999998,58294327257.38659,47.15999984741211,Blue Chips,85,10.810000453261788,162.15000679892682,70.92,46.0,Baixo,,🟢,55.81999969482422,-15.514152444925736
BRSR6,BANRISUL B,"O Banco do Estado do Rio Grande do Sul S.A., um banco múltiplo, oferece uma gama de produtos e serviços bancários principalmente no Brasil. A empresa atua em atividades bancárias de varejo, empréstimos, financiamento e investimento, empréstimos hipotecários, desenvolvimento, carteira de arrendamento e câmbio. Também oferece corretagem de valores mobiliários, grupos de consórcios, soluções para o setor de pagamentos, seguros e produtos de previdência e títulos de capitalização. O Banco do Estado do Rio Grande do Sul S.A. foi constituído em 1928 e está sediado em Porto Alegre, Brasil.",https://www.banrisul.com.br,Financial Services,Serviços Financeiros,4.4630075,0.6672614,0.1567,0.0495,7647823031.922764,18.700000762939453,Small Caps,70,4.189999851655964,62.84999777483946,70.25,46.0,Baixo,,🟢,18.030000686645508,3.71602912245146
JHSF3,JHSF PART ED,"A JHSF Participações S.A., em conjunto com suas subsidiárias, atua no ramo imobiliário no Brasil e internacionalmente. Atua por meio de cinco segmentos: Renda Recorrente; Negócios Imobiliários; Aeroporto, Hotéis e Restaurantes; e Segurando. A empresa atua na construção e operação de shopping centers; compra e venda de imóveis residenciais e comerciais; varejo de artigos de moda; locação de imóveis comerciais; e desenvolvimento e operação de hotéis, atividades turísticas, hotelaria e gastronomia, incluindo bares, cafés e restaurantes. Também se dedica à prestação de serviços de gestão; e soluções de financiamento, serviços e investimentos imobiliários. A JHSF Participações S.A. foi fundada em 1972 e está sediada em São Paulo, Brasil.",https://jhsf.com.br,Real Estate,Imobiliário,4.527076,1.3288121,0.28806,0.06570000000000001,8385650423.270656,12.539999961853027,Small Caps,85,2.7699998767091665,41.5499981506375,69.82,52.0,Baixo,,🟢,9.260000228881836,35.42116254750091
BRSR5,BANRISUL A,"O Banco do Estado do Rio Grande do Sul S.A., um banco múltiplo, oferece uma gama de produtos e serviços bancários principalmente no Brasil. A empresa atua em atividades bancárias de varejo, empréstimos, financiamento e investimento, empréstimos hipotecários, desenvolvimento, carteira de arrendamento e câmbio. Também oferece corretagem de valores mobiliários, grupos de consórcios, soluções para o setor de pagamentos, seguros e produtos de previdência e títulos de capitalização. O Banco do Estado do Rio Grande do Sul S.A. foi constituído em 1928 e está sediado em Porto Alegre, Brasil.",https://www.banrisul.com.br,Financial Services,Serviços Financeiros,4.534606,0.6779661,0.1567,0.049800000000000004,7770515063.0,19.0,Small Caps,70,4.19000018965264,62.8500028447896,69.77,46.0,Baixo,,🟢,18.790000915527344,1.117610826187459
BRSR3,BANRISUL,"O Banco do Estado do Rio Grande do Sul S.A., um banco múltiplo, oferece uma gama de produtos e serviços bancários principalmente no Brasil. A empresa atua em atividades bancárias de varejo, empréstimos, financiamento e investimento, empréstimos hipotecários, desenvolvimento, carteira de arrendamento e câmbio. Também oferece corretagem de valores mobiliários, grupos de consórcios, soluções para o setor de pagamentos, seguros e produtos de previdência e títulos de capitalização. O Banco do Estado do Rio Grande do Sul S.A. foi constituído em 1928 e está sediado em Porto Alegre, Brasil.",https://www.banrisul.com.br,Financial Services,Serviços Financeiros,4.673031,0.6986619,0.1567,0.0473,8007720228.457724,19.579999923706055,Small Caps,70,4.190000007212889,62.85000010819334,68.85,46.0,Baixo,,🟢,18.799999237060547,4.148939990954297
AZZA3,AZZAS 2154,"A Azzas 2154 S.A. atua no desenvolvimento e comercialização de calçados, bolsas, acessórios e confecções femininos, masculinos e infantis no Brasil e no exterior. Oferece seus produtos por meio de lojas franqueadas, lojas próprias e canal de web commerce das marcas Arezzo, Schutz, Anacapri, Alexandre Birman, Alme, Vans, Reserva, Reserva Mini, Reserva INK, Reserva Go, Oficina Reserva, Brizza, Troc, Baw, Carol Bassi, ZZMALL, Reversa, Simples Reserva, Paris Texas, Vicenza, Animale, Farm, Farm Global, Fabula, Foxton, Cris Barros, Off Premium, Maria Filo, NV, Marcas Hering e Dzarm. A empresa era anteriormente conhecida como Arezzo Indústria e Comércio S.A. e mudou seu nome para Azzas 2154 S.A. em julho de 2024. Azzas 2154 S.A. foi fundada em 1972 e está sediada em Belo Horizonte, Brasil.",https://ri.azzas2154.com.br,Consumer Cyclical,Consumo Cíclico,4.6952596,0.52595645,0.11609,0.11900000000000001,4201035105.106945,20.799999237060547,Small Caps,65,4.429999831545107,66.44999747317661,68.7,40.0,Baixo,,🟢,27.520000457763672,-24.418608680681704
ABCB4,ABC BRASIL,"O Banco ABC Brasil S.A., um banco comercial, fornece diversos produtos e serviços financeiros para médias e grandes empresas no Brasil. A empresa oferece conta corrente; produtos de crédito e financiamento, como capital de giro, rotativo, recebíveis, antecipação a fornecedores, empréstimo consignado para empregados, sobre empréstimos em moeda estrangeira e empréstimos em moeda estrangeira, bem como para agronegócio, comércio exterior, transferências do fundo de defesa da economia cafeeira e imóveis; questões de garantias, tais como garantia de pagamento emitida, garantia de execução emitida, garantia judicial emitida, carta de crédito stand-by, confirmação de cartas de crédito de exportação, garantia de oferta, garantia de execução e carta de crédito de importação; derivativos, como contratos a termo de não entrega, prazo de mercadorias, swap e opções; serviços de câmbio para exportação e importação de câmbio, câmbio à vista de adiantamentos sobre câmbios entregues e câmbio à vista financeiro de remessas; cédulas de crédito do agronegócio e imobiliário, certificado de depósito bancário, fundos de investimento, certificado de operações estruturadas e debêntures. Também fornece serviços de investimentos em operações de fusões e aquisições, mercado de capitais e financiamento de projetos. Além disso, a empresa oferece produtos de seguros, como seguros de vida, seguros de vida e seguros de propriedades e acidentes; e atua como comercializadora de energia. A empresa era anteriormente conhecida como Banco Roma de Investimentos e mudou seu nome para Banco ABC Brasil S.A. em 1997. A empresa foi constituída em 1983 e está sediada em São Paulo, Brasil. O Banco ABC Brasil S.A. é uma subsidiária da Marsau Uruguai Holdings SA.",https://www.abcbrasil.com.br,Financial Services,Serviços Financeiros,5.0560746,0.9652096,0.15463,0.1133,6529786258.378773,27.049999237060547,Small Caps,85,5.350000025130275,80.25000037695413,66.29,52.0,Baixo,,🟢,26.959999084472656,0.33382847049028763
EVEN3,EVEN,"A Even Construtora e Incorporadora S.A. atua como incorporadora e construtora imobiliária no Brasil. A empresa desenvolve e comercializa projetos residenciais, hotéis e centros de arte. Também está envolvida na prospecção de terrenos; incorporação e venda imobiliária; operação do portal da corretora; e atividades de construção de projetos. A empresa foi fundada em 1974 e está sediada em São Paulo, Brasil.",https://www.even.com.br,Real Estate,Imobiliário,5.0633802,0.7495048,0.14028,0.10640000000000001,1407924039.884737,7.190000057220459,Small Caps,65,1.4200000342104389,21.300000513156583,66.24,40.0,Baixo,,🟢,7.710000038146973,-6.744487397583604
TRIS3,TRISUL,"A Trisul S.A. atua na construção e incorporação de imóveis no Brasil. A empresa atua no loteamento de terrenos; e compra e venda de imóveis. Também desenvolve projetos imobiliários com participação acionária de terceiros. A Trisul S.A. foi fundada em 2007 e está sediada em São Paulo, Brasil.",https://www.trisul-sa.com.br,Real Estate,Imobiliário,5.330275,0.93604,0.14368,0.18719999999999998,1357561600.289897,5.809999942779541,Small Caps,65,1.0900000361669033,16.35000054250355,64.46,40.0,Baixo,,🟢,6.900000095367432,-15.797103442356505
VTRU3,VITRUEDUCA,"A Vitru Educação S.A., em conjunto com suas subsidiárias, presta serviços educacionais no Brasil. Oferece cursos de graduação, pós-graduação e técnicos e profissionalizantes a distância e presenciais, além de serviços de educação digital sob as marcas Uniasselvi e UniCesumar. A empresa era anteriormente conhecida como Vitru Brasil Empreendimentos, Participações e Comércio S.A. e mudou seu nome para Vitru Educação S.A. em dezembro de 2025. A empresa foi constituída em 2014 e está sediada em São Paulo, Brasil.",https://www.vitru.com.br/pt_BR,Consumer Defensive,Consumo Defensivo,5.490196,0.6395322,0.1349,0.19,1871135392.0,14.0,Small Caps,65,2.550000036428572,38.25000054642858,63.4,40.0,Baixo,,🟢,14.15999984741211,-1.1299424374029994
GMAT3,GRUPO MATEUS,"O Grupo Mateus S.A. opera uma rede de supermercados no Brasil. Atua no atacado, móveis e eletrodomésticos, e-commerce, indústria de panificação e central de fatiamento e porcionamento. A empresa foi fundada em 1986 e está sediada em São Luís, Brasil.",https://www.grupomateus.com.br,Consumer Cyclical,Consumo Cíclico,5.573171,0.98789454,0.17944999,0.0546,10511218027.369343,4.570000171661377,Mid Caps,100,0.8199999913265494,12.299999869898242,62.85,52.0,Baixo,,🟢,5.460000038146973,-16.30036374116301
BMGB4,BANCO BMG,"O Banco BMG S.A. fornece produtos e serviços comerciais e de crédito, financiamento e investimento principalmente no Brasil. A empresa oferece contas digitais; cartão de crédito conta digital e cartão de crédito consignado; consignado e empréstimo pessoal; produtos de seguros, incluindo seguros de prestamistas, de vida, de vida familiar e protegidos pelo FGTS, além dos serviços do Bmg Med e do Consórcio Bmg. Também oferece produtos de investimento, como certificados de depósitos bancários, cartas de crédito do agronegócio e cartas de crédito imobiliário. Além disso, a empresa oferece serviços bancários comerciais; debêntures; financiamento comercial; e capital de giro; e derivativos, como opções a termo não entregáveis, SWAP. A empresa era anteriormente conhecida como BMG Financeira S.A.Crédito, Financiamento e Investimento e mudou seu nome para Banco BMG S.A. em abril de 1989. O Banco BMG S.A. foi fundado em 1930 e está sediado em São Paulo, Brasil.",https://www.bancobmg.com.br,Financial Services,Serviços Financeiros,5.957895,0.728349,0.12981,0.0781,3654561991.1566925,5.659999847412109,Small Caps,65,0.9499999324278305,14.249998986417458,60.28,40.0,Baixo,,🟢,4.949999809265137,14.343435666765759
CEEB5,COELBA A,"Companhia de Eletricidade do Estado da Bahia - COELBA engages in the distribution of electricity. The company was founded in 1960 and is headquartered in Salvador, Brazil. Companhia de Eletricidade do Estado da Bahia - COELBA operates as a subsidiary of Iberdrola, S.A.",https://www.coelba.com.br,Utilities,Utilidades Públicas,6.0165973,1.4527602,0.25589,0.046,11401179784.5,43.5,Mid Caps,85,7.230000252800699,108.45000379201049,59.89,52.0,Baixo,,🟢,38.0,14.473684210526317
CYRE3,CYRELA REALT,"Cyrela Brazil Realty S.A. Empreendimentos e Participações atua na incorporação e construção de imóveis residenciais no Brasil. Também presta serviços imobiliários, incluindo gestão de obras e serviços de consultoria técnica. Cyrela Brazil Realty S.A. Empreendimentos e Participações foi fundada em 1962 e está sediada em São Paulo, Brasil.",https://www.cyrela.com.br,Consumer Cyclical,Consumo Cíclico,6.0853386,0.99606013,0.22374001,0.1366,10188105841.899672,27.809999465942383,Mid Caps,100,4.570000339166399,68.55000508749599,59.43,64.0,Baixo,,🟢,29.0,-4.103450117440059
EUCA3,EUCATEX,"A Eucatex S.A. Indústria e Comércio produz e comercializa painéis de fibra e madeira no Brasil. A empresa fornece pisos laminados e vinílicos, portas, divisórias, painéis de fibra de média densidade (MDF) e aglomerado de média densidade (MDP), placas de fibra, tintas e vernizes, painéis decorativos, folhas de fibra de madeira, lacas e outros produtos. Produz também mudas de eucalipto e rodapés; e atua em consultoria de gestão empresarial, atividades imobiliárias, florestais, colheita, manejo florestal, transporte, logística de coleta de resíduos, material reciclado e eletricidade. A empresa atende principalmente os setores moveleiro e de construção civil. Também exporta seus produtos para os Estados Unidos e América Latina. A Eucatex S.A. Indústria e Comércio foi constituída em 1951 e está sediada em São Paulo, Brasil.",https://www.eucatex.com.br,Industrials,Indústria,6.1560693,0.7091254,0.11956,0.048,1962474918.5065918,21.299999237060547,Small Caps,50,3.459999912129083,51.899998681936246,58.96,34.0,Baixo,,🟢,21.5,-0.9302361066951308
BEEF3,MINERVA,"A Minerva S.A. produz e comercializa carne bovina in natura, gado e subprodutos na América do Sul e internacionalmente. A empresa também atua no abate, desossa e processamento de carnes; venda de carnes resfriadas, congeladas e processadas, bem como produtos bovinos, suínos e aves; exportação e venda de gado vivo; e criação e venda de gado vivo, cordeiros, porcos e outros animais vivos. Além disso, comercializa eletricidade; comercializa proteínas e produtos alimentícios; vende marcas de terceiros principalmente produtos Swift; e prepara produtos para animais, que incluem farinha de carne e ossos, sangue e sebo. A Minerva S.A. foi fundada em 1957 e está sediada em Barretos, Brasil.",https://ri.minervafoods.com,Consumer Defensive,Consumo Defensivo,6.1594205,3.1978931,0.85664004,0.029300000000000003,4196599243.0,4.25,Small Caps,45,0.6899999764588243,10.349999646882363,58.94,34.0,Médio,,🟡,4.099999904632568,3.658538996499666
