Ticker,Empresa,Resumo,Site,setor_original,Setor,PL,PVP,ROE,DivYield,MarketCap,Preco,Categoria,Score,LucroPorAcao,PrecoJusto,Desconto_%,Ranking,Risco,Risco_num,Farol,Preco_antigo,Variacao_%
BSLI3,BRB BANCO,"O BRB - Banco de Brasília S.A. atua nas atividades de crédito, financiamento e investimento para clientes pessoas físicas e jurídicas no Brasil. A empresa envolvida na distribuição de valores mobiliários e gestão de fundos, cartões de crédito, seguros e prestação de outros serviços relacionados. A empresa era anteriormente conhecida como Banco regional de Brasília SA BRB e mudou seu nome para BRB - Banco de Brasília S.A. em janeiro de 1986. O BRB - Banco de Brasília S.A. foi constituído em 1964 e está sediado em Brasília, Brasil.",https://www.brb.com.br,Financial Services,Serviços Financeiros,1.5049505,0.37091264,0.25134,0.1891,1477990485.9336634,3.0399999618530273,Small Caps,85,2.0199999680076037,30.299999520114056,89.97,58.0,Baixo,,🟢,4.789999961853027,-36.534447055047714
SEER3,SER EDUCA,"Ser Educacional S.A., together with its subsidiaries, operates on-campus and distance-learning undergraduate, graduate, and professional training courses and other education-related areas in Brazil. It offers undergraduate, post graduate, on-campus and digital learning, and vocational courses. The company operates under the UNINASSAU  Centro Universitário Maurício de Nassau, UNINABUCO  Centro Universitário Nabuco, UNG  Universidade Guarulhos, UNAMA  University of the Amazon, UNIVERITAS  Universus Veritas University Center, UNINORTE - Northern University Center, University Center for Biomedical Sciences of Cacoal UNIFACIMED, UNIJUAZEIRO - Centro Universitário de Juazeiro do Norte, UNESC - Educational Society of Rondônia, UNIFASB - São Francisco de Barreiras University Center, UNI7 - 7 de Setembro University Center, CDMV - Center for the Development of Veterinary Medicine, FAEL University Center, UNINASSAU Colleges, UNINABUCO Colleges, and Joaquim Nabuco and Maurício de Nassau Technical Schools, GOKURSOS, BEDUKA, DELÍNEA, PROVA FÁCIL and Peixe 30, CDO, CDM, DOK, and PLANTÃO VETERINÁRIO brands. It is also involved in the investment business. The company was founded in 1993 and is headquartered in Recife, Brazil.",https://www.sereducacional.com,Consumer Defensive,Consumo Defensivo,1.5082417,0.9911536,0.18484,0.0435,1405884301.9877243,10.979999542236328,Small Caps,70,7.279999977613886,109.19999966420829,89.95,46.0,Baixo,,🟢,13.479999542236328,-18.545994695080314
BSLI4,BRB BANCO,"O BRB - Banco de Brasília S.A. atua nas atividades de crédito, financiamento e investimento para clientes pessoas físicas e jurídicas no Brasil. A empresa envolvida na distribuição de valores mobiliários e gestão de fundos, cartões de crédito, seguros e prestação de outros serviços relacionados. A empresa era anteriormente conhecida como Banco regional de Brasília SA BRB e mudou seu nome para BRB - Banco de Brasília S.A. em janeiro de 1986. O BRB - Banco de Brasília S.A. foi constituído em 1964 e está sediado em Brasília, Brasil.",https://www.brb.com.br,Financial Services,Serviços Financeiros,1.5841584,0.39043435,0.25134,0.1971,1555779501.5829208,3.200000047683716,Small Caps,85,2.020000050300346,30.30000075450519,89.44,58.0,Baixo,,🟢,4.300000190734863,-25.58139754089544
VTRU3,VITRUEDUCA,"A Vitru Educação S.A., em conjunto com suas subsidiárias, presta serviços educacionais no Brasil. Oferece cursos de graduação, pós-graduação e técnicos e profissionalizantes a distância e presenciais, além de serviços de educação digital sob as marcas Uniasselvi e UniCesumar. A empresa era anteriormente conhecida como Vitru Brasil Empreendimentos, Participações e Comércio S.A. e mudou seu nome para Vitru Educação S.A. em dezembro de 2025. A empresa foi constituída em 2014 e está sediada em São Paulo, Brasil.",https://www.vitru.com.br/pt_BR,Consumer Defensive,Consumo Defensivo,1.7272727,0.47752407,0.35219002,0.19,2166891106.3753138,13.300000190734863,Small Caps,85,7.700000232004398,115.50000348006597,88.48,58.0,Baixo,,🟢,14.15999984741211,-6.073443968535213
CEEB3,COELBA,"Companhia de Eletricidade do Estado da Bahia - COELBA engages in the distribution of electricity. The company was founded in 1960 and is headquartered in Salvador, Brazil. Companhia de Eletricidade do Estado da Bahia - COELBA operates as a subsidiary of Iberdrola, S.A.",https://www.coelba.com.br,Utilities,Utilidades Públicas,1.9509176,1.5265671,0.23447001,0.11779999999999999,11980411896.813866,45.709999084472656,Mid Caps,75,23.42999985466975,351.44999782004624,86.99,52.0,Baixo,,🟢,47.0,-2.7446827989943485
EVEN3,EVEN,"A Even Construtora e Incorporadora S.A. atua como incorporadora e construtora imobiliária no Brasil. A empresa desenvolve e comercializa projetos residenciais, hotéis e centros de arte. Também está envolvida na prospecção de terrenos; incorporação e venda imobiliária; operação do portal da corretora; e atividades de construção de projetos. A empresa foi fundada em 1974 e está sediada em São Paulo, Brasil.",https://www.even.com.br,Real Estate,Imobiliário,2.8190956,0.5699482,0.121929996,0.16449999999999998,1114112293.5851579,5.610000133514404,Small Caps,65,1.9899999608081418,29.849999412122127,81.21,40.0,Baixo,,🟢,7.710000038146973,-27.237352713908468
BRSR6,BANRISUL B EJ,"O Banco do Estado do Rio Grande do Sul S.A., um banco múltiplo, oferece uma gama de produtos e serviços bancários principalmente no Brasil. A empresa atua em atividades bancárias de varejo, empréstimos, financiamento e investimento, empréstimos hipotecários, desenvolvimento, carteira de arrendamento e câmbio. Também oferece corretagem de valores mobiliários, grupos de consórcios, soluções para o setor de pagamentos, seguros e produtos de previdência e títulos de capitalização. O Banco do Estado do Rio Grande do Sul S.A. foi constituído em 1928 e está sediado em Porto Alegre, Brasil.",https://www.banrisul.com.br,Financial Services,Serviços Financeiros,3.085847,0.4745763,0.1559,0.06480000000000001,5439360622.105691,13.300000190734863,Small Caps,85,4.309999877095288,64.64999815642932,79.43,52.0,Baixo,,🟢,18.030000686645508,-26.234056105245017
BNBR3,NORD BRASIL,"O Banco do Nordeste do Brasil S.A. atua como um banco de desenvolvimento regional na América Latina. Atua por meio dos segmentos Carteira Própria e FNE. A empresa oferece contas de poupança, depósitos à vista e a prazo e custódia de títulos; crédito especializado; crédito para infra-estruturas e microfinanciamento urbano e rural; e serviços de cobrança e cartões de crédito. Atua também na estruturação e distribuição de valores mobiliários, como debêntures, notas promissórias, certificados de recebíveis imobiliários, fundos de investimento; administração de recursos de terceiros, consistindo na administração de fundos de investimento; operações cambiais; gestão de carteira e análise de crédito; e transferências eletrônicas. Atende empresas corporativas, grandes, médias, pequenas e microempresas; agroindústria, produtores rurais e agricultura familiar; sectores de microfinanças urbanas e rurais; entidades representativas; indivíduos; e instituições da administração pública direta e indireta. A empresa atua por meio de pontos de atendimento físicos, incluindo agências e unidades de microcrédito. O Banco do Nordeste do Brasil S.A. foi fundado em 1952 e está sediado em Fortaleza, Brasil.",https://www.bnb.gov.br,Financial Services,Serviços Financeiros,3.223648,0.6273151,0.21034001,0.065,10413810727.835411,105.51000213623047,Mid Caps,100,32.73000096047412,490.95001440711184,78.51,64.0,Baixo,,🟢,119.75,-11.891438717135308
JHSF3,JHSF PART,"A JHSF Participações S.A., em conjunto com suas subsidiárias, atua no ramo imobiliário no Brasil e internacionalmente. Atua por meio de cinco segmentos: Renda Recorrente; Negócios Imobiliários; Aeroporto, Hotéis e Restaurantes; e Segurando. A empresa atua na construção e operação de shopping centers; compra e venda de imóveis residenciais e comerciais; varejo de artigos de moda; locação de imóveis comerciais; e desenvolvimento e operação de hotéis, atividades turísticas, hotelaria e gastronomia, incluindo bares, cafés e restaurantes. Também se dedica à prestação de serviços de gestão; e soluções de financiamento, serviços e investimentos imobiliários. A JHSF Participações S.A. foi fundada em 1972 e está sediada em São Paulo, Brasil.",https://jhsf.com.br,Real Estate,Imobiliário,3.4113922,1.0177492,0.27879998,0.07719999999999999,7187156863.648647,10.779999732971191,Small Caps,85,3.160000111676163,47.40000167514245,77.26,52.0,Baixo,,🟢,9.260000228881836,16.414681063921513
BRSR3,BANRISUL EJ,"O Banco do Estado do Rio Grande do Sul S.A., um banco múltiplo, oferece uma gama de produtos e serviços bancários principalmente no Brasil. A empresa atua em atividades bancárias de varejo, empréstimos, financiamento e investimento, empréstimos hipotecários, desenvolvimento, carteira de arrendamento e câmbio. Também oferece corretagem de valores mobiliários, grupos de consórcios, soluções para o setor de pagamentos, seguros e produtos de previdência e títulos de capitalização. O Banco do Estado do Rio Grande do Sul S.A. foi constituído em 1928 e está sediado em Porto Alegre, Brasil.",https://www.banrisul.com.br,Financial Services,Serviços Financeiros,4.150812,0.6461516,0.1559,0.0506,7316553143.911789,17.889999389648438,Small Caps,85,4.309999920412786,64.64999880619179,72.33,46.0,Baixo,,🟢,18.799999237060547,-4.840424916710749
ABCB4,ABC BRASIL,"O Banco ABC Brasil S.A., um banco comercial, fornece diversos produtos e serviços financeiros para médias e grandes empresas no Brasil. A empresa oferece conta corrente; produtos de crédito e financiamento, como capital de giro, rotativo, recebíveis, antecipação a fornecedores, empréstimo consignado para empregados, sobre empréstimos em moeda estrangeira e empréstimos em moeda estrangeira, bem como para agronegócio, comércio exterior, transferências do fundo de defesa da economia cafeeira e imóveis; questões de garantias, tais como garantia de pagamento emitida, garantia de execução emitida, garantia judicial emitida, carta de crédito stand-by, confirmação de cartas de crédito de exportação, garantia de oferta, garantia de execução e carta de crédito de importação; derivativos, como contratos a termo de não entrega, prazo de mercadorias, swap e opções; serviços de câmbio para exportação e importação de câmbio, câmbio à vista de adiantamentos sobre câmbios entregues e câmbio à vista financeiro de remessas; cédulas de crédito do agronegócio e imobiliário, certificado de depósito bancário, fundos de investimento, certificado de operações estruturadas e debêntures. Também fornece serviços de investimentos em operações de fusões e aquisições, mercado de capitais e financiamento de projetos. Além disso, a empresa oferece produtos de seguros, como seguros de vida, seguros de vida e seguros de propriedades e acidentes; e atua como comercializadora de energia. A empresa era anteriormente conhecida como Banco Roma de Investimentos e mudou seu nome para Banco ABC Brasil S.A. em 1997. A empresa foi constituída em 1983 e está sediada em São Paulo, Brasil. O Banco ABC Brasil S.A. é uma subsidiária da Marsau Uruguai Holdings SA.",https://www.abcbrasil.com.br,Financial Services,Serviços Financeiros,4.441775,0.8136385,0.15,0.1085,6192061510.585127,24.030000686645508,Small Caps,65,5.409999535466229,81.14999303199343,70.39,40.0,Baixo,,🟢,26.959999084472656,-10.867946948539222
SUZB3,SUZANO S.A. ATZ,"A Suzano S.A. fabrica e comercializa produtos de celulose e papel no Brasil e internacionalmente. Atua em dois segmentos, Celulose e Papel. A empresa oferece papéis de impressão e escrita revestidos e não revestidos, cartões, papéis tissue e celuloses de mercado e fluff. Também se dedica à pesquisa, desenvolvimento e produção de biocombustíveis; operação de terminais portuários; atividades de pesquisa e desenvolvimento em biotecnologia e polpas nanocristalinas; negócios de geração e distribuição de energia; atividades de transporte rodoviário de cargas; comercialização de equipamentos e peças; pesquisa e desenvolvimento de lignina; industrialização e comercialização de produtos de celulose, microfibras celulósicas, papel e papelão; e industrialização, comercialização e exportação de produtos de celulose. Além disso, a empresa está envolvida em atividades de escritório comercial, capital de risco corporativo e captação de recursos financeiros; produção de bens de consumo através de líquidos à base de celulose; desenvolvimento e produção de fibras, fios e filamentos têxteis à base de celulose; restauração, conservação e preservação de florestas; e pesquisa de matérias-primas para a indústria têxtil. A empresa era anteriormente conhecida como Suzano Papel e Celulose S.A. e mudou seu nome para Suzano S.A. em abril de 2019. A empresa foi fundada em 1924 e está sediada em Salvador, Brasil.",https://www.suzano.com.br,Basic Materials,Materiais Básicos,4.591948,1.0859216,0.26295,0.026699999999999998,52095340610.238625,42.20000076293945,Blue Chips,85,9.18999970446953,137.84999556704295,69.39,46.0,Baixo,,🟢,55.81999969482422,-24.399854902091032
PETR4,PETROBRAS,"Petróleo Brasileiro S.A. - A Petrobras explora, produz e vende petróleo e gás no Brasil, China, Estados Unidos, Américas, Ásia, Europa, Cingapura e internacionalmente. Atua por meio de três segmentos: Exploração e Produção; Refino, Transporte e Comercialização; e gás e energias de baixo carbono. O segmento de Exploração e Produção explora, desenvolve e produz petróleo bruto, líquidos de gás natural e gás natural principalmente para abastecimento às refinarias nacionais. Seu segmento de Refino, Transporte e Comercialização atua no refino, logística, transporte, aquisição e exportação de petróleo bruto; comércio de produtos petrolíferos; e produção de fertilizantes, além de participação em empresas petroquímicas. O segmento de Gás e Energias de Baixo Carbono atua na logística e comercialização de gás natural e eletricidade; transporte e comercialização de gás natural liquefeito; geração de energia elétrica por meio de usinas termelétricas; negócios de energia renovável; negócios de baixo carbono; e negócios de processamento de gás natural, bem como produção de biodiesel e seus coprodutos. Também se dedica à prospecção, perfuração, refinação, processamento, comercialização e transporte de petróleo bruto proveniente de campos petrolíferos onshore e offshore, e xisto ou outras rochas, bem como produtos petrolíferos, gás natural e outros hidrocarbonetos líquidos. Além disso, a empresa se dedica à pesquisa, desenvolvimento, produção, transporte, distribuição e comercialização de energia. A Petróleo Brasileiro S.A. - Petrobras foi constituída em 1953 e está sediada no Rio de Janeiro, Brasil.",https://petrobras.com.br,Energy,Energia,4.7097173,1.1085377,0.25601,0.09910000000000001,523174882680.8848,38.290000915527344,Blue Chips,100,8.129999844263974,121.9499976639596,68.6,58.0,Baixo,,🟢,42.34000015258789,-9.565420931660068
AZZA3,AZZAS 2154,"Azzas 2154 S.A. atua no desenvolvimento e comercialização de calçados, bolsas, acessórios e confecções femininos, masculinos e infantis no Brasil e no exterior. Oferece seus produtos por meio de lojas franqueadas, lojas próprias e canal de web commerce das marcas Arezzo, Schutz, Anacapri, Alexandre Birman, Alme, Vans, Reserva, Reserva Mini, Reserva INK, Reserva Go, Oficina Reserva, Brizza, Troc, Baw, Carol Bassi, ZZMALL, Reversa, Simples Reserva, Paris Texas, Vicenza, Animale, Farm, Farm Global, Fabula, Foxton, Cris Barros, Off Premium, Maria Filo, NV, Marcas Hering e Dzarm. A empresa era anteriormente conhecida como Arezzo Indústria e Comércio S.A. e mudou seu nome para Azzas 2154 S.A. em julho de 2024. Azzas 2154 S.A. foi fundada em 1972 e está sediada em Belo Horizonte, Brasil.",https://ri.azzas2154.com.br,Consumer Cyclical,Consumo Cíclico,4.767901,0.48720795,0.10524999,0.1232,3902616430.205143,19.309999465942383,Small Caps,65,4.0500000872380495,60.750001308570745,68.21,40.0,Baixo,,🟢,27.520000457763672,-29.832851944975765
GMAT3,GRUPO MATEUS,"O Grupo Mateus S.A. opera uma rede de supermercados no Brasil. Atua no atacado, móveis e eletrodomésticos, e-commerce, indústria de panificação e central de fatiamento e porcionamento. A empresa foi fundada em 1986 e está sediada em São Luís, Brasil.",https://www.grupomateus.com.br,Consumer Cyclical,Consumo Cíclico,4.835443,0.7840722,0.16014999,0.0649,8786181762.495256,3.819999933242798,Small Caps,85,0.7899999923983797,11.849999885975695,67.76,52.0,Baixo,,🟢,5.460000038146973,-30.036631748097236
CSED3,CRUZEIRO EDU,"A Cruzeiro do Sul Educacional S.A. presta serviços de educação no Brasil. A empresa oferece ensino superior; educação a distância com a marca Cruzeiro do Sul Virtual; e cursos de medicina. Também opera escolas do Colégio Alto Padrão; Colégio Ceunsp Itu, que oferece serviços de educação infantil, fundamental e médio; O Colégio Ceunsp Salto oferece serviços de educação básica, educação infantil e ensino médio; e o Colégio Cruzeiro do Sul que oferece serviços de educação infantil, ensino médio e escola técnica. A empresa foi fundada em 1965 e está sediada em São Paulo, Brasil.",https://www.cruzeirodosuleducacional.com.br,Consumer Defensive,Consumo Defensivo,4.8533335,0.8031774,0.16947001,0.1338,1326934927.5220356,3.640000104904175,Small Caps,85,0.7499999958593768,11.249999937890653,67.64,52.0,Baixo,,🟢,6.559999942779541,-44.51219303880255
CYRE3,CYRELA REALT,"Cyrela Brazil Realty S.A. Empreendimentos e Participações atua na incorporação e construção de imóveis residenciais no Brasil. Também presta serviços imobiliários, incluindo gestão de obras e serviços de consultoria técnica. Cyrela Brazil Realty S.A. Empreendimentos e Participações foi fundada em 1962 e está sediada em São Paulo, Brasil.",https://www.cyrela.com.br,Consumer Cyclical,Consumo Cíclico,5.0,0.9231148,0.21141,0.1759,8242804260.0,22.5,Small Caps,85,4.5,67.5,66.67,58.0,Baixo,,🟢,29.0,-22.413793103448278
PLPL3,PLANOEPLANO,"A Plano & Plano Desenvolvimento Imobiliário S.A., por meio de suas subsidiárias, desenvolve, constrói e comercializa empreendimentos imobiliários na Região Metropolitana de São Paulo. Também fornece seus serviços online. A empresa foi fundada em 1997 e está sediada em São Paulo, Brasil.",https://www.planoeplano.com.br,Real Estate,Imobiliário,5.0952387,1.6974024,0.37973,0.18170000000000003,1737215961.9594383,8.5600004196167,Small Caps,60,1.679999882952824,25.19999824429236,66.03,46.0,Baixo,,🟢,14.449999809265137,-40.761241988888145
MDNE3,MOURA DUBEUX,"A Moura Dubeux Engenharia S.A. presta serviços de incorporação imobiliária no Brasil. A empresa desenvolve apartamentos, hotéis, resorts e edifícios residenciais, além de oferecer serviços de administração técnica de obras e assessoria técnica aos condomínios. Também atua na compra e venda de imóveis; construção imobiliária; gerenciamento; administração; e serviços de engenharia, bem como serviços de consultoria imobiliária, incluindo compra de terreno; formatação de produtos; e aprovação do projeto. A empresa foi fundada em 1983 e está sediada em Recife, Brasil.",https://www.mouradubeux.com.br,Real Estate,Imobiliário,5.100529,1.609349,0.2716,0.1721,2984920314.914528,28.920000076293945,Small Caps,60,5.67000012671116,85.0500019006674,66.0,46.0,Baixo,,🟢,33.20000076293945,-12.891568037020026
BMGB4,BANCO BMG,"O Banco BMG S.A. fornece produtos e serviços comerciais e de crédito, financiamento e investimento principalmente no Brasil. A empresa oferece contas digitais; cartão de crédito conta digital e cartão de crédito consignado; consignado e empréstimo pessoal; produtos de seguros, incluindo seguros de prestamistas, de vida, de vida familiar e protegidos pelo FGTS, além dos serviços do Bmg Med e do Consórcio Bmg. Também oferece produtos de investimento, como certificados de depósitos bancários, cartas de crédito do agronegócio e cartas de crédito imobiliário. Além disso, a empresa oferece serviços bancários comerciais; debêntures; financiamento comercial; e capital de giro; e derivativos, como opções a termo não entregáveis, SWAP. A empresa era anteriormente conhecida como BMG Financeira S.A.Crédito, Financiamento e Investimento e mudou seu nome para Banco BMG S.A. em abril de 1989. O Banco BMG S.A. foi fundado em 1930 e está sediado em São Paulo, Brasil.",https://www.bancobmg.com.br,Financial Services,Serviços Financeiros,5.22,0.67924523,0.1351,0.0827,3375261390.8375382,5.21999979019165,Small Caps,65,0.9999999598068297,14.999999397102444,65.2,40.0,Baixo,,🟢,4.949999809265137,5.4545452793986495
PETR3,PETROBRAS,"Petróleo Brasileiro S.A. - A Petrobras explora, produz e vende petróleo e gás no Brasil, China, Estados Unidos, Américas, Ásia, Europa, Cingapura e internacionalmente. Atua por meio de três segmentos: Exploração e Produção; Refino, Transporte e Comercialização; e gás e energias de baixo carbono. O segmento de Exploração e Produção explora, desenvolve e produz petróleo bruto, líquidos de gás natural e gás natural principalmente para abastecimento às refinarias nacionais. Seu segmento de Refino, Transporte e Comercialização atua no refino, logística, transporte, aquisição e exportação de petróleo bruto; comércio de produtos petrolíferos; e produção de fertilizantes, além de participação em empresas petroquímicas. O segmento de Gás e Energias de Baixo Carbono atua na logística e comercialização de gás natural e eletricidade; transporte e comercialização de gás natural liquefeito; geração de energia elétrica por meio de usinas termelétricas; negócios de energia renovável; negócios de baixo carbono; e negócios de processamento de gás natural, bem como produção de biodiesel e seus coprodutos. Também se dedica à prospecção, perfuração, refinação, processamento, comercialização e transporte de petróleo bruto proveniente de campos petrolíferos onshore e offshore, e xisto ou outras rochas, bem como produtos petrolíferos, gás natural e outros hidrocarbonetos líquidos. Além disso, a empresa se dedica à pesquisa, desenvolvimento, produção, transporte, distribuição e comercialização de energia. A Petróleo Brasileiro S.A. - Petrobras foi constituída em 1953 e está sediada no Rio de Janeiro, Brasil.",https://petrobras.com.br,Energy,Energia,5.2644525,1.2391071,0.25601,0.0886,551637752337.4773,42.79999923706055,Blue Chips,100,8.130000078272252,121.95000117408378,64.9,58.0,Baixo,,🟢,46.220001220703125,-7.399398297961687
EUCA4,EUCATEX,"A Eucatex S.A. Indústria e Comércio produz e comercializa painéis de fibra e madeira no Brasil. A empresa fornece pisos laminados e vinílicos, portas, divisórias, painéis de fibra de média densidade (MDF) e aglomerado de média densidade (MDP), placas de fibra, tintas e vernizes, painéis decorativos, folhas de fibra de madeira, lacas e outros produtos. Produz também mudas de eucalipto e rodapés; e atua em consultoria de gestão empresarial, atividades imobiliárias, florestais, colheita, manejo florestal, transporte, logística de coleta de resíduos, material reciclado e eletricidade. A empresa atende principalmente os setores moveleiro e de construção civil. Também exporta seus produtos para os Estados Unidos e América Latina. A Eucatex S.A. Indústria e Comércio foi constituída em 1951 e está sediada em São Paulo, Brasil.",https://www.eucatex.com.br,Industrials,Indústria,5.326576,0.7399875,0.14633,0.0479,2178992147.253296,23.649999618530273,Small Caps,50,4.44000040899262,66.6000061348893,64.49,34.0,Baixo,,🟢,20.86000061035156,13.374875007406311
RECV3,PETRORECSA,"A Petroreconcavo S.A. atua na exploração e produção de extração de petróleo e gás no Brasil. A empresa foi fundada em 1999 e está sediada em Mata de São João, Brasil.",https://petroreconcavo.com.br,Energy,Energia,5.489011,0.69757694,0.12347,0.135,2927160542.235546,9.989999771118164,Small Caps,65,1.8199999546581642,27.299999319872462,63.41,40.0,Baixo,,🟢,12.600000381469728,-20.714289931212846
LAVV3,LAVVI,"A Lavvi Empreendimentos Imobiliários S.A. desenvolve e constrói imóveis residenciais e não residenciais principalmente no Brasil. A empresa oferece imóveis com as marcas Lavvi e Novvo. A empresa foi constituída em 2016 e está sediada em São Paulo, Brasil.",https://www.lavvi.com.br,Real Estate,Imobiliário,5.5221677,1.6018863,0.26556998,0.0935,2190819093.375229,11.210000038146973,Small Caps,60,2.0299999288589103,30.449998932883656,63.19,46.0,Baixo,,🟢,17.790000915527344,-36.98707441682738
