Ticker,Empresa,Resumo,Site,setor_original,Setor,PL,PVP,ROE,DivYield,MarketCap,Preco,Categoria,Score,LucroPorAcao,PrecoJusto,Desconto_%,Ranking,Risco,Risco_num,Farol,Preco_antigo,Variacao_%
INTB3,INTELBRAS,"A Intelbras S.A. - Indústria de Telecomunicações Eletrônica Brasileira atua na fabricação, desenvolvimento e comercialização de equipamentos de segurança eletrônica e serviços de vigilância e monitoramento eletrônicos no Brasil. A empresa atua por meio de três segmentos: Segurança, Tecnologia da Informação e Comunicação (TIC) e Energia. Oferece produtos e soluções de segurança eletrônica, inclusive Oferece produtos e soluções de segurança eletrônica, incluindo alarmes, armazenamento, câmeras, comunicação condominial, controle de acesso corporativo, fechaduras, gravadores de vídeo digital, produtos contra incêndio e intercomunicação, monitoramento de veículos, sensores, sinalização de emergência, produtos de software e aplicativos e acessórios; e os produtos e soluções de redes incluem produtos 5G e Wi-Fi corporativo, racks, roteadores, switches, rádios externos, fibra óptica e produtos passivos, injetores PoE, adaptadores USB, software e aplicativos e cabos. A empresa também fornece produtos e soluções relacionados à comunicação, como webcams, projetores, mouses e teclados sem fio, soluções em nuvem, antenas e conversores, centrais telefônicas, produtos para eletrodomésticos e conferências, gateways, fones de ouvido, rádios comunicadores, caixas e controles inteligentes, alto-falantes inteligentes, software e aplicativos e telefones; e produtos e soluções relacionados à energia que incluem carregadores de veículos elétricos, UPS, baterias, smart, fontes, protetores eletrônicos, protetores contra surtos, acessórios USB e sensores de presença de iluminação. Além disso, oferece soluções on grid, que incluem painéis solares, estruturas de fixação, inversores on grid, string boxes e acessórios; e soluções fora da rede, como produtos de iluminação, estruturas de montagem, gabinetes externos, acionamentos e painéis solares, bombas solares e geradores e inversores fora da rede. A Intelbras S.A. - Indústria de Telecomunicações Eletrônica Brasileira foi constituída em 1974 e está sediada em São José, Brasil.",https://www.intelbras.com,Industrials,Indústria,7.7556815,1.4208388,0.18765,0.10400000000000001,4466431526.678867,13.649999618530273,Small Caps,85,1.760000023019289,26.400000345289335,48.3,42.0,Baixo,,🟢,13.970000267028809,-2.2906273613593426
KEPL3,KEPLER WEBER,"A Kepler Weber S.A. fornece equipamentos para armazenamento de grãos e soluções pós-colheita de grãos no Brasil, nas Américas, na África, na Europa e na Ásia. Atua em cinco segmentos: Fazendas, Agroindústria, Portos e Terminais, Reposição e Serviços e Negócios Internacionais. A empresa oferece sistemas de armazenamento e preservação de grãos, como silos, secadores e transportadores, além de máquinas de limpeza. Também fornece equipamentos para commodities agrícolas, como etanol de milho, óleo de soja, ração animal, moinhos de trigo, indústrias de arroz, complexos cooperativos, produtores de cereais e canteiros; equipamentos industriais; e terminais portuários. Além disso, a empresa oferece peças de reposição e serviços de assistência técnica; serviços de engenharia técnica e processamento de dados; serviços de seguros contra riscos de engenharia; e serviços de monitoramento de temperatura e umidade de grãos no processo de processamento e armazenamento. Além disso, importa e exporta matérias-primas e produtos acabados e semiacabados. A empresa foi fundada em 1925 e está sediada em São Paulo, Brasil.",https://www.kepler.com.br,Industrials,Indústria,7.7764707,1.4470228,0.19634001,0.0817,1146224596.2624192,6.610000133514404,Small Caps,85,0.8500000049526844,12.750000074290265,48.16,42.0,Baixo,,🟢,8.369999885559082,-21.027476417069472
ISAE4,ISA ENERGIA,"A ISA Energía Brasil S.A. atua no negócio de transmissão de energia elétrica no Brasil. Em 31 de dezembro de 2025, possuía capacidade total instalada de transformação de 84.910 MVA juntamente com linhas de transmissão de 23 mil quilômetros. Atua nos estados da Bahia, Espírito Santo, Minas Gerais, Rio de Janeiro e São Paulo. A ISA Energía Brasil S.A. foi constituída em 1999 e está sediada em São Paulo, Brasil.",https://www.isacteep.com.br,Utilities,Utilidades Públicas,7.8174157,0.86692417,0.11273,0.0947,18336722300.051193,27.829999923706055,Mid Caps,80,3.5600000040558233,53.40000006083735,47.88,42.0,Baixo,,🟢,28.770000457763672,-3.267294122701187
HYPE3,HYPERA,"A Hypera S.A. atua como empresa farmacêutica no Brasil. A empresa fornece adoçantes sob as marcas Adocyl, Finn e Zero-cal; produtos analgésicos e antiinflamatórios das marcas Doril, Atroveran, Calminex, Alivium, Buscopan, Buscofem, geloll, Torsilax, Neosaldina e naprohax; produtos de remédios e descongestionantes para gripes e resfriados das marcas BENEGRIO, Rinosoro, Blu, Neosoro, Coristina, APRACUR e Fluviral. Oferece produtos anti-histamínicos das marcas Alektos, Histamin, Polaramine, PredSim e Desrinite; produtos antissépticos da marca Merthiolate; Produtos fitoterápicos das marcas Maracugina, Eparema, Tamarine e Naturetti; produtos gastrointestinais das marcas Dramin, Estomazil, Engov, Lacto-purga, gastrol, Epocler, Bifilax e Pepsamar. Além disso, a empresa fornece produtos genéricos com a marca neo química; produtos de cuidados de esqui das marcas Episol, Epidrat, Simple Organic e Bioage; suplementos e produtos vitamínicos das marcas Addera, Biotonico Fontoura, Colflex e Vitasay; e outros produtos das marcas Nebacetin, Cepacol, ESCABIN, Mirrorelax, Ammy, Nesina e Diprospan. A empresa era anteriormente conhecida como Hypermarcas S.A. e mudou seu nome para Hypera S.A. em fevereiro de 2018. A Hypera S.A. foi fundada em 1999 e está sediada em São Paulo, Brasil.",https://www.hypera.com.br,Healthcare,Saúde,8.011451,0.9419314,0.12954001,0.0518,14776797271.31896,20.989999771118164,Mid Caps,80,2.619999769220103,39.29999653830155,46.59,36.0,Baixo,,🟢,20.989999771118164,0.0
BBSE3,BBSEGURIDADE,"A BB Seguridade Participações S.A., por meio de suas subsidiárias, atua nos negócios de seguros, previdência e obrigações no Brasil. A empresa atua por meio de dois segmentos, Seguros e Corretagem. O segmento de Seguros oferece produtos e serviços de seguros, incluindo seguros de vida, patrimonial e de veículos, seguros patrimoniais, rurais, riscos especiais e financeiros, transportes, cascos e habitação, bem como planos de previdência complementar, odontológico e de capitalização. Seu segmento de Corretagem atua na corretagem e administração, implementação, promoção e viabilização de negócios de seguros nos setores básico, vida e capitalização, bem como planos de previdência aberta e planos odontológicos. A empresa foi fundada em 1981 e está sediada em Brasília, Brasil. A BB Seguridade Participações S.A. atua como subsidiária do Banco do Brasil S.A.",https://www.bbseguridaderi.com.br,Financial Services,Serviços Financeiros,8.160338,5.9398036,0.75649,0.1362,75087494274.34204,38.68000030517578,Blue Chips,75,4.739999777604283,71.09999666406425,45.6,48.0,Baixo,,🟢,34.849998474121094,10.989962693682095
SANB4,SANTANDER BR,"O Banco Santander (Brasil) S.A., em conjunto com suas subsidiárias, fornece diversos produtos e serviços bancários para pessoas físicas, pequenas e médias empresas e clientes corporativos no Brasil e internacionalmente. Atua em dois segmentos, Banco Comercial e Banco Global de Atacado. A empresa oferece produtos de pagamento e fidelidade, incluindo cartões de crédito e débito; crédito consignado e imobiliário; soluções de financiamento de home equity; programas de microfinanciamento; consórcios; produtos do agronegócio, como crédito, valores mobiliários e outros produtos; call center e soluções digitais; ativos inadimplentes; e produtos de seguros que abrangem seguros de vida, acidentes pessoais, automóveis, patrimoniais e de crédito, bem como seguros de viagens e transações bancárias. Também oferece soluções emergenciais para residências, carros, motocicletas, animais de estimação e telemedicina; financiamento ao consumo; e serviços bancários corporativos e de investimento, que incluem gestão de caixa, soluções estruturadas de comércio e capital de giro, comércio e empréstimos, fusões e aquisições, mercados de capitais acionários, dívida com grau de investimento e de mercados emergentes e finanças estruturadas, bem como mercados de vendas, criação de mercado, comércio de energia, ações, pesquisa e mobilização e securitização de dívida privada. Além disso, a empresa oferece soluções de gestão de caixa, como cobranças, pagamentos, pagamentos instantâneos e serviços de folha de pagamento e custódia; programa advance, plataforma não financeira de apoio a empreendedores em conteúdos educacionais, cursos certificados, eventos com foco em gestão, inovação, internacionalização e desenvolvimento de equipes; financiamento de clientes através de depósitos e outros instrumentos de financiamento bancário; e vários investimentos. Oferece seus produtos e serviços por meio de agências, miniagências e caixas eletrônicos; centrais de atendimento; correspondentes bancários e fornecedores terceirizados; e plataformas bancárias online e móveis. A empresa foi fundada em 1970 e está sediada em São Paulo, Brasil.",https://www.santander.com.br,Financial Services,Serviços Financeiros,8.408537,0.40844736,0.10467,0.0667,103253003043.0235,13.789999961853027,Blue Chips,80,1.6399999145931126,24.59999871889669,43.94,42.0,Baixo,,🟢,16.420000076293945,-16.017052997691085
TGMA3,TEGMA,"A Tegma Gestão Logística S.A., em conjunto com suas subsidiárias, presta serviços logísticos no Brasil. Atua nos segmentos de Logística Automotiva e Logística Integrada. O segmento de Logística Automotiva atua no transporte e distribuição de veículos novos e usados; transferências portuárias; e gerenciamento de pátio e estoque para montadoras, além de serviços de pré-entrega de veículos. O segmento de Logística Integrada fornece serviços de transporte, armazenamento e gerenciamento de estoque para produtos químicos, eletrodomésticos e bens de consumo. A empresa também oferece logística e centro automotivo, gerenciamento de pátio, transporte e armazenamento de veículos, logística integrada, gerenciamento da cadeia de suprimentos de produtos químicos, gerenciamento de embalagens, intralogística e serviços de projetos especiais. Atende indústrias de alimentos e bebidas, automotiva, cosmética, eletrodomésticos, farmacêutica e química e petroquímica. A empresa foi fundada em 1969 e está sediada em São Bernardo do Campo, Brasil.",https://www.tegma.com.br,Industrials,Indústria,8.434903,2.2039664,0.25372,0.146,2007805238.1565285,30.450000762939453,Small Caps,60,3.610000110604645,54.15000165906967,43.77,42.0,Baixo,,🟢,36.84999847412109,-17.367701427928704
MILS3,MILLS,"A Mills Locação, Serviços e Logística S.A. atua como locadora de máquinas e equipamentos no Brasil. Aluga, vende, importa e exporta estruturas tubulares de aço e alumínio, escoramentos e equipamentos de acesso para obras de construção civil e formas de concreto reutilizáveis. A empresa também desenvolve projetos de engenharia relacionados e presta serviços de supervisão e montagem opcional. Além disso, vende, aluga e distribui plataformas elevatórias de trabalho, peças relacionadas, carros novos e usados. Também oferece máquinas pesadas, retroescavadeiras, rolos compactos, minicarregadeiras, rebocadores, geradores, compressores, tratores de esteira e agrícolas, escavadeiras, carregadeiras de rodas, motoniveladoras, empilhadeiras e porta-paletes. Além disso, fornece frete, manutenção, treinamento, telemetria, operação remota e serviços e soluções de consultoria. A empresa era anteriormente conhecida como Mills Estruturas e Serviços de Engenharia S.A. e mudou seu nome para Mills Locação, Serviços e Logística S.A. em julho de 2022. A Mills Locação, Serviços e Logística S.A. foi fundada em 1952 e tem sede no Rio de Janeiro, Brasil.",https://www.mills.com.br,Industrials,Indústria,8.55,1.968786,0.26311,0.078,3506345962.210164,15.390000343322754,Small Caps,60,1.8000000401547078,27.00000060232062,43.0,42.0,Baixo,,🟢,15.119999885559082,1.7857173267676134
TAEE3,TAESA,"A Transmissora Aliança de Energia Elétrica S.A., em conjunto com suas subsidiárias, atua na construção, operação e manutenção de linhas de transmissão de energia elétrica no Brasil. Opera uma extensão total de aproximadamente 15.319 quilômetros (km) de linhas de transmissão, que incluem 14.677 km de linhas de transmissão em operação e 642 km de linhas em construção; 113 subestações com tensão entre 230 e 525KV; e um centro de operação do sistema localizado no Rio de Janeiro. A empresa foi fundada em 2000 e está sediada no Rio de Janeiro, Brasil.",https://institucional.taesa.com.br/,Utilities,Utilidades Públicas,8.618422,0.5670014,0.20559,0.0562,13538807439.347712,13.100000381469727,Mid Caps,100,1.5199998771781802,22.799998157672704,42.54,54.0,Baixo,,🟢,14.270000457763672,-8.199019192444387
BMEB4,MERCANTIL,"O Banco Mercantil do Brasil S.A., em conjunto com suas subsidiárias, presta serviços financeiros a clientes pessoas físicas e jurídicas no Brasil. Atua nos segmentos Financeiro, de Seguros e Intermediação Empresarial, Marketplace e Outros. A empresa oferece produtos de Conta Corrente, Empréstimos, Cartões, Investimentos, Cartões a Receber, Cheque Especial, Previdência Privada, Transferência de Benefícios, Limite Especial e Mercado de Capitais. Também oferece internet, WhatsApp, aplicativo Mercantil e serviços bancários de autoatendimento. Além disso, a empresa atua em atividades imobiliárias, securitização e tecnologia. A empresa era anteriormente conhecida como Banco Industrial de Minas Gerais e mudou seu nome para Banco Mercantil do Brasil S.A. em 1974. O Banco Mercantil do Brasil S.A. foi fundado em 1940 e está sediado em Belo Horizonte, Brasil.",https://bancomercantil.com.br,Financial Services,Serviços Financeiros,8.664955,2.7863777,0.32384998,0.0277,8328158505.0,67.5,Small Caps,45,7.790000063474074,116.85000095211112,42.23,30.0,Médio,,🟡,87.25,-22.636103151862464
DIRR3,DIRECIAL,"A Direcional Engenharia S.A. atua no desenvolvimento e construção de projetos imobiliários residenciais de médio e baixo custo, principalmente no Brasil. A empresa tem como foco a incorporação, construção e comercialização de unidades habitacionais para famílias de baixa e média renda. A empresa foi fundada em 1981 e está sediada em Belo Horizonte, Brasil.",https://direcional.com.br,Real Estate,Imobiliário,8.72327,3.3887124,0.42945,0.1913,7217039746.72244,13.869999885559082,Small Caps,60,1.5900000671260988,23.850001006891482,41.84,42.0,Baixo,,🟢,13.510000228881836,2.6646902337398535
TAEE4,TAESA,"A Transmissora Aliança de Energia Elétrica S.A., em conjunto com suas subsidiárias, atua na construção, operação e manutenção de linhas de transmissão de energia elétrica no Brasil. Opera uma extensão total de aproximadamente 15.319 quilômetros (km) de linhas de transmissão, que incluem 14.677 km de linhas de transmissão em operação e 642 km de linhas em construção; 113 subestações com tensão entre 230 e 525KV; e um centro de operação do sistema localizado no Rio de Janeiro. A empresa foi fundada em 2000 e está sediada no Rio de Janeiro, Brasil.",https://institucional.taesa.com.br/,Utilities,Utilidades Públicas,8.730264,0.5743594,0.20559,0.0556,13714501960.767254,13.270000457763672,Mid Caps,100,1.5199999058177016,22.799998587265524,41.8,54.0,Baixo,,🟢,14.5600004196167,-8.859889592551175
CPFE3,CPFL ENERGIA,"A CPFL Energia S.A., por meio de suas subsidiárias, atua como empresa de energia no Brasil. Atua nos segmentos de Distribuição, Geração, Transmissão, Comercialização e Serviços. A empresa gera eletricidade por meio de fontes hidrelétricas, solares, eólicas e de biomassa. Também atua na operação e manutenção de instalações de transmissão de energia elétrica; e comercialização de eletricidade. Em 31 de dezembro de 2025, a rede de distribuição da empresa era composta por 349.342 quilômetros de linhas de distribuição, bem como 12.154 quilômetros de linhas de distribuição de alta tensão; e 596 subestações transformadoras de alta e média tensão com capacidade total de transformação de 20.637 MVA. Atende os setores residencial, comercial e industrial. A empresa foi fundada em 1912 e está sediada em Campinas, Brasil. A CPFL Energia S.A. opera como subsidiária da State Grid Brazil Power Participações S.A.",https://www.cpfl.com.br,Utilities,Utilidades Públicas,8.874,2.10414,0.24763,0.08460000000000001,51125528272.05948,44.369998931884766,Blue Chips,75,4.999999879635425,74.99999819453137,40.84,48.0,Baixo,,🟢,49.869998931884766,-11.028674790052047
UGPA3,ULTRAPAR,"A Ultrapar Participações S.A., por meio de suas subsidiárias, atua nos setores de energia, mobilidade e infraestrutura logística no Brasil, no resto da Europa, nos Estados Unidos, no Canadá, em outros países da América Latina, na Oceania e internacionalmente. Atua nos segmentos Ultragaz, Ipiranga, Ultracargo e Hidrovias. A empresa distribui e vende produtos derivados de petróleo, biocombustíveis, gasolina, etanol, diesel, óleo combustível, querosene, gás natural para veículos e combustíveis aditivos da marca Ipimax para transportadoras, revendedores e varejistas; opera postos de abastecimento da marca Ipiranga e lojas de conveniência da marca AmPm; e produz e vende lubrificantes sob a marca ICONIC. Atua também na distribuição de gás liquefeito de petróleo a granel e envasado para os setores residencial, condominial, comércio, serviços, industrial e agronegócio; operação de rede de gasodutos de gás natural; e fornecimento de eletricidade renovável para empresas e residências, bem como gás natural comprimido e biometano para clientes corporativos. Além disso, a empresa opera terminais de armazenamento de granéis líquidos em centros logísticos; infraestrutura hidroviária e multimodal; e operações portuárias. Além disso, a empresa oferece soluções logísticas para movimentação de grãos, minérios e fertilizantes; serviços automotivos através das unidades Jet Oil; e programas de fidelidade da marca Km de Vantagens (KMV). Também exporta seus produtos e serviços. A Ultrapar Participações S.A. foi fundada em 1937 e está sediada em São Paulo, Brasil.",https://www.ultra.com.br,Energy,Energia,8.884211,1.6429822,0.19181,0.0687,27076882463.56894,25.31999969482422,Mid Caps,75,2.849999813694679,42.749997205420186,40.77,42.0,Baixo,,🟢,27.229999542236328,-7.014321996037926
CMIG3,CEMIG,"A Companhia Energética de Minas Gerais - CEMIG, por meio de suas subsidiárias, atua na geração, transmissão, distribuição e comercialização de energia no Brasil. Em 31 de dezembro de 2025, a empresa operava 32 usinas hidrelétricas com capacidade total de 4.434 MW, 2 parques eólicos com capacidade total de 71 MW e 12 usinas fotovoltaicas com capacidade total de 169 MW; 365.577 milhas de linhas de distribuição; e 4.865 milhas de linhas de transmissão. Também atua na aquisição, transporte e distribuição de gás e seus subprodutos e derivados; venda e comercialização de energia; construção, implantação, operação e manutenção de transmissão de energia elétrica; comercialização e intermediação de negócios relacionados à energia; instalação, operação, manutenção e aluguel de usinas solares; e atividades de geração distribuída, serviços de conta, cogeração, eficiência energética e gestão de abastecimento e armazenamento. A empresa foi constituída em 1952 e está sediada em Belo Horizonte, Brasil.",https://www.cemig.com.br,Utilities,Utilidades Públicas,8.982456,1.5210934,0.17038,0.0883,43940072740.74282,15.359999656677246,Mid Caps,75,1.7099999884972712,25.64999982745907,40.12,42.0,Baixo,,🟢,15.520000457763672,-1.0309329662834354
EKTR4,ELEKTRO,"A Elektro Redes S.A. atua na distribuição de energia elétrica no Brasil. A empresa era anteriormente conhecida como Elektro Eletricidade e Serviços S.A. e mudou seu nome para Elektro Redes S.A. em agosto de 2016. A empresa foi constituída em 1998 e está sediada em Campinas, Brasil. A Elektro Redes S.A. é subsidiária da Neoenergia S.A.",https://www.elektro.com.br,Utilities,Utilidades Públicas,8.993167,3.3625755,0.39254,0.0385,7649615693.504047,39.47999954223633,Small Caps,45,4.389999601056705,65.84999401585058,40.05,36.0,Baixo,,🟢,39.5,-0.050634070287776896
ALUP4,ALUPAR,"A Alupar Investimento S.A., em conjunto com suas subsidiárias, atua na transmissão, geração e comercialização de energia no Brasil, Colômbia, Peru e Chile. Atua nos segmentos de Transmissão e Geração. A empresa detém participação em concessões de 44 sistemas de transmissão de energia elétrica, totalizando 9.999 quilômetros de linhas de transmissão; e opera linhas aéreas e subestações. Também atua na geração de energia renovável por meio de hidrelétricas, parques eólicos e usinas fotovoltaicas, que possuem capacidade instalada de 798,5 MW. A empresa foi constituída em 2006 e está sediada em São Paulo, Brasil. A Alupar Investimento S.A. é uma subsidiária da Guarupart Participações Ltda.",https://www.alupar.com.br,Utilities,Utilidades Públicas,9.070176,1.1010151,0.12679,0.027000000000000003,10225025565.231205,10.34000015258789,Mid Caps,65,1.139999946262111,17.099999193931666,39.53,24.0,Baixo,,🟢,10.989999771118164,-5.914464350021912
VIVA3,VIVARA S.A.,"A Vivara Participações S.A. atua na fabricação e comercialização de joias e outros artigos na América Latina. A empresa oferece produtos de joalheria, incluindo anéis, colares, alianças, brinquedos, solitários, brincos, correntes, correntes, pingentes e pulseiras. Também fornece relógios; acessórios, como óculos de sol, carteiras e porta-cartões, porta-passaportes e relógios, porta-joias, perfumes, abotoaduras, chaveiros, canetas e facas; e produtos para presente que incluem kits para presentear, quiz, formatura, infantil, mãe/avó e produtos customizáveis. A empresa vende seus produtos sob as marcas Vivara, Tag Heuer, Victorinox, Movado, Baume and Mercier, Bulova, Akium, Lacoste, Calvin Klein, Hugo Boss, Tommy Hilfiger, Olivia Burton, Festina, Adidas, Life By Vivara, Guess. Marcas Nautica, Porsche Design, Montblanc e Festina. Oferece seus produtos por meio de lojas e quiosques, bem como por meio de e-commerce. A Vivara Participações S.A. foi fundada em 1962 e está sediada em São Paulo, Brasil.",https://www.vivara.com.br,Consumer Cyclical,Consumo Cíclico,9.096385,1.8050685,0.20746,0.0621,5322111497.465366,22.649999618530273,Small Caps,60,2.4900001064741955,37.35000159711293,39.36,42.0,Baixo,,🟢,29.670000076293945,-23.660264373819757
MOVI3,MOVIDA,"A Movida Participações S.A. presta serviços de aluguel de automóveis no Brasil. Atua em dois segmentos, Rent-a-Car e Gestão e Terceirização de Frotas (GTF). A empresa oferece serviços de aluguel de veículos leves; e serviços de gestão e terceirização de frotas. Também vende carros usados. A empresa era anteriormente conhecida como H.L.C.S.P.E Empreendimentos e Participações S.A. e mudou seu nome para Movida Participações S.A. em dezembro de 2014. A empresa foi fundada em 2006 e tem sede em São Paulo, Brasil. A Movida Participações S.A. atua como subsidiária da Simpar S.A.",https://ri.movida.com.br,Industrials,Indústria,9.104763,1.0570545,0.12866999,0.095,3833906985.9615192,9.5600004196167,Small Caps,65,1.0499999197800864,15.749998796701297,39.3,30.0,Baixo,,🟢,12.93000030517578,-26.063416906572655
