Ticker,Empresa,Resumo,Site,setor_original,Setor,PL,PVP,ROE,DivYield,MarketCap,Preco,Categoria,Score,LucroPorAcao,PrecoJusto,Desconto_%,Ranking,Risco,Risco_num,Farol,Preco_antigo,Variacao_%
DIRR3,DIRECIAL,"A Direcional Engenharia S.A. atua no desenvolvimento e construção de projetos imobiliários residenciais de médio e baixo custo, principalmente no Brasil. A empresa tem como foco a incorporação, construção e comercialização de unidades habitacionais para famílias de baixa e média renda. A empresa foi fundada em 1981 e está sediada em Belo Horizonte, Brasil.",https://direcional.com.br,Real Estate,Imobiliário,9.553333,3.880314,0.43120998,0.18420000000000003,7456627798.43038,14.329999923706055,Small Caps,60,1.5000000443516472,22.500000665274708,36.31,42.0,Baixo,,🟢,13.510000228881836,6.0695757285866945
TAEE3,TAESA,"A Transmissora Aliança de Energia Elétrica S.A., em conjunto com suas subsidiárias, atua na construção, operação e manutenção de linhas de transmissão de energia elétrica no Brasil. Opera uma extensão total de aproximadamente 15.319 quilômetros (km) de linhas de transmissão, que incluem 14.677 km de linhas de transmissão em operação e 642 km de linhas em construção; 113 subestações com tensão entre 230 e 525KV; e um centro de operação do sistema localizado no Rio de Janeiro. A empresa foi fundada em 2000 e está sediada no Rio de Janeiro, Brasil.",https://institucional.taesa.com.br/,Utilities,Utilidades Públicas,9.738562,0.67460495,0.21719,0.073,15399100748.652288,14.899999618530273,Mid Caps,100,1.5299999752047861,22.949999628071794,35.08,60.0,Baixo,,🟢,14.270000457763672,4.41485031925032
SANB3,SANTANDER BR,"O Banco Santander (Brasil) S.A., em conjunto com suas subsidiárias, fornece diversos produtos e serviços bancários para pessoas físicas, pequenas e médias empresas e clientes corporativos no Brasil e internacionalmente. Atua em dois segmentos, Banco Comercial e Banco Global de Atacado. A empresa oferece produtos de pagamento e fidelidade, incluindo cartões de crédito e débito; crédito consignado e imobiliário; soluções de financiamento de home equity; programas de microfinanciamento; consórcios; produtos do agronegócio, como crédito, valores mobiliários e outros produtos; call center e soluções digitais; ativos inadimplentes; e produtos de seguros que abrangem seguros de vida, acidentes pessoais, automóveis, patrimoniais e de crédito, bem como seguros de viagens e transações bancárias. Também oferece soluções emergenciais para residências, carros, motocicletas, animais de estimação e telemedicina; financiamento ao consumo; e serviços bancários corporativos e de investimento, que incluem gestão de caixa, soluções estruturadas de comércio e capital de giro, comércio e empréstimos, fusões e aquisições, mercados de capitais acionários, dívida com grau de investimento e de mercados emergentes e finanças estruturadas, bem como mercados de vendas, criação de mercado, comércio de energia, ações, pesquisa e mobilização e securitização de dívida privada. Além disso, a empresa oferece soluções de gestão de caixa, como cobranças, pagamentos, pagamentos instantâneos e serviços de folha de pagamento e custódia; programa advance, plataforma não financeira de apoio a empreendedores em conteúdos educacionais, cursos certificados, eventos com foco em gestão, inovação, internacionalização e desenvolvimento de equipes; financiamento de clientes através de depósitos e outros instrumentos de financiamento bancário; e vários investimentos. Oferece seus produtos e serviços por meio de agências, miniagências e caixas eletrônicos; centrais de atendimento; correspondentes bancários e fornecedores terceirizados; e plataformas bancárias online e móveis. A empresa foi fundada em 1970 e está sediada em São Paulo, Brasil.",https://www.santander.com.br,Financial Services,Serviços Financeiros,9.7423315,0.47391668,0.10524,0.053200000000000004,118936541649.2489,15.880000114440918,Blue Chips,80,1.6299999763343012,24.44999964501452,35.05,36.0,Baixo,,🟢,15.960000038146973,-0.5012526536017667
TAEE4,TAESA,"A Transmissora Aliança de Energia Elétrica S.A., em conjunto com suas subsidiárias, atua na construção, operação e manutenção de linhas de transmissão de energia elétrica no Brasil. Opera uma extensão total de aproximadamente 15.319 quilômetros (km) de linhas de transmissão, que incluem 14.677 km de linhas de transmissão em operação e 642 km de linhas em construção; 113 subestações com tensão entre 230 e 525KV; e um centro de operação do sistema localizado no Rio de Janeiro. A empresa foi fundada em 2000 e está sediada no Rio de Janeiro, Brasil.",https://institucional.taesa.com.br/,Utilities,Utilidades Públicas,9.908497,0.6863766,0.21719,0.0799,15667810132.660915,15.15999984741211,Mid Caps,100,1.5299999432216722,22.949999148325084,33.94,60.0,Baixo,,🟢,14.5600004196167,4.120875072139631
TTEN3,3TENTOS,"A Três Tentos Agroindustrial S/A, em conjunto com suas subsidiárias, atua no setor do agronegócio. Atua por meio de três segmentos: Insumos, Grãos e Industrial. A empresa comercializa e distribui produtos agrícolas, incluindo produtos para proteção e nutrição de cultivos e sementes para soja, milho e trigo. Também se dedica ao armazenamento, comercialização e comércio de produtos agrícolas; e atividades de industrialização de grãos. Além disso, a empresa oferece soluções de digitalização que incluem o 3tentos, aplicativo com foco na comodidade e gestão do produtor rural; App 3tentos + Nota Fiscal Eletrônica; certificado digital; Portal do Parceiro, possibilita certificado digital do agricultor para uso no App 3tentos e consulta relatórios e informações para o manejo da lavoura; e Terra3, plataforma de monitoramento agronômico remoto. Além disso, oferece serviços de assistência técnica. A empresa opera na África, América Central, América do Sul, América do Norte, Ásia e Europa. A Três Tentos Agroindustrial S/A foi fundada em 1954 e está sediada em Santa Bárbara do Sul, Brasil.",https://www.3tentos.com.br,Basic Materials,Materiais Básicos,9.981366,1.7097563,0.18494,0.0232,8046577430.482246,16.06999969482422,Small Caps,45,1.6100000435635984,24.150000653453976,33.46,24.0,Baixo,,🟢,15.84000015258789,1.4520172981106412
SANB4,SANTANDER BR,"O Banco Santander (Brasil) S.A., em conjunto com suas subsidiárias, fornece diversos produtos e serviços bancários para pessoas físicas, pequenas e médias empresas e clientes corporativos no Brasil e internacionalmente. Atua em dois segmentos, Banco Comercial e Banco Global de Atacado. A empresa oferece produtos de pagamento e fidelidade, incluindo cartões de crédito e débito; crédito consignado e imobiliário; soluções de financiamento de home equity; programas de microfinanciamento; consórcios; produtos do agronegócio, como crédito, valores mobiliários e outros produtos; call center e soluções digitais; ativos inadimplentes; e produtos de seguros que abrangem seguros de vida, acidentes pessoais, automóveis, patrimoniais e de crédito, bem como seguros de viagens e transações bancárias. Também oferece soluções emergenciais para residências, carros, motocicletas, animais de estimação e telemedicina; financiamento ao consumo; e serviços bancários corporativos e de investimento, que incluem gestão de caixa, soluções estruturadas de comércio e capital de giro, comércio e empréstimos, fusões e aquisições, mercados de capitais acionários, dívida com grau de investimento e de mercados emergentes e finanças estruturadas, bem como mercados de vendas, criação de mercado, comércio de energia, ações, pesquisa e mobilização e securitização de dívida privada. Além disso, a empresa oferece soluções de gestão de caixa, como cobranças, pagamentos, pagamentos instantâneos e serviços de folha de pagamento e custódia; programa advance, plataforma não financeira de apoio a empreendedores em conteúdos educacionais, cursos certificados, eventos com foco em gestão, inovação, internacionalização e desenvolvimento de equipes; financiamento de clientes através de depósitos e outros instrumentos de financiamento bancário; e vários investimentos. Oferece seus produtos e serviços por meio de agências, miniagências e caixas eletrônicos; centrais de atendimento; correspondentes bancários e fornecedores terceirizados; e plataformas bancárias online e móveis. A empresa foi fundada em 1970 e está sediada em São Paulo, Brasil.",https://www.santander.com.br,Financial Services,Serviços Financeiros,10.0,0.48645097,0.10524,0.057,122082211849.50734,16.299999237060547,Blue Chips,55,1.6299999237060547,24.44999885559082,33.33,36.0,Baixo,,🟢,16.420000076293945,-0.7308211856018644
BMEB3,MERCANTIL,"O Banco Mercantil do Brasil S.A., em conjunto com suas subsidiárias, presta serviços financeiros a clientes pessoas físicas e jurídicas no Brasil. Atua nos segmentos Financeiro, de Seguros e Intermediação Empresarial, Marketplace e Outros. A empresa oferece produtos de Conta Corrente, Empréstimos, Cartões, Investimentos, Cartões a Receber, Cheque Especial, Previdência Privada, Transferência de Benefícios, Limite Especial e Mercado de Capitais. Também oferece internet, WhatsApp, aplicativo Mercantil e serviços bancários de autoatendimento. Além disso, a empresa atua em atividades imobiliárias, securitização e tecnologia. A empresa era anteriormente conhecida como Banco Industrial de Minas Gerais e mudou seu nome para Banco Mercantil do Brasil S.A. em 1974. O Banco Mercantil do Brasil S.A. foi fundado em 1940 e está sediado em Belo Horizonte, Brasil.",https://bancomercantil.com.br,Financial Services,Serviços Financeiros,10.1227,3.006423,0.30315,0.0255,8526046320.0,66.0,Small Caps,20,6.5199996048485085,97.79999407272763,32.52,30.0,Médio,,🟡,73.63999938964844,-10.37479556351326
PSSA3,PORTO SEGURO EDJ,"A Porto Seguro S.A., em conjunto com suas subsidiárias, oferece uma gama de produtos e serviços de seguros no Brasil e no Uruguai. Oferece seguros de automóveis, residenciais, viagens, celular, vida, motocicleta, notebook e tablet, foto e vídeo, smart e games, moto, imobiliário, green card, fiança e mudança, além de resseguros, proteção combinada, responsabilidade civil profissional, máquinas e equipamentos, eventos, agronegócio e táxi. A empresa também atua na gestão e comercialização de títulos de capitalização; concessão de empréstimos e financiamentos para consumo e capital de giro; operação de cartões de crédito; gestão de grupos de consórcios para aquisição de bens móveis e imóveis; distribuição de cotas de fundos de investimento; manutenção, desenvolvimento e licenciamento de programas; instalação de sistemas de aquecimento, gás natural e gás liquefeito de petróleo; operação de centros de oncologia, hematologia e radioterapia; venda e distribuição de peças automotivas; e administração e gestão de carteiras de valores mobiliários, fundos de investimento e recursos financeiros. Além disso, presta serviços técnicos de corretagem de seguros; serviços de obtenção de crédito e financiamento ao consumo; suporte técnico para software e outros serviços de tecnologia da informação; serviços de intermediação e agência para serviços e empresas; serviços de cobrança de dívidas e informações de crédito; serviços de assessoria administrativa para médicos e seguradoras de saúde; serviços de consultoria e assessoria em saúde ocupacional, segurança no trabalho, ergonomia e serviços ambulatoriais; serviços relacionados com protecção e monitorização electrónica; e telemarketing e atendimento geral ao cliente. A empresa foi fundada em 1945 e está sediada em São Paulo, Brasil. A Porto Seguro S.A. opera como subsidiária da Porto Seguro Itaú Unibanco Participações S.A.",https://www.portoseguro.com.br,Financial Services,Serviços Financeiros,10.21689,2.1654055,0.22815001,0.047,34191854678.09925,53.22999954223633,Mid Caps,35,5.210000258614542,78.15000387921813,31.89,42.0,Baixo,,🟢,50.470001220703125,5.468591747132817
VIVA3,VIVARA S.A.,"A Vivara Participações S.A. atua na fabricação e comercialização de joias e outros artigos na América Latina. A empresa oferece produtos de joalheria, incluindo anéis, colares, alianças, brinquedos, solitários, brincos, correntes, correntes, pingentes e pulseiras. Também fornece relógios; acessórios, como óculos de sol, carteiras e porta-cartões, porta-passaportes e relógios, porta-joias, perfumes, abotoaduras, chaveiros, canetas e facas; e produtos para presente que incluem kits para presentear, quiz, formatura, infantil, mãe/avó e produtos customizáveis. A empresa vende seus produtos sob as marcas Vivara, Tag Heuer, Victorinox, Movado, Baume and Mercier, Bulova, Akium, Lacoste, Calvin Klein, Hugo Boss, Tommy Hilfiger, Olivia Burton, Festina, Adidas, Life By Vivara, Guess. Marcas Nautica, Porsche Design, Montblanc e Festina. Oferece seus produtos por meio de lojas e quiosques, bem como por meio de e-commerce. A Vivara Participações S.A. foi fundada em 1962 e está sediada em São Paulo, Brasil.",https://www.vivara.com.br,Consumer Cyclical,Consumo Cíclico,10.325757,2.1724577,0.22749001,0.049800000000000004,6408057703.443668,27.260000228881836,Small Caps,20,2.640000169370811,39.600002540562166,31.16,36.0,Baixo,,🟢,29.670000076293945,-8.122682309453975
LREN3,LOJAS RENNER,"A Lojas Renner S.A., em conjunto com suas subsidiárias, atua como empresa de moda e estilo de vida no Brasil, Argentina e Uruguai. Atua nos segmentos de Varejo e Produtos Financeiros. A empresa comercializa roupas e produtos esportivos, calçados, acessórios, perfumaria, eletrodomésticos, móveis, relógios, artigos para casa e decoração, entregas urbanas e soluções de gestão logística, além de cosméticos. Atua também na concessão de empréstimos a pessoas físicas e jurídicas, financiamento de compras, seguros e prática de recebíveis e contas a pagar inerentes a empresas de crédito, financiamento e investimento, comissões de intermediação de vendas, bem como na concessão de empréstimos pessoais. Oferece seus produtos por meio de lojas e canais digitais das marcas Renner, Youcom, Camicado, Realize, Ashua, Uello, Realize e Repasse. A Lojas Renner S.A. foi constituída em 1965 e está sediada em Porto Alegre, Brasil.",https://www.lojasrennersa.com.br/en/,Consumer Cyclical,Consumo Cíclico,10.916666,1.476611,0.13732,0.0567,15452137546.11874,15.720000267028809,Mid Caps,55,1.4400001123995925,21.600001685993888,27.22,26.0,Baixo,,🟢,15.470000267028809,1.6160309999013036
EKTR3,ELEKTRO,"A Elektro Redes S.A. atua na distribuição de energia elétrica no Brasil. A empresa era anteriormente conhecida como Elektro Eletricidade e Serviços S.A. e mudou seu nome para Elektro Redes S.A. em agosto de 2016. A empresa foi constituída em 1998 e está sediada em Campinas, Brasil. A Elektro Redes S.A. é subsidiária da Neoenergia S.A.",https://www.elektro.com.br,Utilities,Utilidades Públicas,10.959575,4.88988,0.47262,0.0745,9980539414.931507,51.5099983215332,Small Caps,35,4.699999618738246,70.49999428107368,26.94,38.0,Baixo,,🟢,48.7599983215332,5.639868939014208
REDE3,REDE ENERGIA,"A Rede Energia Participações S.A. atua na geração, distribuição e comercialização de energia elétrica no Brasil. A empresa atua na construção, operação, manutenção e serviços relacionados à geração e distribuição de energia elétrica. Oferece eletricidade a clientes residenciais, industriais, comerciais, rurais, governamentais e do setor público. A empresa foi constituída em 1929 e está sediada em Cataguases, Brasil.",https://www.energisa.com.br,Utilities,Utilidades Públicas,11.178572,2.5975103,0.25566998,0.0726,16076959123.955301,6.260000228881836,Mid Caps,50,0.5599999918488547,8.39999987773282,25.48,44.0,Baixo,,🟢,6.289999961853027,-0.47694329337250924
CPFE3,CPFL ENERGIA,"A CPFL Energia S.A., por meio de suas subsidiárias, atua como empresa de energia no Brasil. Atua nos segmentos de Distribuição, Geração, Transmissão, Comercialização e Serviços. A empresa gera eletricidade por meio de fontes hidrelétricas, solares, eólicas e de biomassa; e presta serviços de gestão e comercialização de energia, eficiência energética, geração distribuída, infraestrutura energética e consultoria. Também atua na construção, operação e manutenção de instalações de transmissão de energia elétrica. Em 31 de dezembro de 2024, a rede de distribuição da empresa era composta por 345.785 quilômetros de linhas de distribuição, incluindo 530.081 transformadores de distribuição, bem como 12.174 quilômetros de linhas de distribuição de alta tensão; e 594 subestações transformadoras de alta e média tensão com capacidade total de transformação de 20.363 MVA. Atendeu 10,7 milhões de clientes dos setores residencial, comercial e industrial em 687 municípios. A empresa foi fundada em 1912 e está sediada em Campinas, Brasil. A CPFL Energia S.A. é uma subsidiária da State Grid Brazil Power Participações S.A.",https://www.cpfl.com.br,Utilities,Utilidades Públicas,11.304622,2.7569425,0.25354,0.0693,62002812998.78067,53.810001373291016,Blue Chips,50,4.760000057789727,71.4000008668459,24.64,44.0,Baixo,,🟢,49.869998931884766,7.900546472414659
CMIG3,CEMIG,"A Companhia Energética de Minas Gerais - CEMIG, por meio de suas subsidiárias, atua na geração, transmissão, distribuição e comercialização de energia no Brasil. Em 31 de dezembro de 2024, a empresa operava 36 usinas hidrelétricas com capacidade total de 4.449,0 MW, 2 parques eólicos com capacidade total de 70,8 MW e 10 usinas fotovoltaicas com capacidade total de 158,99 MW; 357.044 milhas de linhas de distribuição; e 4.754 milhas de linhas de transmissão. Também atua na aquisição, transporte e distribuição de gás e seus subprodutos e derivados; venda e comercialização de energia; construção, implantação, operação e manutenção de transmissão de energia elétrica; comercialização e intermediação de negócios relacionados à energia; instalação, operação, manutenção e aluguel de usinas solares; e atividades de geração distribuída, serviços de conta, cogeração, eficiência energética e gestão de abastecimento e armazenamento. A empresa foi constituída em 1952 e está sediada em Belo Horizonte, Brasil.",https://www.cemig.com.br,Utilities,Utilidades Públicas,11.473684,1.9641606,0.1751,0.0705,56126580945.23978,19.6200008392334,Blue Chips,50,1.710000104520344,25.65000156780516,23.51,38.0,Baixo,,🟢,15.520000457763672,26.417527451932234
MILS3,MILLS,"A Mills Locação, Serviços e Logística S.A. atua como locadora de máquinas e equipamentos no Brasil. Aluga, vende, importa e exporta estruturas tubulares de aço e alumínio, escoramentos e equipamentos de acesso para obras de construção civil e formas de concreto reutilizáveis. A empresa também desenvolve projetos de engenharia relacionados e presta serviços de supervisão e montagem opcional. Além disso, vende, aluga e distribui plataformas elevatórias de trabalho, peças relacionadas, carros novos e usados. Também oferece máquinas pesadas, retroescavadeiras, rolos compactos, minicarregadeiras, rebocadores, geradores, compressores, tratores de esteira e agrícolas, escavadeiras, carregadeiras de rodas, motoniveladoras, empilhadeiras e porta-paletes. Além disso, fornece frete, manutenção, treinamento, telemetria, operação remota e serviços e soluções de consultoria. A empresa era anteriormente conhecida como Mills Estruturas e Serviços de Engenharia S.A. e mudou seu nome para Mills Locação, Serviços e Logística S.A. em julho de 2022. A Mills Locação, Serviços e Logística S.A. foi fundada em 1952 e tem sede no Rio de Janeiro, Brasil.",https://www.mills.com.br,Industrials,Indústria,11.488,2.0670793,0.19438,0.052300000000000006,3255679664.3623304,14.359999656677246,Small Caps,35,1.249999970114663,18.749999551719945,23.41,26.0,Baixo,,🟢,15.119999885559082,-5.026456578268247
CURY3,CURY S/A,"A Cury Construtora e Incorporadora S.A. atua no ramo imobiliário no Brasil. A empresa atua na venda de unidades imobiliárias; serviços de análise de crédito; empreendimentos imobiliários residenciais; aluguel de imóveis próprios; e prestação de serviços relativos a construção, fiscalização, estudos e projetos, além da execução de quaisquer obras de construção e engenharia civil. Também presta serviços de construção, administração, administração imobiliária e instalações elétricas e hidráulicas. A empresa foi fundada em 1963 e está sediada em São Paulo, Brasil.",https://cury.net,Real Estate,Imobiliário,12.036912,7.99777,0.7277,0.1389,11049666867.749672,35.869998931884766,Mid Caps,50,2.980000097357592,44.700001460363886,19.75,44.0,Baixo,,🟢,36.77999877929688,-2.4741704122196624
CEBR5,CEB A,"A Companhia Energética de Brasília - CEB, por meio de suas subsidiárias, atua na geração e distribuição de energia elétrica e gás no Brasil. Atua nos segmentos de Geração de Energia, Comercialização de Energia Elétrica, Iluminação Pública e Outros. A empresa produz energia elétrica a partir de usinas hidráulicas; distribui gás canalizado; serviços de iluminação pública; e fornece serviços de manutenção e expansão. Atua também na prestação de serviços de elaboração de estudos; projetos de engenharia; execução de obras de implantação, ampliação, reforma ou manutenção de redes aéreas e subterrâneas de transmissão e distribuição de energia elétrica; e instalação de sistemas de iluminação pública e elétrica predial. A empresa era anteriormente conhecida como Companhia de Eletricidade de Brasília e mudou seu nome para Companhia Energética de Brasília CEB em 1992. A Companhia Energética de Brasília CEB foi fundada em 1968 e está sediada em Brasília, Brasil.",https://www.ceb.com.br,Utilities,Utilidades Públicas,12.137651,2.172149,0.18968001,0.13140000000000002,2161015778.703518,29.979999542236328,Small Caps,35,2.4700001295338225,37.05000194300734,19.08,32.0,Baixo,,🟢,30.06999969482422,-0.29930214001093536
BMEB4,MERCANTIL,"O Banco Mercantil do Brasil S.A., em conjunto com suas subsidiárias, presta serviços financeiros a clientes pessoas físicas e jurídicas no Brasil. Atua nos segmentos Financeiro, de Seguros e Intermediação Empresarial, Marketplace e Outros. A empresa oferece produtos de Conta Corrente, Empréstimos, Cartões, Investimentos, Cartões a Receber, Cheque Especial, Previdência Privada, Transferência de Benefícios, Limite Especial e Mercado de Capitais. Também oferece internet, WhatsApp, aplicativo Mercantil e serviços bancários de autoatendimento. Além disso, a empresa atua em atividades imobiliárias, securitização e tecnologia. A empresa era anteriormente conhecida como Banco Industrial de Minas Gerais e mudou seu nome para Banco Mercantil do Brasil S.A. em 1974. O Banco Mercantil do Brasil S.A. foi fundado em 1940 e está sediado em Belo Horizonte, Brasil.",https://bancomercantil.com.br,Financial Services,Serviços Financeiros,12.603369,3.7489185,0.30315,0.0225,10154184746.326263,82.30000305175781,Mid Caps,35,6.53000027625612,97.9500041438418,15.98,32.0,Médio,,🟡,87.25,-5.673348937813396
ENGI4,ENERGISA,"A Energisa S.A., por meio de suas subsidiárias, atua na geração, transmissão e distribuição de energia elétrica no Brasil. A empresa gera eletricidade por meio de projetos hidráulicos, solares e eólicos. Também fornece gás natural para empresas e gás natural veicular, bem como serviços de valor agregado. Além disso, a empresa desenvolve atividades de inspeção termográfica aérea e corretagem de seguros. A empresa foi fundada em 1905 e está sediada em Cataguases, Brasil. A Energisa S.A. atua como subsidiária da Gipar S.A.",https://www.energisa.com.br,Utilities,Utilidades Públicas,12.724137,0.20040189,0.14495,0.0591,27835727972.189606,11.069999694824219,Mid Caps,55,0.870000039674535,13.050000595118025,15.17,32.0,Baixo,,🟢,10.399999618530272,6.442308662205812
