Ticker,Empresa,Resumo,Site,setor_original,Setor,PL,PVP,ROE,DivYield,MarketCap,Preco,Categoria,CNPJ,Score,LucroPorAcao,PrecoJusto,Desconto_%,Ranking,Risco,Risco_num,Farol,Preco_antigo,Variacao_%
BLAU3,BLAU EJ,"Blau Farmacêutica S.A., uma empresa farmacêutica fornece medicamentos no Brasil, Argentina, Chile, Colômbia, Uruguai, Equador, Peru e Estados Unidos. Seus produtos abrangem diversas áreas, como imunologia, hematologia, oncologia, nefrologia, infectologia e anestesiologia. A empresa oferece estimuladores uterinos, antirreumáticos, anestésicos, antibióticos, cuidados com a saúde feminina, biofarmacêuticos, oncológicos, produtos hospitalares, antivirais e antirretrovirais, biológicos, inibidores de bomba de ácido, hemoderivados, antitrombóticos e trombolíticos. A Blau Farmacêutica S.A. foi constituída em 1987 e está sediada em Cotia, Brasil.",https://www.blau.com,Healthcare,Saúde,7.9843755,1.039146,0.1347,0.0674,2360619494.1784143,10.220000267028809,Small Caps,Não disponível,65,1.2799999532873685,19.199999299310527,46.77,30.0,Baixo,,🟢,10.699999809265137,-4.485977110211686
SAPR3,SANEPAR,"A Companhia de Saneamento do Paraná - SANEPAR presta serviços de saneamento no Brasil. A empresa atua na distribuição de água; coleta e tratamento de esgoto e resíduos sólidos; estudo, projeto e obras de novas instalações; expansão das redes de distribuição de água; e redes de coleta e tratamento de esgoto. Presta ainda serviços de consultoria e assistência técnica nas suas áreas de atuação. A Companhia de Saneamento do Paraná - SANEPAR foi fundada em 1963 e está sediada em Curitiba, Brasil.",https://www.sanepar.com.br,Utilities,Utilidades Públicas,8.054264,0.25432026,0.17944999,0.0207,15701425861.241241,10.390000343322754,Mid Caps,Não disponível,85,1.2899999730978218,19.349999596467327,46.3,42.0,Baixo,,🟢,9.510000228881836,9.253418435978169
BPAC5,BTGP BANCO A,"O Banco BTG Pactual S.A. fornece produtos e serviços financeiros relativos a carteiras comerciais, de investimentos, de crédito, de financiamento, de arrendamento mercantil, de seguros e de câmbio no Brasil e internacionalmente. A empresa também oferece serviços de investimento pessoal para uma carteira de investimentos customizada; serviços de contas bancárias internacionais, incluindo cartão de débito, transferência, pagamento e recebimento, e serviços de suporte ao cliente. Também fornece serviços de gestão de patrimônio, como execução, pesquisa de mercado, recursos e análises educacionais e gestão de relacionamento; gestão do patrimônio familiar; contas correntes e de poupança, certificados de depósito, contas de aposentadoria e contas do mercado monetário; financiamento imobiliário; bem como empréstimos corporativos, empréstimos a prazo, linhas de crédito e financiamento de credores. O Banco BTG Pactual S.A. foi fundado em 1983 e está sediado no Rio de Janeiro, Brasil. O Banco BTG Pactual S.A. opera como subsidiária do BTG Pactual Holding Financeira Ltda.",https://www.btgpactual.com,Financial Services,Serviços Financeiros,8.057143,0.7758443,0.23868,0.042800000000000005,130708741538.24239,11.279999732971191,Blue Chips,Não disponível,85,1.3999999420354325,20.99999913053149,46.29,54.0,Baixo,,🟢,11.380000114440918,-0.8787379654138028
NEOE3,NEOENERGIA,"A Neoenergia S.A. gera, transmite, distribui, comercializa e comercializa energia elétrica no Brasil. Opera através de Redes, Renováveis, Liberalizadas e Outros. A empresa fornece soluções para o mercado livre de energia, como gestão de energia, sistemas de medição e cobrança, certificados de energia renovável e contratos de longo prazo; hidrogênio verde, que inclui amônia verde, aço e metanol; soluções de gases industriais; usina solar; e soluções de frota eletrificada para empresas. Também oferece cobrança de energia solar, seguros e serviços para clientes residenciais. A empresa foi fundada em 1997 e está sediada no Rio de Janeiro, Brasil. A Neoenergia S.A. é uma subsidiária da Iberdrola Energía, S.A.U.",https://www.neoenergia.com,Utilities,Utilidades Públicas,8.060387,1.1111851,0.14588,0.0438,40504412869.28467,33.369998931884766,Mid Caps,Não disponível,65,4.1399995970273835,62.09999395541075,46.26,30.0,Baixo,,🟢,32.939998626708984,1.3054047453029367
CLSC4,CELESC EJ,"A Centrais Elétricas de Santa Catarina S.A., por meio de suas subsidiárias, atua na geração, transmissão e comercialização de energia elétrica no Brasil. Possui principalmente usinas hidrelétricas. A empresa foi fundada em 1955 e está sediada em Florianópolis, Brasil.",https://www.celesc.com.br,Utilities,Utilidades Públicas,8.101458,1.4047586,0.19097,0.0562,5574752000.145538,144.52999877929688,Small Caps,Não disponível,85,17.839998526104424,267.59997789156637,45.99,36.0,Baixo,,🟢,147.75,-2.1793578481916245
EKTR4,ELEKTRO,"A Elektro Redes S.A. atua na distribuição de energia elétrica no Brasil. A empresa era anteriormente conhecida como Elektro Eletricidade e Serviços S.A. e mudou seu nome para Elektro Redes S.A. em agosto de 2016. A empresa foi constituída em 1998 e está sediada em Campinas, Brasil. A Elektro Redes S.A. é subsidiária da Neoenergia S.A.",https://www.elektro.com.br,Utilities,Utilidades Públicas,8.25532,3.683311,0.47262,0.1076,7517859334.173412,38.79999923706055,Small Caps,Não disponível,60,4.699999423046054,70.49999134569082,44.96,42.0,Baixo,,🟢,39.5,-1.7721538302264634
TGMA3,TEGMA,"A Tegma Gestão Logística S.A., em conjunto com suas subsidiárias, presta serviços logísticos no Brasil. Atua nos segmentos de Logística Automotiva e Logística Integrada. O segmento de Logística Automotiva atua no transporte e distribuição de veículos novos e usados; transferências portuárias; e gerenciamento de pátio e estoque para montadoras, além de serviços de pré-entrega de veículos. O segmento de Logística Integrada fornece serviços de transporte, armazenamento e gerenciamento de estoque para produtos químicos, eletrodomésticos e bens de consumo. A empresa também oferece logística e centro automotivo, gerenciamento de pátio, transporte e armazenamento de veículos, logística integrada, gerenciamento da cadeia de suprimentos de produtos químicos, gerenciamento de embalagens, intralogística e serviços de projetos especiais. Atende indústrias de alimentos e bebidas, automotiva, cosmética, eletrodomésticos, farmacêutica e química e petroquímica. A empresa foi fundada em 1969 e está sediada em São Bernardo do Campo, Brasil.",https://www.tegma.com.br,Industrials,Indústria,8.380435,2.3314183,0.27091998,0.147,2033520898.5413055,30.84000015258789,Small Caps,Não disponível,60,3.679999922747195,55.19999884120793,44.13,42.0,Baixo,,🟢,36.84999847412109,-16.309358399984415
WHRL3,WHIRLPOOL,"A Whirlpool S.A. fabrica, vende, importa e exporta eletrodomésticos no Brasil. A empresa oferece geladeiras, freezers, condicionadores de ar, máquinas de fazer gelo, fogões, lava-louças, trituradores de lixo, compactadores de lixo, aspiradores de pó, máquinas de lavar, secadoras de roupas e fornos de micro-ondas. Comercializa seus produtos com as marcas Brastemp, Consul, KitchenAind, Compra Certa, B.blend, Jenn-Air, KitchenAid, Whirlpool e Maytag. A empresa foi fundada em 1957 e está sediada em São Paulo, Brasil. A Whirlpool S.A. opera como subsidiária da Whirlpool Corporation.",https://www.whirlpool.com.br,Consumer Cyclical,Consumo Cíclico,8.574469,2.826087,0.30252,0.1297,6119352254.943407,4.03000020980835,Small Caps,Não disponível,60,0.46999997432008317,7.049999614801248,42.84,42.0,Baixo,,🟢,4.349999904632568,-7.35631498482178
SBFG3,GRUPO SBF,"O Grupo SBF S.A. comercializa no varejo e atacado produtos esportivos e de lazer no Brasil. Oferece calçados, roupas, equipamentos esportivos e acessórios. Também presta serviços de logística; e organização de corridas e eventos esportivos sob as marcas Xterra e Uphill. Além disso, a empresa atua nos negócios de filmes publicitários e produção audiovisual. Além disso, opera uma plataforma de dança e uma rede de canais de esportes. A empresa comercializa seus produtos esportivos e de lazer por meio de lojas físicas e canais de comércio eletrônico. O Grupo SBF S.A. foi fundado em 1981 e está sediado em São Paulo, Brasil.",https://ri.gruposbf.com.br,Consumer Cyclical,Consumo Cíclico,8.707143,0.8604503,0.10802,0.0463,2806938944.8466616,12.1899995803833,Small Caps,Não disponível,50,1.399999928838116,20.99999893257174,41.95,30.0,Baixo,,🟢,12.3100004196167,-0.9748240060347206
RANI3,IRANI,"A Irani Papel e Embalagem S.A. fabrica e comercializa papelão ondulado e papéis para embalagens no Brasil e no exterior. Atua por meio de três segmentos: Embalagens Sustentáveis; Segmento Papel para Embalagens Sustentáveis; e RS Florestal. A empresa oferece caixas e folhas de papelão leve, corrugado e pesado; e papéis kraft de baixa e alta densidade e papéis reciclados. Também presta serviços florestais e de reflorestamento; e cultivo de pinus para comercialização de madeira em tora. A Irani Papel e Embalagem S.A. foi fundada em 1941 e está sediada em Porto Alegre, Brasil.",https://irani.com.br,Consumer Cyclical,Consumo Cíclico,8.781817,1.5335767,0.18021,0.048,2226641740.368305,9.65999984741211,Small Caps,Não disponível,45,1.1000001306577112,16.500001959865667,41.45,30.0,Baixo,,🟢,9.56999969482422,0.9404404959026694
ALUP4,ALUPAR,"A Alupar Investimento S.A., em conjunto com suas subsidiárias, atua na transmissão, geração e comercialização de energia no Brasil, Colômbia, Peru e Chile. Atua nos segmentos de Transmissão e Geração. A empresa detém participação em concessões de 44 sistemas de transmissão de energia elétrica, totalizando 9.999 quilômetros de linhas de transmissão; e opera linhas aéreas e subestações. Também atua na geração de energia renovável por meio de hidrelétricas, parques eólicos e usinas fotovoltaicas, que possuem capacidade instalada de 798,5 MW. A empresa foi constituída em 2006 e está sediada em São Paulo, Brasil. A Alupar Investimento S.A. é uma subsidiária da Guarupart Participações Ltda.",https://www.alupar.com.br,Utilities,Utilidades Públicas,8.870968,0.39566922,0.14265001,0.0229,10877686611.0,11.0,Mid Caps,Não disponível,65,1.2399999639272739,18.599999458909107,40.86,30.0,Baixo,,🟢,10.989999771118164,0.09099389526937612
BEES3,BANESTES EJ,"O Banestes S.A - Banco do Estado do Espírito Santo S.A., em conjunto com suas subsidiárias, atua como banco múltiplo no Brasil. Opera através do Financeiro; e Seguros e Outros segmentos. A empresa atua por meio de suas carteiras de comércio, rural, industrial, imobiliário, câmbio, arrendamento, investimento e administração de cartões de crédito; e nas áreas de seguros e distribuição, intermediação e administração de recursos de terceiros. Também fornece gestão de ativos e fundos; administração e intermediação de valores mobiliários, seguros, previdência e capitalização; fundos de investimento; cartões de crédito e débito; banco pela internet; conta corrente, poupança, especial, cheque fiduciário, jovem e universitário, conta mais fácil, simplificada, salário e judicial; títulos de capitalização; seguro de carro, vida, casa, acidentes pessoais, proteção financeira de cartão e seguro empresarial; cobranças e convênios; transferência de fundos e recursos; coleção; custódia; opções de crédito e financiamento; empréstimos e garantias; e outros serviços. Além disso, a empresa opera um serviço público de loteria. Banestes S.A - Banco do Estado do Espírito Santo S.A. foi fundado em 1935 e está sediado em Vitória, Brasil.",https://www.banestes.com.br,Financial Services,Serviços Financeiros,8.89796,1.2505379,0.14352,0.0395,3030236245.913618,8.720000267028809,Small Caps,Não disponível,50,0.9799999401018671,14.699999101528006,40.68,24.0,Baixo,,🟢,8.630000114440918,1.0428754506884634
SMTO3,SAO MARTINHO,"A São Martinho S.A., em conjunto com suas subsidiárias, atua na produção e comercialização de açúcar, etanol e outros subprodutos da cana-de-açúcar no Brasil. A empresa atua nos segmentos de Açúcar, Etanol, Etanol de Cormo, Energia Elétrica, Negócios Imobiliários, Leveduras e Outros Produtos. Oferece uma variedade de açúcar bruto; etanol hidratado, utilizado em tanques de carros movidos a etanol; etanol anidro, utilizado como aditivo à gasolina em veículos movidos a gasolina; e o etanol industrial, utilizado principalmente na produção de tintas, cosméticos e bebidas alcoólicas. A empresa também gera energia elétrica a partir do bagaço da cana-de-açúcar; fornece subprodutos, incluindo leveduras utilizadas na alimentação animal; oferece óleo fúsel usado como solvente e amilaetanol puro; e SMartLiO, substituto do óleo de soja utilizado na produção de biocombustíveis, tintas e produtos químicos, além de Grãos Secos de Destilaria com Solúveis, nutrição animal para ruminantes, porcos, cavalos, pássaros, peixes e animais de estimação. Além disso, atua no cultivo de cana-de-açúcar; desenvolvimento de imóveis; importação e exportação de bens, produtos e matérias-primas; produções agrícolas; e investimento em outras empresas. A empresa foi fundada em 1914 e está sediada em São Paulo, Brasil. A São Martinho S.A. é uma subsidiária da LJN Participações S.A.",https://www.saomartinho.com.br,Basic Materials,Materiais Básicos,8.99138,0.9300459,0.11124,0.0426,6733051047.2651825,20.860000610351562,Small Caps,Não disponível,50,2.3199998899336434,34.79999834900465,40.06,30.0,Baixo,,🟢,18.459999084472656,13.001092334276606
BEES4,BANESTES EJ,"O Banestes S.A - Banco do Estado do Espírito Santo S.A., em conjunto com suas subsidiárias, atua como banco múltiplo no Brasil. Opera através do Financeiro; e Seguros e Outros segmentos. A empresa atua por meio de suas carteiras de comércio, rural, industrial, imobiliário, câmbio, arrendamento, investimento e administração de cartões de crédito; e nas áreas de seguros e distribuição, intermediação e administração de recursos de terceiros. Também fornece gestão de ativos e fundos; administração e intermediação de valores mobiliários, seguros, previdência e capitalização; fundos de investimento; cartões de crédito e débito; banco pela internet; conta corrente, poupança, especial, cheque fiduciário, jovem e universitário, conta mais fácil, simplificada, salário e judicial; títulos de capitalização; seguro de carro, vida, casa, acidentes pessoais, proteção financeira de cartão e seguro empresarial; cobranças e convênios; transferência de fundos e recursos; coleção; custódia; opções de crédito e financiamento; empréstimos e garantias; e outros serviços. Além disso, a empresa opera um serviço público de loteria. Banestes S.A - Banco do Estado do Espírito Santo S.A. foi fundado em 1935 e está sediado em Vitória, Brasil.",https://www.banestes.com.br,Financial Services,Serviços Financeiros,9.061224,1.2734834,0.14352,0.0391,3099094598.7395525,8.880000114440918,Small Caps,Não disponível,50,0.9800000656027176,14.700000984040763,39.59,24.0,Baixo,,🟢,8.800000190734863,0.9090900224102623
KEPL3,KEPLER WEBER,"A Kepler Weber S.A. fornece equipamentos para armazenamento de grãos e soluções pós-colheita de grãos no Brasil, nas Américas, na África, na Europa e na Ásia. Atua em cinco segmentos: Fazendas, Agroindústria, Portos e Terminais, Reposição e Serviços e Negócios Internacionais. A empresa oferece sistemas de armazenamento e preservação de grãos, como silos, secadores e transportadores, além de máquinas de limpeza. Também fornece equipamentos para commodities agrícolas, como etanol de milho, óleo de soja, ração animal, moinhos de trigo, indústrias de arroz, complexos cooperativos, produtores de cereais e canteiros; equipamentos industriais; e terminais portuários. Além disso, a empresa oferece peças de reposição e serviços de assistência técnica; serviços de engenharia técnica e processamento de dados; serviços de seguros contra riscos de engenharia; e serviços de monitoramento de temperatura e umidade de grãos no processo de processamento e armazenamento. Além disso, importa e exporta matérias-primas e produtos acabados e semiacabados. A empresa foi fundada em 1925 e está sediada em São Paulo, Brasil.",https://www.kepler.com.br,Industrials,Indústria,9.066667,1.8267293,0.20629999,0.0666,1414387869.5516586,8.15999984741211,Small Caps,Não disponível,60,0.8999999500822197,13.499999251233294,39.56,42.0,Baixo,,🟢,8.369999885559082,-2.5089610635394353
SANB3,SANTANDER BR,"O Banco Santander (Brasil) S.A., em conjunto com suas subsidiárias, fornece diversos produtos e serviços bancários para pessoas físicas, pequenas e médias empresas e clientes corporativos no Brasil e internacionalmente. Atua em dois segmentos, Banco Comercial e Banco Global de Atacado. A empresa oferece produtos de pagamento e fidelidade, incluindo cartões de crédito e débito; crédito consignado e imobiliário; soluções de financiamento de home equity; programas de microfinanciamento; consórcios; produtos do agronegócio, como crédito, valores mobiliários e outros produtos; call center e soluções digitais; ativos inadimplentes; e produtos de seguros que abrangem seguros de vida, acidentes pessoais, automóveis, patrimoniais e de crédito, bem como seguros de viagens e transações bancárias. Também oferece soluções emergenciais para residências, carros, motocicletas, animais de estimação e telemedicina; financiamento ao consumo; e serviços bancários corporativos e de investimento, que incluem gestão de caixa, soluções estruturadas de comércio e capital de giro, comércio e empréstimos, fusões e aquisições, mercados de capitais acionários, dívida com grau de investimento e de mercados emergentes e finanças estruturadas, bem como mercados de vendas, criação de mercado, comércio de energia, ações, pesquisa e mobilização e securitização de dívida privada. Além disso, a empresa oferece soluções de gestão de caixa, como cobranças, pagamentos, pagamentos instantâneos e serviços de folha de pagamento e custódia; programa advance, plataforma não financeira de apoio a empreendedores em conteúdos educacionais, cursos certificados, eventos com foco em gestão, inovação, internacionalização e desenvolvimento de equipes; financiamento de clientes através de depósitos e outros instrumentos de financiamento bancário; e vários investimentos. Oferece seus produtos e serviços por meio de agências, miniagências e caixas eletrônicos; centrais de atendimento; correspondentes bancários e fornecedores terceirizados; e plataformas bancárias online e móveis. A empresa foi fundada em 1970 e está sediada em São Paulo, Brasil.",https://www.santander.com.br,Financial Services,Serviços Financeiros,9.147239,0.44496837,0.10524,0.059000000000000004,111671524248.25146,14.90999984741211,Blue Chips,Não disponível,80,1.6300000303274145,24.450000454911216,39.02,36.0,Baixo,,🟢,15.960000038146973,-6.5789485477769025
TAEE3,TAESA,"A Transmissora Aliança de Energia Elétrica S.A., em conjunto com suas subsidiárias, atua na construção, operação e manutenção de linhas de transmissão de energia elétrica no Brasil. Opera uma extensão total de aproximadamente 15.319 quilômetros (km) de linhas de transmissão, que incluem 14.677 km de linhas de transmissão em operação e 735 km de linhas em construção; 113 subestações com tensão entre 230 e 525KV; e um centro de operação do sistema localizado no Rio de Janeiro. A empresa foi fundada em 2000 e está sediada no Rio de Janeiro, Brasil.",https://institucional.taesa.com.br/,Utilities,Utilidades Públicas,9.163399,0.6347625,0.21719,0.0794,14489624501.517254,14.020000457763672,Mid Caps,Não disponível,100,1.5299999986646518,22.949999979969775,38.91,60.0,Baixo,,🟢,14.270000457763672,-1.7519270636321957
ISAE3,ISA ENERGIA,"ISA Energía Brasil S.A. engages in the electric power transmission business in Brazil. As of December 31, 2024, it had a total installed transformation capacity of 85,000 MVA together with transmission lines of 23, 0000 kilometers; and 136 substations. It operates in the states of Alagoas, Bahia, Espírito Santo, Goiás, Maranhão, Mato Grosso, Mato Grosso do Sul, Minas Gerais, Paraíba, Paraná, Pernambuco, Piauí, Rio de Janeiro, Rio Grande do Sul, Rondônia, Santa Catarina, São Paulo, and Tocantins. ISA Energía Brasil S.A. was incorporated in 1999 and is headquartered in São Paulo, Brazil.",https://www.isacteep.com.br,Utilities,Utilidades Públicas,9.342318,1.0796834,0.12099,0.077,22836895216.102386,34.65999984741211,Mid Caps,Não disponível,80,3.7100000072157795,55.65000010823669,37.72,36.0,Baixo,,🟢,32.0099983215332,8.278668118817874
WHRL4,WHIRLPOOL,"A Whirlpool S.A. fabrica, vende, importa e exporta eletrodomésticos no Brasil. A empresa oferece geladeiras, freezers, condicionadores de ar, máquinas de fazer gelo, fogões, lava-louças, trituradores de lixo, compactadores de lixo, aspiradores de pó, máquinas de lavar, secadoras de roupas e fornos de micro-ondas. Comercializa seus produtos com as marcas Brastemp, Consul, KitchenAind, Compra Certa, B.blend, Jenn-Air, KitchenAid, Whirlpool e Maytag. A empresa foi fundada em 1957 e está sediada em São Paulo, Brasil. A Whirlpool S.A. opera como subsidiária da Whirlpool Corporation.",https://www.whirlpool.com.br,Consumer Cyclical,Consumo Cíclico,9.361702,3.0855541,0.30252,0.1246,6612258569.716842,4.400000095367432,Small Caps,Não disponível,60,0.4700000165960668,7.050000248941003,37.59,42.0,Baixo,,🟢,4.599999904632568,-4.347822030685715
TAEE4,TAESA,"A Transmissora Aliança de Energia Elétrica S.A., em conjunto com suas subsidiárias, atua na construção, operação e manutenção de linhas de transmissão de energia elétrica no Brasil. Opera uma extensão total de aproximadamente 15.319 quilômetros (km) de linhas de transmissão, que incluem 14.677 km de linhas de transmissão em operação e 735 km de linhas em construção; 113 subestações com tensão entre 230 e 525KV; e um centro de operação do sistema localizado no Rio de Janeiro. A empresa foi fundada em 2000 e está sediada no Rio de Janeiro, Brasil.",https://institucional.taesa.com.br/,Utilities,Utilidades Públicas,9.418301,0.65242,0.21719,0.0873,14892687591.910915,14.40999984741211,Mid Caps,Não disponível,100,1.529999927525369,22.949998912880535,37.21,60.0,Baixo,,🟢,14.5600004196167,-1.0302236805054894
SANB4,SANTANDER BR,"O Banco Santander (Brasil) S.A., em conjunto com suas subsidiárias, fornece diversos produtos e serviços bancários para pessoas físicas, pequenas e médias empresas e clientes corporativos no Brasil e internacionalmente. Atua em dois segmentos, Banco Comercial e Banco Global de Atacado. A empresa oferece produtos de pagamento e fidelidade, incluindo cartões de crédito e débito; crédito consignado e imobiliário; soluções de financiamento de home equity; programas de microfinanciamento; consórcios; produtos do agronegócio, como crédito, valores mobiliários e outros produtos; call center e soluções digitais; ativos inadimplentes; e produtos de seguros que abrangem seguros de vida, acidentes pessoais, automóveis, patrimoniais e de crédito, bem como seguros de viagens e transações bancárias. Também oferece soluções emergenciais para residências, carros, motocicletas, animais de estimação e telemedicina; financiamento ao consumo; e serviços bancários corporativos e de investimento, que incluem gestão de caixa, soluções estruturadas de comércio e capital de giro, comércio e empréstimos, fusões e aquisições, mercados de capitais acionários, dívida com grau de investimento e de mercados emergentes e finanças estruturadas, bem como mercados de vendas, criação de mercado, comércio de energia, ações, pesquisa e mobilização e securitização de dívida privada. Além disso, a empresa oferece soluções de gestão de caixa, como cobranças, pagamentos, pagamentos instantâneos e serviços de folha de pagamento e custódia; programa advance, plataforma não financeira de apoio a empreendedores em conteúdos educacionais, cursos certificados, eventos com foco em gestão, inovação, internacionalização e desenvolvimento de equipes; financiamento de clientes através de depósitos e outros instrumentos de financiamento bancário; e vários investimentos. Oferece seus produtos e serviços por meio de agências, miniagências e caixas eletrônicos; centrais de atendimento; correspondentes bancários e fornecedores terceirizados; e plataformas bancárias online e móveis. A empresa foi fundada em 1970 e está sediada em São Paulo, Brasil.",https://www.santander.com.br,Financial Services,Serviços Financeiros,9.552147,0.46466514,0.10524,0.061900000000000004,116614729460.75293,15.569999694824219,Blue Chips,Não disponível,80,1.6300000088801208,24.45000013320181,36.32,42.0,Baixo,,🟢,16.420000076293945,-5.176616184654579
