Ticker,Empresa,Resumo,Site,setor_original,Setor,PL,PVP,ROE,DivYield,MarketCap,Preco,Categoria,Score,LucroPorAcao,PrecoJusto,Desconto_%,Ranking,Risco,Risco_num,Farol,Preco_antigo,Variacao_%
CLSC4,CELESC,"A Centrais Elétricas de Santa Catarina S.A., por meio de suas subsidiárias, atua na geração, transmissão e comercialização de energia elétrica no Brasil. A empresa possui principalmente usinas hidrelétricas. A Centrais Elétricas de Santa Catarina S.A. foi fundada em 1955 e tem sede em Florianópolis, Brasil.",https://www.celesc.com.br,Utilities,Utilidades Públicas,7.8926973,1.3084418,0.18175,0.0564,5418923031.4700775,140.49000549316406,Small Caps,85,17.799999183189765,266.9999877478465,47.38,36.0,Baixo,,🟢,147.75,-4.913701865878807
INTB3,INTELBRAS,"A Intelbras S.A. - Indústria de Telecomunicações Eletrônica Brasileira atua na fabricação, desenvolvimento e comercialização de equipamentos de segurança eletrônica e serviços de vigilância e monitoramento eletrônicos no Brasil. A empresa atua por meio de três segmentos: Segurança, Tecnologia da Informação e Comunicação (TIC) e Energia. Oferece produtos e soluções de segurança eletrônica, inclusive Oferece produtos e soluções de segurança eletrônica, incluindo alarmes, armazenamento, câmeras, comunicação condominial, controle de acesso corporativo, fechaduras, gravadores de vídeo digital, produtos contra incêndio e intercomunicação, monitoramento de veículos, sensores, sinalização de emergência, produtos de software e aplicativos e acessórios; e os produtos e soluções de redes incluem produtos 5G e Wi-Fi corporativo, racks, roteadores, switches, rádios externos, fibra óptica e produtos passivos, injetores PoE, adaptadores USB, software e aplicativos e cabos. A empresa também fornece produtos e soluções relacionados à comunicação, como webcams, projetores, mouses e teclados sem fio, soluções em nuvem, antenas e conversores, centrais telefônicas, produtos para eletrodomésticos e conferências, gateways, fones de ouvido, rádios comunicadores, caixas e controles inteligentes, alto-falantes inteligentes, software e aplicativos e telefones; e produtos e soluções relacionados à energia que incluem carregadores de veículos elétricos, UPS, baterias, smart, fontes, protetores eletrônicos, protetores contra surtos, acessórios USB e sensores de presença de iluminação. Além disso, oferece soluções on grid, que incluem painéis solares, estruturas de fixação, inversores on grid, string boxes e acessórios; e soluções fora da rede, como produtos de iluminação, estruturas de montagem, gabinetes externos, acionamentos e painéis solares, bombas solares e geradores e inversores fora da rede. A Intelbras S.A. - Indústria de Telecomunicações Eletrônica Brasileira foi constituída em 1974 e está sediada em São José, Brasil.",https://www.intelbras.com,Industrials,Indústria,7.897727,1.4468616,0.18765,0.1009,4548234304.178867,13.899999618530273,Small Caps,85,1.7600000124757762,26.400000187136644,47.35,42.0,Baixo,,🟢,13.970000267028809,-0.5010783619220585
BMEB3,MERCANTIL,"O Banco Mercantil do Brasil S.A., em conjunto com suas subsidiárias, presta serviços financeiros a clientes pessoas físicas e jurídicas no Brasil. Atua nos segmentos Financeiro, de Seguros e Intermediação Empresarial, Marketplace e Outros. A empresa oferece produtos de Conta Corrente, Empréstimos, Cartões, Investimentos, Cartões a Receber, Cheque Especial, Previdência Privada, Transferência de Benefícios, Limite Especial e Mercado de Capitais. Também oferece internet, WhatsApp, aplicativo Mercantil e serviços bancários de autoatendimento. Além disso, a empresa atua em atividades imobiliárias, securitização e tecnologia. A empresa era anteriormente conhecida como Banco Industrial de Minas Gerais e mudou seu nome para Banco Mercantil do Brasil S.A. em 1974. O Banco Mercantil do Brasil S.A. foi fundado em 1940 e está sediado em Belo Horizonte, Brasil.",https://bancomercantil.com.br,Financial Services,Serviços Financeiros,8.016688,2.5779154,0.32384998,0.0269,8067448472.558441,62.45000076293945,Small Caps,45,7.79000015504401,116.85000232566014,46.56,30.0,Médio,,🟡,73.63999938964844,-15.195544160042404
SANB3,SANTANDER BR,"O Banco Santander (Brasil) S.A., em conjunto com suas subsidiárias, fornece diversos produtos e serviços bancários para pessoas físicas, pequenas e médias empresas e clientes corporativos no Brasil e internacionalmente. Atua em dois segmentos, Banco Comercial e Banco Global de Atacado. A empresa oferece produtos de pagamento e fidelidade, incluindo cartões de crédito e débito; crédito consignado e imobiliário; soluções de financiamento de home equity; programas de microfinanciamento; consórcios; produtos do agronegócio, como crédito, valores mobiliários e outros produtos; call center e soluções digitais; ativos inadimplentes; e produtos de seguros que abrangem seguros de vida, acidentes pessoais, automóveis, patrimoniais e de crédito, bem como seguros de viagens e transações bancárias. Também oferece soluções emergenciais para residências, carros, motocicletas, animais de estimação e telemedicina; financiamento ao consumo; e serviços bancários corporativos e de investimento, que incluem gestão de caixa, soluções estruturadas de comércio e capital de giro, comércio e empréstimos, fusões e aquisições, mercados de capitais acionários, dívida com grau de investimento e de mercados emergentes e finanças estruturadas, bem como mercados de vendas, criação de mercado, comércio de energia, ações, pesquisa e mobilização e securitização de dívida privada. Além disso, a empresa oferece soluções de gestão de caixa, como cobranças, pagamentos, pagamentos instantâneos e serviços de folha de pagamento e custódia; programa advance, plataforma não financeira de apoio a empreendedores em conteúdos educacionais, cursos certificados, eventos com foco em gestão, inovação, internacionalização e desenvolvimento de equipes; financiamento de clientes através de depósitos e outros instrumentos de financiamento bancário; e vários investimentos. Oferece seus produtos e serviços por meio de agências, miniagências e caixas eletrônicos; centrais de atendimento; correspondentes bancários e fornecedores terceirizados; e plataformas bancárias online e móveis. A empresa foi fundada em 1970 e está sediada em São Paulo, Brasil.",https://www.santander.com.br,Financial Services,Serviços Financeiros,8.036586,0.39037973,0.10467,0.064,98684343537.16263,13.180000305175781,Blue Chips,80,1.6399999085651273,24.59999862847691,46.42,42.0,Baixo,,🟢,15.960000038146973,-17.418544651168823
WHRL3,WHIRLPOOL,"A Whirlpool S.A. fabrica, vende, importa e exporta eletrodomésticos no Brasil. A empresa oferece refrigeradores, freezers, refrigeradores-freezer, condicionadores de ar, máquinas de fazer gelo, fogões, lava-louças, trituradores e compactadores de lixo, compactadores de lixo e aspiradores de pó. Também realiza manutenção e reparo de produtos e peças elétricas; serviços de eletrônica, hidráulica, metalurgia, produtos químicos e ferro, pintura e construção; assessoria orçamentária; serviços auxiliares nas áreas de segurança, saúde, lazer, vida cotidiana e bem-estar; marketing e publicidade; intermediação na comercialização de produtos; venda de assinaturas por meio eletrônico; e atividades de comercialização de roupas, acessórios, utensílios para casa e cozinha e outros produtos. Comercializa seus produtos com as marcas Brastemp, Consul, KitchenAind, Compra Certa, B.blend e Insinkerator. A empresa foi fundada em 1957 e está sediada em São Paulo, Brasil. A Whirlpool S.A. opera como subsidiária da Whirlpool Corporation.",https://www.whirlpool.com.br,Consumer Cyclical,Consumo Cíclico,8.361702,3.2292523,0.14189,0.1317,5905949103.901789,3.930000066757202,Small Caps,40,0.47000001515925854,7.050000227388878,44.26,24.0,Baixo,,🟢,4.349999904632568,-9.65516889846558
DIRR3,DIRECIAL,"A Direcional Engenharia S.A. atua no desenvolvimento e construção de projetos imobiliários residenciais de médio e baixo custo, principalmente no Brasil. A empresa tem como foco a incorporação, construção e comercialização de unidades habitacionais para famílias de baixa e média renda. A empresa foi fundada em 1981 e está sediada em Belo Horizonte, Brasil.",https://direcional.com.br,Real Estate,Imobiliário,8.396227,3.6149473,0.42945,0.1978,6943680442.76227,13.350000381469727,Small Caps,60,1.5899999346694327,23.84999902004149,44.03,42.0,Baixo,,🟢,13.510000228881836,-1.1843067705510457
MILS3,MILLS,"A Mills Locação, Serviços e Logística S.A. atua como locadora de máquinas e equipamentos no Brasil. Aluga, vende, importa e exporta estruturas tubulares de aço e alumínio, escoramentos e equipamentos de acesso para obras de construção civil e formas de concreto reutilizáveis. A empresa também desenvolve projetos de engenharia relacionados e presta serviços de supervisão e montagem opcional. Além disso, vende, aluga e distribui plataformas elevatórias de trabalho, peças relacionadas, carros novos e usados. Também oferece máquinas pesadas, retroescavadeiras, rolos compactos, minicarregadeiras, rebocadores, geradores, compressores, tratores de esteira e agrícolas, escavadeiras, carregadeiras de rodas, motoniveladoras, empilhadeiras e porta-paletes. Além disso, fornece frete, manutenção, treinamento, telemetria, operação remota e serviços e soluções de consultoria. A empresa era anteriormente conhecida como Mills Estruturas e Serviços de Engenharia S.A. e mudou seu nome para Mills Locação, Serviços e Logística S.A. em julho de 2022. A Mills Locação, Serviços e Logística S.A. foi fundada em 1952 e tem sede no Rio de Janeiro, Brasil.",https://www.mills.com.br,Industrials,Indústria,8.5,1.9572726,0.26311,0.0784,3480356007.187269,15.300000190734863,Small Caps,60,1.8000000224393957,27.000000336590936,43.33,42.0,Baixo,,🟢,15.119999885559082,1.1904782178450757
TGMA3,TEGMA,"A Tegma Gestão Logística S.A., em conjunto com suas subsidiárias, presta serviços logísticos no Brasil. Atua nos segmentos de Logística Automotiva e Logística Integrada. O segmento de Logística Automotiva atua no transporte e distribuição de veículos novos e usados; transferências portuárias; e gerenciamento de pátio e estoque para montadoras, além de serviços de pré-entrega de veículos. O segmento de Logística Integrada fornece serviços de transporte, armazenamento e gerenciamento de estoque para produtos químicos, eletrodomésticos e bens de consumo. A empresa também oferece logística e centro automotivo, gerenciamento de pátio, transporte e armazenamento de veículos, logística integrada, gerenciamento da cadeia de suprimentos de produtos químicos, gerenciamento de embalagens, intralogística e serviços de projetos especiais. Atende indústrias de alimentos e bebidas, automotiva, cosmética, eletrodomésticos, farmacêutica e química e petroquímica. A empresa foi fundada em 1969 e está sediada em São Bernardo do Campo, Brasil.",https://www.tegma.com.br,Industrials,Indústria,8.506926,2.222785,0.25372,0.14429999999999998,2024948948.4621658,30.709999084472656,Small Caps,60,3.609999556181946,54.14999334272919,43.29,42.0,Baixo,,🟢,36.84999847412109,-16.66214285995266
WHRL4,WHIRLPOOL,"A Whirlpool S.A. fabrica, vende, importa e exporta eletrodomésticos no Brasil. A empresa oferece refrigeradores, freezers, refrigeradores-freezer, condicionadores de ar, máquinas de fazer gelo, fogões, lava-louças, trituradores e compactadores de lixo, compactadores de lixo e aspiradores de pó. Também realiza manutenção e reparo de produtos e peças elétricas; serviços de eletrônica, hidráulica, metalurgia, produtos químicos e ferro, pintura e construção; assessoria orçamentária; serviços auxiliares nas áreas de segurança, saúde, lazer, vida cotidiana e bem-estar; marketing e publicidade; intermediação na comercialização de produtos; venda de assinaturas por meio eletrônico; e atividades de comercialização de roupas, acessórios, utensílios para casa e cozinha e outros produtos. Comercializa seus produtos com as marcas Brastemp, Consul, KitchenAind, Compra Certa, B.blend e Insinkerator. A empresa foi fundada em 1957 e está sediada em São Paulo, Brasil. A Whirlpool S.A. opera como subsidiária da Whirlpool Corporation.",https://www.whirlpool.com.br,Consumer Cyclical,Consumo Cíclico,8.531916,3.294988,0.14189,0.13699999999999998,6026172228.02042,4.010000228881836,Small Caps,40,0.4699999658789228,7.0499994881838415,43.12,24.0,Baixo,,🟢,4.599999904632568,-12.826080173535559
PSSA3,PORTO SEGURO,"A Porto Seguro S.A., em conjunto com suas subsidiárias, oferece uma gama de produtos e serviços de seguros no Brasil e no Uruguai. Oferece seguros de automóveis, residenciais, viagens, celular, vida, motocicleta, notebook e tablet, foto e vídeo, smart e games, moto, imobiliário, green card, fiança e mudança, além de resseguros, proteção combinada, responsabilidade civil profissional, máquinas e equipamentos, eventos, agronegócio e táxi. A empresa também atua na gestão e comercialização de títulos de capitalização; concessão de empréstimos e financiamentos para consumo e capital de giro; operação de cartões de crédito; gestão de grupos de consórcios para aquisição de bens móveis e imóveis; distribuição de cotas de fundos de investimento; manutenção, desenvolvimento e licenciamento de programas; instalação de sistemas de aquecimento, gás natural e gás liquefeito de petróleo; operação de centros de oncologia, hematologia e radioterapia; venda e distribuição de peças automotivas; e administração e gestão de carteiras de valores mobiliários, fundos de investimento e recursos financeiros. Além disso, presta serviços técnicos de corretagem de seguros; serviços de obtenção de crédito e financiamento ao consumo; suporte técnico para software e outros serviços de tecnologia da informação; serviços de intermediação e agência para serviços e empresas; serviços de cobrança de dívidas e informações de crédito; serviços de assessoria administrativa para médicos e seguradoras de saúde; serviços de consultoria e assessoria em saúde ocupacional, segurança no trabalho, ergonomia e serviços ambulatoriais; serviços relacionados com protecção e monitorização electrónica; e telemarketing e atendimento geral ao cliente. A empresa foi fundada em 1945 e está sediada em São Paulo, Brasil. A Porto Seguro S.A. opera como subsidiária da Porto Seguro Itaú Unibanco Participações S.A.",https://www.portoseguro.com.br,Financial Services,Serviços Financeiros,8.580986,2.00882,0.2516,0.0513,31311202022.54859,48.7400016784668,Mid Caps,75,5.680000139665395,85.20000209498093,42.79,42.0,Baixo,,🟢,50.470001220703125,-3.4277778886335173
VIVA3,VIVARA S.A.,"A Vivara Participações S.A. atua na fabricação e comercialização de joias e outros artigos na América Latina. A empresa oferece produtos de joalheria, incluindo anéis, colares, alianças, brinquedos, solitários, brincos, correntes, correntes, pingentes e pulseiras. Também fornece relógios; acessórios, como óculos de sol, carteiras e porta-cartões, porta-passaportes e relógios, porta-joias, perfumes, abotoaduras, chaveiros, canetas e facas; e produtos para presente que incluem kits para presentear, quiz, formatura, infantil, mãe/avó e produtos customizáveis. A empresa vende seus produtos sob as marcas Vivara, Tag Heuer, Victorinox, Movado, Baume and Mercier, Bulova, Akium, Lacoste, Calvin Klein, Hugo Boss, Tommy Hilfiger, Olivia Burton, Festina, Adidas, Life By Vivara, Guess. Marcas Nautica, Porsche Design, Montblanc e Festina. Oferece seus produtos por meio de lojas e quiosques, bem como por meio de e-commerce. A Vivara Participações S.A. foi fundada em 1962 e está sediada em São Paulo, Brasil.",https://www.vivara.com.br,Consumer Cyclical,Consumo Cíclico,8.5943775,1.705451,0.20746,0.0634,5030536751.327219,21.399999618530273,Small Caps,60,2.489999958522915,37.34999937784372,42.7,42.0,Baixo,,🟢,29.670000076293945,-27.87327413716903
EQPA3,EQTL PARA,"Equatorial Pará Distribuidora de Energia S.A. engages in the distribution of electricity in the state of Pará, Brazil. It serves residential, industrial, commercial, rural, public authority, public lighting service, and public service customers. The company was formerly known as Centrais Elétricas do Pará S.A. and changed its name to Equatorial Pará Distribuidora de Energia S.A. in December 2019. The company was founded in 1962 and is headquartered in Belém, Brazil. Equatorial Pará Distribuidora de Energia S.A. is a subsidiary of Equatorial Energia Distribuição S.A.",https://pa.equatorialenergia.com.br,Utilities,Utilidades Públicas,8.614286,2.3938072,0.28202,0.0223,13320716725.692171,6.03000020980835,Mid Caps,60,0.7000000011386144,10.500000017079216,42.57,36.0,Médio,,🟡,6.389999866485596,-5.633797561802463
TAEE3,TAESA,"A Transmissora Aliança de Energia Elétrica S.A., em conjunto com suas subsidiárias, atua na construção, operação e manutenção de linhas de transmissão de energia elétrica no Brasil. Opera uma extensão total de aproximadamente 15.319 quilômetros (km) de linhas de transmissão, que incluem 14.677 km de linhas de transmissão em operação e 642 km de linhas em construção; 113 subestações com tensão entre 230 e 525KV; e um centro de operação do sistema localizado no Rio de Janeiro. A empresa foi fundada em 2000 e está sediada no Rio de Janeiro, Brasil.",https://institucional.taesa.com.br/,Utilities,Utilidades Públicas,8.618422,0.5670014,0.20559,0.056900000000000006,13538807439.347712,13.100000381469727,Mid Caps,100,1.5199998771781802,22.799998157672704,42.54,54.0,Baixo,,🟢,14.270000457763672,-8.199019192444387
SANB4,SANTANDER BR,"O Banco Santander (Brasil) S.A., em conjunto com suas subsidiárias, fornece diversos produtos e serviços bancários para pessoas físicas, pequenas e médias empresas e clientes corporativos no Brasil e internacionalmente. Atua em dois segmentos, Banco Comercial e Banco Global de Atacado. A empresa oferece produtos de pagamento e fidelidade, incluindo cartões de crédito e débito; crédito consignado e imobiliário; soluções de financiamento de home equity; programas de microfinanciamento; consórcios; produtos do agronegócio, como crédito, valores mobiliários e outros produtos; call center e soluções digitais; ativos inadimplentes; e produtos de seguros que abrangem seguros de vida, acidentes pessoais, automóveis, patrimoniais e de crédito, bem como seguros de viagens e transações bancárias. Também oferece soluções emergenciais para residências, carros, motocicletas, animais de estimação e telemedicina; financiamento ao consumo; e serviços bancários corporativos e de investimento, que incluem gestão de caixa, soluções estruturadas de comércio e capital de giro, comércio e empréstimos, fusões e aquisições, mercados de capitais acionários, dívida com grau de investimento e de mercados emergentes e finanças estruturadas, bem como mercados de vendas, criação de mercado, comércio de energia, ações, pesquisa e mobilização e securitização de dívida privada. Além disso, a empresa oferece soluções de gestão de caixa, como cobranças, pagamentos, pagamentos instantâneos e serviços de folha de pagamento e custódia; programa advance, plataforma não financeira de apoio a empreendedores em conteúdos educacionais, cursos certificados, eventos com foco em gestão, inovação, internacionalização e desenvolvimento de equipes; financiamento de clientes através de depósitos e outros instrumentos de financiamento bancário; e vários investimentos. Oferece seus produtos e serviços por meio de agências, miniagências e caixas eletrônicos; centrais de atendimento; correspondentes bancários e fornecedores terceirizados; e plataformas bancárias online e móveis. A empresa foi fundada em 1970 e está sediada em São Paulo, Brasil.",https://www.santander.com.br,Financial Services,Serviços Financeiros,8.628049,0.4191102,0.10467,0.06559999999999999,105947146515.42172,14.149999618530273,Blue Chips,80,1.6399999140628747,24.59999871094312,42.48,42.0,Baixo,,🟢,16.420000076293945,-13.8246068648985
TAEE4,TAESA,"A Transmissora Aliança de Energia Elétrica S.A., em conjunto com suas subsidiárias, atua na construção, operação e manutenção de linhas de transmissão de energia elétrica no Brasil. Opera uma extensão total de aproximadamente 15.319 quilômetros (km) de linhas de transmissão, que incluem 14.677 km de linhas de transmissão em operação e 642 km de linhas em construção; 113 subestações com tensão entre 230 e 525KV; e um centro de operação do sistema localizado no Rio de Janeiro. A empresa foi fundada em 2000 e está sediada no Rio de Janeiro, Brasil.",https://institucional.taesa.com.br/,Utilities,Utilidades Públicas,8.690789,0.57176244,0.20559,0.0564,13652491723.83477,13.210000038146973,Mid Caps,100,1.5200000872356896,22.800001308535343,42.06,54.0,Baixo,,🟢,14.5600004196167,-9.271980374745525
CPFE3,CPFL ENERGIA,"A CPFL Energia S.A., por meio de suas subsidiárias, atua como empresa de energia no Brasil. Atua nos segmentos de Distribuição, Geração, Transmissão, Comercialização e Serviços. A empresa gera eletricidade por meio de fontes hidrelétricas, solares, eólicas e de biomassa; e presta serviços de gestão e comercialização de energia, eficiência energética, geração distribuída, infraestrutura energética e consultoria. Também atua na construção, operação e manutenção de instalações de transmissão de energia elétrica. Em 31 de dezembro de 2024, a rede de distribuição da empresa era composta por 345.785 quilômetros de linhas de distribuição, incluindo 530.081 transformadores de distribuição, bem como 12.174 quilômetros de linhas de distribuição de alta tensão; e 594 subestações transformadoras de alta e média tensão com capacidade total de transformação de 20.363 MVA. Atendeu 10,7 milhões de clientes dos setores residencial, comercial e industrial em 687 municípios. A empresa foi fundada em 1912 e está sediada em Campinas, Brasil. A CPFL Energia S.A. é uma subsidiária da State Grid Brazil Power Participações S.A.",https://www.cpfl.com.br,Utilities,Utilidades Públicas,8.7,2.0628824,0.24763,0.0858,50123068140.0,43.5,Blue Chips,75,5.0,75.0,42.0,48.0,Baixo,,🟢,49.869998931884766,-12.773208478679269
BPAC5,BTGP BANCO A,"O Banco BTG Pactual S.A. fornece produtos e serviços financeiros relativos a carteiras comerciais, de investimentos, de crédito, de financiamento, de arrendamento mercantil, de seguros e de câmbio no Brasil e internacionalmente. A empresa também oferece serviços de investimento pessoal para uma carteira de investimentos customizada; serviços de contas bancárias internacionais, incluindo cartão de débito, transferência, pagamento e recebimento, e serviços de suporte ao cliente. Também fornece serviços de gestão de patrimônio, como execução, pesquisa de mercado, recursos e análises educacionais e gestão de relacionamento; gestão do patrimônio familiar; contas correntes e de poupança, certificados de depósito, contas de aposentadoria e contas do mercado monetário; financiamento imobiliário; bem como empréstimos corporativos, empréstimos a prazo, linhas de crédito e financiamento de credores. O Banco BTG Pactual S.A. foi fundado em 1983 e está sediado no Rio de Janeiro, Brasil. O Banco BTG Pactual S.A. opera como subsidiária do BTG Pactual Holding Financeira Ltda.",https://www.btgpactual.com,Financial Services,Serviços Financeiros,8.880795,0.8676242,0.2484,0.0347,155390447302.92422,13.40999984741211,Blue Chips,85,1.5099999321470778,22.649998982206167,40.79,54.0,Baixo,,🟢,11.380000114440918,17.838310303663143
