Ticker,Empresa,Resumo,Site,setor_original,Setor,PL,PVP,ROE,DivYield,MarketCap,Preco,Categoria,Score,LucroPorAcao,PrecoJusto,Desconto_%,Ranking,Risco,Risco_num,Farol,Preco_antigo,Variacao_%
CEBR3,CEB,"A Companhia Energética de Brasília - CEB, por meio de suas subsidiárias, gera e distribui energia elétrica e gás no Brasil. A empresa atua nos segmentos de Geração de Energia, Comercialização de Energia Elétrica, Iluminação Pública e Outros. A empresa produz energia elétrica a partir de usinas hidráulicas; distribui gás canalizado; serviços de iluminação pública; e fornece serviços de manutenção e expansão. Atua também na prestação de serviços de elaboração de estudos; projetos de engenharia; execução de obras de implantação, ampliação, reforma ou manutenção de redes aéreas e subterrâneas de transmissão e distribuição de energia elétrica; e instalação de sistemas de iluminação pública e elétrica predial. A empresa era anteriormente conhecida como Companhia de Eletricidade de Brasília e mudou seu nome para Companhia Energética de Brasília CEB em 1992. A Companhia Energética de Brasília CEB foi fundada em 1968 e está sediada em Brasília, Brasil.",https://www.ceb.com.br,Utilities,Utilidades Públicas,11.779279,1.9931402,0.16638,0.151,1884942049.7529316,26.149999618530273,Small Caps,35,2.220000020249989,33.30000030374983,21.47,32.0,Baixo,,🟢,31.520000457763672,-17.036804445574546
REDE3,REDE ENERGIA,"A Rede Energia Participações S.A. atua na geração, distribuição e comercialização de energia elétrica no Brasil. A empresa atua na construção, operação, manutenção e serviços relacionados à geração e distribuição de energia elétrica. Oferece eletricidade a clientes residenciais, industriais, comerciais, rurais, governamentais e do setor público. A empresa foi constituída em 1929 e está sediada em Cataguases, Brasil.",https://www.energisa.com.br,Utilities,Utilidades Públicas,11.92,2.3954985,0.23211999,0.0755,15306497362.409218,5.960000038146973,Mid Caps,50,0.5000000032002494,7.500000048003741,20.53,44.0,Baixo,,🟢,6.289999961853027,-5.246421712359392
ENGI4,ENERGISA,"A Energisa S.A., por meio de suas subsidiárias, atua na geração, transmissão e distribuição de energia elétrica no Brasil. A empresa gera eletricidade por meio de projetos hidráulicos, solares e eólicos. Também fornece gás natural para empresas e gás natural veicular, bem como serviços de valor agregado. Além disso, a empresa desenvolve atividades de inspeção termográfica aérea e corretagem de seguros. A empresa foi fundada em 1905 e está sediada em Cataguases, Brasil. A Energisa S.A. atua como subsidiária da Gipar S.A.",https://www.energisa.com.br,Utilities,Utilidades Públicas,12.013887,0.16827811,0.12091,0.07490000000000001,21747980588.90213,8.649999618530273,Mid Caps,55,0.7200000814499314,10.800001221748971,19.91,38.0,Baixo,,🟢,10.399999618530272,-16.826923694130947
BPAC5,BTGP BANCO A,"O Banco BTG Pactual S.A. fornece produtos e serviços financeiros relativos a carteiras comerciais, de investimentos, de crédito, de financiamento, de arrendamento mercantil, de seguros e de câmbio no Brasil e internacionalmente. A empresa também oferece serviços de investimento pessoal para uma carteira de investimentos customizada; serviços de contas bancárias internacionais, incluindo cartão de débito, transferência, pagamento e recebimento, e serviços de suporte ao cliente. Também fornece serviços de gestão de patrimônio, como execução, pesquisa de mercado, recursos e análises educacionais e gestão de relacionamento; gestão do patrimônio familiar; contas correntes e de poupança, certificados de depósito, contas de aposentadoria e contas do mercado monetário; financiamento imobiliário; bem como empréstimos corporativos, empréstimos a prazo, linhas de crédito e financiamento de credores. O Banco BTG Pactual S.A. foi fundado em 1983 e está sediado no Rio de Janeiro, Brasil. O Banco BTG Pactual S.A. opera como subsidiária do BTG Pactual Holding Financeira Ltda.",https://www.btgpactual.com,Financial Services,Serviços Financeiros,12.059602,1.1781832,0.2484,0.0258,211011180859.0453,18.209999084472656,Blue Chips,60,1.5100000053461677,22.650000080192516,19.6,38.0,Baixo,,🟢,11.380000114440918,60.01756503819935
BMOB3,BEMOBI TECH,"Bemobi Mobile Tech S.A., uma empresa de tecnologia, fornece soluções e plataformas móveis para pagamentos digitais, engajamento de clientes, microfinanças e serviços digitais no Brasil e internacionalmente. A empresa oferece Bemobi Pay, que inclui checkouts inteligentes que oferecem solução white-label e customizável, orquestração de meios de pagamento e múltiplos métodos de pagamento; Smart POS, que aceita pagamentos; Orquestração de pagamentos que otimiza pagamentos e conecta negócios a vários provedores, aumenta as taxas de aprovação e reduz fraudes; e simplificar o gerenciamento de pagamentos. Ele também fornece Grace, uma plataforma de pagamentos conversacionais com IA; soluções de engajamento digital para ISPs de telecomunicações e MNOS de telecomunicações; e Agenda Edu SuperApp, ferramenta de comunicação, engajamento e finanças escolares. Além disso, a empresa oferece soluções de microfinanças e assinaturas digitais para telecomunicações MNOS; e Wave, plataforma digital nativa para telecomunicações; e soluções de pontuação móvel para empresas de telecomunicações e finanças. Atende MNOs e ISPs de telecomunicações, serviços públicos, educação, saúde e setores financeiros. A Bemobi Mobile Tech S.A. foi constituída em 2007 e está sediada no Rio de Janeiro, Brasil.",https://www.bemobi.com.br,Communication Services,Comunicação,12.276596,2.0108032,0.15548,0.0767,1914910873.3900127,23.079999923706055,Small Caps,35,1.8799999546866293,28.19999932029944,18.16,32.0,Baixo,,🟢,24.540000915527344,-5.949474072339964
TIMS3,TIM,"A TIM S.A. atua no setor de telecomunicações no Brasil. Oferece serviços de telefonia fixa comutada nas modalidades de longa distância local, nacional e internacional, bem como serviços de comunicação pessoal móvel e multimídia. A empresa está sediada no Rio de Janeiro, Brasil. A TIM S.A. é uma subsidiária da TIM Brasil Serviços e Participações S.A.",https://www.tim.com.br,Communication Services,Comunicação,12.391062,2.1696177,0.17724001,0.0712,52980664110.92372,22.18000030517578,Blue Chips,50,1.7899999455394366,26.84999918309155,17.39,38.0,Baixo,,🟢,27.26000022888184,-18.63536273313682
GGPS3,GPS,"A GPS Participações e Empreendimentos S.A., em conjunto com suas subsidiárias, fornece facilities, segurança, logística interna, engenharia de utilidades, serviços industriais, alimentação, mão de obra temporária, marketing de campo e serviços de infraestrutura no Brasil. A empresa oferece serviços de segurança patrimonial; serviços de higiene e limpeza; serviços de catering; serviços de segurança eletrônica, implantação, operação e manutenção predial; serviços de hotéis marítimos; serviços de cozinha e venda de refeições; manutenção industrial; serviços de manutenção de rodovias; participação em sociedades mediante aquisição de ações ou quotas de capital; administração e gestão trabalhista; e consultoria financeira e assessoria empresarial na área de planejamento de eventos promocionais. Também atua na venda e distribuição de brindes promocionais; corretagem de seguros gerais, seguros de vida, seguros de saúde, seguros de pensões e capitalização; manutenção de redes telefônicas, manutenção de acessos e instalação de sistemas de telecomunicações; e construção de rede de distribuição de energia e manutenção de atividades de redes energizadas. A GPS Participações e Empreendimentos S.A. foi fundada em 1962 e está sediada em São Paulo, Brasil.",https://gpssa.com.br,Industrials,Indústria,12.425532,2.1317759,0.17129,0.046,8787453917.759148,11.680000305175781,Small Caps,20,0.9400000181220234,14.10000027183035,17.16,26.0,Baixo,,🟢,18.31999969482422,-36.24453875686677
ALPA3,ALPARGATAS,"A Alpargatas S.A. fabrica e comercializa calçados e acessórios no Brasil e no exterior. A empresa oferece seus produtos com as marcas Havaianas, ioasys e Rothys. A empresa era anteriormente conhecida como São Paulo Alpargatas S.A. e mudou seu nome para Alpargatas S.A. em 2010. A empresa foi fundada em 1907 e está sediada em São Paulo, Brasil.",https://www.alpargatas.com.br,Consumer Cyclical,Consumo Cíclico,12.44186,2.0976279,0.16464001,0.048,7267467540.652388,10.699999809265137,Small Caps,20,0.8600000168194415,12.900000252291623,17.05,26.0,Baixo,,🟢,11.020000457763672,-2.9038170163876202
CEBR6,CEB B,"A Companhia Energética de Brasília - CEB, por meio de suas subsidiárias, gera e distribui energia elétrica e gás no Brasil. A empresa atua nos segmentos de Geração de Energia, Comercialização de Energia Elétrica, Iluminação Pública e Outros. A empresa produz energia elétrica a partir de usinas hidráulicas; distribui gás canalizado; serviços de iluminação pública; e fornece serviços de manutenção e expansão. Atua também na prestação de serviços de elaboração de estudos; projetos de engenharia; execução de obras de implantação, ampliação, reforma ou manutenção de redes aéreas e subterrâneas de transmissão e distribuição de energia elétrica; e instalação de sistemas de iluminação pública e elétrica predial. A empresa era anteriormente conhecida como Companhia de Eletricidade de Brasília e mudou seu nome para Companhia Energética de Brasília CEB em 1992. A Companhia Energética de Brasília CEB foi fundada em 1968 e está sediada em Brasília, Brasil.",https://www.ceb.com.br,Utilities,Utilidades Públicas,12.68018,2.1455793,0.16638,0.158,2029105879.7529316,28.149999618530273,Small Caps,35,2.2200000014613575,33.30000002192036,15.47,32.0,Baixo,,🟢,31.200000762939453,-9.775644454573499
PNVL3,DIMED,"A Dimed S.A. Distribuidora de Medicamentos comercializa medicamentos, perfumarias, produtos de higiene pessoal e beleza, cosméticos e dermocosméticos no Brasil. Vende seus produtos em lojas físicas do setor varejista. A Dimed S.A. Distribuidora de Medicamentos foi fundada em 1920 e está sediada em Eldorado do Sul, Brasil.",https://www.grupopanvel.com.br,Healthcare,Saúde,12.761363,1.2871059,0.10398,0.0315,1673540159.2721977,11.229999542236328,Small Caps,25,0.8800000080113957,13.200000120170936,14.92,16.0,Baixo,,🟢,11.229999542236328,0.0
FLRY3,FLEURY,"Fleury S.A., em conjunto com suas subsidiárias, presta serviços de diagnóstico por imagem, análises clínicas, fertilidade e infusões no Brasil. Atua em dois segmentos, Medicina Diagnóstica e Medicina Integrada. A empresa também presta serviços de gestão em saúde, como telemedicina; serviços de medicina ortopédica; apoio laboratorial; exame toxicológico; soluções preventivas, integradas e pesquisas clínicas em oncologia; soluções integradas, pesquisa, desenvolvimento de processos e serviços em genômica; e serviços de análises laboratoriais. Além disso, opera plataforma de saúde, centro de infusão de imunobiológicos e centros de atendimento oftalmológico. Fleury S.A. foi fundada em 1926 e está sediada em São Paulo, Brasil.",https://ri.fleury.com.br,Healthcare,Saúde,13.068966,1.5902654,0.11672,0.12539999999999998,8241373230.329224,15.15999984741211,Small Caps,15,1.1599999454748073,17.39999918212211,12.87,16.0,Baixo,,🟢,16.350000381469727,-7.278290558367842
CXSE3,CAIXA SEGURI,"A Caixa Seguridade Participações S.A., em conjunto com suas subsidiárias, oferece produtos de seguros no Brasil e internacionalmente. A empresa atua em três segmentos: Escoamento/Mar Aberto, Segurança e Distribuição. Oferece produtos de seguros de vida, residencial e habitacional, acidentes pessoais e isenção de dívidas para pessoas físicas; e produtos de seguros de vida, residenciais e habitacionais, automóveis e credores para empresas. A empresa também oferece seguridade social, incluindo planos de previdência privada e corporativa; capitalização; consórcio; e corretagem e intermediação de produtos de segurança. Além disso, atua na aquisição de participação societária ou holding; administração, comercialização e prestação de planos privados de saúde e odontológicos; estruturação, administração e comercialização de cartas de crédito; e operações de resseguro e retrocessão. A empresa foi constituída em 2015 e está sediada em Brasília, Brasil. A Caixa Seguridade Participações S.A. atua como subsidiária da Caixa Econômica Federal.",https://www.caixaseguridade.com.br,Financial Services,Serviços Financeiros,13.29452,4.227837,0.31588,0.0721,58229999542.23633,19.40999984741211,Blue Chips,50,1.460000048697667,21.900000730465006,11.37,40.0,Baixo,,🟢,18.06999969482422,7.415606946422397
SAUD3,BRADSAUDE,"A Bradsaúde S.A. oferece planos privados de assistência odontológica no Brasil. A empresa atua nos segmentos Corporativo, Pequena e Média Empresa (PME), Pessoa Física e Outros. A empresa administra e vende planos de assistência odontológica para empresas e/ou pessoas físicas. Também atua em serviços de assessoria comercial, consultoria e gestão empresarial; desenvolve e licencia programas de software; comércio atacadista e varejista de produtos e equipamentos, saneantes, medicamentos, medicamentos, insumos farmacêuticos e correlatos; prestação de serviços de armazenamento, carregamento, organização, arrumação, guarda de mercadorias, serviços de programação técnica e administrativa, bem como gestão geral de bens e negócios. Além disso, a empresa atua na integração de tecnologias para desenvolver soluções odontológicas; e prestar serviços especializados relacionados a acidentes e doenças, além de serviços atuariais, financeiros, administrativos, comerciais e de gerenciamento de riscos. A empresa era anteriormente conhecida como Odontoprev S.A. e mudou seu nome para Bradsaúde S.A. em abril de 2026. A Bradsaúde S.A. foi fundada em 1987 e está sediada em Barueri, Brasil. A Bradsaúde S.A. atua como subsidiária da Bradesco Saúde S.A.",https://www.bradescori.com.br/en/bradesco/bradsaude/,Healthcare,Saúde,13.365385,5.2912064,0.40374002,0.0725,7576795077.463451,13.899999618530273,Small Caps,35,1.0399999415303243,15.599999122954864,10.9,34.0,Baixo,,🟢,13.899999618530272,1.2779545957916184e-14
PASS3,COMPASS,"A Compass Gás e Energia S.A. atua na distribuição e promoção de gás natural no Brasil. A empresa atua por meio de dois segmentos operacionais: Distribuição de Gás e Comercialização e Serviços. Atua na distribuição de gás natural canalizado, na originação, na comercialização e na infraestrutura de abastecimento de gás, bem como no desenvolvimento de soluções alinhadas à transição energética, incluindo projetos de biometano. A empresa atende clientes dos setores residencial, comercial, industrial, automotivo, cogeração e geração termelétrica. A empresa foi fundada em 2012 e está sediada em São Paulo, Brasil. A Compass Gás e Energia S.A. é uma subsidiária da Cosan Dez Participações S.A.",https://www.compassbr.com,Utilities,Utilidades Públicas,14.393064,3.1051252,0.18847999,0.050499999999999996,17783333093.058098,24.899999618530273,Mid Caps,50,1.7299999234721857,25.949998852082786,4.05,24.0,Baixo,,🟢,24.899999618530277,-1.426792663947117e-14
EGIE3,ENGIE BRASIL,"A Engie Brasil Energia S.A., em conjunto com suas subsidiárias, desenvolve atividades de geração, comercialização, comercialização e transmissão no Brasil. A empresa também atua no negócio de transporte de gás. Em 31 de dezembro de 2025, opera um parque gerador de 12.384,5 MW composto por 133 usinas, sendo 13 hidrelétricas e 120 complementares, além de uma usina de biomassa, 88 eólicas, duas hidrelétricas e 29 solares. A empresa foi fundada em 2005 e está sediada em Florianópolis, Brasil. A Engie Brasil Energia S.A. é uma subsidiária da ENGIE Brasil Participações Ltda.",https://www.engie.com.br,Utilities,Utilidades Públicas,14.933332,2.8218694,0.20204,0.0536,38381239146.5903,33.599998474121094,Mid Caps,50,2.2500000987134747,33.750001480702124,0.44,30.0,Baixo,,🟢,33.060001373291016,1.6333849921323313
BPAC3,BTGP BANCO,"O Banco BTG Pactual S.A. fornece produtos e serviços financeiros relativos a carteiras comerciais, de investimentos, de crédito, de financiamento, de arrendamento mercantil, de seguros e de câmbio no Brasil e internacionalmente. A empresa também oferece serviços de investimento pessoal para uma carteira de investimentos customizada; serviços de contas bancárias internacionais, incluindo cartão de débito, transferência, pagamento e recebimento, e serviços de suporte ao cliente. Também fornece serviços de gestão de patrimônio, como execução, pesquisa de mercado, recursos e análises educacionais e gestão de relacionamento; gestão do patrimônio familiar; contas correntes e de poupança, certificados de depósito, contas de aposentadoria e contas do mercado monetário; financiamento imobiliário; bem como empréstimos corporativos, empréstimos a prazo, linhas de crédito e financiamento de credores. O Banco BTG Pactual S.A. foi fundado em 1983 e está sediado no Rio de Janeiro, Brasil. O Banco BTG Pactual S.A. opera como subsidiária do BTG Pactual Holding Financeira Ltda.",https://www.btgpactual.com,Financial Services,Serviços Financeiros,15.178808,1.4829192,0.2484,0.0206,265589045828.7879,22.920000076293945,Blue Chips,60,1.5099999997558402,22.649999996337602,-1.19,30.0,Baixo,,🟢,22.920000076293945,0.0
ALPA4,ALPARGATAS,"A Alpargatas S.A. fabrica e comercializa calçados e acessórios no Brasil e no exterior. A empresa oferece seus produtos com as marcas Havaianas, ioasys e Rothys. A empresa era anteriormente conhecida como São Paulo Alpargatas S.A. e mudou seu nome para Alpargatas S.A. em 2010. A empresa foi fundada em 1907 e está sediada em São Paulo, Brasil.",https://www.alpargatas.com.br,Consumer Cyclical,Consumo Cíclico,15.255814,2.5720448,0.16464001,0.049,8911137850.591433,13.119999885559082,Small Caps,20,0.8599999898765861,12.899999848148791,-1.71,18.0,Baixo,,🟢,11.460000038146973,14.485164414366997
B3SA3,B3,"B3 S.A. - Brasil, Bolsa, Balcão, empresa de infraestrutura para o mercado financeiro, presta serviços de negociação em ambiente de bolsa e balcão. Atua por meio de mercados, soluções de análise de dados, soluções de mercado de capitais e segmentos de tecnologia e plataformas. A empresa organizou mercados de títulos, como ações, contratos financeiros, índices, taxas, moedas, energia, transporte, commodities e transações de liquidação à vista e futura. Também fornece soluções tecnológicas para os mercados de seguros, resseguros, previdência e títulos de capitalização; serviços de processamento e análise de dados, incluindo padronização, cotações e estatísticas; apoia operações de crédito, financiamento e leasing nos setores automotivo, imobiliário, energia e agronegócio; e opera sistemas de negociação e câmaras de compensação. Além disso, a empresa organizou um mercado de balcão e atua como câmara de compensação e liquidação. A empresa era anteriormente conhecida como BM&FBOVESPA S.A. - Bolsa de Valores, Mercadorias e Futuros e mudou sua razão social para B3 S.A. - Brasil, Bolsa, Balcão em junho de 2017. B3 S.A. - Brasil, Bolsa, Balcão foi constituída em 2007 e está sediada em São Paulo, Brasil.",https://www.b3.com.br,Financial Services,Serviços Financeiros,16.27174,4.109251,0.26738,0.06,74963720672.71252,14.970000267028809,Blue Chips,50,0.9199999672455931,13.799999508683896,-8.48,30.0,Baixo,,🟢,18.459999084472656,-18.90573667676618
ENGI3,ENERGISA,"A Energisa S.A., por meio de suas subsidiárias, atua na geração, transmissão e distribuição de energia elétrica no Brasil. A empresa gera eletricidade por meio de projetos hidráulicos, solares e eólicos. Também fornece gás natural para empresas e gás natural veicular, bem como serviços de valor agregado. Além disso, a empresa desenvolve atividades de inspeção termográfica aérea e corretagem de seguros. A empresa foi fundada em 1905 e está sediada em Cataguases, Brasil. A Energisa S.A. atua como subsidiária da Gipar S.A.",https://www.energisa.com.br,Utilities,Utilidades Públicas,16.291666,0.22819678,0.12091,0.0555,29491770358.682556,11.729999542236328,Mid Caps,55,0.7200000013648898,10.800000020473348,-8.61,24.0,Baixo,,🟢,12.779999732971191,-8.21596410542922
CSMG3,COPASA,"A Companhia de Saneamento de Minas Gerais planeja, executa, amplia, reforma e explora serviços públicos, saneamento básico, abastecimento de água, esgotamento sanitário, sanitários e resíduos sólidos no Brasil e no exterior. Atua na captação, tratamento e distribuição de água tratada aos consumidores finais; coleta, transporte, reciclagem, tratamento e disposição final de resíduos urbanos, domésticos e industriais; e limpeza urbana e gestão de resíduos sólidos, bem como drenagem e gestão de águas pluviais urbanas. A empresa era anteriormente conhecida como Companhia Mineira de Água e Esgotos e mudou seu nome para Companhia de Saneamento de Minas Gerais em novembro de 1974. A Companhia de Saneamento de Minas Gerais foi fundada em 1963 e está sediada em Belo Horizonte, Brasil.",https://denuncias.copasa.com.br,Utilities,Utilidades Públicas,16.32493,2.5201073,0.15884,0.0206,22098693277.532043,58.279998779296875,Mid Caps,35,3.569999919099003,53.54999878648504,-8.83,18.0,Médio,,🟡,58.27999877929688,-1.2191879729628788e-14
CPLE3,COPEL,"A Companhia Paranaense de Energia - COPEL, em conjunto com suas subsidiárias, atua na pesquisa, estudo, planejamento, construção, produção, transformação, transporte, distribuição e comercialização de energia elétrica no Brasil. A empresa atua por meio de três segmentos: Geração e Transmissão de Energia Elétrica; Distribuição de Energia Elétrica; e Comercialização. Produz eletricidade a partir de energia hidrelétrica e eólica; e constrói, opera e mantém subestações, bem como linhas de transmissão de energia. A empresa era anteriormente conhecida como Companhia Paranaense de Energia Elétrica e mudou seu nome para Companhia Paranaense de Energia - COPEL em outubro de 1979. A Companhia Paranaense de Energia - COPEL foi fundada em 1954 e está sediada em Curitiba, Brasil.",https://www.copel.com,Utilities,Utilidades Públicas,16.505495,1.8718843,0.10787,0.0709,44603064451.404976,15.020000457763672,Mid Caps,30,0.9100000004703689,13.650000007055533,-10.04,18.0,Baixo,,🟢,15.119999885559082,-0.6613718819595913
SMFT3,SMART FIT,"Smartfit Escola de Ginástica e Dança S.A. operates a network of Smart Fit gyms in Latin America. The company offers digital fitness services under the Queima Diária brand. It operates through owned and franchised units in Brazil, Mexico, Colombia, Chile, Peru, Argentina, Paraguay, Uruguay, Panama, Costa Rica, Dominican Republic, Ecuador, Guatemala, El Salvador and Honduras under the Smart Fit and Bio Ritmo brands. Smartfit Escola de Ginástica e Dança S.A. was founded in 1996 and is based in São Paulo, Brazil.",https://www.smartfit.com.br,Consumer Cyclical,Consumo Cíclico,16.90991,1.9521582,0.12060001,0.058600000000000006,11521726101.67241,18.770000457763672,Mid Caps,30,1.1100000211570418,16.650000317355627,-12.73,12.0,Baixo,,🟢,19.07999992370605,-1.624735152945251
WHRL3,WHIRLPOOL,"A Whirlpool S.A. fabrica, vende, importa e exporta eletrodomésticos no Brasil. A empresa oferece refrigeradores, freezers, refrigeradores-freezer, condicionadores de ar, máquinas de fazer gelo, fogões, lava-louças, trituradores e compactadores de lixo, compactadores de lixo e aspiradores de pó. Também realiza manutenção e reparo de produtos e peças elétricas; serviços de eletrônica, hidráulica, metalurgia, produtos químicos e ferro, pintura e construção; assessoria orçamentária; serviços auxiliares nas áreas de segurança, saúde, lazer, vida cotidiana e bem-estar; marketing e publicidade; intermediação na comercialização de produtos; venda de assinaturas por meio eletrônico; e atividades de comercialização de roupas, acessórios, utensílios para casa e cozinha e outros produtos. Comercializa seus produtos com as marcas Brastemp, Consul, KitchenAind, Compra Certa, B.blend e Insinkerator. A empresa foi fundada em 1957 e está sediada em São Paulo, Brasil. A Whirlpool S.A. opera como subsidiária da Whirlpool Corporation.",https://www.whirlpool.com.br,Consumer Cyclical,Consumo Cíclico,17.636364,3.1881678,0.14189,0.1317,5830809875.26021,3.880000114440918,Small Caps,15,0.2200000019528355,3.3000000292925327,-17.58,12.0,Baixo,,🟢,4.349999904632568,-10.804593114843986
