Ticker,Empresa,Resumo,Site,setor_original,Setor,PL,PVP,ROE,DivYield,MarketCap,Preco,Categoria,Score,LucroPorAcao,PrecoJusto,Desconto_%,Ranking,Risco,Risco_num,Farol,Preco_antigo,Variacao_%
SANB3,SANTANDER BR,"O Banco Santander (Brasil) S.A., em conjunto com suas subsidiárias, fornece diversos produtos e serviços bancários para pessoas físicas, pequenas e médias empresas e clientes corporativos no Brasil e internacionalmente. Atua em dois segmentos, Banco Comercial e Banco Global de Atacado. A empresa oferece produtos de pagamento e fidelidade, incluindo cartões de crédito e débito; crédito consignado e imobiliário; soluções de financiamento de home equity; programas de microfinanciamento; consórcios; produtos do agronegócio, como crédito, valores mobiliários e outros produtos; call center e soluções digitais; ativos inadimplentes; e produtos de seguros que abrangem seguros de vida, acidentes pessoais, automóveis, patrimoniais e de crédito, bem como seguros de viagens e transações bancárias. Também oferece soluções emergenciais para residências, carros, motocicletas, animais de estimação e telemedicina; financiamento ao consumo; e serviços bancários corporativos e de investimento, que incluem gestão de caixa, soluções estruturadas de comércio e capital de giro, comércio e empréstimos, fusões e aquisições, mercados de capitais acionários, dívida com grau de investimento e de mercados emergentes e finanças estruturadas, bem como mercados de vendas, criação de mercado, comércio de energia, ações, pesquisa e mobilização e securitização de dívida privada. Além disso, a empresa oferece soluções de gestão de caixa, como cobranças, pagamentos, pagamentos instantâneos e serviços de folha de pagamento e custódia; programa advance, plataforma não financeira de apoio a empreendedores em conteúdos educacionais, cursos certificados, eventos com foco em gestão, inovação, internacionalização e desenvolvimento de equipes; financiamento de clientes através de depósitos e outros instrumentos de financiamento bancário; e vários investimentos. Oferece seus produtos e serviços por meio de agências, miniagências e caixas eletrônicos; centrais de atendimento; correspondentes bancários e fornecedores terceirizados; e plataformas bancárias online e móveis. A empresa foi fundada em 1970 e está sediada em São Paulo, Brasil.",https://www.santander.com.br,Financial Services,Serviços Financeiros,7.664634,0.37231204,0.10467,0.06849999999999999,94118219857.95,12.57,Blue Chips,80,1.6400000313126497,24.600000469689746,48.9,42.0,Baixo,,🟢,15.960000038146973,-21.240601692007054
CLSC4,CELESC EJ,"A Centrais Elétricas de Santa Catarina S.A., por meio de suas subsidiárias, atua na geração, transmissão e comercialização de energia elétrica no Brasil. A empresa possui principalmente usinas hidrelétricas. A Centrais Elétricas de Santa Catarina S.A. foi fundada em 1955 e tem sede em Florianópolis, Brasil.",https://www.celesc.com.br,Utilities,Utilidades Públicas,7.693259,1.2753791,0.18175,0.07440000000000001,5281993671.54,136.94,Small Caps,85,17.799998674163966,266.99998011245947,48.71,42.0,Baixo,,🟢,147.75,-7.316412859560069
HYPE3,HYPERA EJ,"A Hypera S.A. atua como empresa farmacêutica no Brasil. A empresa fornece adoçantes sob as marcas Adocyl, Finn e Zero-cal; produtos analgésicos e antiinflamatórios das marcas Doril, Atroveran, Calminex, Alivium, Buscopan, Buscofem, geloll, Torsilax, Neosaldina e naprohax; produtos de remédios e descongestionantes para gripes e resfriados das marcas BENEGRIO, Rinosoro, Blu, Neosoro, Coristina, APRACUR e Fluviral. Oferece produtos anti-histamínicos das marcas Alektos, Histamin, Polaramine, PredSim e Desrinite; produtos antissépticos da marca Merthiolate; Produtos fitoterápicos das marcas Maracugina, Eparema, Tamarine e Naturetti; produtos gastrointestinais das marcas Dramin, Estomazil, Engov, Lacto-purga, gastrol, Epocler, Bifilax e Pepsamar. Além disso, a empresa fornece produtos genéricos com a marca neo química; produtos de cuidados de esqui das marcas Episol, Epidrat, Simple Organic e Bioage; suplementos e produtos vitamínicos das marcas Addera, Biotonico Fontoura, Colflex e Vitasay; e outros produtos das marcas Nebacetin, Cepacol, ESCABIN, Mirrorelax, Ammy, Nesina e Diprospan. A empresa era anteriormente conhecida como Hypermarcas S.A. e mudou seu nome para Hypera S.A. em fevereiro de 2018. A Hypera S.A. foi fundada em 1999 e está sediada em São Paulo, Brasil.",https://www.hypera.com.br,Healthcare,Saúde,7.767176,0.9132113,0.12954001,0.052300000000000006,14326242389.250002,20.35,Mid Caps,80,2.619999855803448,39.29999783705172,48.22,36.0,Baixo,,🟢,20.35,0.0
ISAE4,ISA ENERGIA,"A ISA Energía Brasil S.A. atua no negócio de transmissão de energia elétrica no Brasil. Em 31 de dezembro de 2025, possuía capacidade total instalada de transformação de 84.910 MVA juntamente com linhas de transmissão de 23 mil quilômetros. Atua nos estados da Bahia, Espírito Santo, Minas Gerais, Rio de Janeiro e São Paulo. A ISA Energía Brasil S.A. foi constituída em 1999 e está sediada em São Paulo, Brasil.",https://www.isacteep.com.br,Utilities,Utilidades Públicas,8.238764,0.9019342,0.11273,0.0916,19325047306.32,29.33,Mid Caps,80,3.560000019420389,53.40000029130584,45.07,42.0,Baixo,,🟢,28.770000457763672,1.9464703973795343
BBSE3,BBSEGURIDADE,"A BB Seguridade Participações S.A., por meio de suas subsidiárias, atua nos negócios de seguros, previdência e obrigações no Brasil. A empresa atua por meio de dois segmentos, Seguros e Corretagem. O segmento de Seguros oferece produtos e serviços de seguros, incluindo seguros de vida, patrimonial e de veículos, seguros patrimoniais, rurais, riscos especiais e financeiros, transportes, cascos e habitação, bem como planos de previdência complementar, odontológico e de capitalização. Seu segmento de Corretagem atua na corretagem e administração, implementação, promoção e viabilização de negócios de seguros nos setores básico, vida e capitalização, bem como planos de previdência aberta e planos odontológicos. A empresa foi fundada em 1981 e está sediada em Brasília, Brasil. A BB Seguridade Participações S.A. atua como subsidiária do Banco do Brasil S.A.",https://www.bbseguridaderi.com.br,Financial Services,Serviços Financeiros,8.28692,6.031941,0.75649,0.13449999999999998,76252242808.32,39.28,Blue Chips,75,4.739999903462324,71.09999855193486,44.75,48.0,Baixo,,🟢,34.849998474121094,12.711626168846282
TGMA3,TEGMA,"A Tegma Gestão Logística S.A., em conjunto com suas subsidiárias, presta serviços logísticos no Brasil. Atua nos segmentos de Logística Automotiva e Logística Integrada. O segmento de Logística Automotiva atua no transporte e distribuição de veículos novos e usados; transferências portuárias; e gerenciamento de pátio e estoque para montadoras, além de serviços de pré-entrega de veículos. O segmento de Logística Integrada fornece serviços de transporte, armazenamento e gerenciamento de estoque para produtos químicos, eletrodomésticos e bens de consumo. A empresa também oferece logística e centro automotivo, gerenciamento de pátio, transporte e armazenamento de veículos, logística integrada, gerenciamento da cadeia de suprimentos de produtos químicos, gerenciamento de embalagens, intralogística e serviços de projetos especiais. Atende indústrias de alimentos e bebidas, automotiva, cosmética, eletrodomésticos, farmacêutica e química e petroquímica. A empresa foi fundada em 1969 e está sediada em São Bernardo do Campo, Brasil.",https://www.tegma.com.br,Industrials,Indústria,8.32687,2.1757383,0.25372,0.14880000000000002,1982089456.3799999,30.06,Small Caps,60,3.609999915934799,54.14999873902198,44.49,42.0,Baixo,,🟢,36.84999847412109,-18.426048182578754
MOVI3,MOVIDA,"A Movida Participações S.A. presta serviços de aluguel de automóveis no Brasil. Atua em dois segmentos, Rent-a-Car e Gestão e Terceirização de Frotas (GTF). A empresa oferece serviços de aluguel de veículos leves; e serviços de gestão e terceirização de frotas. Também vende carros usados. A empresa era anteriormente conhecida como H.L.C.S.P.E Empreendimentos e Participações S.A. e mudou seu nome para Movida Participações S.A. em dezembro de 2014. A empresa foi fundada em 2006 e tem sede em São Paulo, Brasil. A Movida Participações S.A. atua como subsidiária da Simpar S.A.",https://ri.movida.com.br,Industrials,Indústria,8.352382,0.96970373,0.12866999,0.1073,3517088158.06,8.77,Small Caps,65,1.0499998683010427,15.74999802451564,44.32,36.0,Baixo,,🟢,12.93000030517578,-32.17324212676595
SANB4,SANTANDER BR,"O Banco Santander (Brasil) S.A., em conjunto com suas subsidiárias, fornece diversos produtos e serviços bancários para pessoas físicas, pequenas e médias empresas e clientes corporativos no Brasil e internacionalmente. Atua em dois segmentos, Banco Comercial e Banco Global de Atacado. A empresa oferece produtos de pagamento e fidelidade, incluindo cartões de crédito e débito; crédito consignado e imobiliário; soluções de financiamento de home equity; programas de microfinanciamento; consórcios; produtos do agronegócio, como crédito, valores mobiliários e outros produtos; call center e soluções digitais; ativos inadimplentes; e produtos de seguros que abrangem seguros de vida, acidentes pessoais, automóveis, patrimoniais e de crédito, bem como seguros de viagens e transações bancárias. Também oferece soluções emergenciais para residências, carros, motocicletas, animais de estimação e telemedicina; financiamento ao consumo; e serviços bancários corporativos e de investimento, que incluem gestão de caixa, soluções estruturadas de comércio e capital de giro, comércio e empréstimos, fusões e aquisições, mercados de capitais acionários, dívida com grau de investimento e de mercados emergentes e finanças estruturadas, bem como mercados de vendas, criação de mercado, comércio de energia, ações, pesquisa e mobilização e securitização de dívida privada. Além disso, a empresa oferece soluções de gestão de caixa, como cobranças, pagamentos, pagamentos instantâneos e serviços de folha de pagamento e custódia; programa advance, plataforma não financeira de apoio a empreendedores em conteúdos educacionais, cursos certificados, eventos com foco em gestão, inovação, internacionalização e desenvolvimento de equipes; financiamento de clientes através de depósitos e outros instrumentos de financiamento bancário; e vários investimentos. Oferece seus produtos e serviços por meio de agências, miniagências e caixas eletrônicos; centrais de atendimento; correspondentes bancários e fornecedores terceirizados; e plataformas bancárias online e móveis. A empresa foi fundada em 1970 e está sediada em São Paulo, Brasil.",https://www.santander.com.br,Financial Services,Serviços Financeiros,8.353659,0.40578163,0.10467,0.0693,102579125859.5,13.7,Blue Chips,80,1.6399999090219026,24.59999863532854,44.31,42.0,Baixo,,🟢,16.420000076293945,-16.565164821289454
MILS3,MILLS,"A Mills Locação, Serviços e Logística S.A. atua como locadora de máquinas e equipamentos no Brasil. Aluga, vende, importa e exporta estruturas tubulares de aço e alumínio, escoramentos e equipamentos de acesso para obras de construção civil e formas de concreto reutilizáveis. A empresa também desenvolve projetos de engenharia relacionados e presta serviços de supervisão e montagem opcional. Além disso, vende, aluga e distribui plataformas elevatórias de trabalho, peças relacionadas, carros novos e usados. Também oferece máquinas pesadas, retroescavadeiras, rolos compactos, minicarregadeiras, rebocadores, geradores, compressores, tratores de esteira e agrícolas, escavadeiras, carregadeiras de rodas, motoniveladoras, empilhadeiras e porta-paletes. Além disso, fornece frete, manutenção, treinamento, telemetria, operação remota e serviços e soluções de consultoria. A empresa era anteriormente conhecida como Mills Estruturas e Serviços de Engenharia S.A. e mudou seu nome para Mills Locação, Serviços e Logística S.A. em julho de 2022. A Mills Locação, Serviços e Logística S.A. foi fundada em 1952 e tem sede no Rio de Janeiro, Brasil.",https://www.mills.com.br,Industrials,Indústria,8.583333,1.9764615,0.26311,0.0781,3520015848.45,15.45,Small Caps,60,1.8000000699029153,27.00000104854373,42.78,42.0,Baixo,,🟢,15.119999885559082,2.182540455943364
TAEE3,TAESA,"A Transmissora Aliança de Energia Elétrica S.A., em conjunto com suas subsidiárias, atua na construção, operação e manutenção de linhas de transmissão de energia elétrica no Brasil. Opera uma extensão total de aproximadamente 15.319 quilômetros (km) de linhas de transmissão, que incluem 14.677 km de linhas de transmissão em operação e 642 km de linhas em construção; 113 subestações com tensão entre 230 e 525KV; e um centro de operação do sistema localizado no Rio de Janeiro. A empresa foi fundada em 2000 e está sediada no Rio de Janeiro, Brasil.",https://institucional.taesa.com.br/,Utilities,Utilidades Públicas,8.756579,0.57609075,0.20559,0.0567,13755841356.51,13.31,Mid Caps,100,1.519999990864012,22.79999986296018,41.62,54.0,Baixo,,🟢,14.270000457763672,-6.72740313222189
TAEE4,TAESA,"A Transmissora Aliança de Energia Elétrica S.A., em conjunto com suas subsidiárias, atua na construção, operação e manutenção de linhas de transmissão de energia elétrica no Brasil. Opera uma extensão total de aproximadamente 15.319 quilômetros (km) de linhas de transmissão, que incluem 14.677 km de linhas de transmissão em operação e 642 km de linhas em construção; 113 subestações com tensão entre 230 e 525KV; e um centro de operação do sistema localizado no Rio de Janeiro. A empresa foi fundada em 2000 e está sediada no Rio de Janeiro, Brasil.",https://institucional.taesa.com.br/,Utilities,Utilidades Públicas,8.894737,0.58518004,0.20559,0.0554,13972875667.92,13.52,Mid Caps,100,1.519999973017752,22.79999959526628,40.7,54.0,Baixo,,🟢,14.5600004196167,-7.142859818983976
ISAE3,ISA ENERGIA,"A ISA Energía Brasil S.A. atua no negócio de transmissão de energia elétrica no Brasil. Em 31 de dezembro de 2025, possuía capacidade total instalada de transformação de 84.910 MVA juntamente com linhas de transmissão de 23 mil quilômetros. Atua nos estados da Bahia, Espírito Santo, Minas Gerais, Rio de Janeiro e São Paulo. A ISA Energía Brasil S.A. foi constituída em 1999 e está sediada em São Paulo, Brasil.",https://www.isacteep.com.br,Utilities,Utilidades Públicas,9.044944,0.9901903,0.11273,0.08130000000000001,21216042388.800003,32.2,Mid Caps,80,3.559999929242238,53.39999893863357,39.7,42.0,Baixo,,🟢,32.0099983215332,0.5935697857846657
VIVA3,VIVARA S.A.,"A Vivara Participações S.A. atua na fabricação e comercialização de joias e outros artigos na América Latina. A empresa oferece produtos de joalheria, incluindo anéis, colares, alianças, brinquedos, solitários, brincos, correntes, correntes, pingentes e pulseiras. Também fornece relógios; acessórios, como óculos de sol, carteiras e porta-cartões, porta-passaportes e relógios, porta-joias, perfumes, abotoaduras, chaveiros, canetas e facas; e produtos para presente que incluem kits para presentear, quiz, formatura, infantil, mãe/avó e produtos customizáveis. A empresa vende seus produtos sob as marcas Vivara, Tag Heuer, Victorinox, Movado, Baume and Mercier, Bulova, Akium, Lacoste, Calvin Klein, Hugo Boss, Tommy Hilfiger, Olivia Burton, Festina, Adidas, Life By Vivara, Guess. Marcas Nautica, Porsche Design, Montblanc e Festina. Oferece seus produtos por meio de lojas e quiosques, bem como por meio de e-commerce. A Vivara Participações S.A. foi fundada em 1962 e está sediada em São Paulo, Brasil.",https://www.vivara.com.br,Consumer Cyclical,Consumo Cíclico,9.068273,1.7516097,0.20746,0.061200000000000004,5305663560.12,22.58,Small Caps,60,2.4900000253631536,37.350000380447305,39.54,42.0,Baixo,,🟢,29.670000076293945,-23.89619163485878
EKTR4,ELEKTRO,"A Elektro Redes S.A. atua na distribuição de energia elétrica no Brasil. A empresa era anteriormente conhecida como Elektro Eletricidade e Serviços S.A. e mudou seu nome para Elektro Redes S.A. em agosto de 2016. A empresa foi constituída em 1998 e está sediada em Campinas, Brasil. A Elektro Redes S.A. é subsidiária da Neoenergia S.A.",https://www.elektro.com.br,Utilities,Utilidades Públicas,9.100228,3.4026062,0.39254,0.037599999999999995,7740682636.750001,39.95,Small Caps,45,4.389999898903632,65.84999848355449,39.33,36.0,Baixo,,🟢,39.5,1.139240506329121
CURY3,CURY S/A,"A Cury Construtora e Incorporadora S.A. atua no ramo imobiliário no Brasil. A empresa atua na venda de unidades imobiliárias; serviços de análise de crédito; empreendimentos imobiliários residenciais; aluguel de imóveis próprios; e prestação de serviços relativos a construção, fiscalização, estudos e projetos, além da execução de quaisquer obras de construção e engenharia civil. Também presta serviços de construção, administração, administração imobiliária e instalações elétricas e hidráulicas. A empresa foi fundada em 1963 e está sediada em São Paulo, Brasil.",https://cury.net,Real Estate,Imobiliário,9.134079,6.5217395,0.73690003,0.13949999999999999,10073156323.800001,32.7,Mid Caps,75,3.579999691266082,53.69999536899123,39.11,48.0,Baixo,,🟢,36.77999877929688,-11.092982367344375
ALUP4,ALUPAR,"A Alupar Investimento S.A., em conjunto com suas subsidiárias, atua na transmissão, geração e comercialização de energia no Brasil, Colômbia, Peru e Chile. Atua nos segmentos de Transmissão e Geração. A empresa detém participação em concessões de 44 sistemas de transmissão de energia elétrica, totalizando 9.999 quilômetros de linhas de transmissão; e opera linhas aéreas e subestações. Também atua na geração de energia renovável por meio de hidrelétricas, parques eólicos e usinas fotovoltaicas, que possuem capacidade instalada de 798,5 MW. A empresa foi constituída em 2006 e está sediada em São Paulo, Brasil. A Alupar Investimento S.A. é uma subsidiária da Guarupart Participações Ltda.",https://www.alupar.com.br,Utilities,Utilidades Públicas,9.184211,1.1148577,0.12679,0.0268,10353579892.470001,10.47,Mid Caps,65,1.1399999412034416,17.099999118051624,38.77,24.0,Baixo,,🟢,10.989999771118164,-4.731572174229961
CPFE3,CPFL ENERGIA,"A CPFL Energia S.A., por meio de suas subsidiárias, atua como empresa de energia no Brasil. Atua nos segmentos de Distribuição, Geração, Transmissão, Comercialização e Serviços. A empresa gera eletricidade por meio de fontes hidrelétricas, solares, eólicas e de biomassa. Também atua na operação e manutenção de instalações de transmissão de energia elétrica; e comercialização de eletricidade. Em 31 de dezembro de 2025, a rede de distribuição da empresa era composta por 349.342 quilômetros de linhas de distribuição, bem como 12.154 quilômetros de linhas de distribuição de alta tensão; e 596 subestações transformadoras de alta e média tensão com capacidade total de transformação de 20.637 MVA. Atende os setores residencial, comercial e industrial. A empresa foi fundada em 1912 e está sediada em Campinas, Brasil. A CPFL Energia S.A. opera como subsidiária da State Grid Brazil Power Participações S.A.",https://www.cpfl.com.br,Utilities,Utilidades Públicas,9.258,2.1951914,0.24763,0.0821,53337858027.6,46.29,Blue Chips,75,5.0,75.0,38.28,48.0,Baixo,,🟢,49.869998931884766,-7.178662539725596
FIQE3,UNIFIQUE,"A Unifique Telecomunicações S.A. fornece serviços de telecomunicações no Brasil. A empresa oferece armazenamento de dados, hospedagem de dados e serviços de Internet. Também fornece serviços de comunicação multimídia SCM; acesso a redes de comunicação, portais, provedores de conteúdo e serviços de informação na Internet; TV paga via satélite, cabo e micro-ondas; e serviços de hospedagem de internet e telefonia fixa comutada. Além disso, a empresa atua no comércio varejista de hospedagem de internet e telefonia fixa comutada; equipamentos e suprimentos para informática e telefonia móvel; publicação de livros e venda a retalho de livros; e planos de saúde. A Unifique Telecomunicações S.A. foi constituída em 1997 e está sediada em Timbó, Brasil.",https://unifique.com.br,Communication Services,Comunicação,9.354839,1.931402,0.18761998,0.1425,2258425425.2,5.8,Small Caps,60,0.6199999807586213,9.29999971137932,37.63,36.0,Baixo,,🟢,5.510000228881836,5.263153522173529
CMIG3,CEMIG,"A Companhia Energética de Minas Gerais - CEMIG, por meio de suas subsidiárias, atua na geração, transmissão, distribuição e comercialização de energia no Brasil. Em 31 de dezembro de 2025, a empresa operava 32 usinas hidrelétricas com capacidade total de 4.434 MW, 2 parques eólicos com capacidade total de 71 MW e 12 usinas fotovoltaicas com capacidade total de 169 MW; 365.577 milhas de linhas de distribuição; e 4.865 milhas de linhas de transmissão. Também atua na aquisição, transporte e distribuição de gás e seus subprodutos e derivados; venda e comercialização de energia; construção, implantação, operação e manutenção de transmissão de energia elétrica; comercialização e intermediação de negócios relacionados à energia; instalação, operação, manutenção e aluguel de usinas solares; e atividades de geração distribuída, serviços de conta, cogeração, eficiência energética e gestão de abastecimento e armazenamento. A empresa foi constituída em 1952 e está sediada em Belo Horizonte, Brasil.",https://www.cemig.com.br,Utilities,Utilidades Públicas,9.356725,1.5844723,0.17038,0.08900000000000001,45770910128.0,16.0,Mid Caps,75,1.7100000267187503,25.650000400781256,37.62,42.0,Baixo,,🟢,15.520000457763672,3.092780464424631
PSSA3,PORTO SEGURO,"A Porto Seguro S.A., em conjunto com suas subsidiárias, oferece uma gama de produtos e serviços de seguros no Brasil e no Uruguai. Oferece seguros de automóveis, residenciais, viagens, celular, vida, motocicleta, notebook e tablet, foto e vídeo, smart e games, moto, imobiliário, green card, fiança e mudança, além de resseguros, proteção combinada, responsabilidade civil profissional, máquinas e equipamentos, eventos, agronegócio e táxi. A empresa também atua na gestão e comercialização de títulos de capitalização; concessão de empréstimos e financiamentos para consumo e capital de giro; operação de cartões de crédito; gestão de grupos de consórcios para aquisição de bens móveis e imóveis; distribuição de cotas de fundos de investimento; manutenção, desenvolvimento e licenciamento de programas; instalação de sistemas de aquecimento, gás natural e gás liquefeito de petróleo; operação de centros de oncologia, hematologia e radioterapia; venda e distribuição de peças automotivas; e administração e gestão de carteiras de valores mobiliários, fundos de investimento e recursos financeiros. Além disso, presta serviços técnicos de corretagem de seguros; serviços de obtenção de crédito e financiamento ao consumo; suporte técnico para software e outros serviços de tecnologia da informação; serviços de intermediação e agência para serviços e empresas; serviços de cobrança de dívidas e informações de crédito; serviços de assessoria administrativa para médicos e seguradoras de saúde; serviços de consultoria e assessoria em saúde ocupacional, segurança no trabalho, ergonomia e serviços ambulatoriais; serviços relacionados com protecção e monitorização electrónica; e telemarketing e atendimento geral ao cliente. A empresa foi fundada em 1945 e está sediada em São Paulo, Brasil. A Porto Seguro S.A. opera como subsidiária da Porto Seguro Itaú Unibanco Participações S.A.",https://www.portoseguro.com.br,Financial Services,Serviços Financeiros,9.392606,2.198821,0.2516,0.0391,34196940432.05,53.35,Mid Caps,60,5.679999778549211,85.19999667823816,37.38,42.0,Baixo,,🟢,50.470001220703125,5.706357657299763
BEES3,BANESTES EJ,"O Banestes S.A - Banco do Estado do Espírito Santo S.A., em conjunto com suas subsidiárias, atua como banco múltiplo no Brasil. Opera através do Financeiro; e Seguros e Outros segmentos. A empresa atua por meio de suas carteiras de comércio, rural, industrial, imobiliário, câmbio, arrendamento, investimento e administração de cartões de crédito; e nas áreas de seguros e distribuição, intermediação e administração de recursos de terceiros. Também fornece gestão de ativos e fundos; administração e intermediação de valores mobiliários, seguros, previdência e capitalização; fundos de investimento; cartões de crédito e débito; banco pela internet; conta corrente, poupança, especial, cheque fiduciário, jovem e universitário, conta mais fácil, simplificada, salário e judicial; títulos de capitalização; seguro de carro, vida, casa, acidentes pessoais, proteção financeira de cartão e seguro empresarial; cobranças e convênios; transferência de fundos e recursos; coleção; custódia; opções de crédito e financiamento; empréstimos e garantias; e outros serviços. Além disso, a empresa opera um serviço público de loteria. Banestes S.A - Banco do Estado do Espírito Santo S.A. foi fundado em 1935 e está sediado em Vitória, Brasil.",https://www.banestes.com.br,Financial Services,Serviços Financeiros,9.43956,1.2141343,0.13748999,0.0401,2985060614.14,8.59,Small Caps,50,0.9100000423748564,13.650000635622847,37.07,24.0,Baixo,,🟢,8.630000114440918,-0.4635007405618031
