Ticker,Empresa,Resumo,Site,setor_original,Setor,PL,PVP,ROE,DivYield,MarketCap,Preco,Categoria,CNPJ,Score,LucroPorAcao,PrecoJusto,Desconto_%,Ranking,Risco,Risco_num,Farol,Preco_antigo,Variacao_%
BSLI4,BRB BANCO,"O BRB - Banco de Brasília S.A. atua nas atividades de crédito, financiamento e investimento para clientes pessoas físicas e jurídicas no Brasil. A empresa envolvida na distribuição de valores mobiliários e gestão de fundos, cartões de crédito, seguros e prestação de outros serviços relacionados. A empresa era anteriormente conhecida como Banco regional de Brasília SA BRB e mudou seu nome para BRB - Banco de Brasília S.A. em janeiro de 1986. O BRB - Banco de Brasília S.A. foi constituído em 1964 e está sediado em Brasília, Brasil.",https://www.brb.com.br,Financial Services,Serviços Financeiros,1.960396,0.48316252,0.25134,0.1605,2040252726.453905,3.9600000381469727,Small Caps,Não disponível,85,2.0200000602668915,30.300000904003372,86.93,58.0,Baixo,,🟢,4.300000190734863,-7.9069799420121685
BSLI3,BRB BANCO,"O BRB - Banco de Brasília S.A. atua nas atividades de crédito, financiamento e investimento para clientes pessoas físicas e jurídicas no Brasil. A empresa envolvida na distribuição de valores mobiliários e gestão de fundos, cartões de crédito, seguros e prestação de outros serviços relacionados. A empresa era anteriormente conhecida como Banco regional de Brasília SA BRB e mudou seu nome para BRB - Banco de Brasília S.A. em janeiro de 1986. O BRB - Banco de Brasília S.A. foi constituído em 1964 e está sediado em Brasília, Brasil.",https://www.brb.com.br,Financial Services,Serviços Financeiros,2.0693069,0.5100049,0.25134,0.141,2032236860.2014852,4.179999828338623,Small Caps,Não disponível,85,2.0199999470057453,30.29999920508618,86.2,58.0,Baixo,,🟢,4.789999961853027,-12.73486718940231
BNBR3,NORD BRASIL ERJ,"O Banco do Nordeste do Brasil S.A. atua como um banco de desenvolvimento regional na América Latina. Atua por meio dos segmentos Carteira Própria e FNE. A empresa oferece contas de poupança, depósitos à vista e a prazo e custódia de títulos; crédito especializado; crédito para infra-estruturas e microfinanciamento urbano e rural; e serviços de cobrança e cartões de crédito. Atua também na estruturação e distribuição de bonds e títulos locais de curto e longo prazo, como debêntures, notas, notas promissórias, certificados de recebíveis imobiliários, fundos de investimento; administração de recursos de terceiros, consistindo na administração de fundos de investimento; operações de câmbio; gestão de carteira e análise de crédito; e transferências eletrônicas. Atende empresas corporativas, grandes, médias, pequenas e microempresas; agroindústria, produtores rurais e agricultura familiar; sectores de microfinanças urbanas e rurais; entidades representativas; indivíduos; e instituições da administração pública direta e indireta. A empresa atua por meio de pontos de atendimento físicos, incluindo agências e unidades de microcrédito. O Banco do Nordeste do Brasil S.A. foi fundado em 1952 e está sediado em Fortaleza, Brasil.",https://www.bnb.gov.br,Financial Services,Serviços Financeiros,3.93726,0.7821542,0.19412,0.055999999999999994,12140069250.0,123.0,Mid Caps,Não disponível,100,31.239999390439035,468.5999908565855,73.75,52.0,Baixo,,🟢,119.75,2.7139874739039667
BAZA3,AMAZIA,"O Banco da Amazônia S.A. fornece produtos e serviços bancários na região amazônica do Brasil. A empresa oferece contas poupança, corrente, simplificada e salário; cartões de crédito; produtos de capitalização; vários empréstimos pessoais e empresariais; planos de pensões; fundos de investimento, certificados de depósitos bancários e recibos de depósitos e cartas de crédito do agronegócio; produtos de seguros; e débito direto e serviços financeiros online. Também oferece programas de financiamento para agricultura familiar, máquinas e equipamentos, atividades rurais e de biodiversidade, caminhões, energia verde, negócios e infraestrutura verdes e investimentos rurais e não rurais, bem como atividades de ciência, tecnologia e inovação; fundo de desenvolvimento e marinha mercante; capital de giro; comércio exterior; e serviços de poupança para pessoas jurídicas, cobrança, adiantamento de cartão, cheque comercial, débito automático, mensagens de celular e domicílio bancário. A empresa foi fundada em 1942 e está sediada em Belém, Brasil.",https://www.bancoamazonia.com.br,Financial Services,Serviços Financeiros,3.9569995,0.63747406,0.15239,0.0965,4642749631.19236,82.81999969482422,Small Caps,Não disponível,85,20.930000040390254,313.9500006058538,73.62,52.0,Baixo,,🟢,85.54000091552734,-3.1798003175019685
BRSR6,BANRISUL B,"O Banco do Estado do Rio Grande do Sul S.A., um banco múltiplo, oferece uma gama de produtos e serviços bancários principalmente no Brasil. A empresa atua em atividades bancárias de varejo, empréstimos, financiamento e investimento, empréstimos hipotecários, desenvolvimento, carteira de arrendamento e câmbio. Também oferece corretagem de valores mobiliários, grupos de consórcios, soluções para o setor de pagamentos, seguros e produtos de previdência e títulos de capitalização. O Banco do Estado do Rio Grande do Sul S.A. foi constituído em 1928 e está sediado em Porto Alegre, Brasil.",https://www.banrisul.com.br,Financial Services,Serviços Financeiros,4.0787587,0.6098127,0.1567,0.055999999999999994,6989373874.334553,17.09000015258789,Small Caps,Não disponível,85,4.1900002941061185,62.850004411591776,72.81,46.0,Baixo,,🟢,18.030000686645508,-5.213535764054953
BRSR3,BANRISUL,"O Banco do Estado do Rio Grande do Sul S.A., um banco múltiplo, oferece uma gama de produtos e serviços bancários principalmente no Brasil. A empresa atua em atividades bancárias de varejo, empréstimos, financiamento e investimento, empréstimos hipotecários, desenvolvimento, carteira de arrendamento e câmbio. Também oferece corretagem de valores mobiliários, grupos de consórcios, soluções para o setor de pagamentos, seguros e produtos de previdência e títulos de capitalização. O Banco do Estado do Rio Grande do Sul S.A. foi constituído em 1928 e está sediado em Porto Alegre, Brasil.",https://www.banrisul.com.br,Financial Services,Serviços Financeiros,4.4319806,0.66262263,0.1567,0.050300000000000004,7594655913.080894,18.56999969482422,Small Caps,Não disponível,85,4.190000221306072,62.850003319591075,70.45,46.0,Baixo,,🟢,18.799999237060547,-1.2234018700539555
BRSR5,BANRISUL A,"O Banco do Estado do Rio Grande do Sul S.A., um banco múltiplo, oferece uma gama de produtos e serviços bancários principalmente no Brasil. A empresa atua em atividades bancárias de varejo, empréstimos, financiamento e investimento, empréstimos hipotecários, desenvolvimento, carteira de arrendamento e câmbio. Também oferece corretagem de valores mobiliários, grupos de consórcios, soluções para o setor de pagamentos, seguros e produtos de previdência e títulos de capitalização. O Banco do Estado do Rio Grande do Sul S.A. foi constituído em 1928 e está sediado em Porto Alegre, Brasil.",https://www.banrisul.com.br,Financial Services,Serviços Financeiros,4.634845,0.69295275,0.1567,0.0487,7942284374.542276,19.420000076293945,Small Caps,Não disponível,70,4.189999897794628,62.84999846691942,69.1,46.0,Baixo,,🟢,18.790000915527344,3.3528426294327325
ABCB4,ABC BRASIL,"O Banco ABC Brasil S.A., um banco comercial, fornece diversos produtos e serviços financeiros para médias e grandes empresas no Brasil. A empresa oferece conta corrente; produtos de crédito e financiamento, como capital de giro, rotativo, recebíveis, antecipação a fornecedores, empréstimo consignado para empregados, sobre empréstimos em moeda estrangeira e empréstimos em moeda estrangeira, bem como para agronegócio, comércio exterior, transferências do fundo de defesa da economia cafeeira e imóveis; questões de garantias, tais como garantia de pagamento emitida, garantia de execução emitida, garantia judicial emitida, carta de crédito stand-by, confirmação de cartas de crédito de exportação, garantia de oferta, garantia de execução e carta de crédito de importação; derivativos, como contratos a termo de não entrega, prazo de mercadorias, swap e opções; serviços de câmbio para exportação e importação de câmbio, câmbio à vista de adiantamentos sobre câmbios entregues e câmbio à vista financeiro de remessas; cédulas de crédito do agronegócio e imobiliário, certificado de depósito bancário, fundos de investimento, certificado de operações estruturadas e debêntures. Também fornece serviços de investimentos em operações de fusões e aquisições, mercado de capitais e financiamento de projetos. Além disso, a empresa oferece produtos de seguros, como seguros de vida, seguros de vida e seguros de propriedades e acidentes; e atua como comercializadora de energia. A empresa era anteriormente conhecida como Banco Roma de Investimentos e mudou seu nome para Banco ABC Brasil S.A. em 1997. A empresa foi constituída em 1983 e está sediada em São Paulo, Brasil. O Banco ABC Brasil S.A. é uma subsidiária da Marsau Uruguai Holdings SA.",https://www.abcbrasil.com.br,Financial Services,Serviços Financeiros,4.7682242,0.9102587,0.15463,0.12390000000000001,6158035254.861368,25.510000228881836,Small Caps,Não disponível,85,5.350000159153976,80.25000238730964,68.21,52.0,Baixo,,🟢,26.959999084472656,-5.378334216731976
SUZB3,SUZANO S.A.,"A Suzano S.A. fabrica e comercializa produtos de celulose e papel no Brasil e internacionalmente. Atua em dois segmentos, Celulose e Papel. A empresa oferece papéis de impressão e escrita revestidos e não revestidos, cartões, papéis tissue e celuloses de mercado e fluff. Também se dedica à pesquisa, desenvolvimento e produção de biocombustíveis; operação de terminais portuários; atividades de pesquisa e desenvolvimento em biotecnologia e polpas nanocristalinas; negócios de geração e distribuição de energia; atividades de transporte rodoviário de cargas; comercialização de equipamentos e peças; pesquisa e desenvolvimento de lignina; industrialização e comercialização de produtos de celulose, microfibras celulósicas, papel e papelão; e industrialização, comercialização e exportação de produtos de celulose. Além disso, a empresa está envolvida em atividades de escritório comercial, capital de risco corporativo e captação de recursos financeiros; produção de bens de consumo através de líquidos à base de celulose; desenvolvimento e produção de fibras, fios e filamentos têxteis à base de celulose; restauração, conservação e preservação de florestas; e pesquisa de matérias-primas para a indústria têxtil. A empresa era anteriormente conhecida como Suzano Papel e Celulose S.A. e mudou seu nome para Suzano S.A. em abril de 2019. A empresa foi fundada em 1924 e está sediada em Salvador, Brasil.",https://www.suzano.com.br,Basic Materials,Materiais Básicos,4.788159,1.4601257,0.35192,0.0222,63980370881.25248,51.7599983215332,Blue Chips,Não disponível,85,10.809999902161394,162.1499985324209,68.08,46.0,Baixo,,🟢,55.81999969482422,-7.273381217283435
JHSF3,JHSF PART,"A JHSF Participações S.A., em conjunto com suas subsidiárias, atua no ramo imobiliário no Brasil e internacionalmente. Atua por meio de cinco segmentos: Renda Recorrente; Negócios Imobiliários; Aeroporto, Hotéis e Restaurantes; e Holding. A empresa atua na construção e operação de shopping centers; compra e venda de imóveis residenciais e comerciais; varejo de artigos de moda; locação de imóveis comerciais; e desenvolvimento e operação de hotéis, atividades turísticas e gastronômicas, incluindo bares, cafés e restaurantes. Também se dedica à operação e gestão do aeródromo; prestação de serviços de gestão; e soluções de financiamento, serviços e investimentos imobiliários. A empresa foi fundada em 1972 e está sediada em São Paulo, Brasil.",https://jhsf.com.br,Real Estate,Imobiliário,4.921053,0.990781,0.20974001,0.095,6252458923.043444,9.350000381469727,Small Caps,Não disponível,85,1.8999999352719281,28.49999902907892,67.19,58.0,Baixo,,🟢,9.260000228881836,0.9719238700143998
EVEN3,EVEN,"A Even Construtora e Incorporadora S.A. atua como incorporadora e construtora imobiliária no Brasil. A empresa desenvolve e comercializa empreendimentos residenciais e comerciais sob as marcas Open e Even. Também está envolvida na prospecção de terrenos; incorporação e venda imobiliária; operação do portal da corretora; e atividades de construção de projetos. A empresa foi fundada em 1974 e está sediada em São Paulo, Brasil.",https://www.even.com.br,Real Estate,Imobiliário,5.147887,0.7620139,0.14028,0.1079,1431422046.805263,7.309999942779541,Small Caps,Não disponível,65,1.4200000782417215,21.300001173625823,65.68,40.0,Baixo,,🟢,7.710000038146973,-5.188068656139306
TRIS3,TRISUL,"A Trisul S.A. atua na construção e incorporação de imóveis no Brasil. A empresa atua no loteamento de terrenos; e compra e venda de imóveis. Também desenvolve projetos imobiliários com participação acionária de terceiros. A Trisul S.A. foi fundada em 2007 e está sediada em São Paulo, Brasil.",https://www.trisul-sa.com.br,Real Estate,Imobiliário,5.247706,0.9215402,0.14368,0.1963,1336532210.8962889,5.71999979019165,Small Caps,Não disponível,65,1.0900000476763847,16.35000071514577,65.02,40.0,Baixo,,🟢,6.900000095367432,-17.101453461834264
BMGB4,BANCO BMG,"O Banco BMG S.A. fornece produtos e serviços comerciais e de crédito, financiamento e investimento principalmente no Brasil. A empresa oferece contas digitais; cartão de crédito conta digital e cartão de crédito consignado; consignado e empréstimo pessoal; produtos de seguros, incluindo seguros de prestamistas, de vida, de vida familiar e protegidos pelo FGTS, além dos serviços do Bmg Med e do Consórcio Bmg. Também oferece produtos de investimento, como certificados de depósitos bancários, cartas de crédito do agronegócio e cartas de crédito imobiliário. Além disso, a empresa oferece serviços bancários comerciais; debêntures; financiamento comercial; e capital de giro; e derivativos, como opções a termo não entregáveis, SWAP. A empresa era anteriormente conhecida como BMG Financeira S.A.Crédito, Financiamento e Investimento e mudou seu nome para Banco BMG S.A. em abril de 1989. O Banco BMG S.A. foi fundado em 1930 e está sediado em São Paulo, Brasil.",https://www.bancobmg.com.br,Financial Services,Serviços Financeiros,5.2736845,0.6447047,0.12981,0.0916,3234868711.2649612,5.010000228881836,Small Caps,Não disponível,65,0.9499999912550392,14.249999868825588,64.84,40.0,Baixo,,🟢,4.949999809265137,1.2121297359323882
CEEB5,COELBA A,"Companhia de Eletricidade do Estado da Bahia - COELBA engages in the distribution of electricity. The company was founded in 1960 and is headquartered in Salvador, Brazil. Companhia de Eletricidade do Estado da Bahia - COELBA operates as a subsidiary of Iberdrola, S.A.",https://www.coelba.com.br,Utilities,Utilidades Públicas,5.6500688,1.3642586,0.25589,0.0489,10706625153.95,40.85,Mid Caps,Não disponível,85,7.230000455923652,108.45000683885478,62.33,52.0,Baixo,,🟢,38.0,7.5000000000000036
AZZA3,AZZAS 2154,"A Azzas 2154 S.A. atua no desenvolvimento e comercialização de calçados, bolsas, acessórios e confecções femininos, masculinos e infantis no Brasil e no exterior. Oferece seus produtos por meio de lojas franqueadas, lojas próprias e canal de web commerce das marcas Arezzo, Schutz, Anacapri, Alexandre Birman, Alme, Vans, Reserva, Reserva Mini, Reserva INK, Reserva Go, Oficina Reserva, Brizza, Troc, Baw, Carol Bassi, ZZMALL, Reversa, Simples Reserva, Paris Texas, Vicenza, Animale, Farm, Farm Global, Fabula, Foxton, Cris Barros, Off Premium, Maria Filo, NV, Marcas Hering e Dzarm. A empresa era anteriormente conhecida como Arezzo Indústria e Comércio S.A. e mudou seu nome para Azzas 2154 S.A. em julho de 2024. Azzas 2154 S.A. foi fundada em 1972 e está sediada em Belo Horizonte, Brasil.",https://ri.azzas2154.com.br,Consumer Cyclical,Consumo Cíclico,5.76298,0.645561,0.11609,0.0993,5156366973.653749,25.530000686645508,Small Caps,Não disponível,65,4.429999876217774,66.44999814326661,61.58,40.0,Baixo,,🟢,27.520000457763672,-7.231103699188947
GMAT3,GRUPO MATEUS,"O Grupo Mateus S.A. opera uma rede de supermercados no Brasil. A empresa opera lojas de atacado, atacado, móveis e eletrodomésticos; e centros de fatiamento e porcionamento, bem como em e-commerce, indústria de panificação e centros de fatiamento e porcionamento. O Grupo Mateus S.A. foi fundado em 1986 e está sediado em São Luís, Brasil.",https://www.grupomateus.com.br,Consumer Cyclical,Consumo Cíclico,5.768293,1.0224817,0.17333001,0.0554,10879225291.199926,4.730000019073486,Mid Caps,Não disponível,100,0.8199999582326152,12.299999373489229,61.54,46.0,Baixo,,🟢,5.460000038146973,-13.369963625883699
PETR4,PETROBRAS ATZ,"Petróleo Brasileiro S.A. - A Petrobras explora, produz e comercializa petróleo e gás no Brasil e internacionalmente. Atua por meio de três segmentos: Exploração e Produção; Refino, Transporte e Comercialização; e gás e energias de baixo carbono. O segmento de Exploração e Produção explora, desenvolve e produz petróleo bruto, líquidos de gás natural e gás natural principalmente para abastecimento às refinarias nacionais. O segmento de Refino, Transporte e Comercialização atua no refino, logística, transporte, aquisição e exportação de petróleo bruto; comércio de produtos petrolíferos; e produção de fertilizantes, além de participação em empresas petroquímicas. O segmento de Gás e Energias de Baixo Carbono atua na logística e comercialização de gás natural e eletricidade; transporte e comercialização de gás natural liquefeito; geração de energia elétrica por meio de usinas termelétricas; negócios de energia renovável; negócios de baixo carbono; e negócios de processamento de gás natural, bem como produção de biodiesel e seus coprodutos. A empresa também se dedica à prospecção, perfuração, refino, processamento, comercialização e transporte de petróleo bruto proveniente de campos petrolíferos onshore e offshore, e xisto ou outras rochas, bem como produtos petrolíferos, gás natural e outros hidrocarbonetos líquidos. Além disso, atua na pesquisa, desenvolvimento, produção, transporte, distribuição e comercialização de energia. A empresa foi constituída em 1953 e está sediada no Rio de Janeiro, Brasil.",https://petrobras.com.br,Energy,Energia,5.894737,1.4928705,0.28176,0.0787,620721367803.0955,48.15999984741211,Blue Chips,33.000.167/0001-01,100,8.169999755275274,122.54999632912912,60.7,58.0,Baixo,,🟢,42.34000015258789,13.745866022318593
EUCA3,EUCATEX,"A Eucatex S.A. Indústria e Comércio produz e comercializa painéis compensados, madeira e materiais relacionados no Brasil. A empresa fornece pisos laminados e vinílicos, sistemas Eucafix, portas, divisórias, painéis de MDF e MDP, painéis T-HDF, painéis de madeira, placas de fibra, tintas e vernizes, chapas de fibra de madeira, lacas e outros produtos. Também produz mudas de eucalipto; e atua em consultoria de gestão empresarial, atividades imobiliárias, florestais, colheita, manejo florestal, transporte, logística de coleta de resíduos e materiais reciclados e eletricidade. A empresa atende principalmente indústrias moveleiras e de construção. Também exporta seus produtos para os Estados Unidos e América Latina. A Eucatex S.A. Indústria e Comércio foi constituída em 1951 e está sediada em São Paulo, Brasil.",https://www.eucatex.com.br,Industrials,Indústria,5.927746,0.6828245,0.11956,0.049,1889688378.8480225,20.510000228881836,Small Caps,Não disponível,50,3.459999842922054,51.899997643830815,60.48,34.0,Baixo,,🟢,21.5,-4.604650098224019
EUCA4,EUCATEX,"A Eucatex S.A. Indústria e Comércio produz e comercializa painéis compensados, madeira e materiais relacionados no Brasil. A empresa fornece pisos laminados e vinílicos, sistemas Eucafix, portas, divisórias, painéis de MDF e MDP, painéis T-HDF, painéis de madeira, placas de fibra, tintas e vernizes, chapas de fibra de madeira, lacas e outros produtos. Também produz mudas de eucalipto; e atua em consultoria de gestão empresarial, atividades imobiliárias, florestais, colheita, manejo florestal, transporte, logística de coleta de resíduos e materiais reciclados e eletricidade. A empresa atende principalmente indústrias moveleiras e de construção. Também exporta seus produtos para os Estados Unidos e América Latina. A Eucatex S.A. Indústria e Comércio foi constituída em 1951 e está sediada em São Paulo, Brasil.",https://www.eucatex.com.br,Industrials,Indústria,5.968208,0.6874854,0.11956,0.0552,1902587219.253296,20.649999618530273,Small Caps,Não disponível,65,3.459999989700472,51.89999984550708,60.21,34.0,Baixo,,🟢,20.86000061035156,-1.0067161345962508
CYRE3,CYRELA REALT,"Cyrela Brazil Realty S.A. Empreendimentos e Participações atua na incorporação e construção de imóveis residenciais no Brasil. A empresa também presta serviços imobiliários, como gestão de obras e serviços de consultoria técnica. Cyrela Brazil Realty S.A. Empreendimentos e Participações foi fundada em 1962 e está sediada em São Paulo, Brasil.",https://www.cyrela.com.br,Consumer Cyclical,Consumo Cíclico,6.063457,0.9924785,0.22374001,0.14300000000000002,10151471016.649437,27.709999084472656,Mid Caps,Não disponível,100,4.570000098041869,68.55000147062803,59.58,64.0,Baixo,,🟢,29.0,-4.448279019059806
VLID3,VALID,"A Valid Soluções S.A. fornece soluções de pagamentos digitais no Brasil e internacionalmente. Atua por meio de três segmentos: Meio de Pagamento, Identificação e Mobile. O segmento de Meios de Pagamento oferece produtos e soluções integradas, como cartões com chip e tarja magnética, vale-presente, impressão de cheques, faturas e extratos bancários, além de soluções em identificação por radiofrequência, cartões sem contato e pagamentos móveis. O segmento de Identificação fornece captura, armazenamento e administração de dados, formulários de segurança, reconhecimento e impressões digitais. Suas soluções são utilizadas na geração de sistemas informatizados para gerenciamento de bancos de dados, coleta de dados biométricos, impressão e customização de documentos oficiais de identificação, soluções para cidades inteligentes, carimbos rastreáveis ​​e serviços de certificação digital. O segmento Mobile oferece serviços de emissão de extratos e tecnologias para uso em celulares e mobilidade digital, como soluções NFC, TSM e HCE para operadoras de telefonia móvel. Também desenvolve tecnologias para uso em celulares, como recarga e pagamento e produção de cartões destinados a telecomunicações. Atende governos estaduais e agências governamentais, grandes instituições financeiras, empresas de telecomunicações, varejistas, cooperativas agrícolas e profissionais independentes. A empresa era anteriormente conhecida como Valid Soluções e Serviços de Segurança em Meios de Pagamento e Identificação S.A. e mudou seu nome para Valid Soluções S.A. em agosto de 2018. A Valid Soluções S.A. foi fundada em 1957 e está sediada em Sorocaba, Brasil.",https://www.valid.com,Industrials,Indústria,6.105422,0.93173987,0.15168001,0.16210000000000002,1587125731.99255,20.270000457763672,Small Caps,Não disponível,85,3.319999904636186,49.799998569542794,59.3,52.0,Baixo,,🟢,21.06999969482422,-3.796864018261302
BEEF3,MINERVA,"A Minerva S.A. produz e comercializa carne bovina in natura, gado e subprodutos na América do Sul e internacionalmente. A empresa também atua no abate, desossa e processamento de carnes; venda de carnes resfriadas, congeladas e processadas, bem como produtos bovinos, suínos e aves; exportação e venda de gado vivo; e criação e venda de gado vivo, cordeiros, porcos e outros animais vivos. Além disso, comercializa eletricidade; comercializa proteínas e produtos alimentícios; vende marcas de terceiros principalmente produtos Swift; e prepara produtos para animais, que incluem farinha de carne e ossos, sangue e sebo. A empresa foi fundada em 1957 e está sediada em Barretos, Brasil.",https://ri.minervafoods.com,Consumer Defensive,Consumo Defensivo,6.144927,3.1903687,0.85664004,0.0301,4176850559.51383,4.230000019073486,Small Caps,Não disponível,45,0.6883727046836335,10.325590570254503,59.03,40.0,Baixo,,🟢,4.099999904632568,3.1707345723113685
