Ticker,Empresa,Resumo,Site,setor_original,Setor,PL,PVP,ROE,DivYield,MarketCap,Preco,Categoria,Score,LucroPorAcao,PrecoJusto,Desconto_%,Ranking,Risco,Risco_num,Farol,Preco_antigo,Variacao_%
CEBR3,CEB,"A Companhia Energética de Brasília - CEB, por meio de suas subsidiárias, gera e distribui energia elétrica e gás no Brasil. A empresa atua nos segmentos de Geração de Energia, Comercialização de Energia Elétrica, Iluminação Pública e Outros. A empresa produz energia elétrica a partir de usinas hidráulicas; distribui gás canalizado; serviços de iluminação pública; e fornece serviços de manutenção e expansão. Atua também na prestação de serviços de elaboração de estudos; projetos de engenharia; execução de obras de implantação, ampliação, reforma ou manutenção de redes aéreas e subterrâneas de transmissão e distribuição de energia elétrica; e instalação de sistemas de iluminação pública e elétrica predial. A empresa era anteriormente conhecida como Companhia de Eletricidade de Brasília e mudou seu nome para Companhia Energética de Brasília CEB em 1992. A Companhia Energética de Brasília CEB foi fundada em 1968 e está sediada em Brasília, Brasil.",https://www.ceb.com.br,Utilities,Utilidades Públicas,12.112107,2.058689,0.16638,0.18289999999999998,1946932540.648241,27.010000228881836,Small Caps,35,2.2300001336581516,33.450002004872275,19.25,32.0,Baixo,,🟢,31.520000457763672,-14.308376152865762
BMOB3,BEMOBI TECH,"Bemobi Mobile Tech S.A., uma empresa de tecnologia, fornece soluções e plataformas móveis para pagamentos digitais, engajamento de clientes, microfinanças e serviços digitais no Brasil e internacionalmente. A empresa oferece Bemobi Pay, que inclui checkouts inteligentes que oferecem solução white-label e customizável, orquestração de meios de pagamento e múltiplos métodos de pagamento; Smart POS, que aceita pagamentos; Orquestração de pagamentos que otimiza pagamentos e conecta negócios a vários provedores, aumenta as taxas de aprovação e reduz fraudes; e simplificar o gerenciamento de pagamentos. Ele também fornece Grace, uma plataforma de pagamentos conversacionais com IA; soluções de engajamento digital para ISPs de telecomunicações e MNOS de telecomunicações; e Agenda Edu SuperApp, ferramenta de comunicação, engajamento e finanças escolares. Além disso, a empresa oferece soluções de microfinanças e assinaturas digitais para telecomunicações MNOS; e Wave, plataforma digital nativa para telecomunicações; e soluções de pontuação móvel para empresas de telecomunicações e finanças. Atende MNOs e ISPs de telecomunicações, serviços públicos, educação, saúde e setores financeiros. A Bemobi Mobile Tech S.A. foi constituída em 2007 e está sediada no Rio de Janeiro, Brasil.",https://www.bemobi.com.br,Communication Services,Comunicação,12.361702,2.024743,0.15548,0.0765,1928185806.1700382,23.239999771118164,Small Caps,35,1.880000000899404,28.20000001349106,17.59,32.0,Baixo,,🟢,24.540000915527344,-5.297477978440588
GGPS3,GPS,"A GPS Participações e Empreendimentos S.A., em conjunto com suas subsidiárias, fornece facilities, segurança, logística interna, engenharia de utilidades, serviços industriais, alimentação, mão de obra temporária, marketing de campo e serviços de infraestrutura no Brasil. A empresa oferece serviços de segurança patrimonial; serviços de higiene e limpeza; serviços de catering; serviços de segurança eletrônica, implantação, operação e manutenção predial; serviços de hotéis marítimos; serviços de cozinha e venda de refeições; manutenção industrial; serviços de manutenção de rodovias; participação em sociedades mediante aquisição de ações ou quotas de capital; administração e gestão trabalhista; e consultoria financeira e assessoria empresarial na área de planejamento de eventos promocionais. Também atua na venda e distribuição de brindes promocionais; corretagem de seguros gerais, seguros de vida, seguros de saúde, seguros de pensões e capitalização; manutenção de redes telefônicas, manutenção de acessos e instalação de sistemas de telecomunicações; e construção de rede de distribuição de energia e manutenção de atividades de redes energizadas. A GPS Participações e Empreendimentos S.A. foi fundada em 1962 e está sediada em São Paulo, Brasil.",https://gpssa.com.br,Industrials,Indústria,12.43617,2.133601,0.17129,0.045599999999999995,8794976877.331173,11.6899995803833,Small Caps,20,0.9399999823404874,14.09999973510731,17.09,26.0,Baixo,,🟢,18.31999969482422,-36.189957559409955
TIMS3,TIM EJ,"A TIM S.A. atua no setor de telecomunicações no Brasil. Oferece serviços de telefonia fixa comutada nas modalidades de longa distância local, nacional e internacional, bem como serviços de comunicação pessoal móvel e multimídia. A empresa está sediada no Rio de Janeiro, Brasil. A TIM S.A. é uma subsidiária da TIM Brasil Serviços e Participações S.A.",https://www.tim.com.br,Communication Services,Comunicação,12.452515,2.1803777,0.17724001,0.0712,53243419084.271164,22.290000915527344,Blue Chips,50,1.7899999249571146,26.849998874356718,16.98,38.0,Baixo,,🟢,27.26000022888184,-18.23183885409071
ENGI4,ENERGISA,"A Energisa S.A., por meio de suas subsidiárias, atua na geração, transmissão e distribuição de energia elétrica no Brasil. A empresa gera eletricidade por meio de projetos hidráulicos, solares e eólicos. Também fornece gás natural para empresas e gás natural veicular, bem como serviços de valor agregado. Além disso, a empresa desenvolve atividades de inspeção termográfica aérea e corretagem de seguros. A empresa foi fundada em 1905 e está sediada em Cataguases, Brasil. A Energisa S.A. atua como subsidiária da Gipar S.A.",https://www.energisa.com.br,Utilities,Utilidades Públicas,12.625,0.17683794,0.12091,0.07200000000000001,22854237640.439148,9.09000015258789,Mid Caps,55,0.7200000120861696,10.800000181292544,15.83,38.0,Baixo,,🟢,10.399999618530272,-12.596149173008433
PNVL3,DIMED,"A Dimed S.A. Distribuidora de Medicamentos comercializa medicamentos, perfumarias, produtos de higiene pessoal e beleza, cosméticos e dermocosméticos no Brasil. Vende seus produtos em lojas físicas do setor varejista. A Dimed S.A. Distribuidora de Medicamentos foi fundada em 1920 e está sediada em Eldorado do Sul, Brasil.",https://www.grupopanvel.com.br,Healthcare,Saúde,12.715909,1.2825214,0.10398,0.0336,1667579202.4370146,11.1899995803833,Small Caps,25,0.8799999732919841,13.199999599379762,15.23,20.0,Baixo,,🟢,11.1899995803833,0.0
CEBR6,CEB B,"A Companhia Energética de Brasília - CEB, por meio de suas subsidiárias, gera e distribui energia elétrica e gás no Brasil. A empresa atua nos segmentos de Geração de Energia, Comercialização de Energia Elétrica, Iluminação Pública e Outros. A empresa produz energia elétrica a partir de usinas hidráulicas; distribui gás canalizado; serviços de iluminação pública; e fornece serviços de manutenção e expansão. Atua também na prestação de serviços de elaboração de estudos; projetos de engenharia; execução de obras de implantação, ampliação, reforma ou manutenção de redes aéreas e subterrâneas de transmissão e distribuição de energia elétrica; e instalação de sistemas de iluminação pública e elétrica predial. A empresa era anteriormente conhecida como Companhia de Eletricidade de Brasília e mudou seu nome para Companhia Energética de Brasília CEB em 1992. A Companhia Energética de Brasília CEB foi fundada em 1968 e está sediada em Brasília, Brasil.",https://www.ceb.com.br,Utilities,Utilidades Públicas,13.3693695,2.262195,0.16638,0.18309999999999998,2139391259.1976547,29.68000030517578,Small Caps,35,2.2200000011351158,33.30000001702673,10.87,28.0,Baixo,,🟢,31.200000762939453,-4.871796219855181
FLRY3,FLEURY,"Fleury S.A., em conjunto com suas subsidiárias, presta serviços de diagnóstico por imagem, análises clínicas, fertilidade e infusões no Brasil. Atua em dois segmentos, Medicina Diagnóstica e Medicina Integrada. A empresa também presta serviços de gestão em saúde, como telemedicina; serviços de medicina ortopédica; apoio laboratorial; exame toxicológico; soluções preventivas, integradas e pesquisas clínicas em oncologia; soluções integradas, pesquisa, desenvolvimento de processos e serviços em genômica; e serviços de análises laboratoriais. Além disso, opera plataforma de saúde, centro de infusão de imunobiológicos e centros de atendimento oftalmológico. Fleury S.A. foi fundada em 1926 e está sediada em São Paulo, Brasil.",https://ri.fleury.com.br,Healthcare,Saúde,13.431035,1.6343229,0.11672,0.1213,8469696279.164612,15.579999923706055,Small Caps,15,1.1599999496469227,17.39999924470384,10.46,16.0,Baixo,,🟢,16.350000381469727,-4.709482812222757
CXSE3,CAIXA SEGURI,"A Caixa Seguridade Participações S.A., em conjunto com suas subsidiárias, oferece produtos de seguros no Brasil e internacionalmente. A empresa atua em três segmentos: Escoamento/Mar Aberto, Segurança e Distribuição. Oferece produtos de seguros de vida, residencial e habitacional, acidentes pessoais e isenção de dívidas para pessoas físicas; e produtos de seguros de vida, residenciais e habitacionais, automóveis e credores para empresas. A empresa também oferece seguridade social, incluindo planos de previdência privada e corporativa; capitalização; consórcio; e corretagem e intermediação de produtos de segurança. Além disso, atua na aquisição de participação societária ou holding; administração, comercialização e prestação de planos privados de saúde e odontológicos; estruturação, administração e comercialização de cartas de crédito; e operações de resseguro e retrocessão. A empresa foi constituída em 2015 e está sediada em Brasília, Brasil. A Caixa Seguridade Participações S.A. atua como subsidiária da Caixa Econômica Federal.",https://www.caixaseguridade.com.br,Financial Services,Serviços Financeiros,13.499999,4.293182,0.31588,0.071,59129997253.41797,19.709999084472656,Blue Chips,50,1.4600000403313107,21.900000604969662,10.0,40.0,Baixo,,🟢,18.06999969482422,9.075813045631548
SAUD3,BRADSAUDE,"A Bradsaúde S.A. oferece planos privados de assistência odontológica no Brasil. A empresa atua nos segmentos Corporativo, Pequena e Média Empresa (PME), Pessoa Física e Outros. A empresa administra e vende planos de assistência odontológica para empresas e/ou pessoas físicas. Também atua em serviços de assessoria comercial, consultoria e gestão empresarial; desenvolve e licencia programas de software; comércio atacadista e varejista de produtos e equipamentos, saneantes, medicamentos, medicamentos, insumos farmacêuticos e correlatos; prestação de serviços de armazenamento, carregamento, organização, arrumação, guarda de mercadorias, serviços de programação técnica e administrativa, bem como gestão geral de bens e negócios. Além disso, a empresa atua na integração de tecnologias para desenvolver soluções odontológicas; e prestar serviços especializados relacionados a acidentes e doenças, além de serviços atuariais, financeiros, administrativos, comerciais e de gerenciamento de riscos. A empresa era anteriormente conhecida como Odontoprev S.A. e mudou seu nome para Bradsaúde S.A. em abril de 2026. A Bradsaúde S.A. foi fundada em 1987 e está sediada em Barueri, Brasil. A Bradsaúde S.A. atua como subsidiária da Bradesco Saúde S.A.",https://www.bradescori.com.br/en/bradesco/bradsaude/,Healthcare,Saúde,13.903847,5.5043774,0.40374002,0.0403,7882047490.353655,14.460000038146973,Small Caps,20,1.0399999394517914,15.599999091776871,7.31,28.0,Baixo,,🟢,14.460000038146973,0.0
PASS3,COMPASS,"A Compass Gás e Energia S.A. atua na distribuição e promoção de gás natural no Brasil. A empresa atua por meio de dois segmentos operacionais: Distribuição de Gás e Comercialização e Serviços. Atua na distribuição de gás natural canalizado, na originação, na comercialização e na infraestrutura de abastecimento de gás, bem como no desenvolvimento de soluções alinhadas à transição energética, incluindo projetos de biometano. A empresa atende clientes dos setores residencial, comercial, industrial, automotivo, cogeração e geração termelétrica. A empresa foi fundada em 2012 e está sediada em São Paulo, Brasil. A Compass Gás e Energia S.A. é uma subsidiária da Cosan Dez Participações S.A.",https://www.compassbr.com,Utilities,Utilidades Públicas,14.092484,3.0402792,0.18847999,0.052000000000000005,17411953916.72782,24.3799991607666,Mid Caps,50,1.73000013062045,25.95000195930675,6.05,28.0,Baixo,,🟢,24.3799991607666,0.0
ALPA4,ALPARGATAS,"A Alpargatas S.A. fabrica e comercializa calçados e acessórios no Brasil e no exterior. A empresa oferece seus produtos com as marcas Havaianas, ioasys e Rothys. A empresa era anteriormente conhecida como São Paulo Alpargatas S.A. e mudou seu nome para Alpargatas S.A. em 2010. A empresa foi fundada em 1907 e está sediada em São Paulo, Brasil.",https://www.alpargatas.com.br,Consumer Cyclical,Consumo Cíclico,14.488372,2.4426584,0.16464001,0.052000000000000005,8462864247.469522,12.460000038146973,Small Caps,35,0.8600000081546065,12.900000122319097,3.41,18.0,Baixo,,🟢,11.460000038146973,8.726003461355095
BPAC3,BTGP BANCO,"O Banco BTG Pactual S.A. fornece produtos e serviços financeiros relativos a carteiras comerciais, de investimentos, de crédito, de financiamento, de arrendamento mercantil, de seguros e de câmbio no Brasil e internacionalmente. A empresa também oferece serviços de investimento pessoal para uma carteira de investimentos customizada; serviços de contas bancárias internacionais, incluindo cartão de débito, transferência, pagamento e recebimento, e serviços de suporte ao cliente. Também fornece serviços de gestão de patrimônio, como execução, pesquisa de mercado, recursos e análises educacionais e gestão de relacionamento; gestão do patrimônio familiar; contas correntes e de poupança, certificados de depósito, contas de aposentadoria e contas do mercado monetário; financiamento imobiliário; bem como empréstimos corporativos, empréstimos a prazo, linhas de crédito e financiamento de credores. O Banco BTG Pactual S.A. foi fundado em 1983 e está sediado no Rio de Janeiro, Brasil. O Banco BTG Pactual S.A. opera como subsidiária do BTG Pactual Holding Financeira Ltda.",https://www.btgpactual.com,Financial Services,Serviços Financeiros,14.907285,1.4563923,0.2484,0.0207,260838109183.86368,22.510000228881836,Blue Chips,60,1.5099999918752365,22.649999878128547,0.62,30.0,Baixo,,🟢,22.51000022888184,-1.578282382352947e-14
EGIE3,ENGIE BRASIL,"A Engie Brasil Energia S.A., em conjunto com suas subsidiárias, desenvolve atividades de geração, comercialização, comercialização e transmissão no Brasil. A empresa também atua no negócio de transporte de gás. Em 31 de dezembro de 2025, opera um parque gerador de 12.384,5 MW composto por 133 usinas, sendo 13 hidrelétricas e 120 complementares, além de uma usina de biomassa, 88 eólicas, duas hidrelétricas e 29 solares. A empresa foi fundada em 2005 e está sediada em Florianópolis, Brasil. A Engie Brasil Energia S.A. é uma subsidiária da ENGIE Brasil Participações Ltda.",https://www.engie.com.br,Utilities,Utilidades Públicas,15.191112,2.8705804,0.20204,0.0536,39043774563.08194,34.18000030517578,Mid Caps,50,2.2499998884331696,33.74999832649755,-1.27,30.0,Baixo,,🟢,33.060001373291016,3.387776422748749
B3SA3,B3 EJ,"A B3 S.A. - Brasil, Bolsa, Balcão, empresa de infraestrutura para o mercado financeiro, presta serviços de negociação em ambiente de bolsa e balcão. Atua por meio de mercados, soluções de análise de dados, soluções de mercado de capitais e segmentos de tecnologia e plataformas. A empresa organizou mercados de títulos, como ações, contratos financeiros, índices, taxas, moedas, energia, transporte, commodities e transações de liquidação à vista e futura. Também fornece soluções tecnológicas para os mercados de seguros, resseguros, previdência e títulos de capitalização; serviços de processamento e análise de dados, incluindo padronização, cotações e estatísticas; apoia operações de crédito, financiamento e leasing nos setores automotivo, imobiliário, energia e agronegócio; e opera sistemas de negociação e câmaras de compensação. Além disso, a empresa organizou um mercado de balcão e atua como câmara de compensação e liquidação. A empresa era anteriormente conhecida como BM&FBOVESPA S.A. - Bolsa de Valores, Mercadorias e Futuros e mudou sua razão social para B3 S.A. - Brasil, Bolsa, Balcão em junho de 2017. B3 S.A. - Brasil, Bolsa, Balcão foi constituída em 2007 e está sediada em São Paulo, Brasil.",https://www.b3.com.br,Financial Services,Serviços Financeiros,15.98913,4.037881,0.26738,0.0601,73661744441.24464,14.710000038146973,Blue Chips,50,0.9200000274028026,13.800000411042038,-6.59,36.0,Baixo,,🟢,18.459999084472656,-20.31418869072392
TFCO4,TRACK FIELD,"Track & Field Co S.A. atua no desenvolvimento e comercialização de produtos esportivos e de lazer no Brasil. Oferece roupas esportivas, produtos de estilo de vida, moda praia, calçados e acessórios. A empresa vende seus produtos por meio de lojas físicas, lojas franqueadas e e-commerce. A Track & Field Co S.A. foi fundada em 1988 e está sediada em São Paulo, Brasil.",https://www.tfco.com.br,Consumer Cyclical,Consumo Cíclico,16.234043,3.9289393,0.26393,0.0223,2315820308.7745476,15.260000228881836,Small Caps,20,0.9399999882273218,14.099999823409826,-8.23,18.0,Médio,,🟡,16.059999465942383,-4.981315464904369
RDOR3,REDE D OR,"A Rede D'Or São Luiz S.A. atua na prestação de serviços hospitalares no Brasil. A empresa presta serviços de assistência e conceito de hospitalidade; e serviços complementares, como banco de sangue, diálise e ambulatórios de diversas especialidades. Também oferece planos e seguros de saúde, além de planos odontológicos para pequenas, médias e grandes empresas; planos individuais; vida individual e em grupo, viagens, prestamista, doação, bem como produtos de seguro de acidentes pessoais, individuais e em grupo; e risco previdenciário. Além disso, a empresa possui e opera hospitais, clínicas e laboratórios de oncologia e radioterapia. Além disso, está envolvido em atividades de gestão de ativos. A empresa era anteriormente conhecida como Hospital Maternidade São Luiz S.A. Rede D'Or São Luiz S.A. foi fundada em 1977 e está sediada em São Paulo, Brasil.",https://www.rededorsaoluiz.com.br,Healthcare,Saúde,16.593302,3.8580487,0.19188,0.021099999999999997,76383246396.63446,34.68000030517578,Blue Chips,35,2.0899999472784727,31.349999209177092,-10.62,18.0,Médio,,🟡,39.52999877929688,-12.269159180093876
ENGI3,ENERGISA,"A Energisa S.A., por meio de suas subsidiárias, atua na geração, transmissão e distribuição de energia elétrica no Brasil. A empresa gera eletricidade por meio de projetos hidráulicos, solares e eólicos. Também fornece gás natural para empresas e gás natural veicular, bem como serviços de valor agregado. Além disso, a empresa desenvolve atividades de inspeção termográfica aérea e corretagem de seguros. A empresa foi fundada em 1905 e está sediada em Cataguases, Brasil. A Energisa S.A. atua como subsidiária da Gipar S.A.",https://www.energisa.com.br,Utilities,Utilidades Públicas,16.638887,0.23306032,0.12091,0.0547,30120324738.682556,11.979999542236328,Mid Caps,55,0.72000005422456,10.800000813368401,-10.93,24.0,Baixo,,🟢,12.779999732971191,-6.259782530909906
CPLE3,COPEL,"A Companhia Paranaense de Energia - COPEL, em conjunto com suas subsidiárias, atua na pesquisa, estudo, planejamento, construção, produção, transformação, transporte, distribuição e comercialização de energia elétrica no Brasil. A empresa atua por meio de três segmentos: Geração e Transmissão de Energia Elétrica; Distribuição de Energia Elétrica; e Comercialização. Produz eletricidade a partir de energia hidrelétrica e eólica; e constrói, opera e mantém subestações, bem como linhas de transmissão de energia. A empresa era anteriormente conhecida como Companhia Paranaense de Energia Elétrica e mudou seu nome para Companhia Paranaense de Energia - COPEL em outubro de 1979. A Companhia Paranaense de Energia - COPEL foi fundada em 1954 e está sediada em Curitiba, Brasil.",https://www.copel.com,Utilities,Utilidades Públicas,16.714285,1.8955632,0.10787,0.0699,45167283044.70042,15.210000038146973,Mid Caps,30,0.9100000411711882,13.650000617567823,-11.43,18.0,Baixo,,🟢,15.119999885559082,0.5952391089225378
WHRL3,WHIRLPOOL,"A Whirlpool S.A. fabrica, vende, importa e exporta eletrodomésticos no Brasil. A empresa oferece refrigeradores, freezers, refrigeradores-freezer, condicionadores de ar, máquinas de fazer gelo, fogões, lava-louças, trituradores e compactadores de lixo, compactadores de lixo e aspiradores de pó. Também realiza manutenção e reparo de produtos e peças elétricas; serviços de eletrônica, hidráulica, metalurgia, produtos químicos e ferro, pintura e construção; assessoria orçamentária; serviços auxiliares nas áreas de segurança, saúde, lazer, vida cotidiana e bem-estar; marketing e publicidade; intermediação na comercialização de produtos; venda de assinaturas por meio eletrônico; e atividades de comercialização de roupas, acessórios, utensílios para casa e cozinha e outros produtos. Comercializa seus produtos com as marcas Brastemp, Consul, KitchenAind, Compra Certa, B.blend e Insinkerator. A empresa foi fundada em 1957 e está sediada em São Paulo, Brasil. A Whirlpool S.A. opera como subsidiária da Whirlpool Corporation.",https://www.whirlpool.com.br,Consumer Cyclical,Consumo Cíclico,17.363636,3.138866,0.14189,0.1355,5740642442.598211,3.819999933242798,Small Caps,15,0.22000000076267423,3.3000000114401136,-15.76,12.0,Baixo,,🟢,4.349999904632568,-12.183907655385065
SMFT3,SMART FIT,"Smartfit Escola de Ginástica e Dança S.A. operates a network of Smart Fit gyms in Latin America. The company offers digital fitness services under the Queima Diária brand. It operates through owned and franchised units in Brazil, Mexico, Colombia, Chile, Peru, Argentina, Paraguay, Uruguay, Panama, Costa Rica, Dominican Republic, Ecuador, Guatemala, El Salvador and Honduras under the Smart Fit and Bio Ritmo brands. Smartfit Escola de Ginástica e Dança S.A. was founded in 1996 and is based in São Paulo, Brazil.",https://www.smartfit.com.br,Consumer Cyclical,Consumo Cíclico,17.540539,2.024961,0.12060001,0.056799999999999996,11951411497.991386,19.469999313354492,Mid Caps,30,1.110000058342249,16.650000875133735,-16.94,12.0,Baixo,,🟢,19.07999992370605,2.04402196649846
WHRL4,WHIRLPOOL,"A Whirlpool S.A. fabrica, vende, importa e exporta eletrodomésticos no Brasil. A empresa oferece refrigeradores, freezers, refrigeradores-freezer, condicionadores de ar, máquinas de fazer gelo, fogões, lava-louças, trituradores e compactadores de lixo, compactadores de lixo e aspiradores de pó. Também realiza manutenção e reparo de produtos e peças elétricas; serviços de eletrônica, hidráulica, metalurgia, produtos químicos e ferro, pintura e construção; assessoria orçamentária; serviços auxiliares nas áreas de segurança, saúde, lazer, vida cotidiana e bem-estar; marketing and advertising; intermediation in the trade of products; sale of subscriptions through electronic means; e atividades de comercialização de roupas, acessórios, utensílios para casa e cozinha e outros produtos. Comercializa seus produtos com as marcas Brastemp, Consul, KitchenAind, Compra Certa, B.blend e Insinkerator. A empresa foi fundada em 1957 e está sediada em São Paulo, Brasil. A Whirlpool S.A. opera como subsidiária da Whirlpool Corporation.",https://www.whirlpool.com.br,Consumer Cyclical,Consumo Cíclico,18.181818,3.2867708,0.14189,0.1374,6011144024.0,4.0,Small Caps,15,0.22000000220000002,3.3000000330000003,-21.21,12.0,Baixo,,🟢,4.599999904632568,-13.043476458082539
UNIP3,UNIPAR,"A Unipar Carbocloro S.A. produz e comercializa cloro e soda cáustica na América do Sul. A empresa oferece hipoclorito de sódio, ácido clorídrico, dicloroetano e monômero de cloreto de vinila. Seus produtos são utilizados nas indústrias de construção, saneamento, alimentos, serviços públicos, mineração, siderurgia, automotiva, saúde e papel e celulose. A Unipar Carbocloro S.A. foi constituída em 1969 e está sediada em São Paulo, Brasil.",https://www.unipar.com,Basic Materials,Materiais Básicos,18.528662,3.4678428,0.16176,0.159,6678603365.791763,58.18000030517578,Small Caps,35,3.1400000877114485,47.100001315671726,-23.52,24.0,Baixo,,🟢,65.77999877929688,-11.553661622312255
IGTI4,IGUATEMI S.A,"A Iguatemi S.A., em conjunto com suas subsidiárias, atua na exploração e planejamento comercial de shopping centers no Brasil. A empresa também atua na compra de estacionamentos e na venda de imóveis. Além disso, presta serviços de assessoria e consultoria econômica, financeira e tributária. A empresa era anteriormente conhecida como Jereissati Participações S.A. e mudou seu nome para Iguatemi S.A. em novembro de 2021. A Iguatemi S.A. foi fundada em 1946 e está sediada em São Paulo, Brasil.",https://iguatemi.com.br,Real Estate,Imobiliário,18.913794,0.6664642,0.15361,0.0264,13205214896.657804,10.970000267028809,Mid Caps,60,0.5799999866250425,8.699999799375638,-26.09,30.0,Baixo,,🟢,11.899999618530272,-7.815120851376331
