Ticker,Empresa,Resumo,Site,setor_original,Setor,PL,PVP,ROE,DivYield,MarketCap,Preco,Categoria,Score,LucroPorAcao,PrecoJusto,Desconto_%,Ranking,Risco,Risco_num,Farol,Preco_antigo,Variacao_%
MDNE3,MOURA DUBEUX,"A Moura Dubeux Engenharia S.A. presta serviços de incorporação imobiliária no Brasil. A empresa desenvolve apartamentos, hotéis, resorts e edifícios residenciais, além de oferecer serviços de administração técnica de obras e assessoria técnica aos condomínios. Também atua na compra e venda de imóveis; construção imobiliária; gerenciamento; administração; e serviços de engenharia, bem como serviços de consultoria imobiliária, incluindo compra de terreno; formatação de produtos; e aprovação do projeto. A empresa foi fundada em 1983 e está sediada em Recife, Brasil.",https://www.mouradubeux.com.br,Real Estate,Imobiliário,6.2348175,1.7139678,0.27528998,0.1592,3192820690.5113983,30.799999237060547,Small Caps,60,4.940000126236341,74.10000189354511,58.43,46.0,Baixo,,🟢,33.20000076293945,-7.2289200925500685
POMO4,MARCOPOLO EJ,"A Marcopolo S.A. atua na fabricação e comercialização de ônibus, carrocerias e componentes no Brasil, África do Sul, Austrália, China, México, Argentina e internacionalmente. A empresa oferece ônibus intermunicipais, urbanos e microônibus, ônibus elétricos e ônibus híbridos; e família de microônibus Volare, como ônibus completo, com chassi e carroceria, carroceria para transporte escolar, fretamento executivo, transporte urbano e projetos especiais. Também está envolvida no desenvolvimento e produção de novos modelos sobre trilhos; produção de unidades com propulsão, automóveis de passageiros e fabricação de caixas para transporte de pessoas, TRAMs e EMUs; disponibilização de soluções de crédito para aquisição de ônibus e micro-ônibus; montagem, comercialização, importação e exportação de equipamentos de refrigeração e ar condicionado; e negócio de espuma para assentos. A empresa foi fundada em 1949 e está sediada em Caxias Do Sul, Brasil.",https://www.marcopolo.com.br,Industrials,Indústria,6.38,2.0653934,0.30973,0.16260000000000002,7919745086.600013,6.380000114440918,Small Caps,60,1.000000017937448,15.000000269061719,57.47,46.0,Baixo,,🟢,6.389999866485596,-0.15649064559648337
SHUL4,SCHULZ,"A Schulz S.A., juntamente com suas subsidiárias, fabrica e comercializa compressores de ar no Brasil, América Latina, Estados Unidos, Canadá, Europa e internacionalmente. Atua nos segmentos de Indústria e Comercialização. A empresa oferece compressores de ar, incluindo motor de diafragma, alternativo, parafuso rotativo, booster, scroll, isento de óleo e compressores de pistão; equipamentos de tratamento de ar, como separadores e drenos de condensado, purificadores e separadores de água e óleo, bem como tanques e secadores de ar, e filtros e gerenciadores de ar; e produtos de limpeza que incluem aspiradores de pó e líquidos e lavadoras de alta pressão. Também fornece máquinas e ferramentas, que incluem geradores de energia, máquinas de solda, motores de combustão, equipamentos de coluna e bancada, ferramentas elétricas e sem fio, ferramentas manuais, ferramentas pneumáticas e a bateria, linhas automotivas de 12V, motores e pistolas elétricas, bem como lubrificantes; bombas motorizadas; peças de reposição; e outros acessórios relacionados. Além disso, a empresa oferece serviços pós-venda. Além disso, seus produtos são utilizados para aplicações residenciais, profissionais e industriais. Além disso, a empresa exporta seus produtos. A Schulz S.A. foi fundada em 1963 e está sediada em Joinville, Brasil.",https://www.schulz.com.br,Consumer Cyclical,Consumo Cíclico,6.4814816,1.2485137,0.19755,0.106,1871909649.75,5.25,Small Caps,85,0.8099999851885716,12.149999777828574,56.79,46.0,Baixo,,🟢,5.349999904632568,-1.8691571292548694
CEAB3,CEA MODAS,"A C&A Modas S.A. atua como varejista de moda feminina, masculina e infantil no Brasil e internacionalmente. Oferece blusas, calças, vestidos, saias, casacos, moda praia, roupas íntimas, camisetas, camisas, bermudas, jaquetas e casacos, bodys, conjuntos e shorts; produtos de beleza, incluindo perfumes, maquiagem, cuidados com a pele, corpo e banho e acessórios; e calçados, como botas, sapatos e mocassins, sapatilhas, sandálias e tênis. A empresa vende seus produtos em lojas e também online. A empresa foi fundada em 1841 e está sediada em Barueri, Brasil.",https://www.cea.com.br,Consumer Cyclical,Consumo Cíclico,6.4973545,1.0034319,0.16736999,0.0788,3713033940.780012,12.279999732971191,Small Caps,85,1.8899999581323739,28.349999371985607,56.68,46.0,Baixo,,🟢,12.140000343322754,1.1532074603724372
SAPR4,SANEPAR,"A Companhia de Saneamento do Paraná - SANEPAR presta serviços de saneamento no Brasil. A empresa atua na distribuição de água; coleta e tratamento de esgoto e resíduos sólidos; estudo, projeto e obras de novas instalações; expansão das redes de distribuição de água; e redes de coleta e tratamento de esgoto. Presta ainda serviços de consultoria e assistência técnica nas suas áreas de atuação. A Companhia de Saneamento do Paraná - SANEPAR foi fundada em 1963 e está sediada em Curitiba, Brasil.",https://www.sanepar.com.br,Utilities,Utilidades Públicas,6.51938,0.205855,0.17944999,0.0277,12709238184.198338,8.40999984741211,Mid Caps,85,1.2899999459169598,19.349999188754396,56.54,46.0,Baixo,,🟢,8.100000381469727,3.8271537202833326
PINE3,PINE EJ,"O Banco Pine S.A., em conjunto com suas subsidiárias, fornece produtos e serviços bancários no Brasil. A empresa se dedica a negócios comerciais, de investimento, crédito, financiamento, câmbio e leasing. Também está envolvida em consultoria; distribuição de títulos; imobiliária; intermediação de negócios; e comercialização de ativos ambientais. A empresa foi constituída em 1991 e está sediada em São Paulo, Brasil.",https://www.pine.com,Financial Services,Serviços Financeiros,6.617801,2.286955,0.33765998,0.0706,3248374948.711092,12.640000343322754,Small Caps,60,1.9100000654783595,28.650000982175392,55.88,46.0,Baixo,,🟢,11.600000381469728,8.965516617692188
CSED3,CRUZEIRO EDU ED,"A Cruzeiro do Sul Educacional S.A. presta serviços de educação no Brasil. A empresa oferece ensino superior; educação a distância com a marca Cruzeiro do Sul Virtual; e cursos de medicina. Também opera escolas do Colégio Alto Padrão; Colégio Ceunsp Itu, que oferece serviços de educação infantil, fundamental e médio; O Colégio Ceunsp Salto oferece serviços de educação básica, educação infantil e ensino médio; e o Colégio Cruzeiro do Sul que oferece serviços de educação infantil, ensino médio e escola técnica. A empresa foi fundada em 1965 e está sediada em São Paulo, Brasil.",https://www.cruzeirodosuleducacional.com.br,Consumer Defensive,Consumo Defensivo,6.7777777,1.2583085,0.19393998,0.0897,2001338527.0428314,5.489999771118164,Small Caps,85,0.8099999755256305,12.149999632884457,54.81,46.0,Baixo,,🟢,6.559999942779541,-16.310978368820024
PETR3,PETROBRAS ERJ,"Petróleo Brasileiro S.A. - A Petrobras explora, produz e comercializa petróleo e gás no Brasil e internacionalmente. Atua por meio de três segmentos: Exploração e Produção; Refino, Transporte e Comercialização; e gás e energias de baixo carbono. O segmento de Exploração e Produção explora, desenvolve e produz petróleo bruto, líquidos de gás natural e gás natural principalmente para abastecimento às refinarias nacionais. O segmento de Refino, Transporte e Comercialização atua no refino, logística, transporte, aquisição e exportação de petróleo bruto; comércio de produtos petrolíferos; e produção de fertilizantes, além de participação em empresas petroquímicas. O segmento de Gás e Energias de Baixo Carbono atua na logística e comercialização de gás natural e eletricidade; transporte e comercialização de gás natural liquefeito; geração de energia elétrica por meio de usinas termelétricas; negócios de energia renovável; negócios de baixo carbono; e negócios de processamento de gás natural, bem como produção de biodiesel e seus coprodutos. A empresa também se dedica à prospecção, perfuração, refino, processamento, comercialização e transporte de petróleo bruto proveniente de campos petrolíferos onshore e offshore, e xisto ou outras rochas, bem como produtos petrolíferos, gás natural e outros hidrocarbonetos líquidos. Além disso, atua na pesquisa, desenvolvimento, produção, transporte, distribuição e comercialização de energia. A empresa foi constituída em 1953 e está sediada no Rio de Janeiro, Brasil.",https://petrobras.com.br,Energy,Energia,6.796834,1.5970243,0.28176,0.0758,664027517746.7136,51.52000045776367,Blue Chips,75,7.579999814290547,113.6999972143582,54.69,52.0,Baixo,,🟢,46.220001220703125,11.466895493474244
LOGG3,LOG COM PROP,"A LOG Commercial Properties e Participações S.A. desenvolve, constrói e aluga imóveis residenciais e comerciais no Brasil. Oferece logística e armazéns industriais; aluguel de imóveis próprios; construção de edifícios; construção, marketing, locação e serviços relacionados, incluindo consultoria imobiliária; e fornece e participa de bens e serviços no setor imobiliário comercial. A empresa era anteriormente conhecida como MRV Logística E Participações S.A. A LOG Commercial Properties e Participações S.A. foi constituída em 2008 e está sediada em Belo Horizonte, Brasil.",https://www.logcp.com.br,Real Estate,Imobiliário,6.823096,0.66993153,0.100439996,0.1441,2427492929.4150543,27.770000457763672,Small Caps,65,4.069999961566373,61.0499994234956,54.51,40.0,Baixo,,🟢,28.200000762939453,-1.5248237359656005
CMIG4,CEMIG ED,"A Companhia Energética de Minas Gerais - CEMIG, por meio de suas subsidiárias, atua na geração, transmissão, distribuição e comercialização de energia no Brasil. Em 31 de dezembro de 2025, a empresa operava 32 usinas hidrelétricas com capacidade total de 4.434 MW, 2 parques eólicos com capacidade total de 71 MW e 12 usinas fotovoltaicas com capacidade total de 169 MW; 365.577 milhas de linhas de distribuição; e 4.865 milhas de linhas de transmissão. Também atua na aquisição, transporte e distribuição de gás e seus subprodutos e derivados; venda e comercialização de energia; construção, implantação, operação e manutenção de transmissão de energia elétrica; comercialização e intermediação de negócios relacionados à energia; instalação, operação, manutenção e aluguel de usinas solares; e atividades de geração distribuída, serviços de conta, cogeração, eficiência energética e gestão de abastecimento e armazenamento. A empresa foi constituída em 1952 e está sediada em Belo Horizonte, Brasil.",https://www.cemig.com.br,Utilities,Utilidades Públicas,6.919075,1.1983181,0.1751,0.106,34242362903.394474,11.970000267028809,Mid Caps,100,1.7300000747251343,25.950001120877015,53.87,52.0,Baixo,,🟢,11.93000030517578,0.33528885859018215
RANI3,IRANI ED,"A Irani Papel e Embalagem S.A. fabrica e comercializa papelão ondulado e papéis para embalagens no Brasil e no exterior. Atua por meio de três segmentos: Embalagens Sustentáveis; Segmento Papel para Embalagens Sustentáveis; e RS Florestal. A empresa oferece caixas e folhas de papelão leve, corrugado e pesado; e papéis kraft de baixa e alta densidade e papéis reciclados. Também presta serviços florestais e de reflorestamento; e cultivo de pinus para comercialização de madeira em tora. A Irani Papel e Embalagem S.A. foi fundada em 1941 e está sediada em Porto Alegre, Brasil.",https://irani.com.br,Consumer Cyclical,Consumo Cíclico,7.1454544,1.2478172,0.18021,0.058899999999999994,1811739612.115233,7.860000133514404,Small Caps,85,1.1000000410770803,16.500000616156203,52.36,40.0,Baixo,,🟢,9.56999969482422,-17.86833454377895
WIZC3,WIZ CO ED,"Wiz Co Participações e Corretagem de Seguros S.A. operates as an insurance broker in Brazil. The company offers bancassurance, consortiums, and credit services. It also involved in-person, remote, and digital solutions for the sale and after-sales of insurance and financial products. The company was formerly known as Wiz Soluções e Corretagem de Seguros S.A. Wiz Co Participações e Corretagem de Seguros S.A. was founded in 1973 and is headquartered in Brasília, Brazil.",https://wiz.co,Financial Services,Serviços Financeiros,7.2063494,2.08066,0.29974002,0.0703,1451958108.3600426,9.079999923706055,Small Caps,60,1.2599999555539252,18.899999333308877,51.96,46.0,Baixo,,🟢,9.6899995803833,-6.2951463683460425
SMTO3,SAO MARTINHO,"A São Martinho S.A., em conjunto com suas subsidiárias, atua na produção e comercialização de açúcar, etanol e outros subprodutos da cana-de-açúcar no Brasil. A empresa atua nos segmentos de Açúcar, Etanol, Etanol de Cormo, Energia Elétrica, Negócios Imobiliários, Leveduras e Outros Produtos. Oferece uma variedade de açúcar bruto; etanol hidratado, utilizado em tanques de carros movidos a etanol; etanol anidro, utilizado como aditivo à gasolina em veículos movidos a gasolina; e o etanol industrial, utilizado principalmente na produção de tintas, cosméticos e bebidas alcoólicas. A empresa também gera energia elétrica a partir do bagaço da cana-de-açúcar; fornece subprodutos, incluindo leveduras utilizadas na alimentação animal; oferece óleo fúsel usado como solvente e amilaetanol puro; e SMartLiO, substituto do óleo de soja utilizado na produção de biocombustíveis, tintas e produtos químicos, além de Grãos Secos de Destilaria com Solúveis, nutrição animal para ruminantes, porcos, cavalos, pássaros, peixes e animais de estimação. Além disso, atua no cultivo da cana-de-açúcar; desenvolvimento de imóveis; importação e exportação de bens, produtos e matérias-primas; produções agrícolas; e investimento em outras empresas. A empresa foi fundada em 1914 e está sediada em São Paulo, Brasil. A São Martinho S.A. é uma subsidiária da LJN Participações S.A.",https://www.saomartinho.com.br,Basic Materials,Materiais Básicos,7.284483,0.7534887,0.11124,0.054000000000000006,5454868494.771761,16.899999618530273,Small Caps,65,2.319999870756823,34.79999806135234,51.44,34.0,Baixo,,🟢,18.459999084472656,-8.450701751413153
BBSE3,BBSEGURIDADE,"A BB Seguridade Participações S.A., por meio de suas subsidiárias, atua nos negócios de seguros, previdência e obrigações no Brasil. A empresa atua por meio de dois segmentos, Seguros e Corretagem. O segmento de Seguros oferece produtos e serviços de seguros, incluindo seguros de vida, patrimonial e de veículos, seguros patrimoniais, rurais, riscos especiais e financeiros, transportes, cascos e habitação, bem como planos de previdência complementar, odontológico e de capitalização. Seu segmento de Corretagem atua na corretagem e administração, implementação, promoção e viabilização de negócios de seguros nos setores básico, vida e capitalização, bem como planos de previdência aberta e planos odontológicos. A empresa foi fundada em 1981 e está sediada em Brasília, Brasil. A BB Seguridade Participações S.A. atua como subsidiária do Banco do Brasil S.A.",https://www.bbseguridaderi.com.br,Financial Services,Serviços Financeiros,7.348102,5.3485875,0.75649,0.1497,67613690342.052246,34.83000183105469,Blue Chips,75,4.739999775595751,71.09999663393627,51.01,52.0,Baixo,,🟢,34.849998474121094,-0.05737917917343771
ECOR3,ECORODOVIAS,"A EcoRodovias Infraestrutura e Logística S.A. atua como uma empresa de infraestrutura que opera concessões rodoviárias no Brasil. Opera o Ecopátio Logística Cubatão, plataforma logística intermodal, que é o local regulador de caminhões no Porto de Santos. A empresa também atua na operação portuária e na movimentação e armazenagem de cargas de importação e exportação no Porto de Santos. A empresa foi fundada em 1997 e está sediada em São Paulo, Brasil. A EcoRodovias Infraestrutura e Logística S.A. atua como subsidiária da IGLI S.p.A.",https://www.ecorodovias.com.br,Industrials,Indústria,7.4094486,1.5954561,0.21511999,0.032799999999999996,6545795630.516624,9.40999984741211,Small Caps,45,1.2700000169259706,19.05000025388956,50.6,40.0,Baixo,,🟢,9.960000038146973,-5.5220902472726205
PINE4,PINE EJ,"O Banco Pine S.A., em conjunto com suas subsidiárias, fornece produtos e serviços bancários no Brasil. A empresa se dedica a negócios comerciais, de investimento, crédito, financiamento, câmbio e leasing. Também está envolvida em consultoria; distribuição de títulos; imobiliária; intermediação de negócios; e comercialização de ativos ambientais. A empresa foi constituída em 1991 e está sediada em São Paulo, Brasil.",https://www.pine.com,Financial Services,Serviços Financeiros,7.4502616,2.5746336,0.33765998,0.06269999999999999,3656991517.218544,14.229999542236328,Small Caps,60,1.9099999847302447,28.64999977095367,50.33,46.0,Baixo,,🟢,11.960000038146973,18.97992890342046
EZTC3,EZTEC,"A EZTEC Empreendimentos e Participações S.A. atua em atividades de engenharia, construção e incorporação imobiliária no Brasil e internacionalmente. A empresa desenvolve e comercializa imóveis; administra e aluga propriedades; constrói condomínios; e subdivide terras. Atua também na prestação de serviços relacionados à construção, fiscalização, estudos e projetos; e execução de obras e serviços de engenharia civil. A EZTEC Empreendimentos e Participações S.A. foi fundada em 1979 e está sediada em São Paulo, Brasil.",https://www.eztec.com.br,Real Estate,Imobiliário,7.566138,0.78844357,0.10949001,0.0889,3966657419.007682,14.300000190734863,Small Caps,65,1.889999916831396,28.34999875247094,49.56,36.0,Baixo,,🟢,14.9399995803833,-4.283797909129645
BGIP3,BANESE,"O Banco do Estado de Sergipe S.A. oferece diversos produtos e serviços bancários em Sergipe. A empresa oferece contas correntes, únicas e outras; poupança; Produtos CBD/RDB; investimentos; cartões; produtos de seguros; empréstimos e financiamentos, consignado, pagamento, consórcio, capitalização, portabilidade e serviços de internet banking. A empresa era anteriormente conhecida como Banco de Fomento Budget e mudou seu nome para Banco do Estado de Sergipe S.A. em 1967. O Banco do Estado de Sergipe S.A. foi fundado em 1961 e tem sede em Aracaju, Brasil.",https://www.banese.com.br,Financial Services,Serviços Financeiros,7.6185565,1.3556523,0.15865,0.059800000000000006,1293284502.7143555,59.119998931884766,Small Caps,85,7.760000064564037,116.40000096846055,49.21,36.0,Baixo,,🟢,62.2400016784668,-5.012857748140871
TEND3,TENDA,"A Construtora Tenda S.A. atua como construtora de residências no Brasil. Atua nos segmentos On-Site e Off-Site. A empresa também atua na execução e gerenciamento de obras de construção civil; desenvolvimento de imóveis; compra e venda de imóveis e terrenos; prestação de serviços de gestão de construção civil; e intermediação e comercialização de cotas de consórcio. A Construtora Tenda S.A. foi fundada em 1969 e está sediada em São Paulo, Brasil.",https://www.tenda.com,Real Estate,Imobiliário,7.657767,3.1871905,0.47057998,0.0391,3867340602.0802917,31.549999237060547,Small Caps,45,4.119999895147051,61.79999842720576,48.95,36.0,Baixo,,🟢,30.670000076293945,2.869250598557343
SAPR3,SANEPAR,"A Companhia de Saneamento do Paraná - SANEPAR presta serviços de saneamento no Brasil. A empresa atua na distribuição de água; coleta e tratamento de esgoto e resíduos sólidos; estudo, projeto e obras de novas instalações; expansão das redes de distribuição de água; e redes de coleta e tratamento de esgoto. Presta ainda serviços de consultoria e assistência técnica nas suas áreas de atuação. A Companhia de Saneamento do Paraná - SANEPAR foi fundada em 1963 e está sediada em Curitiba, Brasil.",https://www.sanepar.com.br,Utilities,Utilidades Públicas,7.689923,0.24281588,0.17944999,0.021,14991158863.775831,9.920000076293945,Mid Caps,85,1.2899999227942782,19.34999884191417,48.73,42.0,Baixo,,🟢,9.510000228881836,4.311249606145553
LEVE3,METAL LEVE ED,"A MAHLE Metal Leve S.A., empresa de peças automotivas, fabrica e comercializa componentes para motores de combustão interna e filtros automotivos na América do Sul, Europa, América Central e do Norte, África e internacionalmente. Atua nos segmentos de Powertrain e Carregamento e Sistemas Térmicos e Fluidos. A empresa oferece sistemas de acionamento e eletrônica de potência para motores elétricos; sistemas de pistão, componentes de cilindros, trens de válvulas, ar condicionado, refrigeração de motor, gerenciamento de ar, resfriamento de motor, gerenciamento de óleo; e eletrônica de potência para acionamentos de tração para automóveis de passageiros, bem como acionamento elétrico e sistemas mecatrônicos para aplicações industriais, máquinas agrícolas e de construção, veículos comerciais, veículos industriais, veículos de transporte elétrico e indústria automotiva, bem como veículos industriais e especiais; e equipamentos de motores grandes e pequenos. Ela fornece túneis de vento climáticos, testes de motores, engenharia, testes de módulos, gerenciamento térmico e serviços de transmissão. Além disso, disponibiliza túneis de vento climáticos; testes de motores; teste de módulo; gestão térmica industrial; transmissões; e serviços de engenharia. Além disso, a empresa oferece produtos para pistões, anéis de pistão, válvulas, bielas, rolamentos, buchas, arruelas de encosto, camisas de cilindro, anéis de pistão, árvores de cames, pistões, pinos, porta-anéis e compressores mecânicos, bem como filtros de combustível, filtros de ar, filtros de óleo, filtros de ar condicionado, filtros de carvão ativado, separadores de óleo, tampas de válvulas, sistemas de admissão de ar, pré-filtros de diesel e coletores de admissão, ar condicionado e radiadores e condensadores. Além disso, exporta seus produtos. A empresa foi fundada em 1920 e está sediada em Mogi Guaçu, Brasil. A MAHLE Metal Leve S.A. atua como subsidiária da Mahle Indústria E Comercio Ltda.",https://www.mahle.com,Consumer Cyclical,Consumo Cíclico,7.9287305,5.6010065,0.74492997,0.0801,4825188193.183899,35.599998474121094,Small Caps,60,4.489999814487463,67.34999721731195,47.14,42.0,Baixo,,🟢,35.689998626708984,-0.25217191384405957
OFSA3,OUROFINO S/A,"A Ouro Fino Saúde Animal Participações S.A., em conjunto com suas subsidiárias, atua no desenvolvimento, produção e comercialização de medicamentos veterinários, vacinas e outros produtos para animais de produção e de companhia, principalmente no Brasil. A empresa atua através de três segmentos: Animais de Produção; Animais de Companhia; e Operações Internacionais. Fabrica e comercializa medicamentos, incluindo antiinflamatórios, antibióticos, anticoccidianos, antimastíticos, ectoparasiticidas, endectocidas, endoparasiticidas, hemoparasiticidas, inoculantes, terapêuticos, produtos para reprodução animal e vacinas; e aditivos, probióticos e outros produtos veterinários para melhoria de desempenho para bovinos, suínos, aves, ovinos, cavalos e caprinos, bem como serviços de fabricação. A empresa também fabrica soluções veterinárias para cães e gatos, como anestésicos, sedativos, antiinflamatórios, antibióticos, antimicrobianos, dermatológicos, ectoparasiticidas, endoparasiticidas, dermocosméticos e otológicos. Além disso, oferece vacinas e outros produtos veterinários para animais de produção e de companhia. A empresa era anteriormente conhecida como A.H.N.S.P.E. Empreendimentos e Participações S.A. A Ouro Fino Saúde Animal Participações S.A. foi constituída em 1987 e está sediada em Cravinhos, Brasil.",https://www.ourofinosaudeanimal.com,Healthcare,Saúde,8.036319,2.239541,0.28625,0.0444,1784546769.3014297,33.189998626708984,Small Caps,45,4.130000143935175,61.95000215902762,46.42,36.0,Baixo,,🟢,26.21999931335449,26.58275932831358
SEER3,SER EDUCA,"Ser Educacional S.A., together with its subsidiaries, operates on-campus and distance-learning undergraduate, graduate, and professional training courses and other education-related areas in Brazil. It offers undergraduate, post graduate, on-campus and digital learning, and vocational courses. The company operates under the UNINASSAU  Centro Universitário Maurício de Nassau, UNINABUCO  Centro Universitário Nabuco, UNG  Universidade Guarulhos, UNAMA  University of the Amazon, UNIVERITAS  Universus Veritas University Center, UNINORTE - Northern University Center, University Center for Biomedical Sciences of Cacoal UNIFACIMED, UNIJUAZEIRO - Centro Universitário de Juazeiro do Norte, UNESC - Educational Society of Rondônia, UNIFASB - São Francisco de Barreiras University Center, UNI7 - 7 de Setembro University Center, CDMV - Center for the Development of Veterinary Medicine, FAEL University Center, UNINASSAU Colleges, UNINABUCO Colleges, and Joaquim Nabuco and Maurício de Nassau Technical Schools, GOKURSOS, BEDUKA, DELÍNEA, PROVA FÁCIL and Peixe 30, CDO, CDM, DOK, and PLANTÃO VETERINÁRIO brands. It is also involved in the investment business. The company was founded in 1993 and is headquartered in Recife, Brazil.",https://www.sereducacional.com,Consumer Defensive,Consumo Defensivo,8.077381,1.3030536,0.1681,0.0356,1736454302.0388718,13.569999694824219,Small Caps,70,1.6799999523142732,25.1999992847141,46.15,36.0,Baixo,,🟢,13.479999542236328,0.6676569409805753
