Ticker,Empresa,Resumo,Site,setor_original,Setor,PL,PVP,ROE,DivYield,MarketCap,Preco,Categoria,Score,LucroPorAcao,PrecoJusto,Desconto_%,Ranking,Risco,Risco_num,Farol,Preco_antigo,Variacao_%
EKTR4,ELEKTRO,"A Elektro Redes S.A. atua na distribuição de energia elétrica no Brasil. A empresa era anteriormente conhecida como Elektro Eletricidade e Serviços S.A. e mudou seu nome para Elektro Redes S.A. em agosto de 2016. A empresa foi constituída em 1998 e está sediada em Campinas, Brasil. A Elektro Redes S.A. é subsidiária da Neoenergia S.A.",https://www.elektro.com.br,Utilities,Utilidades Públicas,8.106383,3.6168594,0.47262,0.10869999999999999,7382227700.846825,38.099998474121094,Small Caps,60,4.699999799432262,70.49999699148393,45.96,42.0,Baixo,,🟢,39.5,-3.544307660452927
NEOE3,NEOENERGIA,"A Neoenergia S.A. gera, transmite, distribui, comercializa e comercializa energia elétrica no Brasil. Opera através de Redes, Renováveis, Liberalizadas e Outros. A empresa fornece soluções para o mercado livre de energia, como gestão de energia, sistemas de medição e faturamento, certificados de energia renovável e contratos de longo prazo; hidrogênio verde, que inclui amônia verde, aço e metanol; soluções de gases industriais; usina solar; e soluções de frota eletrificada para empresas. Também oferece cobrança de energia solar, seguros e serviços para clientes residenciais. A empresa foi fundada em 1997 e está sediada no Rio de Janeiro, Brasil. A Neoenergia S.A. é uma subsidiária da Iberdrola Energía, S.A.U.",https://www.neoenergia.com,Utilities,Utilidades Públicas,8.111112,1.1181779,0.14588,0.0436,40759313810.36914,33.58000183105469,Mid Caps,65,4.139999772047863,62.09999658071795,45.93,30.0,Baixo,,🟢,32.939998626708984,1.9429363419182555
TEND3,TENDA,"A Construtora Tenda S.A. atua como construtora de residências no Brasil. Atua nos segmentos On-Site e Off-Site. A empresa também atua na execução e gerenciamento de obras de construção civil; desenvolvimento de imóveis; compra e venda de imóveis e terrenos; prestação de serviços de gestão de construção civil; e intermediação e comercialização de cotas de consórcio. A Construtora Tenda S.A. foi fundada em 1969 e está sediada em São Paulo, Brasil.",https://www.tenda.com,Real Estate,Imobiliário,8.237864,3.428629,0.44829,0.0365,4112913383.821991,33.939998626708984,Small Caps,45,4.119999872140276,61.799998082104146,45.08,36.0,Baixo,,🟢,30.670000076293945,10.661879824847311
LEVE3,METAL LEVE,"A MAHLE Metal Leve S.A., empresa de peças automotivas, fabrica e comercializa componentes para motores de combustão interna e filtros automotivos na América do Sul, Europa, América Central e do Norte, África e internacionalmente. Atua nos segmentos de Powertrain e Carregamento e Sistemas Térmicos e Fluidos. A empresa oferece sistemas de acionamento e eletrônica de potência para motores elétricos; sistemas de pistão, componentes de cilindros, trens de válvulas, ar condicionado, refrigeração de motor, gerenciamento de ar, resfriamento de motor, gerenciamento de óleo; e eletrônica de potência para acionamentos de tração para automóveis de passageiros, bem como acionamento elétrico e sistemas mecatrônicos para aplicações industriais, máquinas agrícolas e de construção, veículos comerciais, veículos industriais, veículos de transporte elétrico e indústria automotiva, bem como veículos industriais e especiais; e equipamentos de motores grandes e pequenos. Ela fornece túneis de vento climáticos, testes de motores, engenharia, testes de módulos, gerenciamento térmico e serviços de transmissão. Além disso, disponibiliza túneis de vento climáticos; testes de motores; teste de módulo; gestão térmica industrial; transmissões; e serviços de engenharia. Além disso, a empresa oferece produtos para pistões, anéis de pistão, válvulas, bielas, rolamentos, buchas, arruelas de encosto, camisas de cilindro, anéis de pistão, árvores de cames, pistões, pinos, suportes de anéis e compressores mecânicos, bem como filtros de combustível, filtros de ar, filtros de óleo, filtros de ar condicionado, filtros de carvão ativado, separadores de óleo, tampas de válvulas, sistemas de admissão de ar, pré-filtros de diesel e coletores de admissão, ar condicionado e radiadores e condensadores. Além disso, exporta seus produtos. A empresa foi fundada em 1920 e está sediada em Mogi Guaçu, Brasil. A MAHLE Metal Leve S.A. atua como subsidiária da Mahle Indústria E Comercio Ltda.",https://www.mahle.com,Consumer Cyclical,Consumo Cíclico,8.267261,5.840151,0.74492997,0.077,5031207535.228729,37.119998931884766,Small Caps,60,4.489999642189205,67.34999463283808,44.88,42.0,Baixo,,🟢,35.689998626708984,4.0067255819551235
CLSC4,CELESC,"A Centrais Elétricas de Santa Catarina S.A., por meio de suas subsidiárias, atua na geração, transmissão e comercialização de energia elétrica no Brasil. A empresa possui principalmente usinas hidrelétricas. A Centrais Elétricas de Santa Catarina S.A. foi fundada em 1955 e tem sede em Florianópolis, Brasil.",https://www.celesc.com.br,Utilities,Utilidades Públicas,8.296919,1.4394573,0.19097,0.054000000000000006,5712452862.522308,148.10000610351562,Small Caps,85,17.850000235450725,267.75000353176085,44.69,36.0,Baixo,,🟢,147.75,0.2368907638007614
ISAE4,ISA ENERGIA ED,"A ISA Energía Brasil S.A. atua no negócio de transmissão de energia elétrica no Brasil. Em 31 de dezembro de 2025, possuía capacidade total instalada de transformação de 84.910 MVA juntamente com linhas de transmissão de 23 mil quilômetros. Atua nos estados da Bahia, Espírito Santo, Minas Gerais, Rio de Janeiro e São Paulo. A ISA Energía Brasil S.A. foi constituída em 1999 e está sediada em São Paulo, Brasil.",https://www.isacteep.com.br,Utilities,Utilidades Públicas,8.369272,0.9672294,0.12099,0.0858,20458326086.511932,31.049999237060547,Mid Caps,80,3.710000013986945,55.650000209804176,44.2,42.0,Baixo,,🟢,28.770000457763672,7.924917424468133
RANI3,IRANI,"A Irani Papel e Embalagem S.A. fabrica e comercializa papelão ondulado e papéis para embalagens no Brasil e no exterior. Atua por meio de três segmentos: Embalagens Sustentáveis; Segmento Papel para Embalagens Sustentáveis; e RS Florestal. A empresa oferece caixas e folhas de papelão leve, corrugado e pesado; e papéis kraft de baixa e alta densidade e papéis reciclados. Também presta serviços florestais e de reflorestamento; e cultivo de pinus para comercialização de madeira em tora. A Irani Papel e Embalagem S.A. foi fundada em 1941 e está sediada em Porto Alegre, Brasil.",https://irani.com.br,Consumer Cyclical,Consumo Cíclico,8.654546,1.5113511,0.18021,0.04769999999999999,2194371710.3950844,9.520000457763672,Small Caps,45,1.0999999835651313,16.49999975347697,42.3,30.0,Baixo,,🟢,9.56999969482422,-0.5224580841689047
BLAU3,BLAU,"Blau Farmacêutica S.A., uma empresa farmacêutica fornece medicamentos no Brasil, Argentina, Chile, Colômbia, Uruguai, Equador, Peru e Estados Unidos. Seus produtos abrangem diversas áreas, como imunologia, hematologia, oncologia, nefrologia, infectologia e anestesiologia. A empresa oferece estimuladores uterinos, antirreumáticos, anestésicos, antibióticos, cuidados com a saúde feminina, biofarmacêuticos, oncológicos, produtos hospitalares, antivirais e antirretrovirais, biológicos, inibidores de bomba de ácido, hemoderivados, antitrombóticos e trombolíticos. A Blau Farmacêutica S.A. foi constituída em 1987 e está sediada em Cotia, Brasil.",https://www.blau.com,Healthcare,Saúde,8.7109375,1.1337061,0.1347,0.059000000000000004,2575431093.1379795,11.149999618530273,Small Caps,65,1.2799999562079596,19.199999343119394,41.93,24.0,Baixo,,🟢,10.699999809265137,4.2056057690345146
WHRL3,WHIRLPOOL,"A Whirlpool S.A. fabrica, vende, importa e exporta eletrodomésticos no Brasil. A empresa oferece geladeiras, freezers, condicionadores de ar, máquinas de fazer gelo, fogões, lava-louças, trituradores de lixo, compactadores de lixo, aspiradores de pó, máquinas de lavar, secadoras de roupas e fornos de micro-ondas. Comercializa seus produtos com as marcas Brastemp, Consul, KitchenAind, Compra Certa, B.blend, Jenn-Air, KitchenAid, Whirlpool e Maytag. A empresa foi fundada em 1957 e está sediada em São Paulo, Brasil. A Whirlpool S.A. opera como subsidiária da Whirlpool Corporation.",https://www.whirlpool.com.br,Consumer Cyclical,Consumo Cíclico,8.787234,2.8962133,0.19904,0.1285,6206506376.76021,4.130000114440918,Small Caps,60,0.47000001529957186,7.050000229493578,41.42,36.0,Baixo,,🟢,4.349999904632568,-5.057466552064974
SBFG3,GRUPO SBF,"O Grupo SBF S.A. atua na comercialização de artigos esportivos e produtos de lazer no Brasil. A empresa oferece calçados, roupas, entretenimento em geral, equipamentos e acessórios. Também oferece aulas semanais gratuitas de Yoga e FitDance; promove diversos eventos e aulas esportivas gratuitas; atividades gratuitas, como aulas de diversas modalidades e eventos esportivos; e empréstimo de futebol, basquete, vôlei, raquetes e tapetes de ioga. A empresa comercializa seus produtos por meio de loja física, site e aplicativo das marcas Oxer, Nord e Adams, além das marcas das coleções Go Equal, Farm, Asics, Confederação Brasileira de Futebol (CBF). Além disso, atua na prestação de serviços logísticos; e negócios de comércio esportivo e produção de audiovisão. O Grupo SBF S.A. foi fundado em 1981 e está sediado em São Paulo, Brasil.",https://ri.gruposbf.com.br,Consumer Cyclical,Consumo Cíclico,8.971429,0.8865674,0.10802,0.0421,2892137451.9033384,12.5600004196167,Small Caps,50,1.399999979893582,20.99999969840373,40.19,30.0,Baixo,,🟢,12.3100004196167,2.030869142795564
BEES3,BANESTES EJ,"O Banestes S.A - Banco do Estado do Espírito Santo S.A., em conjunto com suas subsidiárias, atua como banco múltiplo no Brasil. Opera através do Financeiro; e Seguros e Outros segmentos. A empresa atua por meio de suas carteiras de comércio, rural, industrial, imobiliário, câmbio, arrendamento, investimento e administração de cartões de crédito; e nas áreas de seguros e distribuição, intermediação e administração de recursos de terceiros. Também fornece gestão de ativos e fundos; administração e intermediação de valores mobiliários, seguros, previdência e capitalização; fundos de investimento; cartões de crédito e débito; banco pela internet; conta corrente, poupança, especial, cheque fiduciário, jovem e universitário, conta mais fácil, simplificada, salário e judicial; títulos de capitalização; seguro de carro, vida, casa, acidentes pessoais, proteção financeira de cartão e seguro empresarial; cobranças e convênios; transferência de fundos e recursos; coleção; custódia; opções de crédito e financiamento; empréstimos e garantias; e outros serviços. Além disso, a empresa opera um serviço público de loteria. Banestes S.A - Banco do Estado do Espírito Santo S.A. foi fundado em 1935 e está sediado em Vitória, Brasil.",https://www.banestes.com.br,Financial Services,Serviços Financeiros,9.030612,1.2691811,0.14352,0.0391,3075411824.6623116,8.850000381469727,Small Caps,50,0.9800000688181185,14.700001032271778,39.8,24.0,Baixo,,🟢,8.630000114440918,2.549249873828779
BEES4,BANESTES EJ,"O Banestes S.A - Banco do Estado do Espírito Santo S.A., em conjunto com suas subsidiárias, atua como banco múltiplo no Brasil. Opera através do Financeiro; e Seguros e Outros segmentos. A empresa atua por meio de suas carteiras de comércio, rural, industrial, imobiliário, câmbio, arrendamento, investimento e administração de cartões de crédito; e nas áreas de seguros e distribuição, intermediação e administração de recursos de terceiros. Também fornece gestão de ativos e fundos; administração e intermediação de valores mobiliários, seguros, previdência e capitalização; fundos de investimento; cartões de crédito e débito; banco pela internet; conta corrente, poupança, especial, cheque fiduciário, jovem e universitário, conta mais fácil, simplificada, salário e judicial; títulos de capitalização; seguro de carro, vida, casa, acidentes pessoais, proteção financeira de cartão e seguro empresarial; cobranças e convênios; transferência de fundos e recursos; coleção; custódia; opções de crédito e financiamento; empréstimos e garantias; e outros serviços. Além disso, a empresa opera um serviço público de loteria. Banestes S.A - Banco do Estado do Espírito Santo S.A. foi fundado em 1935 e está sediado em Vitória, Brasil.",https://www.banestes.com.br,Financial Services,Serviços Financeiros,9.091836,1.2777857,0.14352,0.0383,3109564419.5972633,8.90999984741211,Small Caps,50,0.9800000624089688,14.700000936134531,39.39,24.0,Baixo,,🟢,8.800000190734863,1.2499960715121339
KEPL3,KEPLER WEBER,"A Kepler Weber S.A. fornece equipamentos para armazenamento de grãos e soluções pós-colheita de grãos no Brasil, nas Américas, na África, na Europa e na Ásia. Atua em cinco segmentos: Fazendas, Agroindústria, Portos e Terminais, Reposição e Serviços e Negócios Internacionais. A empresa oferece sistemas de armazenamento e preservação de grãos, como silos, secadores e transportadores, além de máquinas de limpeza. Também fornece equipamentos para commodities agrícolas, como etanol de milho, óleo de soja, ração animal, moinhos de trigo, indústrias de arroz, complexos cooperativos, produtores de cereais e canteiros; equipamentos industriais; e terminais portuários. Além disso, a empresa oferece peças de reposição e serviços de assistência técnica; serviços de engenharia técnica e processamento de dados; serviços de seguros contra riscos de engenharia; e serviços de monitoramento de temperatura e umidade de grãos no processo de processamento e armazenamento. Além disso, importa e exporta matérias-primas e produtos acabados e semiacabados. A empresa foi fundada em 1925 e está sediada em São Paulo, Brasil.",https://www.kepler.com.br,Industrials,Indústria,9.177778,1.8491157,0.20629999,0.0654,1431721120.672512,8.260000228881836,Small Caps,60,0.9000000031469312,13.500000047203967,38.81,42.0,Baixo,,🟢,8.369999885559082,-1.3142133593935952
WHRL4,WHIRLPOOL,"A Whirlpool S.A. fabrica, vende, importa e exporta eletrodomésticos no Brasil. A empresa oferece geladeiras, freezers, condicionadores de ar, máquinas de fazer gelo, fogões, lava-louças, trituradores de lixo, compactadores de lixo, aspiradores de pó, máquinas de lavar, secadoras de roupas e fornos de micro-ondas. Comercializa seus produtos com as marcas Brastemp, Consul, KitchenAind, Compra Certa, B.blend, Jenn-Air, KitchenAid, Whirlpool e Maytag. A empresa foi fundada em 1957 e está sediada em São Paulo, Brasil. A Whirlpool S.A. opera como subsidiária da Whirlpool Corporation.",https://www.whirlpool.com.br,Consumer Cyclical,Consumo Cíclico,9.212766,3.0364656,0.19904,0.1278,6507063291.326527,4.329999923706055,Small Caps,60,0.4699999895477704,7.049999843216556,38.58,36.0,Baixo,,🟢,4.599999904632568,-5.8695649244384125
ALUP4,ALUPAR,"A Alupar Investimento S.A., em conjunto com suas subsidiárias, atua na transmissão, geração e comercialização de energia no Brasil, Colômbia, Peru e Chile. Atua nos segmentos de Transmissão e Geração. A empresa detém participação em concessões de 44 sistemas de transmissão de energia elétrica, totalizando 9.999 quilômetros de linhas de transmissão; e opera linhas aéreas e subestações. Também atua na geração de energia renovável por meio de hidrelétricas, parques eólicos e usinas fotovoltaicas, que possuem capacidade instalada de 798,5 MW. A empresa foi constituída em 2006 e está sediada em São Paulo, Brasil. A Alupar Investimento S.A. é uma subsidiária da Guarupart Participações Ltda.",https://www.alupar.com.br,Utilities,Utilidades Públicas,9.2338705,1.235567,0.14265001,0.022000000000000002,11322682692.835995,11.449999809265137,Mid Caps,65,1.2400000421562265,18.6000006323434,38.44,24.0,Baixo,,🟢,10.989999771118164,4.1856237281811195
TGMA3,TEGMA,"A Tegma Gestão Logística S.A., em conjunto com suas subsidiárias, presta serviços logísticos no Brasil. Atua nos segmentos de Logística Automotiva e Logística Integrada. O segmento de Logística Automotiva atua no transporte e distribuição de veículos novos e usados; transferências portuárias; e gerenciamento de pátio e estoque para montadoras, além de serviços de pré-entrega de veículos. O segmento de Logística Integrada fornece serviços de transporte, armazenamento e gerenciamento de estoque para produtos químicos, eletrodomésticos e bens de consumo. A empresa também oferece logística e centro automotivo, gerenciamento de pátio, transporte e armazenamento de veículos, logística integrada, gerenciamento da cadeia de suprimentos de produtos químicos, gerenciamento de embalagens, intralogística e serviços de projetos especiais. Atende indústrias de alimentos e bebidas, automotiva, cosmética, eletrodomésticos, farmacêutica e química e petroquímica. A empresa foi fundada em 1969 e está sediada em São Bernardo do Campo, Brasil.",https://www.tegma.com.br,Industrials,Indústria,9.394021,2.613396,0.27091998,0.1266,2279468757.917389,34.56999969482422,Small Caps,60,3.6800002570597,55.200003855895496,37.37,42.0,Baixo,,🟢,36.84999847412109,-6.187242533803791
ISAE3,ISA ENERGIA ED,"A ISA Energía Brasil S.A. atua no negócio de transmissão de energia elétrica no Brasil. Em 31 de dezembro de 2025, possuía capacidade total instalada de transformação de 84.910 MVA juntamente com linhas de transmissão de 23 mil quilômetros. Atua nos estados da Bahia, Espírito Santo, Minas Gerais, Rio de Janeiro e São Paulo. A ISA Energía Brasil S.A. foi constituída em 1999 e está sediada em São Paulo, Brasil.",https://www.isacteep.com.br,Utilities,Utilidades Públicas,9.433962,1.0902747,0.12099,0.0761,23060915640.0,35.0,Mid Caps,80,3.7100001038800032,55.650001558200046,37.11,36.0,Baixo,,🟢,32.0099983215332,9.340836723678974
DIRR3,DIRECIAL,"A Direcional Engenharia S.A. atua no desenvolvimento e construção de projetos imobiliários residenciais de médio e baixo custo, principalmente no Brasil. A empresa tem como foco a incorporação, construção e comercialização de unidades habitacionais para famílias de baixa e média renda. A empresa foi fundada em 1981 e está sediada em Belo Horizonte, Brasil.",https://direcional.com.br,Real Estate,Imobiliário,9.473333,3.84782,0.43120998,0.18420000000000003,7394185754.65981,14.210000038146973,Small Caps,60,1.5000000568065086,22.500000852097628,36.84,42.0,Baixo,,🟢,13.510000228881836,5.18134565067341
INTB3,INTELBRAS,"A Intelbras S.A. - Indústria de Telecomunicações Eletrônica Brasileira atua na fabricação, desenvolvimento e comercialização de equipamentos de segurança eletrônica e serviços de vigilância e monitoramento eletrônicos no Brasil. A empresa atua por meio de três segmentos: Segurança, Tecnologia da Informação e Comunicação (TIC) e Energia. Oferece produtos e soluções de segurança eletrônica, inclusive Oferece produtos e soluções de segurança eletrônica, incluindo alarmes, armazenamento, câmeras, comunicação condominial, controle de acesso corporativo, fechaduras, gravadores de vídeo digital, produtos contra incêndio e intercomunicação, monitoramento de veículos, sensores, sinalização de emergência, produtos de software e aplicativos e acessórios; e os produtos e soluções de redes incluem produtos 5G e Wi-Fi corporativo, racks, roteadores, switches, rádios externos, fibra óptica e produtos passivos, injetores PoE, adaptadores USB, software e aplicativos e cabos. A empresa também fornece produtos e soluções relacionados à comunicação, como webcams, projetores, mouses e teclados sem fio, soluções em nuvem, antenas e conversores, centrais telefônicas, produtos para eletrodomésticos e conferências, gateways, fones de ouvido, rádios comunicadores, caixas e controles inteligentes, alto-falantes inteligentes, software e aplicativos e telefones; e produtos e soluções relacionados à energia que incluem carregadores de veículos elétricos, UPS, baterias, smart, fontes, protetores eletrônicos, protetores contra surtos, acessórios USB e sensores de presença de iluminação. Além disso, oferece soluções on grid, que incluem painéis solares, estruturas de fixação, inversores on grid, string boxes e acessórios; e soluções fora da rede, como produtos de iluminação, estruturas de montagem, gabinetes externos, acionamentos e painéis solares, bombas solares e geradores e inversores fora da rede. A Intelbras S.A. - Indústria de Telecomunicações Eletrônica Brasileira foi constituída em 1974 e está sediada em São José, Brasil.",https://www.intelbras.com,Technology,Tecnologia,9.47973,1.5350108,0.16176,0.10060000000000001,4591348783.694225,14.029999732971191,Small Caps,60,1.4799999296363073,22.19999894454461,36.8,36.0,Baixo,,🟢,13.970000267028809,0.4294879369758503
SANB3,SANTANDER BR,"O Banco Santander (Brasil) S.A., em conjunto com suas subsidiárias, fornece diversos produtos e serviços bancários para pessoas físicas, pequenas e médias empresas e clientes corporativos no Brasil e internacionalmente. Atua em dois segmentos, Banco Comercial e Banco Global de Atacado. A empresa oferece produtos de pagamento e fidelidade, incluindo cartões de crédito e débito; crédito consignado e imobiliário; soluções de financiamento de home equity; programas de microfinanciamento; consórcios; produtos do agronegócio, como crédito, valores mobiliários e outros produtos; call center e soluções digitais; ativos inadimplentes; e produtos de seguros que abrangem seguros de vida, acidentes pessoais, automóveis, patrimoniais e de crédito, bem como seguros de viagens e transações bancárias. Também oferece soluções emergenciais para residências, carros, motocicletas, animais de estimação e telemedicina; financiamento ao consumo; e serviços bancários corporativos e de investimento, que incluem gestão de caixa, soluções estruturadas de comércio e capital de giro, comércio e empréstimos, fusões e aquisições, mercados de capitais acionários, dívida com grau de investimento e de mercados emergentes e finanças estruturadas, bem como mercados de vendas, criação de mercado, comércio de energia, ações, pesquisa e mobilização e securitização de dívida privada. Além disso, a empresa oferece soluções de gestão de caixa, como cobranças, pagamentos, pagamentos instantâneos e serviços de folha de pagamento e custódia; programa advance, plataforma não financeira de apoio a empreendedores em conteúdos educacionais, cursos certificados, eventos com foco em gestão, inovação, internacionalização e desenvolvimento de equipes; financiamento de clientes através de depósitos e outros instrumentos de financiamento bancário; e vários investimentos. Oferece seus produtos e serviços por meio de agências, miniagências e caixas eletrônicos; centrais de atendimento; correspondentes bancários e fornecedores terceirizados; e plataformas bancárias online e móveis. A empresa foi fundada em 1970 e está sediada em São Paulo, Brasil.",https://www.santander.com.br,Financial Services,Serviços Financeiros,9.595092,0.46675423,0.10524,0.053200000000000004,117139013779.74669,15.640000343322754,Blue Chips,80,1.630000039949878,24.45000059924817,36.03,36.0,Baixo,,🟢,15.960000038146973,-2.005010614407067
TAEE3,TAESA,"A Transmissora Aliança de Energia Elétrica S.A., em conjunto com suas subsidiárias, atua na construção, operação e manutenção de linhas de transmissão de energia elétrica no Brasil. Opera uma extensão total de aproximadamente 15.319 quilômetros (km) de linhas de transmissão, que incluem 14.677 km de linhas de transmissão em operação e 642 km de linhas em construção; 113 subestações com tensão entre 230 e 525KV; e um centro de operação do sistema localizado no Rio de Janeiro. A empresa foi fundada em 2000 e está sediada no Rio de Janeiro, Brasil.",https://institucional.taesa.com.br/,Utilities,Utilidades Públicas,9.633987,0.6673609,0.21719,0.073,15233741430.991373,14.739999771118164,Mid Caps,100,1.5299999648243416,22.949999472365125,35.77,60.0,Baixo,,🟢,14.270000457763672,3.293618067817135
TAEE4,TAESA,"A Transmissora Aliança de Energia Elétrica S.A., em conjunto com suas subsidiárias, atua na construção, operação e manutenção de linhas de transmissão de energia elétrica no Brasil. Opera uma extensão total de aproximadamente 15.319 quilômetros (km) de linhas de transmissão, que incluem 14.677 km de linhas de transmissão em operação e 642 km de linhas em construção; 113 subestações com tensão entre 230 e 525KV; e um centro de operação do sistema localizado no Rio de Janeiro. A empresa foi fundada em 2000 e está sediada no Rio de Janeiro, Brasil.",https://institucional.taesa.com.br/,Utilities,Utilidades Públicas,9.849673,0.6823018,0.21719,0.0799,15574795270.07183,15.069999694824219,Mid Caps,100,1.5300000004897847,22.95000000734677,34.34,60.0,Baixo,,🟢,14.5600004196167,3.502742173828492
