Ticker,Empresa,Resumo,Site,setor_original,Setor,PL,PVP,ROE,DivYield,MarketCap,Preco,Categoria,Score,LucroPorAcao,PrecoJusto,Desconto_%,Ranking,Risco,Risco_num,Farol,Preco_antigo,Variacao_%
SMTO3,SAO MARTINHO,"A São Martinho S.A., em conjunto com suas subsidiárias, atua na produção e comercialização de açúcar, etanol e outros subprodutos da cana-de-açúcar no Brasil. A empresa atua nos segmentos de Açúcar, Etanol, Etanol de Cormo, Energia Elétrica, Negócios Imobiliários, Leveduras e Outros Produtos. Oferece uma variedade de açúcar bruto; etanol hidratado, utilizado em tanques de carros movidos a etanol; etanol anidro, utilizado como aditivo à gasolina em veículos movidos a gasolina; e o etanol industrial, utilizado principalmente na produção de tintas, cosméticos e bebidas alcoólicas. A empresa também gera energia elétrica a partir do bagaço da cana-de-açúcar; fornece subprodutos, incluindo leveduras utilizadas na alimentação animal; oferece óleo fúsel usado como solvente e amilaetanol puro; e SMartLiO, substituto do óleo de soja utilizado na produção de biocombustíveis, tintas e produtos químicos, além de Grãos Secos de Destilaria com Solúveis, nutrição animal para ruminantes, porcos, cavalos, pássaros, peixes e animais de estimação. Além disso, atua no cultivo de cana-de-açúcar; desenvolvimento de imóveis; importação e exportação de bens, produtos e matérias-primas; produções agrícolas; e investimento em outras empresas. A empresa foi fundada em 1914 e está sediada em São Paulo, Brasil. A São Martinho S.A. é uma subsidiária da LJN Participações S.A.",https://www.saomartinho.com.br,Basic Materials,Materiais Básicos,7.5862074,0.78469837,0.11124,0.0519,5680810044.728239,17.600000381469727,Small Caps,65,2.319999896321016,34.799998444815245,49.43,30.0,Baixo,,🟢,18.459999084472656,-4.658714765193593
ISAE4,ISA ENERGIA,"A ISA Energía Brasil S.A. atua no negócio de transmissão de energia elétrica no Brasil. Em 31 de dezembro de 2025, possuía capacidade total instalada de transformação de 84.910 MVA juntamente com linhas de transmissão de 23 mil quilômetros. Atua nos estados da Bahia, Espírito Santo, Minas Gerais, Rio de Janeiro e São Paulo. A ISA Energía Brasil S.A. foi constituída em 1999 e está sediada em São Paulo, Brasil.",https://www.isacteep.com.br,Utilities,Utilidades Públicas,7.9213486,0.8784499,0.11273,0.0935,18580509675.488068,28.200000762939453,Mid Caps,80,3.5599999680533507,53.399999520800264,47.19,42.0,Baixo,,🟢,28.770000457763672,-1.9812293561170333
INTB3,INTELBRAS,"A Intelbras S.A. - Indústria de Telecomunicações Eletrônica Brasileira atua na fabricação, desenvolvimento e comercialização de equipamentos de segurança eletrônica e serviços de vigilância e monitoramento eletrônicos no Brasil. A empresa atua por meio de três segmentos: Segurança, Tecnologia da Informação e Comunicação (TIC) e Energia. Oferece produtos e soluções de segurança eletrônica, inclusive Oferece produtos e soluções de segurança eletrônica, incluindo alarmes, armazenamento, câmeras, comunicação condominial, controle de acesso corporativo, fechaduras, gravadores de vídeo digital, produtos contra incêndio e intercomunicação, monitoramento de veículos, sensores, sinalização de emergência, produtos de software e aplicativos e acessórios; e os produtos e soluções de redes incluem produtos 5G e Wi-Fi corporativo, racks, roteadores, switches, rádios externos, fibra óptica e produtos passivos, injetores PoE, adaptadores USB, software e aplicativos e cabos. A empresa também fornece produtos e soluções relacionados à comunicação, como webcams, projetores, mouses e teclados sem fio, soluções em nuvem, antenas e conversores, centrais telefônicas, produtos para eletrodomésticos e conferências, gateways, fones de ouvido, rádios comunicadores, caixas e controles inteligentes, alto-falantes inteligentes, software e aplicativos e telefones; e produtos e soluções relacionados à energia que incluem carregadores de veículos elétricos, UPS, baterias, smart, fontes, protetores eletrônicos, protetores contra surtos, acessórios USB e sensores de presença de iluminação. Além disso, oferece soluções on grid, que incluem painéis solares, estruturas de fixação, inversores on grid, string boxes e acessórios; e soluções fora da rede, como produtos de iluminação, estruturas de montagem, gabinetes externos, acionamentos e painéis solares, bombas solares e geradores e inversores fora da rede. A Intelbras S.A. - Indústria de Telecomunicações Eletrônica Brasileira foi constituída em 1974 e está sediada em São José, Brasil.",https://www.intelbras.com,Industrials,Indústria,7.9261365,1.4520662,0.18765,0.10060000000000001,4564594922.089434,13.949999809265137,Small Caps,85,1.7599999456563908,26.399999184845864,47.16,42.0,Baixo,,🟢,13.970000267028809,-0.14316719671706668
SANB3,SANTANDER BR,"O Banco Santander (Brasil) S.A., em conjunto com suas subsidiárias, fornece diversos produtos e serviços bancários para pessoas físicas, pequenas e médias empresas e clientes corporativos no Brasil e internacionalmente. Atua em dois segmentos, Banco Comercial e Banco Global de Atacado. A empresa oferece produtos de pagamento e fidelidade, incluindo cartões de crédito e débito; crédito consignado e imobiliário; soluções de financiamento de home equity; programas de microfinanciamento; consórcios; produtos do agronegócio, como crédito, valores mobiliários e outros produtos; call center e soluções digitais; ativos inadimplentes; e produtos de seguros que abrangem seguros de vida, acidentes pessoais, automóveis, patrimoniais e de crédito, bem como seguros de viagens e transações bancárias. Também oferece soluções emergenciais para residências, carros, motocicletas, animais de estimação e telemedicina; financiamento ao consumo; e serviços bancários corporativos e de investimento, que incluem gestão de caixa, soluções estruturadas de comércio e capital de giro, comércio e empréstimos, fusões e aquisições, mercados de capitais acionários, dívida com grau de investimento e de mercados emergentes e finanças estruturadas, bem como mercados de vendas, criação de mercado, comércio de energia, ações, pesquisa e mobilização e securitização de dívida privada. Além disso, a empresa oferece soluções de gestão de caixa, como cobranças, pagamentos, pagamentos instantâneos e serviços de folha de pagamento e custódia; programa advance, plataforma não financeira de apoio a empreendedores em conteúdos educacionais, cursos certificados, eventos com foco em gestão, inovação, internacionalização e desenvolvimento de equipes; financiamento de clientes através de depósitos e outros instrumentos de financiamento bancário; e vários investimentos. Oferece seus produtos e serviços por meio de agências, miniagências e caixas eletrônicos; centrais de atendimento; correspondentes bancários e fornecedores terceirizados; e plataformas bancárias online e móveis. A empresa foi fundada em 1970 e está sediada em São Paulo, Brasil.",https://www.santander.com.br,Financial Services,Serviços Financeiros,7.9573174,0.38945925,0.10467,0.0647,97710976643.66414,13.050000190734863,Blue Chips,80,1.63999995661036,24.5999993491554,46.95,42.0,Baixo,,🟢,15.960000038146973,-18.233081707122437
BEEF3,MINERVA,"A Minerva S.A. produz e comercializa carne bovina in natura, gado e subprodutos na América do Sul e internacionalmente. A empresa também atua no abate, desossa e processamento de carnes; venda de carnes resfriadas, congeladas e processadas, bem como produtos bovinos, suínos e aves; exportação e venda de gado vivo; e criação e venda de gado vivo, cordeiros, porcos e outros animais vivos. Além disso, comercializa eletricidade; comercializa proteínas e produtos alimentícios; vende marcas de terceiros principalmente produtos Swift; e prepara produtos para animais, que incluem farinha de carne e ossos, sangue e sebo. A Minerva S.A. foi fundada em 1957 e está sediada em Barretos, Brasil.",https://ri.minervafoods.com,Consumer Defensive,Consumo Defensivo,8.042553,2.9623823,0.83755,0.033,3732506267.589243,3.7799999713897705,Small Caps,45,0.47000000763311983,7.050000114496798,46.38,36.0,Baixo,,🟢,4.099999904632568,-7.8048766021002
CLSC4,CELESC,"A Centrais Elétricas de Santa Catarina S.A., por meio de suas subsidiárias, atua na geração, transmissão e comercialização de energia elétrica no Brasil. A empresa possui principalmente usinas hidrelétricas. A Centrais Elétricas de Santa Catarina S.A. foi fundada em 1955 e tem sede em Florianópolis, Brasil.",https://www.celesc.com.br,Utilities,Utilidades Públicas,8.150646,1.4093268,0.18175,0.0547,5592880695.0,145.0,Small Caps,85,17.79000093980281,266.85001409704216,45.66,36.0,Baixo,,🟢,147.75,-1.8612521150592216
WHRL3,WHIRLPOOL,"A Whirlpool S.A. fabrica, vende, importa e exporta eletrodomésticos no Brasil. A empresa oferece refrigeradores, freezers, refrigeradores-freezer, condicionadores de ar, máquinas de fazer gelo, fogões, lava-louças, trituradores e compactadores de lixo, compactadores de lixo e aspiradores de pó. Também realiza manutenção e reparo de produtos e peças elétricas; serviços de eletrônica, hidráulica, metalurgia, produtos químicos e ferro, pintura e construção; assessoria orçamentária; serviços auxiliares nas áreas de segurança, saúde, lazer, vida cotidiana e bem-estar; marketing e publicidade; intermediação na comercialização de produtos; venda de assinaturas por meio eletrônico; e atividades de comercialização de roupas, acessórios, utensílios para casa e cozinha e outros produtos. Comercializa seus produtos com as marcas Brastemp, Consul, KitchenAind, Compra Certa, B.blend e Insinkerator. A empresa foi fundada em 1957 e está sediada em São Paulo, Brasil. A Whirlpool S.A. opera como subsidiária da Whirlpool Corporation.",https://www.whirlpool.com.br,Consumer Cyclical,Consumo Cíclico,8.25532,3.1881678,0.14189,0.1334,5830809875.26021,3.880000114440918,Small Caps,40,0.4699999654090839,7.0499994811362585,44.96,24.0,Baixo,,🟢,4.349999904632568,-10.804593114843986
KEPL3,KEPLER WEBER,"A Kepler Weber S.A. fornece equipamentos para armazenamento de grãos e soluções pós-colheita de grãos no Brasil, nas Américas, na África, na Europa e na Ásia. Atua em cinco segmentos: Fazendas, Agroindústria, Portos e Terminais, Reposição e Serviços e Negócios Internacionais. A empresa oferece sistemas de armazenamento e preservação de grãos, como silos, secadores e transportadores, além de máquinas de limpeza. Também fornece equipamentos para commodities agrícolas, como etanol de milho, óleo de soja, ração animal, moinhos de trigo, indústrias de arroz, complexos cooperativos, produtores de cereais e canteiros; equipamentos industriais; e terminais portuários. Além disso, a empresa oferece peças de reposição e serviços de assistência técnica; serviços de engenharia técnica e processamento de dados; serviços de seguros contra riscos de engenharia; e serviços de monitoramento de temperatura e umidade de grãos no processo de processamento e armazenamento. Além disso, importa e exporta matérias-primas e produtos acabados e semiacabados. A empresa foi fundada em 1925 e está sediada em São Paulo, Brasil.",https://www.kepler.com.br,Industrials,Indústria,8.294118,1.5433451,0.19634001,0.0765,1221989575.5604267,7.050000190734863,Small Caps,60,0.8499999868261898,12.749999802392848,44.71,36.0,Baixo,,🟢,8.369999885559082,-15.770605888557288
TAEE3,TAESA EJ,"A Transmissora Aliança de Energia Elétrica S.A., em conjunto com suas subsidiárias, atua na construção, operação e manutenção de linhas de transmissão de energia elétrica no Brasil. Opera uma extensão total de aproximadamente 15.319 quilômetros (km) de linhas de transmissão, que incluem 14.677 km de linhas de transmissão em operação e 642 km de linhas em construção; 113 subestações com tensão entre 230 e 525KV; e um centro de operação do sistema localizado no Rio de Janeiro. A empresa foi fundada em 2000 e está sediada no Rio de Janeiro, Brasil.",https://institucional.taesa.com.br/,Utilities,Utilidades Públicas,8.434211,0.58043194,0.20559,0.0581,13249427647.82183,12.819999694824219,Mid Caps,100,1.5199998784503044,22.799998176754567,43.77,54.0,Baixo,,🟢,14.270000457763672,-10.16118231552384
EQPA3,EQTL PARA,"Equatorial Pará Distribuidora de Energia S.A. engages in the distribution of electricity in the state of Pará, Brazil. It serves residential, industrial, commercial, rural, public authority, public lighting service, and public service customers. The company was formerly known as Centrais Elétricas do Pará S.A. and changed its name to Equatorial Pará Distribuidora de Energia S.A. in December 2019. The company was founded in 1962 and is headquartered in Belém, Brazil. Equatorial Pará Distribuidora de Energia S.A. is a subsidiary of Equatorial Energia Distribuição S.A.",https://pa.equatorialenergia.com.br,Utilities,Utilidades Públicas,8.485715,2.3580785,0.28202,0.0227,13121899727.984228,5.940000057220459,Mid Caps,60,0.6999999478205972,10.499999217308957,43.43,36.0,Médio,,🟡,6.389999866485596,-7.0422506833733305
TAEE4,TAESA EJ,"A Transmissora Aliança de Energia Elétrica S.A., em conjunto com suas subsidiárias, atua na construção, operação e manutenção de linhas de transmissão de energia elétrica no Brasil. Opera uma extensão total de aproximadamente 15.319 quilômetros (km) de linhas de transmissão, que incluem 14.677 km de linhas de transmissão em operação e 642 km de linhas em construção; 113 subestações com tensão entre 230 e 525KV; e um centro de operação do sistema localizado no Rio de Janeiro. A empresa foi fundada em 2000 e está sediada no Rio de Janeiro, Brasil.",https://institucional.taesa.com.br/,Utilities,Utilidades Públicas,8.572369,0.5899398,0.20559,0.0572,13466461998.6566,13.029999732971191,Mid Caps,100,1.519999866194653,22.799997992919796,42.85,54.0,Baixo,,🟢,14.5600004196167,-10.508246171367801
WHRL4,WHIRLPOOL,"A Whirlpool S.A. fabrica, vende, importa e exporta eletrodomésticos no Brasil. A empresa oferece refrigeradores, freezers, refrigeradores-freezer, condicionadores de ar, máquinas de fazer gelo, fogões, lava-louças, trituradores e compactadores de lixo, compactadores de lixo e aspiradores de pó. Também realiza manutenção e reparo de produtos e peças elétricas; serviços de eletrônica, hidráulica, metalurgia, produtos químicos e ferro, pintura e construção; assessoria orçamentária; serviços auxiliares nas áreas de segurança, saúde, lazer, vida cotidiana e bem-estar; marketing e publicidade; intermediação na comercialização de produtos; venda de assinaturas por meio eletrônico; e atividades de comercialização de roupas, acessórios, utensílios para casa e cozinha e outros produtos. Comercializa seus produtos com as marcas Brastemp, Consul, KitchenAind, Compra Certa, B.blend e Insinkerator. A empresa foi fundada em 1957 e está sediada em São Paulo, Brasil. A Whirlpool S.A. opera como subsidiária da Whirlpool Corporation.",https://www.whirlpool.com.br,Consumer Cyclical,Consumo Cíclico,8.574469,3.3114216,0.14189,0.1363,6056227919.477052,4.03000020980835,Small Caps,40,0.46999997432008317,7.049999614801248,42.84,24.0,Baixo,,🟢,4.599999904632568,-12.391297970466987
SANB4,SANTANDER BR,"O Banco Santander (Brasil) S.A., em conjunto com suas subsidiárias, fornece diversos produtos e serviços bancários para pessoas físicas, pequenas e médias empresas e clientes corporativos no Brasil e internacionalmente. Atua em dois segmentos, Banco Comercial e Banco Global de Atacado. A empresa oferece produtos de pagamento e fidelidade, incluindo cartões de crédito e débito; crédito consignado e imobiliário; soluções de financiamento de home equity; programas de microfinanciamento; consórcios; produtos do agronegócio, como crédito, valores mobiliários e outros produtos; call center e soluções digitais; ativos inadimplentes; e produtos de seguros que abrangem seguros de vida, acidentes pessoais, automóveis, patrimoniais e de crédito, bem como seguros de viagens e transações bancárias. Também oferece soluções emergenciais para residências, carros, motocicletas, animais de estimação e telemedicina; financiamento ao consumo; e serviços bancários corporativos e de investimento, que incluem gestão de caixa, soluções estruturadas de comércio e capital de giro, comércio e empréstimos, fusões e aquisições, mercados de capitais acionários, dívida com grau de investimento e de mercados emergentes e finanças estruturadas, bem como mercados de vendas, criação de mercado, comércio de energia, ações, pesquisa e mobilização e securitização de dívida privada. Além disso, a empresa oferece soluções de gestão de caixa, como cobranças, pagamentos, pagamentos instantâneos e serviços de folha de pagamento e custódia; programa advance, plataforma não financeira de apoio a empreendedores em conteúdos educacionais, cursos certificados, eventos com foco em gestão, inovação, internacionalização e desenvolvimento de equipes; financiamento de clientes através de depósitos e outros instrumentos de financiamento bancário; e vários investimentos. Oferece seus produtos e serviços por meio de agências, miniagências e caixas eletrônicos; centrais de atendimento; correspondentes bancários e fornecedores terceirizados; e plataformas bancárias online e móveis. A empresa foi fundada em 1970 e está sediada em São Paulo, Brasil.",https://www.santander.com.br,Financial Services,Serviços Financeiros,8.579268,0.41989973,0.10467,0.066,105348152602.58737,14.069999694824219,Blue Chips,80,1.6400000203775214,24.60000030566282,42.8,42.0,Baixo,,🟢,16.420000076293945,-14.311817116630188
PSSA3,PORTO SEGURO,"A Porto Seguro S.A., em conjunto com suas subsidiárias, oferece uma gama de produtos e serviços de seguros no Brasil e no Uruguai. Oferece produtos de seguros de automóveis, residenciais, viagens, celular, vida, motocicleta, notebook e tablet, foto e vídeo, smart e games, bicicleta, imobiliário, green card, fiança e mudança, além de resseguros, proteção combinada, responsabilidade civil profissional, máquinas e equipamentos, eventos, agronegócio e táxi. A empresa também atua na gestão e comercialização de títulos de capitalização; concessão de empréstimos e financiamentos para consumo e capital de giro; operação de cartões de crédito; gestão de grupos de consórcios para aquisição de bens móveis e imóveis; distribuição de cotas de fundos de investimento; manutenção, desenvolvimento e licenciamento de programas; instalação de sistemas de aquecimento, gás natural e gás liquefeito de petróleo; operação de centros de oncologia, hematologia e radioterapia; venda e distribuição de peças automotivas; e administração e gestão de carteiras de valores mobiliários, fundos de investimento e recursos financeiros. Além disso, presta serviços técnicos de corretagem de seguros; serviços de obtenção de crédito e financiamento ao consumo; suporte técnico para software e outros serviços de tecnologia da informação; serviços de intermediação e agência para serviços e empresas; serviços de cobrança de dívidas e informações de crédito; serviços de assessoria administrativa para médicos e seguradoras de saúde; serviços de consultoria e assessoria em saúde ocupacional, segurança no trabalho, ergonomia e serviços ambulatoriais; serviços relacionados com protecção e monitorização electrónica; e telemarketing e atendimento geral ao cliente. A empresa foi fundada em 1945 e está sediada em São Paulo, Brasil. A Porto Seguro S.A. opera como subsidiária da Porto Seguro Itaú Unibanco Participações S.A.",https://www.portoseguro.com.br,Financial Services,Serviços Financeiros,8.65669,2.0267096,0.2516,0.0508,31587437281.44699,49.16999816894531,Mid Caps,75,5.679999880895044,85.19999821342566,42.29,42.0,Baixo,,🟢,50.470001220703125,-2.5757935809689316
CPFE3,CPFL ENERGIA,"A CPFL Energia S.A., por meio de suas subsidiárias, atua como empresa de energia no Brasil. Atua nos segmentos de Distribuição, Geração, Transmissão, Comercialização e Serviços. A empresa gera eletricidade por meio de fontes hidrelétricas, solares, eólicas e de biomassa; e presta serviços de gestão e comercialização de energia, eficiência energética, geração distribuída, infraestrutura energética e consultoria. Também atua na construção, operação e manutenção de instalações de transmissão de energia elétrica. Em 31 de dezembro de 2024, a rede de distribuição da empresa era composta por 345.785 quilômetros de linhas de distribuição, incluindo 530.081 transformadores de distribuição, bem como 12.174 quilômetros de linhas de distribuição de alta tensão; e 594 subestações transformadoras de alta e média tensão com capacidade total de transformação de 20.363 MVA. Atendeu 10,7 milhões de clientes dos setores residencial, comercial e industrial em 687 municípios. A empresa foi fundada em 1912 e está sediada em Campinas, Brasil. A CPFL Energia S.A. é uma subsidiária da State Grid Brazil Power Participações S.A.",https://www.cpfl.com.br,Utilities,Utilidades Públicas,8.662001,2.053872,0.24763,0.0862,49904141378.78067,43.310001373291016,Mid Caps,75,4.9999995813081775,74.99999371962267,42.25,48.0,Baixo,,🟢,49.869998931884766,-13.154196308593793
TGMA3,TEGMA,"A Tegma Gestão Logística S.A., em conjunto com suas subsidiárias, presta serviços logísticos no Brasil. Atua nos segmentos de Logística Automotiva e Logística Integrada. O segmento de Logística Automotiva atua no transporte e distribuição de veículos novos e usados; transferências portuárias; e gerenciamento de pátio e estoque para montadoras, além de serviços de pré-entrega de veículos. O segmento de Logística Integrada fornece serviços de transporte, armazenamento e gerenciamento de estoque para produtos químicos, eletrodomésticos e bens de consumo. A empresa também oferece logística e centro automotivo, gerenciamento de pátio, transporte e armazenamento de veículos, logística integrada, gerenciamento da cadeia de suprimentos de produtos químicos, gerenciamento de embalagens, intralogística e serviços de projetos especiais. Atende indústrias de alimentos e bebidas, automotiva, cosmética, eletrodomésticos, farmacêutica e química e petroquímica. A empresa foi fundada em 1969 e está sediada em São Bernardo do Campo, Brasil.",https://www.tegma.com.br,Industrials,Indústria,8.709142,2.2756226,0.25372,0.1409,2073083618.33457,31.440000534057617,Small Caps,60,3.6099997604881877,54.14999640732282,41.94,42.0,Baixo,,🟢,36.84999847412109,-14.68113477362228
EKTR4,ELEKTRO,"A Elektro Redes S.A. atua na distribuição de energia elétrica no Brasil. A empresa era anteriormente conhecida como Elektro Eletricidade e Serviços S.A. e mudou seu nome para Elektro Redes S.A. em agosto de 2016. A empresa foi constituída em 1998 e está sediada em Campinas, Brasil. A Elektro Redes S.A. é subsidiária da Neoenergia S.A.",https://www.elektro.com.br,Utilities,Utilidades Públicas,8.769932,3.654832,0.47262,0.1082,7459731702.5,38.5,Small Caps,60,4.389999831241565,65.84999746862347,41.53,42.0,Baixo,,🟢,39.5,-2.5316455696202533
VIVA3,VIVARA S.A.,"A Vivara Participações S.A. atua na fabricação e comercialização de joias e outros artigos na América Latina. A empresa oferece produtos de joalheria, incluindo anéis, colares, alianças, brinquedos, solitários, brincos, correntes, correntes, pingentes e pulseiras. Também fornece relógios; acessórios, como óculos de sol, carteiras e porta-cartões, porta-passaportes e relógios, porta-joias, perfumes, abotoaduras, chaveiros, canetas e facas; e produtos para presente que incluem kits para presentear, quiz, formatura, infantil, mãe/avó e produtos customizáveis. A empresa vende seus produtos sob as marcas Vivara, Tag Heuer, Victorinox, Movado, Baume and Mercier, Bulova, Akium, Lacoste, Calvin Klein, Hugo Boss, Tommy Hilfiger, Olivia Burton, Festina, Adidas, Life By Vivara, Guess. Marcas Nautica, Porsche Design, Montblanc e Festina. Oferece seus produtos por meio de lojas e quiosques, bem como por meio de e-commerce. A Vivara Participações S.A. foi fundada em 1962 e está sediada em São Paulo, Brasil.",https://www.vivara.com.br,Consumer Cyclical,Consumo Cíclico,8.911647,1.7684093,0.20746,0.061200000000000004,5216243700.391893,22.190000534057617,Small Caps,60,2.4899999443489644,37.349999165234465,40.59,42.0,Baixo,,🟢,29.670000076293945,-25.210648881031783
MOVI3,MOVIDA,"A Movida Participações S.A. presta serviços de aluguel de automóveis no Brasil. Atua em dois segmentos, Rent-a-Car e Gestão e Terceirização de Frotas (GTF). A empresa oferece serviços de aluguel de veículos leves; e serviços de gestão e terceirização de frotas. Também vende carros usados. A empresa era anteriormente conhecida como H.L.C.S.P.E Empreendimentos e Participações S.A. e mudou seu nome para Movida Participações S.A. em dezembro de 2014. A empresa foi fundada em 2006 e tem sede em São Paulo, Brasil. A Movida Participações S.A. atua como subsidiária da Simpar S.A.",https://ri.movida.com.br,Industrials,Indústria,9.0,1.0448917,0.12866999,0.0968,3798511915.7824163,9.449999809265137,Small Caps,65,1.0499999788072374,15.74999968210856,40.0,30.0,Baixo,,🟢,12.93000030517578,-26.9141563323678
