Ticker,Empresa,Resumo,Site,setor_original,Setor,PL,PVP,ROE,DivYield,MarketCap,Preco,Categoria,CNPJ,Score,LucroPorAcao,PrecoJusto,Desconto_%,Ranking,Risco,Risco_num,Farol,Preco_antigo,Variacao_%
POMO4,MARCOPOLO,"A Marcopolo S.A. atua na fabricação e comercialização de ônibus, carrocerias e componentes no Brasil, África do Sul, Austrália, China, México, Argentina e internacionalmente. A empresa oferece ônibus intermunicipais, urbanos e microônibus, ônibus elétricos e ônibus híbridos; e família de microônibus Volare, como ônibus completo, com chassi e carroceria, carroceria para transporte escolar, fretamento executivo, transporte urbano e projetos especiais. Também está envolvida no desenvolvimento e produção de novos modelos sobre trilhos; produção de unidades com propulsão, automóveis de passageiros e fabricação de caixas para transporte de pessoas, TRAMs e EMUs; disponibilização de soluções de crédito para aquisição de ônibus e micro-ônibus; montagem, comercialização, importação e exportação de equipamentos de refrigeração e ar condicionado; e negócios de espuma para assentos. A empresa foi fundada em 1949 e está sediada em Caxias Do Sul, Brasil.",https://www.marcopolo.com.br,Industrials,Indústria,6.3163266,2.0038848,0.30973,0.19030000000000002,7679183833.3864975,6.190000057220459,Small Caps,Não disponível,60,0.9799999982933845,14.699999974400766,57.89,46.0,Baixo,,🟢,6.389999866485596,-3.1298875343347015
RECV3,PETRORECSA,"A Petroreconcavo S.A. atua na exploração e produção de petróleo e gás natural no Brasil. A empresa foi fundada em 1999 e está sediada em Mata de São João, Brasil.",https://petroreconcavo.com.br,Energy,Energia,6.3394494,0.8872624,0.13571,0.15130000000000002,4048954875.550232,13.819999694824219,Small Caps,Não disponível,65,2.180000000445499,32.70000000668249,57.74,40.0,Baixo,,🟢,12.600000381469728,9.682533939829797
CEAB3,CEA MODAS,"A C&A Modas S.A. atua como varejista de moda feminina, masculina e infantil no Brasil e internacionalmente. Oferece blusas, calças, vestidos, saias, casacos, moda praia, roupas íntimas, camisetas, camisas, bermudas, jaquetas e casacos, bodys, conjuntos e shorts; produtos de beleza, incluindo perfumes, maquiagem, cuidados com a pele, corpo e banho e acessórios; e calçados, como botas, sapatos e mocassins, sapatilhas, sandálias e tênis. A empresa vende seus produtos em lojas e também online. A empresa foi fundada em 1841 e está sediada em Barueri, Brasil.",https://www.cea.com.br,Consumer Cyclical,Consumo Cíclico,6.380953,0.98545516,0.16736999,0.0788,3653146995.147913,12.0600004196167,Small Caps,Não disponível,85,1.8899998824026285,28.34999823603943,57.46,52.0,Baixo,,🟢,12.140000343322754,-0.6589779361090073
SHUL4,SCHULZ EJ,"A Schulz S.A., juntamente com suas subsidiárias, fabrica e comercializa compressores de ar no Brasil, América Latina, Estados Unidos, Canadá, Europa e internacionalmente. Atua nos segmentos de Indústria e Comercialização. A empresa oferece compressores de ar, incluindo motor de diafragma, alternativo, parafuso rotativo, booster, scroll, isento de óleo e compressores de pistão; equipamentos de tratamento de ar, como separadores e drenos de condensado, purificadores e separadores de água e óleo, bem como tanques e secadores de ar, e filtros e gerenciadores de ar; e produtos de limpeza que incluem aspiradores de pó e líquidos e lavadoras de alta pressão. Também fornece máquinas e ferramentas, que incluem geradores de energia, máquinas de solda, motores de combustão, equipamentos de coluna e bancada, ferramentas elétricas e sem fio, ferramentas manuais, ferramentas pneumáticas e a bateria, linhas automotivas de 12V, motores e pistolas elétricas, bem como lubrificantes; bombas motorizadas; peças de reposição; e outros acessórios relacionados. Além disso, a empresa oferece serviços pós-venda. Seus produtos são utilizados para aplicações residenciais, profissionais e industriais. A empresa exporta seus produtos. A Schulz S.A. foi fundada em 1963 e está sediada em Joinville, Brasil.",https://www.schulz.com.br,Consumer Cyclical,Consumo Cíclico,6.382716,1.2294887,0.19755,0.1091,1843385339.432928,5.170000076293945,Small Caps,Não disponível,85,0.8100000182201347,12.15000027330202,57.45,46.0,Baixo,,🟢,5.349999904632568,-3.364482832658765
PINE3,PINE,"O Banco Pine S.A., em conjunto com suas subsidiárias, fornece produtos e serviços bancários no Brasil. A empresa se dedica a negócios comerciais, de investimento, crédito, financiamento, câmbio e leasing. Também está envolvida em consultoria; distribuição de títulos; imobiliária; intermediação de negócios; e comercialização de ativos ambientais. A empresa foi constituída em 1991 e está sediada em São Paulo, Brasil.",https://www.pine.com,Financial Services,Serviços Financeiros,6.4358974,2.2706714,0.33765998,0.0348,3248822904.2256002,12.550000190734863,Small Caps,Não disponível,45,1.9500000405125886,29.25000060768883,57.09,40.0,Baixo,,🟢,11.600000381469728,8.189653258828336
PETR3,PETROBRAS,"Petróleo Brasileiro S.A. - A Petrobras explora, produz e comercializa petróleo e gás no Brasil e internacionalmente. Atua por meio de três segmentos: Exploração e Produção; Refino, Transporte e Comercialização; e gás e energias de baixo carbono. O segmento de Exploração e Produção explora, desenvolve e produz petróleo bruto, líquidos de gás natural e gás natural principalmente para abastecimento às refinarias nacionais. O segmento de Refino, Transporte e Comercialização atua no refino, logística, transporte, aquisição e exportação de petróleo bruto; comércio de produtos petrolíferos; e produção de fertilizantes, além de participação em empresas petroquímicas. O segmento de Gás e Energias de Baixo Carbono atua na logística e comercialização de gás natural e eletricidade; transporte e comercialização de gás natural liquefeito; geração de energia elétrica por meio de usinas termelétricas; negócios de energia renovável; negócios de baixo carbono; e negócios de processamento de gás natural, bem como produção de biodiesel e seus coprodutos. A empresa também se dedica à prospecção, perfuração, refino, processamento, comercialização e transporte de petróleo bruto proveniente de campos petrolíferos onshore e offshore, e xisto ou outras rochas, bem como produtos petrolíferos, gás natural e outros hidrocarbonetos líquidos. Além disso, atua na pesquisa, desenvolvimento, produção, transporte, distribuição e comercialização de energia. A empresa foi constituída em 1953 e está sediada no Rio de Janeiro, Brasil.",https://petrobras.com.br,Energy,Energia,6.493268,1.6444514,0.28176,0.07150000000000001,683747263137.7273,53.04999923706055,Blue Chips,Não disponível,75,8.169999950265497,122.54999925398246,56.71,52.0,Baixo,,🟢,46.220001220703125,14.777148065712492
MDNE3,MOURA DUBEUX,"A Moura Dubeux Engenharia S.A. presta serviços de incorporação imobiliária no Brasil. A empresa desenvolve apartamentos, hotéis, resorts e edifícios residenciais, além de oferecer serviços de administração técnica de obras e assessoria técnica aos condomínios. Também atua na compra e venda de imóveis; construção imobiliária; gerenciamento; administração; e serviços de engenharia, bem como serviços de consultoria imobiliária, incluindo compra de terreno; formatação de produtos; e aprovação do projeto. A empresa foi fundada em 1983 e está sediada em Recife, Brasil.",https://www.mouradubeux.com.br,Real Estate,Imobiliário,6.554656,1.8018922,0.27528998,0.1567,3356608439.2840424,32.380001068115234,Small Caps,Não disponível,60,4.940000065314677,74.10000097972015,56.3,46.0,Baixo,,🟢,33.20000076293945,-2.469878542110063
SAPR4,SANEPAR,"A Companhia de Saneamento do Paraná - SANEPAR presta serviços de saneamento no Brasil. A empresa atua na distribuição de água; coleta e tratamento de esgoto e resíduos sólidos; estudo, projeto e obras de novas instalações; expansão das redes de distribuição de água; e redes de coleta e tratamento de esgoto. Presta ainda serviços de consultoria e assistência técnica nas suas áreas de atuação. A Companhia de Saneamento do Paraná - SANEPAR foi fundada em 1963 e está sediada em Curitiba, Brasil.",https://www.sanepar.com.br,Utilities,Utilidades Públicas,6.5658917,0.20732364,0.17944999,0.0273,12799911149.465408,8.470000267028809,Mid Caps,Não disponível,85,1.2899999960445294,19.349999940667942,56.23,46.0,Baixo,,🟢,8.100000381469727,4.567899606591702
CEEB3,COELBA,"Companhia de Eletricidade do Estado da Bahia - COELBA engages in the distribution of electricity. The company was founded in 1960 and is headquartered in Salvador, Brazil. Companhia de Eletricidade do Estado da Bahia - COELBA operates as a subsidiary of Iberdrola, S.A.",https://www.coelba.com.br,Utilities,Utilidades Públicas,6.573997,1.5873492,0.25589,0.0417,12457426695.168488,47.529998779296875,Mid Caps,Não disponível,60,7.23000007138684,108.4500010708026,56.17,46.0,Baixo,,🟢,47.0,1.1276569772273937
LAVV3,LAVVI,"A Lavvi Empreendimentos Imobiliários S.A. desenvolve e constrói imóveis residenciais e não residenciais principalmente no Brasil. A empresa oferece imóveis com as marcas Lavvi e Novvo. A empresa foi constituída em 2016 e está sediada em São Paulo, Brasil.",https://www.lavvi.com.br,Real Estate,Imobiliário,6.6509438,1.8404909,0.26358998,0.0746,2755624437.752289,14.100000381469727,Small Caps,Não disponível,60,2.1199999286521902,31.799998929782852,55.66,46.0,Baixo,,🟢,17.790000915527344,-20.741991816520574
OFSA3,OUROFINO S/A,"A Ouro Fino Saúde Animal Participações S.A., em conjunto com suas subsidiárias, atua no desenvolvimento, produção e comercialização de medicamentos veterinários, vacinas e outros produtos para animais de produção e de companhia, principalmente no Brasil. A empresa atua através de três segmentos: Animais de Produção; Animais de Companhia; e Operações Internacionais. Fabrica e comercializa medicamentos, incluindo antiinflamatórios, antibióticos, anticoccidianos, antimastíticos, ectoparasiticidas, endectocidas, endoparasiticidas, hemoparasiticidas, inoculantes, terapêuticos, produtos para reprodução animal e vacinas; e aditivos, probióticos e outros produtos veterinários para melhoria de desempenho para bovinos, suínos, aves, ovinos, cavalos e caprinos, bem como serviços de fabricação. A empresa também fabrica soluções veterinárias para cães e gatos, como anestésicos, sedativos, antiinflamatórios, antibióticos, antimicrobianos, dermatológicos, ectoparasiticidas, endoparasiticidas, dermocosméticos e otológicos. Além disso, oferece vacinas e outros produtos veterinários para animais de produção e de companhia. A empresa era anteriormente conhecida como A.H.N.S.P.E. Empreendimentos e Participações S.A. A Ouro Fino Saúde Animal Participações S.A. foi constituída em 1987 e está sediada em Cravinhos, Brasil.",https://www.ourofinosaudeanimal.com,Healthcare,Saúde,6.654589,1.8589743,0.28625,0.0495,1481297504.278572,27.549999237060547,Small Caps,Não disponível,45,4.14000011677063,62.100001751559454,55.64,40.0,Baixo,,🟢,26.21999931335449,5.072463609976743
CSED3,CRUZEIRO EDU,"A Cruzeiro do Sul Educacional S.A. presta serviços de educação no Brasil. Oferece serviços de educação acadêmica e profissional, incluindo cursos de ensino fundamental, graduação, pós-graduação e extensão nas modalidades presencial e a distância; e cursos de medicina. A empresa foi fundada em 1965 e está sediada em São Paulo, Brasil.",https://www.cruzeirodosuleducacional.com.br,Consumer Defensive,Consumo Defensivo,6.7037034,1.2445564,0.19396,0.09140000000000001,1979466000.2121234,5.429999828338623,Small Caps,Não disponível,85,0.8100000110891873,12.15000016633781,55.31,46.0,Baixo,,🟢,6.559999942779541,-17.225611650876402
PINE4,PINE,"O Banco Pine S.A., em conjunto com suas subsidiárias, fornece produtos e serviços bancários no Brasil. A empresa se dedica a negócios comerciais, de investimento, crédito, financiamento, câmbio e leasing. Também está envolvida em consultoria; distribuição de títulos; imobiliária; intermediação de negócios; e comercialização de ativos ambientais. A empresa foi constituída em 1991 e está sediada em São Paulo, Brasil.",https://www.pine.com,Financial Services,Serviços Financeiros,6.764102,2.3864663,0.33765998,0.0332,3414499768.3036795,13.1899995803833,Small Caps,Não disponível,45,1.9500001005873804,29.250001508810705,54.91,40.0,Baixo,,🟢,11.960000038146973,10.284277076197222
IGTI3,IGUATEMI S.A,"A Iguatemi S.A., em conjunto com suas subsidiárias, atua na exploração e planejamento comercial de shopping centers no Brasil. A empresa também atua na compra de estacionamentos e na venda de imóveis. Além disso, presta serviços de assessoria e consultoria econômica, financeira e tributária. A empresa era anteriormente conhecida como Jereissati Participações S.A. e mudou seu nome para Iguatemi S.A. em novembro de 2021. A Iguatemi S.A. foi fundada em 1946 e está sediada em São Paulo, Brasil.",https://iguatemi.com.br,Real Estate,Imobiliário,6.7872343,0.20346983,0.13001001,0.031400000000000004,3848023781.963725,3.190000057220459,Small Caps,Não disponível,50,0.46999999060301473,7.049999859045221,54.75,34.0,Baixo,,🟢,3.259999990463257,-2.1472372223182314
LOGG3,LOG COM PROP,"A LOG Commercial Properties e Participações S.A. desenvolve, constrói e aluga imóveis residenciais e comerciais no Brasil. Oferece logística e armazéns industriais; aluguel de imóveis próprios; construção de edifícios; construção, marketing, locação e serviços relacionados, incluindo consultoria imobiliária; e fornece e participa de bens e serviços no setor imobiliário comercial. A empresa era anteriormente conhecida como MRV Logística E Participações S.A. A LOG Commercial Properties e Participações S.A. foi constituída em 2008 e está sediada em Belo Horizonte, Brasil.",https://www.logcp.com.br,Real Estate,Imobiliário,6.8427515,0.67186147,0.100439996,0.1479,2434486060.3458786,27.850000381469727,Small Caps,Não disponível,65,4.070000259613362,61.05000389420043,54.38,40.0,Baixo,,🟢,28.200000762939453,-1.2411360709241483
CLSC3,CELESC EJ,"A Centrais Elétricas de Santa Catarina S.A., por meio de suas subsidiárias, atua na geração, transmissão e comercialização de energia elétrica no Brasil. Possui principalmente usinas hidrelétricas. A empresa foi fundada em 1955 e está sediada em Florianópolis, Brasil.",https://www.celesc.com.br,Utilities,Utilidades Públicas,6.904762,1.1979278,0.19097,0.056799999999999996,5441652901.5,123.25,Small Caps,Não disponível,85,17.849999753793107,267.7499963068966,53.97,40.0,Baixo,,🟢,124.01000213623048,-0.6128555141831116
ECOR3,ECORODOVIAS,"A EcoRodovias Infraestrutura e Logística S.A. atua como uma empresa de infraestrutura que opera concessões rodoviárias no Brasil. Opera o Ecopátio Logística Cubatão, plataforma logística intermodal, que é o local regulador de caminhões no Porto de Santos. A empresa também atua na operação portuária e na movimentação e armazenagem de cargas de importação e exportação no Porto de Santos. A empresa foi fundada em 1997 e está sediada em São Paulo, Brasil. A EcoRodovias Infraestrutura e Logística S.A. atua como subsidiária da IGLI S.p.A.",https://www.ecorodovias.com.br,Industrials,Indústria,6.96063,1.4988133,0.21511999,0.0373,6149291743.983376,8.84000015258789,Small Caps,Não disponível,70,1.2700000075550475,19.050000113325712,53.6,46.0,Baixo,,🟢,9.960000038146973,-11.244978727605051
WIZC3,WIZ CO,"A Wiz Co Participações e Corretagem de Seguros S.A. atua como corretora de seguros no Brasil. A empresa oferece produtos financeiros e de seguros, incluindo seguros individuais e empresariais, consórcios, capitalização e planos de previdência privada. Atua na prospecção, ativação, suporte, seguros e produtos financeiros por meio de redes de concessionárias de veículos e treinamento para comercialização de produtos de crédito e seguros relacionados a crédito. A empresa era anteriormente conhecida como Wiz Soluções e Corretagem de Seguros S.A. Wiz Co Participações e Corretagem de Seguros S.A. foi fundada em 1973 e está sediada em Brasília, Brasil.",https://wiz.co,Financial Services,Serviços Financeiros,7.0714283,2.041705,0.29974002,0.07200000000000001,1424773858.2200851,8.90999984741211,Small Caps,Não disponível,60,1.2600000267855518,18.900000401783277,52.86,46.0,Baixo,,🟢,9.6899995803833,-8.049533196577677
EZTC3,EZTEC,"A EZTEC Empreendimentos e Participações S.A. atua em atividades de engenharia, construção e incorporação imobiliária no Brasil e internacionalmente. A empresa desenvolve e comercializa imóveis; administra e aluga propriedades; constrói condomínios; e subdivide terras. Atua também na prestação de serviços relacionados à construção, fiscalização, estudos e projetos; e execução de obras e serviços de engenharia civil. A EZTEC Empreendimentos e Participações S.A. foi fundada em 1979 e está sediada em São Paulo, Brasil.",https://www.eztec.com.br,Real Estate,Imobiliário,7.352632,0.7702487,0.10949001,0.0908,3875119193.2607546,13.970000267028809,Small Caps,Não disponível,65,1.89999992751287,28.49999891269305,50.98,40.0,Baixo,,🟢,14.9399995803833,-6.492632801865218
CMIG4,CEMIG EJ,"A Companhia Energética de Minas Gerais - CEMIG, por meio de suas subsidiárias, atua na geração, transmissão, distribuição e comercialização de energia no Brasil. Em 31 de dezembro de 2024, a empresa operava 36 usinas hidrelétricas com capacidade total de 4.449,0 MW, 2 parques eólicos com capacidade total de 70,8 MW e 10 usinas fotovoltaicas com capacidade total de 158,99 MW; 357.044 milhas de linhas de distribuição; e 4.754 milhas de linhas de transmissão. Também atua na aquisição, transporte e distribuição de gás e seus subprodutos e derivados; venda e comercialização de energia; construção, implantação, operação e manutenção de transmissão de energia elétrica; comercialização e intermediação de negócios relacionados à energia; instalação, operação, manutenção e aluguel de usinas solares; e atividades de geração distribuída, serviços de conta, cogeração, eficiência energética e gestão de abastecimento e armazenamento. A empresa foi constituída em 1952 e está sediada em Belo Horizonte, Brasil.",https://www.cemig.com.br,Utilities,Utilidades Públicas,7.3567247,1.2593852,0.1751,0.1528,39684255679.426834,12.579999923706055,Mid Caps,Não disponível,100,1.7100000933439925,25.650001400159887,50.96,52.0,Baixo,,🟢,11.93000030517578,5.44844595056947
PLPL3,PLANOEPLANO,"A Plano & Plano Desenvolvimento Imobiliário S.A., por meio de suas subsidiárias, desenvolve, constrói e comercializa empreendimentos imobiliários na Região Metropolitana de São Paulo. Também fornece seus serviços online. A empresa foi fundada em 1997 e está sediada em São Paulo, Brasil.",https://www.planoeplano.com.br,Real Estate,Imobiliário,7.4333334,2.6531825,0.41075,0.1159,2714932879.6211815,13.380000114440918,Small Caps,Não disponível,60,1.7999999992521414,26.999999988782122,50.44,46.0,Baixo,,🟢,14.449999809265137,-7.404842276455602
BBSE3,BBSEGURIDADE,"A BB Seguridade Participações S.A., por meio de suas subsidiárias, atua nos negócios de seguros, previdência e obrigações no Brasil. A empresa atua por meio de dois segmentos, Segurança e Corretagem. O segmento de Seguridade oferece produtos e serviços relacionados a seguros de vida, riscos rurais, especiais e financeiros, seguros de transporte, cascos, habitacionais e pessoais, planos de previdência, planos complementares, planos odontológicos e planos de capitalização. O segmento Corretora atua na corretagem e administração, implementação, promoção e viabilização de negócios de seguros nos setores básico, vida e capitalização, bem como planos de previdência aberta e planos odontológicos. A BB Seguridade Participações S.A. foi constituída em 2012 e está sediada em Brasília, Brasil. A BB Seguridade Participações S.A. é subsidiária do Banco do Brasil S.A.",https://www.bbseguridaderi.com.br,Financial Services,Serviços Financeiros,7.518279,6.535801,0.89815,0.152,67864871476.36467,34.959999084472656,Blue Chips,Não disponível,75,4.6500002307007575,69.75000346051137,49.88,48.0,Baixo,,🟢,34.849998474121094,0.31564021568966993
TEND3,TENDA,"A Construtora Tenda S.A. atua como construtora de residências no Brasil. Atua nos segmentos On-Site e Off-Site. A empresa também atua na execução e gerenciamento de obras de construção civil; desenvolvimento de imóveis; compra e venda de imóveis e terrenos; prestação de serviços de gestão de construção civil; e intermediação e comercialização de cotas de consórcio. A Construtora Tenda S.A. foi fundada em 1969 e está sediada em São Paulo, Brasil.",https://www.tenda.com,Real Estate,Imobiliário,7.541262,3.1387007,0.44829,0.0418,3765121471.73822,31.06999969482422,Small Caps,Não disponível,45,4.12000003379066,61.8000005068599,49.72,36.0,Baixo,,🟢,30.670000076293945,1.304204817526065
LEVE3,METAL LEVE,"A MAHLE Metal Leve S.A., empresa de peças automotivas, fabrica e comercializa componentes para motores de combustão interna e filtros automotivos na América do Sul, Europa, América Central e do Norte, África e internacionalmente. Atua nos segmentos de Powertrain e Carregamento e Sistemas Térmicos e Fluidos. A empresa oferece sistemas de acionamento e eletrônica de potência para motores elétricos; sistemas de pistão, componentes de cilindros, trens de válvulas, ar condicionado, refrigeração de motor, gerenciamento de ar, resfriamento de motor, gerenciamento de óleo; e eletrônica de potência para acionamentos de tração para automóveis de passageiros, bem como acionamento elétrico e sistemas mecatrônicos para aplicações industriais, máquinas agrícolas e de construção, veículos comerciais, veículos industriais, veículos de transporte elétrico e indústria automotiva, bem como veículos industriais e especiais; e equipamentos de motores grandes e pequenos. Ela fornece túneis de vento climáticos, testes de motores, engenharia, testes de módulos, gerenciamento térmico e serviços de transmissão. Além disso, disponibiliza túneis de vento climáticos; testes de motores; teste de módulo; gestão térmica industrial; transmissões; e serviços de engenharia. Além disso, a empresa oferece produtos para pistões, anéis de pistão, válvulas, bielas, rolamentos, buchas, arruelas de encosto, camisas de cilindro, anéis de pistão, árvores de cames, pistões, pinos, suportes de anéis e compressores mecânicos, bem como filtros de combustível, filtros de ar, filtros de óleo, filtros de ar condicionado, filtros de carvão ativado, separadores de óleo, tampas de válvulas, sistemas de admissão de ar, pré-filtros de diesel e coletores de admissão, ar condicionado e radiadores e condensadores. Além disso, exporta seus produtos. A empresa foi fundada em 1920 e está sediada em Mogi Guaçu, Brasil. A MAHLE Metal Leve S.A. atua como subsidiária da Mahle Indústria E Comercio Ltda.",https://www.mahle.com,Consumer Cyclical,Consumo Cíclico,7.783965,5.4987416,0.74492997,0.08349999999999999,4737088153.408051,34.95000076293945,Small Caps,Não disponível,60,4.489999731876936,67.34999597815404,48.11,42.0,Baixo,,🟢,35.689998626708984,-2.0734040130103737
ISAE4,ISA ENERGIA,"ISA Energía Brasil S.A. engages in the electric power transmission business in Brazil. As of December 31, 2024, it had a total installed transformation capacity of 85,000 MVA together with transmission lines of 23, 0000 kilometers; and 136 substations. It operates in the states of Alagoas, Bahia, Espírito Santo, Goiás, Maranhão, Mato Grosso, Mato Grosso do Sul, Minas Gerais, Paraíba, Paraná, Pernambuco, Piauí, Rio de Janeiro, Rio Grande do Sul, Rondônia, Santa Catarina, São Paulo, and Tocantins. ISA Energía Brasil S.A. was incorporated in 1999 and is headquartered in São Paulo, Brazil.",https://www.isacteep.com.br,Utilities,Utilidades Públicas,7.8010755,0.9039935,0.12099,0.0933,19120793783.69284,29.020000457763672,Mid Caps,Não disponível,80,3.7199999484383497,55.799999226575245,47.99,42.0,Baixo,,🟢,28.770000457763672,0.8689607091491608
BGIP3,BANESE,"O Banco do Estado de Sergipe S.A. oferece diversos produtos e serviços bancários em Sergipe. A empresa oferece contas correntes, únicas e outras; poupança; Produtos CBD/RDB; investimentos; cartões; produtos de seguros; empréstimos e financiamentos, consignado, pagamento, consórcio, capitalização, portabilidade e serviços de internet banking. A empresa era anteriormente conhecida como Banco de Fomento Budget e mudou seu nome para Banco do Estado de Sergipe S.A. em 1967. O Banco do Estado de Sergipe S.A. foi fundado em 1961 e tem sede em Aracaju, Brasil.",https://www.banese.com.br,Financial Services,Serviços Financeiros,7.899484,1.4056408,0.15865,0.083,1330724429.6,61.3,Small Caps,Não disponível,85,7.7600005266166745,116.40000789925011,47.34,42.0,Baixo,,🟢,62.2400016784668,-1.510285432386183
