Ticker,Empresa,Resumo,Site,setor_original,Setor,PL,PVP,ROE,DivYield,MarketCap,Preco,Categoria,Score,LucroPorAcao,PrecoJusto,Desconto_%,Ranking,Risco,Risco_num,Farol,Preco_antigo,Variacao_%
ALUP4,ALUPAR ED,"A Alupar Investimento S.A., em conjunto com suas subsidiárias, atua na transmissão, geração e comercialização de energia no Brasil, Colômbia, Peru e Chile. Atua nos segmentos de Transmissão e Geração. A empresa detém participação em concessões de 44 sistemas de transmissão de energia elétrica, totalizando 9.999 quilômetros de linhas de transmissão; e opera linhas aéreas e subestações. Também atua na geração de energia renovável por meio de hidrelétricas, parques eólicos e usinas fotovoltaicas, que possuem capacidade instalada de 798,5 MW. A empresa foi constituída em 2006 e está sediada em São Paulo, Brasil. A Alupar Investimento S.A. é uma subsidiária da Guarupart Participações Ltda.",https://www.alupar.com.br,Utilities,Utilidades Públicas,9.274336,1.1308945,0.14265001,0.023,10363468245.806385,10.479999542236328,Mid Caps,65,1.1299999851457105,16.94999977718566,38.17,24.0,Baixo,,🟢,10.989999771118164,-4.640584526872529
CMIG3,CEMIG,"A Companhia Energética de Minas Gerais - CEMIG, por meio de suas subsidiárias, atua na geração, transmissão, distribuição e comercialização de energia no Brasil. Em 31 de dezembro de 2025, a empresa operava 32 usinas hidrelétricas com capacidade total de 4.434 MW, 2 parques eólicos com capacidade total de 71 MW e 12 usinas fotovoltaicas com capacidade total de 169 MW; 365.577 milhas de linhas de distribuição; e 4.865 milhas de linhas de transmissão. Também atua na aquisição, transporte e distribuição de gás e seus subprodutos e derivados; venda e comercialização de energia; construção, implantação, operação e manutenção de transmissão de energia elétrica; comercialização e intermediação de negócios relacionados à energia; instalação, operação, manutenção e aluguel de usinas solares; e atividades de geração distribuída, serviços de conta, cogeração, eficiência energética e gestão de abastecimento e armazenamento. A empresa foi constituída em 1952 e está sediada em Belo Horizonte, Brasil.",https://www.cemig.com.br,Utilities,Utilidades Públicas,9.410405,1.6122006,0.17038,0.085,46571903019.514366,16.280000686645508,Mid Caps,75,1.7300000038941477,25.950000058412215,37.26,42.0,Baixo,,🟢,15.520000457763672,4.896908546814224
BEES3,BANESTES,"O Banestes S.A - Banco do Estado do Espírito Santo S.A., em conjunto com suas subsidiárias, atua como banco múltiplo no Brasil. Opera através do Financeiro; e Seguros e Outros segmentos. A empresa atua por meio de suas carteiras de comércio, rural, industrial, imobiliário, câmbio, arrendamento, investimento e administração de cartões de crédito; e nas áreas de seguros e distribuição, intermediação e administração de recursos de terceiros. Também fornece gestão de ativos e fundos; administração e intermediação de valores mobiliários, seguros, previdência e capitalização; fundos de investimento; cartões de crédito e débito; banco pela internet; conta corrente, poupança, especial, cheque fiduciário, jovem e universitário, conta mais fácil, simplificada, salário e judicial; títulos de capitalização; seguro de carro, vida, casa, acidentes pessoais, proteção financeira de cartão e seguro empresarial; cobranças e convênios; transferência de fundos e recursos; coleção; custódia; opções de crédito e financiamento; empréstimos e garantias; e outros serviços. Além disso, a empresa opera um serviço público de loteria. Banestes S.A - Banco do Estado do Espírito Santo S.A. foi fundado em 1935 e está sediado em Vitória, Brasil.",https://www.banestes.com.br,Financial Services,Serviços Financeiros,9.43956,1.2318945,0.13748999,0.04019999999999999,2985060667.1649246,8.59000015258789,Small Caps,50,0.9100000585395813,13.65000087809372,37.07,24.0,Baixo,,🟢,8.630000114440918,-0.4634989724518524
BEES4,BANESTES,"O Banestes S.A - Banco do Estado do Espírito Santo S.A., em conjunto com suas subsidiárias, atua como banco múltiplo no Brasil. Opera através do Financeiro; e Seguros e Outros segmentos. A empresa atua por meio de suas carteiras de comércio, rural, industrial, imobiliário, câmbio, arrendamento, investimento e administração de cartões de crédito; e nas áreas de seguros e distribuição, intermediação e administração de recursos de terceiros. Também fornece gestão de ativos e fundos; administração e intermediação de valores mobiliários, seguros, previdência e capitalização; fundos de investimento; cartões de crédito e débito; banco pela internet; conta corrente, poupança, especial, cheque fiduciário, jovem e universitário, conta mais fácil, simplificada, salário e judicial; títulos de capitalização; seguro de carro, vida, casa, acidentes pessoais, proteção financeira de cartão e seguro empresarial; cobranças e convênios; transferência de fundos e recursos; coleção; custódia; opções de crédito e financiamento; empréstimos e garantias; e outros serviços. Além disso, a empresa opera um serviço público de loteria. Banestes S.A - Banco do Estado do Espírito Santo S.A. foi fundado em 1935 e está sediado em Vitória, Brasil.",https://www.banestes.com.br,Financial Services,Serviços Financeiros,9.516483,1.2419331,0.13748999,0.039900000000000005,3022315135.8472633,8.65999984741211,Small Caps,50,0.9100000333539302,13.650000500308954,36.56,24.0,Baixo,,🟢,8.800000190734863,-1.5909129578219119
ISAE3,ISA ENERGIA,"A ISA Energía Brasil S.A. atua no negócio de transmissão de energia elétrica no Brasil. Em 31 de dezembro de 2025, possuía capacidade total instalada de transformação de 84.910 MVA juntamente com linhas de transmissão de 23 mil quilômetros. Atua nos estados da Bahia, Espírito Santo, Minas Gerais, Rio de Janeiro e São Paulo. A ISA Energía Brasil S.A. foi constituída em 1999 e está sediada em São Paulo, Brasil.",https://www.isacteep.com.br,Utilities,Utilidades Públicas,9.550562,1.0455426,0.11273,0.0776,22402032336.0,34.0,Mid Caps,80,3.5599999246117666,53.3999988691765,36.33,36.0,Baixo,,🟢,32.0099983215332,6.2168128172881465
BMEB4,MERCANTIL,"O Banco Mercantil do Brasil S.A., em conjunto com suas subsidiárias, presta serviços financeiros a clientes pessoas físicas e jurídicas no Brasil. Atua nos segmentos Financeiro, de Seguros e Intermediação Empresarial, Marketplace e Outros. A empresa oferece produtos de Conta Corrente, Empréstimos, Cartões, Investimentos, Cartões a Receber, Cheque Especial, Previdência Privada, Transferência de Benefícios, Limite Especial e Mercado de Capitais. Também oferece internet, WhatsApp, aplicativo Mercantil e serviços bancários de autoatendimento. Além disso, a empresa atua em atividades imobiliárias, securitização e tecnologia. A empresa era anteriormente conhecida como Banco Industrial de Minas Gerais e mudou seu nome para Banco Mercantil do Brasil S.A. em 1974. O Banco Mercantil do Brasil S.A. foi fundado em 1940 e está sediado em Belo Horizonte, Brasil.",https://bancomercantil.com.br,Financial Services,Serviços Financeiros,9.602055,2.1035464,0.32384998,0.024700000000000003,9228833801.326263,74.80000305175781,Small Caps,45,7.78999943780345,116.84999156705176,35.99,30.0,Médio,,🟡,87.25,-14.269337476495345
BPAC5,BTGP BANCO A,"O Banco BTG Pactual S.A. fornece produtos e serviços financeiros relativos a carteiras comerciais, de investimentos, de crédito, de financiamento, de arrendamento mercantil, de seguros e de câmbio no Brasil e internacionalmente. A empresa também oferece serviços de investimento pessoal para uma carteira de investimentos customizada; serviços de contas bancárias internacionais, incluindo cartão de débito, transferência, pagamento e recebimento, e serviços de suporte ao cliente. Também fornece serviços de gestão de patrimônio, como execução, pesquisa de mercado, recursos e análises educacionais e gestão de relacionamento; gestão do patrimônio familiar; contas correntes e de poupança, certificados de depósito, contas de aposentadoria e contas do mercado monetário; financiamento imobiliário; bem como empréstimos corporativos, empréstimos a prazo, linhas de crédito e financiamento de credores. O Banco BTG Pactual S.A. foi fundado em 1983 e está sediado no Rio de Janeiro, Brasil. O Banco BTG Pactual S.A. opera como subsidiária do BTG Pactual Holding Financeira Ltda.",https://www.btgpactual.com,Financial Services,Serviços Financeiros,9.741722,0.95173395,0.2484,0.0316,170454400578.89395,14.710000038146973,Blue Chips,85,1.5099999813325584,22.649999719988376,35.06,54.0,Baixo,,🟢,11.380000114440918,29.261861952710994
UGPA3,ULTRAPAR,"A Ultrapar Participações S.A., por meio de suas subsidiárias, atua nos setores de energia, mobilidade e infraestrutura logística no Brasil, no resto da Europa, nos Estados Unidos, no Canadá, em outros países da América Latina, na Oceania e internacionalmente. Atua nos segmentos Ultragaz, Ipiranga, Ultracargo e Hidrovias. A empresa distribui e vende produtos derivados de petróleo, biocombustíveis, gasolina, etanol, diesel, óleo combustível, querosene, gás natural para veículos e combustíveis aditivos da marca Ipimax para transportadoras, revendedores e varejistas; opera postos de abastecimento da marca Ipiranga e lojas de conveniência da marca AmPm; e produz e vende lubrificantes sob a marca ICONIC. Atua também na distribuição de gás liquefeito de petróleo a granel e envasado para os setores residencial, condominial, comércio, serviços, industrial e agronegócio; operação de rede de gasodutos de gás natural; e fornecimento de eletricidade renovável para empresas e residências, bem como gás natural comprimido e biometano para clientes corporativos. Além disso, a empresa opera terminais de armazenamento de granéis líquidos em centros logísticos; infraestrutura hidroviária e multimodal; e operações portuárias. Além disso, a empresa oferece soluções logísticas para movimentação de grãos, minérios e fertilizantes; serviços automotivos através das unidades Jet Oil; e programas de fidelidade da marca Km de Vantagens (KMV). Também exporta seus produtos e serviços. A Ultrapar Participações S.A. foi fundada em 1937 e está sediada em São Paulo, Brasil.",https://www.ultra.com.br,Energy,Energia,10.070176,1.9578416,0.19181,0.061,30673622870.704754,28.700000762939453,Mid Caps,50,2.8499999168772674,42.74999875315901,32.87,42.0,Baixo,,🟢,27.229999542236328,5.398462157235856
LREN3,LOJAS RENNER,"A Lojas Renner S.A., em conjunto com suas subsidiárias, atua como empresa de moda e estilo de vida no Brasil, Argentina e Uruguai. Atua nos segmentos de Varejo e Produtos Financeiros. A empresa comercializa roupas e produtos esportivos, calçados, acessórios, perfumaria, eletrodomésticos, móveis, relógios, artigos para casa e decoração, entregas urbanas e soluções de gestão logística, além de cosméticos. Atua também na concessão de empréstimos a pessoas físicas e jurídicas, financiamento de compras, seguros e prática de recebíveis e contas a pagar inerentes a empresas de crédito, financiamento e investimento, comissões de intermediação de vendas, bem como na concessão de empréstimos pessoais. Oferece seus produtos por meio de lojas e canais digitais das marcas Renner, Youcom, Camicado, Realize, Ashua, Uello, Realize e Repasse. A Lojas Renner S.A. foi constituída em 1965 e está sediada em Porto Alegre, Brasil.",https://www.lojasrennersa.com.br/en/,Consumer Cyclical,Consumo Cíclico,10.182432,1.4194217,0.14479999,0.0591,14713221355.179176,15.069999694824219,Mid Caps,55,1.4800000328825391,22.200000493238086,32.12,30.0,Baixo,,🟢,15.470000267028809,-2.585653298643508
CURY3,CURY S/A,"A Cury Construtora e Incorporadora S.A. atua no ramo imobiliário no Brasil. A empresa atua na venda de unidades imobiliárias; serviços de análise de crédito; empreendimentos imobiliários residenciais; aluguel de imóveis próprios; e prestação de serviços relativos a construção, fiscalização, estudos e projetos, além da execução de quaisquer obras de construção e engenharia civil. Também presta serviços de construção, administração, administração imobiliária e instalações elétricas e hidráulicas. A empresa foi fundada em 1963 e está sediada em São Paulo, Brasil.",https://cury.net,Real Estate,Imobiliário,10.2449665,7.060592,0.73689,0.1432,9404693256.339497,30.530000686645508,Small Caps,35,2.980000050429204,44.70000075643806,31.7,42.0,Baixo,,🟢,36.77999877929688,-16.992926318881338
FIQE3,UNIFIQUE,"A Unifique Telecomunicações S.A. fornece serviços de telecomunicações no Brasil. A empresa oferece armazenamento de dados, hospedagem de dados e serviços de Internet. Também fornece serviços de comunicação multimídia SCM; acesso a redes de comunicação, portais, provedores de conteúdo e serviços de informação na Internet; TV paga via satélite, cabo e micro-ondas; e serviços de hospedagem de internet e telefonia fixa comutada. Além disso, a empresa atua no comércio varejista de hospedagem de internet e telefonia fixa comutada; equipamentos e suprimentos para informática e telefonia móvel; publicação de livros e venda a retalho de livros; e planos de saúde. A Unifique Telecomunicações S.A. foi constituída em 1997 e está sediada em Timbó, Brasil.",https://unifique.com.br,Communication Services,Comunicação,10.32258,2.2284124,0.18061,0.1304,2491209925.12192,6.400000095367432,Small Caps,35,0.6200000479887229,9.300000719830843,31.18,36.0,Baixo,,🟢,5.510000228881836,16.152446996652966
CMIN3,CSINERACAO,"A CSN Mineração S.A. atua no negócio de mineração de minério de ferro no Brasil, Ásia e Europa. A empresa opera as minas de Casa de Pedra, Engenho e Pires. Também opera uma usina hidrelétrica. A empresa foi fundada em 1913 e está sediada em São Paulo, Brasil. A CSN Mineração S.A. atua como subsidiária da Companhia Siderúrgica Nacional.",https://ri.csnmineracao.com.br,Basic Materials,Materiais Básicos,10.926829,3.6422763,0.25741,0.13949999999999999,24335559633.848026,4.480000019073486,Mid Caps,50,0.4100000118125292,6.1500001771879385,27.15,44.0,Baixo,,🟢,5.269999980926514,-14.990511664368892
VAMO3,VAMOS,"A Vamos Locação de Caminhões, Máquinas e Equipamentos S.A., em conjunto com suas subsidiárias, atua na locação, revenda e venda de caminhões, máquinas, equipamentos e peças no Brasil. A empresa aluga tratores, empilhadeiras, máquinas e implementos agrícolas, ônibus e outros veículos; vende peças e acessórios automotivos; comercializa tratores, máquinas, pneus, câmaras de ar, implementos, veículos automotores e ônibus novos e usados; e presta serviços de manutenção e reparação de automóveis, assistência técnica e serviços correlatos, bem como atua na logística e no transporte rodoviário de cargas. Oferece também construção civil, peças, lubrificantes, prestação de serviços de reparação e manutenção de veículos e similares, transporte rodoviário de cargas em geral, comércio atacadista de máquinas, aparelhos e equipamentos para uso agrícola, partes e peças, e atividades de intermediação e agenciamento de serviços e negócios em geral, exceto imobiliário; representantes comerciais e agentes do comércio de veículos automotores. Além disso, a empresa comercializa fertilizantes, herbicidas e sementes; e presta serviços de engenharia relacionados à customização de caminhões e ônibus, bem como à prestação de atividades agrícolas. Além disso, a empresa fabrica e vende reboques de caminhões, carrocerias de caminhões, implementos rodoviários, cabines e máquinas e equipamentos industriais; e realiza instalação, reforma, reparo e manutenção de equipamentos e veículos; prestação de serviços de logística e transporte rodoviário de cargas; serviços de tecnologia da informação; análises técnicas de veículos automotores; serviços de operador de empilhadeira; e terceirização e gestão de recursos humanos. A Vamos Locação de Caminhões, Máquinas e Equipamentos S.A. foi constituída em 2015 e está sediada em São Paulo, Brasil. A Vamos Locação de Caminhões, Máquinas e Equipamentos S.A. é uma subsidiária da SIMPAR S.A.",https://grupovamos.com.br,Industrials,Indústria,11.206897,1.352476,0.12076,0.0431,3970937311.25,3.25,Small Caps,25,0.28999998840000046,4.349999826000007,25.29,20.0,Baixo,,🟢,4.079999923706055,-20.343135765358713
TTEN3,3TENTOS,"A Três Tentos Agroindustrial S/A, em conjunto com suas subsidiárias, atua no setor do agronegócio. Atua por meio de três segmentos: Insumos, Grãos e Industrial. A empresa comercializa e distribui produtos agrícolas, incluindo produtos para proteção e nutrição de cultivos e sementes para soja, milho e trigo. Também se dedica ao armazenamento, comercialização e comércio de produtos agrícolas; e atividades de industrialização de grãos. Além disso, a empresa oferece soluções de digitalização que incluem o 3tentos, aplicativo com foco na comodidade e gestão do produtor rural; App 3tentos + Nota Fiscal Eletrônica; certificado digital; Portal do Parceiro, possibilita certificado digital do agricultor para uso no App 3tentos e consulta relatórios e informações para o manejo da lavoura; e Terra3, plataforma de monitoramento agronômico remoto. Além disso, oferece serviços de assistência técnica. A empresa opera na África, América Central, América do Sul, América do Norte, Ásia e Europa. A Três Tentos Agroindustrial S/A foi fundada em 1954 e está sediada em Santa Bárbara do Sul, Brasil.",https://www.3tentos.com.br,Basic Materials,Materiais Básicos,11.257143,1.6767741,0.18494,0.022099999999999998,7881425559.18162,15.760000228881836,Small Caps,20,1.4000000025656454,21.000000038484682,24.95,20.0,Baixo,,🟢,15.84000015258789,-0.5050500185316258
ALPA3,ALPARGATAS,"A Alpargatas S.A. fabrica e comercializa calçados e acessórios no Brasil e no exterior. A empresa oferece seus produtos com as marcas Havaianas, ioasys e Rothys. A empresa era anteriormente conhecida como São Paulo Alpargatas S.A. e mudou seu nome para Alpargatas S.A. em 2010. A empresa foi fundada em 1907 e está sediada em São Paulo, Brasil.",https://www.alpargatas.com.br,Consumer Cyclical,Consumo Cíclico,11.639535,2.041191,0.16464001,0.049100000000000005,6798811534.816986,10.010000228881836,Small Caps,20,0.860000011072765,12.900000166091475,22.4,26.0,Baixo,,🟢,11.020000457763672,-9.165155961225786
REDE3,REDE ENERGIA,"A Rede Energia Participações S.A. atua na geração, distribuição e comercialização de energia elétrica no Brasil. A empresa atua na construção, operação, manutenção e serviços relacionados à geração e distribuição de energia elétrica. Oferece eletricidade a clientes residenciais, industriais, comerciais, rurais, governamentais e do setor público. A empresa foi constituída em 1929 e está sediada em Cataguases, Brasil.",https://www.energisa.com.br,Utilities,Utilidades Públicas,11.66,2.419087,0.23211999,0.078,14972630517.431566,5.829999923706055,Mid Caps,50,0.49999999345678,7.4999999018517,22.27,44.0,Baixo,,🟢,6.289999961853027,-7.313196199312172
BLAU3,BLAU,"Blau Farmacêutica S.A., uma empresa farmacêutica fornece medicamentos no Brasil, Argentina, Chile, Colômbia, Uruguai, Equador, Peru e Estados Unidos. Seus produtos abrangem diversas áreas, como imunologia, hematologia, oncologia, nefrologia, infectologia e anestesiologia. A empresa oferece estimuladores uterinos, antirreumáticos, anestésicos, antibióticos, cuidados com a saúde feminina, biofarmacêuticos, oncológicos, produtos hospitalares, antivirais e antirretrovirais, biológicos, inibidores de bomba de ácido, hemoderivados, antitrombóticos e trombolíticos. A Blau Farmacêutica S.A. foi constituída em 1987 e está sediada em Cotia, Brasil.",https://www.blau.com,Healthcare,Saúde,11.861702,1.12286,0.108610004,0.06,2575482227.03623,11.149999618530273,Small Caps,40,0.9399999779568121,14.099999669352181,20.92,20.0,Baixo,,🟢,10.699999809265137,4.2056057690345146
CXSE3,CAIXA SEGURI,"A Caixa Seguridade Participações S.A., em conjunto com suas subsidiárias, oferece produtos de seguros no Brasil e internacionalmente. A empresa atua em três segmentos: Escoamento/Mar Aberto, Segurança e Distribuição. Oferece produtos de seguros de vida, residencial e habitacional, acidentes pessoais e isenção de dívidas para pessoas físicas; e produtos de seguros de vida, residenciais e habitacionais, automóveis e credores para empresas. A empresa também oferece seguridade social, incluindo planos de previdência privada e corporativa; capitalização; consórcio; e corretagem e intermediação de produtos de segurança. Além disso, atua na aquisição de participação societária ou holding; administração, comercialização e prestação de planos privados de saúde e odontológicos; estruturação, administração e comercialização de cartas de crédito; e operações de resseguro e retrocessão. A empresa foi constituída em 2015 e está sediada em Brasília, Brasil. A Caixa Seguridade Participações S.A. atua como subsidiária da Caixa Econômica Federal.",https://www.caixaseguridade.com.br,Financial Services,Serviços Financeiros,11.972602,3.807449,0.31588,0.0801,52439998626.708984,17.479999542236328,Blue Chips,50,1.4600000519716874,21.90000077957531,20.18,44.0,Baixo,,🟢,18.06999969482422,-3.2650811430665607
MULT3,MULTIPLAN,"A Multiplan Empreendimentos Imobiliários S.A. atua no planejamento, implantação, desenvolvimento e comercialização de empreendimentos imobiliários no Brasil. A empresa desenvolve imóveis residenciais ou comerciais, inclusive shoppings urbanos. Atua também na compra e venda de imóveis, bem como na aquisição e alienação de direitos imobiliários, e na sua operação através de locação. Além disso, a empresa presta serviços de gestão e administração de shopping centers próprios ou de terceiros; serviços de assessoria e suporte técnico relacionados a questões imobiliárias; e construção civil, execução de obras e serviços de engenharia e correlatos. Além disso, atua no planejamento, desenvolvimento, gestão, promoção e intermediação de projetos imobiliários; importação e exportação de bens e serviços relacionados às suas atividades; geração de energia elétrica; serviços de fabricação e estacionamento de veículos; serviços de entretenimento; administrar e operar teatros; e serviços de administração e promoção. Adicionalmente, a empresa atua na promoção, organização, produção, agenciamento, programação e execução de eventos, shows e espetáculos esportivos, artísticos e culturais; administra eventos esportivos, artísticos e culturais; e aluguel de equipamentos de som, luz e quaisquer outros. A Multiplan Empreendimentos Imobiliários S.A. foi fundada em 1974 e está sediada no Rio de Janeiro, Brasil.",https://www.multiplan.com.br,Real Estate,Imobiliário,11.983806,2.2417448,0.20018,0.038599999999999995,14534979192.119408,29.600000381469727,Mid Caps,35,2.4699999634064276,37.04999945109641,20.11,38.0,Baixo,,🟢,33.130001068115234,-10.654997201442377
CEBR5,CEB A,"A Companhia Energética de Brasília - CEB, por meio de suas subsidiárias, gera e distribui energia elétrica e gás no Brasil. A empresa atua nos segmentos de Geração de Energia, Comercialização de Energia Elétrica, Iluminação Pública e Outros. A empresa produz energia elétrica a partir de usinas hidráulicas; distribui gás canalizado; serviços de iluminação pública; e fornece serviços de manutenção e expansão. Atua também na prestação de serviços de elaboração de estudos; projetos de engenharia; execução de obras de implantação, ampliação, reforma ou manutenção de redes aéreas e subterrâneas de transmissão e distribuição de energia elétrica; e instalação de sistemas de iluminação pública e elétrica predial. A empresa era anteriormente conhecida como Companhia de Eletricidade de Brasília e mudou seu nome para Companhia Energética de Brasília CEB em 1992. A Companhia Energética de Brasília CEB foi fundada em 1968 e está sediada em Brasília, Brasil.",https://www.ceb.com.br,Utilities,Utilidades Públicas,12.099099,2.1166275,0.16638,0.1467,1936120280.8953094,26.860000610351562,Small Caps,35,2.220000068629206,33.30000102943809,19.34,32.0,Baixo,,🟢,30.06999969482422,-10.675088516961893
