Ticker,Empresa,Resumo,Site,setor_original,Setor,PL,PVP,ROE,DivYield,MarketCap,Preco,Categoria,Score,LucroPorAcao,PrecoJusto,Desconto_%,Ranking,Risco,Risco_num,Farol,Preco_antigo,Variacao_%
SBFG3,GRUPO SBF ED,"O Grupo SBF S.A. atua na comercialização de artigos esportivos e produtos de lazer no Brasil. A empresa oferece calçados, roupas, entretenimento em geral, equipamentos e acessórios. Também oferece aulas semanais gratuitas de Yoga e FitDance; promove diversos eventos e aulas esportivas gratuitas; atividades gratuitas, como aulas de diversas modalidades e eventos esportivos; e empréstimo de futebol, basquete, vôlei, raquetes e tapetes de ioga. A empresa comercializa seus produtos por meio de loja física, site e aplicativo das marcas Oxer, Nord e Adams, além das marcas das coleções Go Equal, Farm, Asics, Confederação Brasileira de Futebol (CBF). Além disso, atua na prestação de serviços logísticos; e negócios de comércio esportivo e produção de audiovisão. O Grupo SBF S.A. foi fundado em 1981 e está sediado em São Paulo, Brasil.",https://ri.gruposbf.com.br,Consumer Cyclical,Consumo Cíclico,8.192858,0.809628,0.10802,0.0473,2641147801.0675793,11.470000267028809,Small Caps,50,1.3999998861238423,20.999998291857633,45.38,30.0,Baixo,,🟢,12.3100004196167,-6.823721559337249
BLAU3,BLAU,"Blau Farmacêutica S.A., uma empresa farmacêutica fornece medicamentos no Brasil, Argentina, Chile, Colômbia, Uruguai, Equador, Peru e Estados Unidos. Seus produtos abrangem diversas áreas, como imunologia, hematologia, oncologia, nefrologia, infectologia e anestesiologia. A empresa oferece estimuladores uterinos, antirreumáticos, anestésicos, antibióticos, cuidados com a saúde feminina, biofarmacêuticos, oncológicos, produtos hospitalares, antivirais e antirretrovirais, biológicos, inibidores de bomba de ácido, hemoderivados, antitrombóticos e trombolíticos. A Blau Farmacêutica S.A. foi constituída em 1987 e está sediada em Cotia, Brasil.",https://www.blau.com,Healthcare,Saúde,8.265625,1.0757499,0.1347,0.0638,2443820869.757246,10.579999923706055,Small Caps,65,1.2799999907697306,19.199999861545958,44.9,30.0,Baixo,,🟢,10.699999809265137,-1.1214942775529215
TGMA3,TEGMA,"A Tegma Gestão Logística S.A., em conjunto com suas subsidiárias, presta serviços logísticos no Brasil. Atua nos segmentos de Logística Automotiva e Logística Integrada. O segmento de Logística Automotiva atua no transporte e distribuição de veículos novos e usados; transferências portuárias; e gerenciamento de pátio e estoque para montadoras, além de serviços de pré-entrega de veículos. O segmento de Logística Integrada fornece serviços de transporte, armazenamento e gerenciamento de estoque para produtos químicos, eletrodomésticos e bens de consumo. A empresa também oferece logística e centro automotivo, gerenciamento de pátio, transporte e armazenamento de veículos, logística integrada, gerenciamento da cadeia de suprimentos de produtos químicos, gerenciamento de embalagens, intralogística e serviços de projetos especiais. Atende indústrias de alimentos e bebidas, automotiva, cosmética, eletrodomésticos, farmacêutica e química e petroquímica. A empresa foi fundada em 1969 e está sediada em São Bernardo do Campo, Brasil.",https://www.tegma.com.br,Industrials,Indústria,8.36413,2.3268824,0.27091998,0.1434,2029564698.2158756,30.780000686645508,Small Caps,60,3.6800002733871318,55.20000410080698,44.24,42.0,Baixo,,🟢,36.84999847412109,-16.472179209826564
CLSC4,CELESC ED,"A Centrais Elétricas de Santa Catarina S.A., por meio de suas subsidiárias, atua na geração, transmissão e comercialização de energia elétrica no Brasil. A empresa possui principalmente usinas hidrelétricas. A Centrais Elétricas de Santa Catarina S.A. foi fundada em 1955 e tem sede em Florianópolis, Brasil.",https://www.celesc.com.br,Utilities,Utilidades Públicas,8.508122,1.4760997,0.19097,0.052199999999999996,5857867336.832153,151.8699951171875,Small Caps,85,17.850002047124793,267.7500307068719,43.28,36.0,Baixo,,🟢,147.75,2.7884907730541455
ISAE4,ISA ENERGIA ED,"A ISA Energía Brasil S.A. atua no negócio de transmissão de energia elétrica no Brasil. Em 31 de dezembro de 2025, possuía capacidade total instalada de transformação de 84.910 MVA juntamente com linhas de transmissão de 23 mil quilômetros. Atua nos estados da Bahia, Espírito Santo, Minas Gerais, Rio de Janeiro e São Paulo. A ISA Energía Brasil S.A. foi constituída em 1999 e está sediada em São Paulo, Brasil.",https://www.isacteep.com.br,Utilities,Utilidades Públicas,8.570225,0.95040804,0.12099,0.0864,20102529755.84642,30.510000228881836,Mid Caps,80,3.5599999100235795,53.399998650353695,42.87,42.0,Baixo,,🟢,28.770000457763672,6.047965740120869
WHRL3,WHIRLPOOL ED,"A Whirlpool S.A. fabrica, vende, importa e exporta eletrodomésticos no Brasil. A empresa oferece refrigeradores, freezers, refrigeradores-freezer, condicionadores de ar, máquinas de fazer gelo, fogões, lava-louças, trituradores e compactadores de lixo, compactadores de lixo e aspiradores de pó. Também realiza manutenção e reparo de produtos e peças elétricas; serviços de eletrônica, hidráulica, metalurgia, produtos químicos e ferro, pintura e construção; assessoria orçamentária; serviços auxiliares nas áreas de segurança, saúde, lazer, vida cotidiana e bem-estar; marketing e publicidade; intermediação na comercialização de produtos; venda de assinaturas por meio eletrônico; e atividades de comercialização de roupas, acessórios, utensílios para casa e cozinha e outros produtos. Comercializa seus produtos com as marcas Brastemp, Consul, KitchenAind, Compra Certa, B.blend e Insinkerator. A empresa foi fundada em 1957 e está sediada em São Paulo, Brasil. A Whirlpool S.A. opera como subsidiária da Whirlpool Corporation.",https://www.whirlpool.com.br,Consumer Cyclical,Consumo Cíclico,8.574469,3.3114216,0.19904,0.1285,6056227919.477052,4.03000020980835,Small Caps,60,0.46999997432008317,7.049999614801248,42.84,36.0,Baixo,,🟢,4.349999904632568,-7.35631498482178
KEPL3,KEPLER WEBER,"A Kepler Weber S.A. fornece equipamentos para armazenamento de grãos e soluções pós-colheita de grãos no Brasil, nas Américas, na África, na Europa e na Ásia. Atua em cinco segmentos: Fazendas, Agroindústria, Portos e Terminais, Reposição e Serviços e Negócios Internacionais. A empresa oferece sistemas de armazenamento e preservação de grãos, como silos, secadores e transportadores, além de máquinas de limpeza. Também fornece equipamentos para commodities agrícolas, como etanol de milho, óleo de soja, ração animal, moinhos de trigo, indústrias de arroz, complexos cooperativos, produtores de cereais e canteiros; equipamentos industriais; e terminais portuários. Além disso, a empresa oferece peças de reposição e serviços de assistência técnica; serviços de engenharia técnica e processamento de dados; serviços de seguros contra riscos de engenharia; e serviços de monitoramento de temperatura e umidade de grãos no processo de processamento e armazenamento. Além disso, importa e exporta matérias-primas e produtos acabados e semiacabados. A empresa foi fundada em 1925 e está sediada em São Paulo, Brasil.",https://www.kepler.com.br,Industrials,Indústria,8.744445,1.7618088,0.20629999,0.06849999999999999,1364121639.663744,7.869999885559082,Small Caps,60,0.8999999297335716,13.499998946003574,41.7,42.0,Baixo,,🟢,8.369999885559082,-5.973715732812128
EKTR4,ELEKTRO,"A Elektro Redes S.A. atua na distribuição de energia elétrica no Brasil. A empresa era anteriormente conhecida como Elektro Eletricidade e Serviços S.A. e mudou seu nome para Elektro Redes S.A. em agosto de 2016. A empresa foi constituída em 1998 e está sediada em Campinas, Brasil. A Elektro Redes S.A. é subsidiária da Neoenergia S.A.",https://www.elektro.com.br,Utilities,Utilidades Públicas,8.876994,3.6994493,0.47262,0.1082,7550798793.57254,38.970001220703125,Small Caps,60,4.3899997252113865,65.8499958781708,40.82,42.0,Baixo,,🟢,39.5,-1.3417690615110758
BMEB3,MERCANTIL,"O Banco Mercantil do Brasil S.A., em conjunto com suas subsidiárias, presta serviços financeiros a clientes pessoas físicas e jurídicas no Brasil. Atua nos segmentos Financeiro, de Seguros e Intermediação Empresarial, Marketplace e Outros. A empresa oferece produtos de Conta Corrente, Empréstimos, Cartões, Investimentos, Cartões a Receber, Cheque Especial, Previdência Privada, Transferência de Benefícios, Limite Especial e Mercado de Capitais. Também oferece internet, WhatsApp, aplicativo Mercantil e serviços bancários de autoatendimento. Além disso, a empresa atua em atividades imobiliárias, securitização e tecnologia. A empresa era anteriormente conhecida como Banco Industrial de Minas Gerais e mudou seu nome para Banco Mercantil do Brasil S.A. em 1974. O Banco Mercantil do Brasil S.A. foi fundado em 1940 e está sediado em Belo Horizonte, Brasil.",https://bancomercantil.com.br,Financial Services,Serviços Financeiros,8.921779,2.6497517,0.30315,0.028900000000000002,7514546951.859741,58.16999816894531,Small Caps,45,6.5199998978841895,97.79999846826284,40.52,30.0,Médio,,🟡,73.63999938964844,-21.007606394518437
ALUP4,ALUPAR,"A Alupar Investimento S.A., em conjunto com suas subsidiárias, atua na transmissão, geração e comercialização de energia no Brasil, Colômbia, Peru e Chile. Atua nos segmentos de Transmissão e Geração. A empresa detém participação em concessões de 44 sistemas de transmissão de energia elétrica, totalizando 9.999 quilômetros de linhas de transmissão; e opera linhas aéreas e subestações. Também atua na geração de energia renovável por meio de hidrelétricas, parques eólicos e usinas fotovoltaicas, que possuem capacidade instalada de 798,5 MW. A empresa foi constituída em 2006 e está sediada em São Paulo, Brasil. A Alupar Investimento S.A. é uma subsidiária da Guarupart Participações Ltda.",https://www.alupar.com.br,Utilities,Utilidades Públicas,8.951613,1.1977986,0.14265001,0.0225,10976575048.328012,11.100000381469727,Mid Caps,65,1.2400000292092304,18.600000438138455,40.32,24.0,Baixo,,🟢,10.989999771118164,1.0009154926521953
TAEE3,TAESA,"A Transmissora Aliança de Energia Elétrica S.A., em conjunto com suas subsidiárias, atua na construção, operação e manutenção de linhas de transmissão de energia elétrica no Brasil. Opera uma extensão total de aproximadamente 15.319 quilômetros (km) de linhas de transmissão, que incluem 14.677 km de linhas de transmissão em operação e 642 km de linhas em construção; 113 subestações com tensão entre 230 e 525KV; e um centro de operação do sistema localizado no Rio de Janeiro. A empresa foi fundada em 2000 e está sediada no Rio de Janeiro, Brasil.",https://institucional.taesa.com.br/,Utilities,Utilidades Públicas,9.03268,0.62570745,0.21719,0.08,14282924368.82183,13.819999694824219,Mid Caps,100,1.5299999219306142,22.949998828959213,39.78,60.0,Baixo,,🟢,14.270000457763672,-3.1534740609950562
BEES3,BANESTES,"O Banestes S.A - Banco do Estado do Espírito Santo S.A., em conjunto com suas subsidiárias, atua como banco múltiplo no Brasil. Opera através do Financeiro; e Seguros e Outros segmentos. A empresa atua por meio de suas carteiras de comércio, rural, industrial, imobiliário, câmbio, arrendamento, investimento e administração de cartões de crédito; e nas áreas de seguros e distribuição, intermediação e administração de recursos de terceiros. Também fornece gestão de ativos e fundos; administração e intermediação de valores mobiliários, seguros, previdência e capitalização; fundos de investimento; cartões de crédito e débito; banco pela internet; conta corrente, poupança, especial, cheque fiduciário, jovem e universitário, conta mais fácil, simplificada, salário e judicial; títulos de capitalização; seguro de carro, vida, casa, acidentes pessoais, proteção financeira de cartão e seguro empresarial; cobranças e convênios; transferência de fundos e recursos; coleção; custódia; opções de crédito e financiamento; empréstimos e garantias; e outros serviços. Além disso, a empresa opera um serviço público de loteria. Banestes S.A - Banco do Estado do Espírito Santo S.A. foi fundado em 1935 e está sediado em Vitória, Brasil.",https://www.banestes.com.br,Financial Services,Serviços Financeiros,9.132652,1.2835221,0.14352,0.038599999999999995,3110162040.418844,8.949999809265137,Small Caps,50,0.9800000929921711,14.700001394882566,39.12,24.0,Baixo,,🟢,8.630000114440918,3.707991779614819
BEES4,BANESTES,"O Banestes S.A - Banco do Estado do Espírito Santo S.A., em conjunto com suas subsidiárias, atua como banco múltiplo no Brasil. Opera através do Financeiro; e Seguros e Outros segmentos. A empresa atua por meio de suas carteiras de comércio, rural, industrial, imobiliário, câmbio, arrendamento, investimento e administração de cartões de crédito; e nas áreas de seguros e distribuição, intermediação e administração de recursos de terceiros. Também fornece gestão de ativos e fundos; administração e intermediação de valores mobiliários, seguros, previdência e capitalização; fundos de investimento; cartões de crédito e débito; banco pela internet; conta corrente, poupança, especial, cheque fiduciário, jovem e universitário, conta mais fácil, simplificada, salário e judicial; títulos de capitalização; seguro de carro, vida, casa, acidentes pessoais, proteção financeira de cartão e seguro empresarial; cobranças e convênios; transferência de fundos e recursos; coleção; custódia; opções de crédito e financiamento; empréstimos e garantias; e outros serviços. Além disso, a empresa opera um serviço público de loteria. Banestes S.A - Banco do Estado do Espírito Santo S.A. foi fundado em 1935 e está sediado em Vitória, Brasil.",https://www.banestes.com.br,Financial Services,Serviços Financeiros,9.183673,1.2906927,0.14352,0.0384,3140974215.0,9.0,Small Caps,50,0.9800000500888914,14.70000075133337,38.78,24.0,Baixo,,🟢,8.800000190734863,2.2727250560256556
TAEE4,TAESA ED,"A Transmissora Aliança de Energia Elétrica S.A., em conjunto com suas subsidiárias, atua na construção, operação e manutenção de linhas de transmissão de energia elétrica no Brasil. Opera uma extensão total de aproximadamente 15.319 quilômetros (km) de linhas de transmissão, que incluem 14.677 km de linhas de transmissão em operação e 642 km de linhas em construção; 113 subestações com tensão entre 230 e 525KV; e um centro de operação do sistema localizado no Rio de Janeiro. A empresa foi fundada em 2000 e está sediada no Rio de Janeiro, Brasil.",https://institucional.taesa.com.br/,Utilities,Utilidades Públicas,9.333333,0.64653414,0.21719,0.0864,14758332899.9066,14.279999732971191,Mid Caps,100,1.5300000260326287,22.950000390489432,37.78,60.0,Baixo,,🟢,14.5600004196167,-1.9230815836259365
WHRL4,WHIRLPOOL ED,"A Whirlpool S.A. fabrica, vende, importa e exporta eletrodomésticos no Brasil. A empresa oferece refrigeradores, freezers, refrigeradores-freezer, condicionadores de ar, máquinas de fazer gelo, fogões, lava-louças, trituradores e compactadores de lixo, compactadores de lixo e aspiradores de pó. Também realiza manutenção e reparo de produtos e peças elétricas; serviços de eletrônica, hidráulica, metalurgia, produtos químicos e ferro, pintura e construção; assessoria orçamentária; serviços auxiliares nas áreas de segurança, saúde, lazer, vida cotidiana e bem-estar; marketing e publicidade; intermediação na comercialização de produtos; venda de assinaturas por meio eletrônico; e atividades de comercialização de roupas, acessórios, utensílios para casa e cozinha e outros produtos. Comercializa seus produtos com as marcas Brastemp, Consul, KitchenAind, Compra Certa, B.blend e Insinkerator. A empresa foi fundada em 1957 e está sediada em São Paulo, Brasil. A Whirlpool S.A. opera como subsidiária da Whirlpool Corporation.",https://www.whirlpool.com.br,Consumer Cyclical,Consumo Cíclico,9.3404255,3.6072307,0.19904,0.12539999999999998,6597230365.696422,4.389999866485596,Small Caps,60,0.46999998731166964,7.049999809675045,37.73,36.0,Baixo,,🟢,4.599999904632568,-4.565218315232698
INTB3,INTELBRAS,"A Intelbras S.A. - Indústria de Telecomunicações Eletrônica Brasileira atua na fabricação, desenvolvimento e comercialização de equipamentos de segurança eletrônica e serviços de vigilância e monitoramento eletrônicos no Brasil. A empresa atua por meio de três segmentos: Segurança, Tecnologia da Informação e Comunicação (TIC) e Energia. Oferece produtos e soluções de segurança eletrônica, inclusive Oferece produtos e soluções de segurança eletrônica, incluindo alarmes, armazenamento, câmeras, comunicação condominial, controle de acesso corporativo, fechaduras, gravadores de vídeo digital, produtos contra incêndio e intercomunicação, monitoramento de veículos, sensores, sinalização de emergência, produtos de software e aplicativos e acessórios; e os produtos e soluções de redes incluem produtos 5G e Wi-Fi corporativo, racks, roteadores, switches, rádios externos, fibra óptica e produtos passivos, injetores PoE, adaptadores USB, software e aplicativos e cabos. A empresa também fornece produtos e soluções relacionados à comunicação, como webcams, projetores, mouses e teclados sem fio, soluções em nuvem, antenas e conversores, centrais telefônicas, produtos para eletrodomésticos e conferências, gateways, fones de ouvido, rádios comunicadores, caixas e controles inteligentes, alto-falantes inteligentes, software e aplicativos e telefones; e produtos e soluções relacionados à energia que incluem carregadores de veículos elétricos, UPS, baterias, smart, fontes, protetores eletrônicos, protetores contra surtos, acessórios USB e sensores de presença de iluminação. Além disso, oferece soluções on grid, que incluem painéis solares, estruturas de fixação, inversores on grid, string boxes e acessórios; e soluções fora da rede, como produtos de iluminação, estruturas de montagem, gabinetes externos, acionamentos e painéis solares, bombas solares e geradores e inversores fora da rede. A Intelbras S.A. - Indústria de Telecomunicações Eletrônica Brasileira foi constituída em 1974 e está sediada em São José, Brasil.",https://www.intelbras.com,Industrials,Indústria,9.459459,1.5317286,0.16176,0.1009,4580955540.0,14.0,Small Caps,60,1.4800000718857176,22.200001078285762,36.94,36.0,Baixo,,🟢,13.970000267028809,0.21474396848792515
PSSA3,PORTO SEGURO,"A Porto Seguro S.A., em conjunto com suas subsidiárias, oferece uma gama de produtos e serviços de seguros no Brasil e no Uruguai. Oferece seguros de automóveis, residenciais, viagens, celular, vida, motocicleta, notebook e tablet, foto e vídeo, smart e games, moto, imobiliário, green card, fiança e mudança, além de resseguros, proteção combinada, responsabilidade civil profissional, máquinas e equipamentos, eventos, agronegócio e táxi. A empresa também atua na gestão e comercialização de títulos de capitalização; concessão de empréstimos e financiamentos para consumo e capital de giro; operação de cartões de crédito; gestão de grupos de consórcios para aquisição de bens móveis e imóveis; distribuição de cotas de fundos de investimento; manutenção, desenvolvimento e licenciamento de programas; instalação de sistemas de aquecimento, gás natural e gás liquefeito de petróleo; operação de centros de oncologia, hematologia e radioterapia; venda e distribuição de peças automotivas; e administração e gestão de carteiras de valores mobiliários, fundos de investimento e recursos financeiros. Além disso, presta serviços técnicos de corretagem de seguros; serviços de obtenção de crédito e financiamento ao consumo; suporte técnico para software e outros serviços de tecnologia da informação; serviços de intermediação e agência para serviços e empresas; serviços de cobrança de dívidas e informações de crédito; serviços de assessoria administrativa para médicos e seguradoras de saúde; serviços de consultoria e assessoria em saúde ocupacional, segurança no trabalho, ergonomia e serviços ambulatoriais; serviços relacionados com protecção e monitorização electrónica; e telemarketing e atendimento geral ao cliente. A empresa foi fundada em 1945 e está sediada em São Paulo, Brasil. A Porto Seguro S.A. opera como subsidiária da Porto Seguro Itaú Unibanco Participações S.A.",https://www.portoseguro.com.br,Financial Services,Serviços Financeiros,9.522073,2.0181434,0.22815001,0.0508,31866577983.034332,49.61000061035156,Mid Caps,75,5.210000029442282,78.15000044163423,36.52,42.0,Baixo,,🟢,50.470001220703125,-1.7039837320209625
CMIG3,CEMIG ED,"A Companhia Energética de Minas Gerais - CEMIG, por meio de suas subsidiárias, atua na geração, transmissão, distribuição e comercialização de energia no Brasil. Em 31 de dezembro de 2025, a empresa operava 32 usinas hidrelétricas com capacidade total de 4.434 MW, 2 parques eólicos com capacidade total de 71 MW e 12 usinas fotovoltaicas com capacidade total de 169 MW; 365.577 milhas de linhas de distribuição; e 4.865 milhas de linhas de transmissão. Também atua na aquisição, transporte e distribuição de gás e seus subprodutos e derivados; venda e comercialização de energia; construção, implantação, operação e manutenção de transmissão de energia elétrica; comercialização e intermediação de negócios relacionados à energia; instalação, operação, manutenção e aluguel de usinas solares; e atividades de geração distribuída, serviços de conta, cogeração, eficiência energética e gestão de abastecimento e armazenamento. A empresa foi constituída em 1952 e está sediada em Belo Horizonte, Brasil.",https://www.cemig.com.br,Utilities,Utilidades Públicas,9.803468,1.6978675,0.1751,0.0816,48517162116.647514,16.959999084472656,Mid Caps,75,1.7299999433335893,25.94999915000384,34.64,42.0,Baixo,,🟢,15.520000457763672,9.278341393273893
ISAE3,ISA ENERGIA ED,"A ISA Energía Brasil S.A. atua no negócio de transmissão de energia elétrica no Brasil. Em 31 de dezembro de 2025, possuía capacidade total instalada de transformação de 84.910 MVA juntamente com linhas de transmissão de 23 mil quilômetros. Atua nos estados da Bahia, Espírito Santo, Minas Gerais, Rio de Janeiro e São Paulo. A ISA Energía Brasil S.A. foi constituída em 1999 e está sediada em São Paulo, Brasil.",https://www.isacteep.com.br,Utilities,Utilidades Públicas,9.901686,1.0980624,0.12099,0.0748,23225636466.0,35.25,Mid Caps,80,3.5599997818553324,53.399996727829986,33.99,36.0,Baixo,,🟢,32.0099983215332,10.121842700276682
MILS3,MILLS ED,"A Mills Locação, Serviços e Logística S.A. atua como locadora de máquinas e equipamentos no Brasil. Aluga, vende, importa e exporta estruturas tubulares de aço e alumínio, escoramentos e equipamentos de acesso para obras de construção civil e formas de concreto reutilizáveis. A empresa também desenvolve projetos de engenharia relacionados e presta serviços de supervisão e montagem opcional. Além disso, vende, aluga e distribui plataformas elevatórias de trabalho, peças relacionadas, carros novos e usados. Também oferece máquinas pesadas, retroescavadeiras, rolos compactos, minicarregadeiras, rebocadores, geradores, compressores, tratores de esteira e agrícolas, escavadeiras, carregadeiras de rodas, motoniveladoras, empilhadeiras e porta-paletes. Além disso, fornece frete, manutenção, treinamento, telemetria, operação remota e serviços e soluções de consultoria. A empresa era anteriormente conhecida como Mills Estruturas e Serviços de Engenharia S.A. e mudou seu nome para Mills Locação, Serviços e Logística S.A. em julho de 2022. A Mills Locação, Serviços e Logística S.A. foi fundada em 1952 e tem sede no Rio de Janeiro, Brasil.",https://www.mills.com.br,Industrials,Indústria,10.112,1.8194904,0.19438,0.0949,2874510408.9563293,12.640000343322754,Small Caps,35,1.2500000339520128,18.75000050928019,32.59,36.0,Baixo,,🟢,15.119999885559082,-16.402113498723924
LREN3,LOJAS RENNER,"A Lojas Renner S.A., em conjunto com suas subsidiárias, atua como empresa de moda e estilo de vida no Brasil, Argentina e Uruguai. Atua nos segmentos de Varejo e Produtos Financeiros. A empresa comercializa roupas e produtos esportivos, calçados, acessórios, perfumaria, eletrodomésticos, móveis, relógios, artigos para casa e decoração, entregas urbanas e soluções de gestão logística, além de cosméticos. Atua também na concessão de empréstimos a pessoas físicas e jurídicas, financiamento de compras, seguros e prática de recebíveis e contas a pagar inerentes a empresas de crédito, financiamento e investimento, comissões de intermediação de vendas, bem como na concessão de empréstimos pessoais. Oferece seus produtos por meio de lojas e canais digitais das marcas Renner, Youcom, Camicado, Realize, Ashua, Uello, Realize e Repasse. A Lojas Renner S.A. foi constituída em 1965 e está sediada em Porto Alegre, Brasil.",https://www.lojasrennersa.com.br/en/,Consumer Cyclical,Consumo Cíclico,10.201388,1.379861,0.13732,0.060599999999999994,14342190130.658403,14.6899995803833,Mid Caps,55,1.4400000843398273,21.600001265097408,31.99,36.0,Baixo,,🟢,15.470000267028809,-5.042021158253774
