Ticker,Empresa,Resumo,Site,setor_original,Setor,PL,PVP,ROE,DivYield,MarketCap,Preco,Categoria,Score,LucroPorAcao,PrecoJusto,Desconto_%,Ranking,Risco,Risco_num,Farol,Preco_antigo,Variacao_%
PETR3,PETROBRAS,"Petróleo Brasileiro S.A. - A Petrobras explora, produz e vende petróleo e gás no Brasil, China, Estados Unidos, Américas, Ásia, Europa, Cingapura e internacionalmente. Atua por meio de três segmentos: Exploração e Produção; Refino, Transporte e Comercialização; e gás e energias de baixo carbono. O segmento de Exploração e Produção explora, desenvolve e produz petróleo bruto, líquidos de gás natural e gás natural principalmente para abastecimento às refinarias nacionais. Seu segmento de Refino, Transporte e Comercialização atua no refino, logística, transporte, aquisição e exportação de petróleo bruto; comércio de produtos petrolíferos; e produção de fertilizantes, além de participação em empresas petroquímicas. O segmento de Gás e Energias de Baixo Carbono atua na logística e comercialização de gás natural e eletricidade; transporte e comercialização de gás natural liquefeito; geração de energia elétrica por meio de usinas termelétricas; negócios de energia renovável; negócios de baixo carbono; e negócios de processamento de gás natural, bem como produção de biodiesel e seus coprodutos. Também se dedica à prospecção, perfuração, refinação, processamento, comercialização e transporte de petróleo bruto proveniente de campos petrolíferos onshore e offshore, e xisto ou outras rochas, bem como produtos petrolíferos, gás natural e outros hidrocarbonetos líquidos. Além disso, a empresa se dedica à pesquisa, desenvolvimento, produção, transporte, distribuição e comercialização de energia. A Petróleo Brasileiro S.A. - Petrobras foi constituída em 1953 e está sediada no Rio de Janeiro, Brasil.",https://petrobras.com.br,Energy,Energia,5.715867,1.4404837,0.25601,0.0834,598939427136.9863,46.470001220703125,Blue Chips,100,8.130000439251495,121.95000658877242,61.89,58.0,Baixo,,🟢,46.220001220703125,0.5408913747237605
POMO3,MARCOPOLO,"A Marcopolo S.A. atua na fabricação e comercialização de ônibus, carrocerias e componentes no Brasil, África do Sul, Austrália, China, México, Argentina e internacionalmente. A empresa oferece ônibus intermunicipais, urbanos e microônibus, ônibus elétricos e ônibus híbridos; e família de microônibus Volare, como ônibus completo, com chassi e carroceria, carroceria para transporte escolar, fretamento executivo, transporte urbano e projetos especiais. Também está envolvida no desenvolvimento e produção de novos modelos sobre trilhos; produção de unidades com propulsão, automóveis de passageiros e fabricação de caixas para transporte de pessoas, TRAMs e EMUs; disponibilização de soluções de crédito para aquisição de ônibus e micro-ônibus; montagem, comercialização, importação e exportação de equipamentos de refrigeração e ar condicionado; e negócio de espuma para assentos. A empresa foi fundada em 1949 e está sediada em Caxias Do Sul, Brasil.",https://www.marcopolo.com.br,Industrials,Indústria,5.83,1.8873422,0.30911,0.1752,7237008216.683325,5.829999923706055,Small Caps,60,0.99999998691356,14.9999998037034,61.13,46.0,Baixo,,🟢,6.010000228881836,-2.995013283206986
EUCA3,EUCATEX,"A Eucatex S.A. Indústria e Comércio produz e comercializa painéis de fibra e madeira no Brasil. A empresa fornece pisos laminados e vinílicos, portas, divisórias, painéis de fibra de média densidade (MDF) e aglomerado de média densidade (MDP), placas de fibra, tintas e vernizes, painéis decorativos, folhas de fibra de madeira, lacas e outros produtos. Produz também mudas de eucalipto e rodapés; e atua em consultoria de gestão empresarial, atividades imobiliárias, florestais, colheita, manejo florestal, transporte, logística de coleta de resíduos, material reciclado e eletricidade. A empresa atende principalmente os setores moveleiro e de construção civil. Também exporta seus produtos para os Estados Unidos e América Latina. A Eucatex S.A. Indústria e Comércio foi constituída em 1951 e está sediada em São Paulo, Brasil.",https://www.eucatex.com.br,Industrials,Indústria,5.900901,0.81977475,0.14633,0.039,2413936441.493408,26.200000762939453,Small Caps,50,4.440000054727143,66.60000082090716,60.66,34.0,Baixo,,🟢,21.5,21.860468664834663
POMO4,MARCOPOLO,"A Marcopolo S.A. atua na fabricação e comercialização de ônibus, carrocerias e componentes no Brasil, África do Sul, Austrália, China, México, Argentina e internacionalmente. A empresa oferece ônibus intermunicipais, urbanos e microônibus, ônibus elétricos e ônibus híbridos; e família de microônibus Volare, como ônibus completo, com chassi e carroceria, carroceria para transporte escolar, fretamento executivo, transporte urbano e projetos especiais. Também está envolvida no desenvolvimento e produção de novos modelos sobre trilhos; produção de unidades com propulsão, automóveis de passageiros e fabricação de caixas para transporte de pessoas, TRAMs e EMUs; disponibilização de soluções de crédito para aquisição de ônibus e micro-ônibus; montagem, comercialização, importação e exportação de equipamentos de refrigeração e ar condicionado; e negócio de espuma para assentos. A empresa foi fundada em 1949 e está sediada em Caxias Do Sul, Brasil.",https://www.marcopolo.com.br,Industrials,Indústria,5.95,1.9261897,0.30911,0.17170000000000002,7385968794.583312,5.949999809265137,Small Caps,60,0.9999999679437205,14.999999519155807,60.33,46.0,Baixo,,🟢,6.389999866485596,-6.885760037776846
EUCA4,EUCATEX,"A Eucatex S.A. Indústria e Comércio produz e comercializa painéis de fibra e madeira no Brasil. A empresa fornece pisos laminados e vinílicos, portas, divisórias, painéis de fibra de média densidade (MDF) e aglomerado de média densidade (MDP), placas de fibra, tintas e vernizes, painéis decorativos, folhas de fibra de madeira, lacas e outros produtos. Produz também mudas de eucalipto e rodapés; e atua em consultoria de gestão empresarial, atividades imobiliárias, florestais, colheita, manejo florestal, transporte, logística de coleta de resíduos, material reciclado e eletricidade. A empresa atende principalmente os setores moveleiro e de construção civil. Também exporta seus produtos para os Estados Unidos e América Latina. A Eucatex S.A. Indústria e Comércio foi constituída em 1951 e está sediada em São Paulo, Brasil.",https://www.eucatex.com.br,Industrials,Indústria,5.995496,0.8329162,0.14633,0.042300000000000004,2452633138.442749,26.6200008392334,Small Caps,50,4.439999766363517,66.59999649545276,60.03,34.0,Baixo,,🟢,20.86000061035156,27.612656089873262
IGTI3,IGUATEMI S.A,"A Iguatemi S.A., em conjunto com suas subsidiárias, atua na exploração e planejamento comercial de shopping centers no Brasil. A empresa também atua na compra de estacionamentos e na venda de imóveis. Além disso, presta serviços de assessoria e consultoria econômica, financeira e tributária. A empresa era anteriormente conhecida como Jereissati Participações S.A. e mudou seu nome para Iguatemi S.A. em novembro de 2021. A Iguatemi S.A. foi fundada em 1946 e está sediada em São Paulo, Brasil.",https://iguatemi.com.br,Real Estate,Imobiliário,6.034483,0.21263671,0.15361,0.0276,4213149591.0,3.5,Small Caps,70,0.5799999768000009,8.699999652000013,59.77,40.0,Baixo,,🟢,3.259999990463257,7.361963504258734
RECV3,PETRORECSA,"A Petroreconcavo S.A. atua na exploração e produção de extração de petróleo e gás no Brasil. A empresa foi fundada em 1999 e está sediada em Mata de São João, Brasil.",https://petroreconcavo.com.br,Energy,Energia,6.0655737,0.7509133,0.12347,0.1229,3252289788.770275,11.100000381469727,Small Caps,65,1.8300000841585236,27.450001262377853,59.56,40.0,Baixo,,🟢,12.600000381469728,-11.904761544340795
CEAB3,CEA MODAS,"A C&A Modas S.A. atua como varejista de moda feminina, masculina e infantil no Brasil e internacionalmente. Oferece blusas, calças, vestidos, saias, casacos, moda praia, roupas íntimas, camisetas, camisas, bermudas, jaquetas e casacos, bodys, conjuntos e shorts; produtos de beleza, incluindo perfumes, maquiagem, cuidados com a pele, corpo e banho e acessórios; e calçados, como botas, sapatos e mocassins, sapatilhas, sandálias e tênis. A empresa vende seus produtos em lojas e também online. A empresa foi fundada em 1841 e está sediada em Barueri, Brasil.",https://www.cea.com.br,Consumer Cyclical,Consumo Cíclico,6.0957446,0.93581575,0.16788,0.0789,3465095279.174284,11.460000038146973,Small Caps,85,1.8800000311933958,28.200000467900935,59.36,52.0,Baixo,,🟢,12.140000343322754,-5.601320312563214
EZTC3,EZTEC,"A EZTEC Empreendimentos e Participações S.A. atua em atividades de engenharia, construção e incorporação imobiliária no Brasil e internacionalmente. A empresa desenvolve e comercializa imóveis; administra e aluga propriedades; constrói condomínios; e subdivide terras. Atua também na prestação de serviços relacionados à construção, fiscalização, estudos e projetos; e execução de obras e serviços de engenharia civil. A EZTEC Empreendimentos e Participações S.A. foi fundada em 1979 e está sediada em São Paulo, Brasil.",https://www.eztec.com.br,Real Estate,Imobiliário,6.247619,0.7233832,0.11286,0.031200000000000002,3639338754.495391,13.119999885559082,Small Caps,50,2.0999999976885726,31.499999965328588,58.35,34.0,Baixo,,🟢,14.9399995803833,-12.182059879131032
CMIG4,CEMIG,"A Companhia Energética de Minas Gerais - CEMIG, por meio de suas subsidiárias, atua na geração, transmissão, distribuição e comercialização de energia no Brasil. Em 31 de dezembro de 2025, a empresa operava 32 usinas hidrelétricas com capacidade total de 4.434 MW, 2 parques eólicos com capacidade total de 71 MW e 12 usinas fotovoltaicas com capacidade total de 169 MW; 365.577 milhas de linhas de distribuição; e 4.865 milhas de linhas de transmissão. Também atua na aquisição, transporte e distribuição de gás e seus subprodutos e derivados; venda e comercialização de energia; construção, implantação, operação e manutenção de transmissão de energia elétrica; comercialização e intermediação de negócios relacionados à energia; instalação, operação, manutenção e aluguel de usinas solares; e atividades de geração distribuída, serviços de conta, cogeração, eficiência energética e gestão de abastecimento e armazenamento. A empresa foi constituída em 1952 e está sediada em Belo Horizonte, Brasil.",https://www.cemig.com.br,Utilities,Utilidades Públicas,6.3583813,1.0893247,0.17038,0.11539999999999999,31467500713.0,11.0,Mid Caps,100,1.7300000552027293,25.950000828040938,57.61,52.0,Baixo,,🟢,11.93000030517578,-7.795475954617561
SHUL4,SCHULZ,"A Schulz S.A., juntamente com suas subsidiárias, fabrica e comercializa compressores de ar no Brasil, América Latina, Estados Unidos, Canadá, Europa e internacionalmente. Atua nos segmentos de Indústria e Comercialização. A empresa oferece compressores de ar, incluindo motor de diafragma, alternativo, parafuso rotativo, booster, scroll, isento de óleo e compressores de pistão; equipamentos de tratamento de ar, como separadores e drenos de condensado, purificadores e separadores de água e óleo, bem como tanques e secadores de ar, e filtros e gerenciadores de ar; e produtos de limpeza que incluem aspiradores de pó e líquidos e lavadoras de alta pressão. Também fornece máquinas e ferramentas, que incluem geradores de energia, máquinas de solda, motores de combustão, equipamentos de coluna e bancada, ferramentas elétricas e sem fio, ferramentas manuais, ferramentas pneumáticas e a bateria, linhas automotivas de 12V, motores e pistolas elétricas, bem como lubrificantes; bombas motorizadas; peças de reposição; e outros acessórios relacionados. Além disso, a empresa oferece serviços pós-venda. Além disso, seus produtos são utilizados para aplicações residenciais, profissionais e industriais. Além disso, a empresa exporta seus produtos. A Schulz S.A. foi fundada em 1963 e está sediada em Joinville, Brasil.",https://www.schulz.com.br,Consumer Cyclical,Consumo Cíclico,6.389611,1.1700357,0.18205,0.1131,1754246784.682928,4.920000076293945,Small Caps,85,0.7699999383834079,11.549999075751117,57.4,46.0,Baixo,,🟢,5.349999904632568,-8.037380112218056
WIZC3,WIZ CO,"Wiz Co Participações e Corretagem de Seguros S.A. operates as an insurance broker in Brazil. The company offers bancassurance, consortiums, and credit services. It also involved in-person, remote, and digital solutions for the sale and after-sales of insurance and financial products. The company was formerly known as Wiz Soluções e Corretagem de Seguros S.A. Wiz Co Participações e Corretagem de Seguros S.A. was founded in 1973 and is headquartered in Brasília, Brazil.",https://wiz.co,Financial Services,Serviços Financeiros,6.471074,1.7942256,0.28619,0.0803,1252074005.8600426,7.829999923706055,Small Caps,60,1.2100000592955753,18.15000088943363,56.86,46.0,Baixo,,🟢,9.6899995803833,-19.195043727790043
OFSA3,OUROFINO S/A,"A Ouro Fino Saúde Animal Participações S.A., em conjunto com suas subsidiárias, atua no desenvolvimento, produção e comercialização de medicamentos veterinários, vacinas e outros produtos para animais de produção e de companhia, principalmente no Brasil. A empresa atua através de três segmentos: Animais de Produção; Animais de Companhia; e Operações Internacionais. Fabrica e comercializa medicamentos, incluindo antiinflamatórios, antibióticos, anticoccidianos, antimastíticos, ectoparasiticidas, endectocidas, endoparasiticidas, hemoparasiticidas, inoculantes, terapêuticos, produtos para reprodução animal e vacinas; e aditivos, probióticos e outros produtos veterinários para melhoria de desempenho para bovinos, suínos, aves, ovinos, cavalos e caprinos, bem como serviços de fabricação. A empresa também fabrica soluções veterinárias para cães e gatos, como anestésicos, sedativos, antiinflamatórios, antibióticos, antimicrobianos, dermatológicos, ectoparasiticidas, endoparasiticidas, dermocosméticos e otológicos. Além disso, oferece vacinas e outros produtos veterinários para animais de produção e de companhia. A empresa era anteriormente conhecida como A.H.N.S.P.E. Empreendimentos e Participações S.A. A Ouro Fino Saúde Animal Participações S.A. foi constituída em 1987 e está sediada em Cravinhos, Brasil.",https://www.ourofinosaudeanimal.com,Healthcare,Saúde,6.6815147,1.9756337,0.33279,0.0461,1613028180.0,30.0,Small Caps,45,4.489999849884338,67.34999774826507,55.46,40.0,Baixo,,🟢,26.21999931335449,14.416478968862004
LEVE3,METAL LEVE,"A MAHLE Metal Leve S.A., empresa de peças automotivas, fabrica e comercializa componentes para motores de combustão interna e filtros automotivos na América do Sul, Europa, América Central e do Norte, África e internacionalmente. Atua nos segmentos de Powertrain e Carregamento e Sistemas Térmicos e Fluidos. A empresa oferece sistemas de acionamento e eletrônica de potência para motores elétricos; sistemas de pistão, componentes de cilindros, trens de válvulas, ar condicionado, refrigeração de motor, gerenciamento de ar, resfriamento de motor, gerenciamento de óleo; e eletrônica de potência para acionamentos de tração para automóveis de passageiros, bem como acionamento elétrico e sistemas mecatrônicos para aplicações industriais, máquinas agrícolas e de construção, veículos comerciais, veículos industriais, veículos de transporte elétrico e indústria automotiva, bem como veículos industriais e especiais; e equipamentos de motores grandes e pequenos. Ela fornece túneis de vento climáticos, testes de motores, engenharia, testes de módulos, gerenciamento térmico e serviços de transmissão. Além disso, disponibiliza túneis de vento climáticos; testes de motores; teste de módulo; gestão térmica industrial; transmissões; e serviços de engenharia. Além disso, a empresa oferece produtos para pistões, anéis de pistão, válvulas, bielas, rolamentos, buchas, arruelas de encosto, camisas de cilindro, anéis de pistão, árvores de cames, pistões, pinos, porta-anéis e compressores mecânicos, bem como filtros de combustível, filtros de ar, filtros de óleo, filtros de ar condicionado, filtros de carvão ativado, separadores de óleo, tampas de válvulas, sistemas de admissão de ar, pré-filtros de diesel e coletores de admissão, ar condicionado e radiadores e condensadores. Além disso, exporta seus produtos. A empresa foi fundada em 1920 e está sediada em Mogi Guaçu, Brasil. A MAHLE Metal Leve S.A. atua como subsidiária da Mahle Indústria E Comercio Ltda.",https://www.mahle.com,Consumer Cyclical,Consumo Cíclico,6.7653065,4.1940794,0.67697,0.086,4493118056.816101,33.150001525878906,Small Caps,60,4.899999952090701,73.49999928136052,54.9,46.0,Baixo,,🟢,35.689998626708984,-7.116831601470684
TEND3,TENDA,"A Construtora Tenda S.A. atua como construtora de residências no Brasil. Atua nos segmentos On-Site e Off-Site. A empresa também atua na execução e gerenciamento de obras de construção civil; desenvolvimento de imóveis; compra e venda de imóveis e terrenos; prestação de serviços de gestão de construção civil; e intermediação e comercialização de cotas de consórcio. A Construtora Tenda S.A. foi fundada em 1969 e está sediada em São Paulo, Brasil.",https://www.tenda.com,Real Estate,Imobiliário,6.7728195,3.3730679,0.47057998,0.0369,4092884420.4642334,33.38999938964844,Small Caps,45,4.92999988994959,73.94999834924386,54.85,40.0,Baixo,,🟢,30.670000076293945,8.868598978116362
BGIP3,BANESE,"O Banco do Estado de Sergipe S.A. oferece diversos produtos e serviços bancários em Sergipe. A empresa oferece contas correntes, únicas e outras; poupança; Produtos CBD/RDB; investimentos; cartões; produtos de seguros; empréstimos e financiamentos, consignado, pagamento, consórcio, capitalização, portabilidade e serviços de internet banking. A empresa era anteriormente conhecida como Banco de Fomento Budget e mudou seu nome para Banco do Estado de Sergipe S.A. em 1967. O Banco do Estado de Sergipe S.A. foi fundado em 1961 e tem sede em Aracaju, Brasil.",https://www.banese.com.br,Financial Services,Serviços Financeiros,6.7783504,1.133523,0.16228001,0.0672,1214099488.7800598,52.599998474121094,Small Caps,85,7.7599999070748975,116.39999860612346,54.81,46.0,Baixo,,🟢,62.2400016784668,-15.488436607290227
ECOR3,ECORODOVIAS,"A EcoRodovias Infraestrutura e Logística S.A. atua como uma empresa de infraestrutura que opera concessões rodoviárias no Brasil. Opera o Ecopátio Logística Cubatão, plataforma logística intermodal, que é o local regulador de caminhões no Porto de Santos. A empresa também atua na operação portuária e na movimentação e armazenagem de cargas de importação e exportação no Porto de Santos. A empresa foi fundada em 1997 e está sediada em São Paulo, Brasil. A EcoRodovias Infraestrutura e Logística S.A. atua como subsidiária da IGLI S.p.A.",https://www.ecorodovias.com.br,Industrials,Indústria,6.953271,1.264446,0.17334,0.0407,5175421961.243766,7.440000057220459,Small Caps,70,1.0700000125438027,16.050000188157043,53.64,40.0,Baixo,,🟢,9.960000038146973,-25.30120453087219
CLSC3,CELESC,"A Centrais Elétricas de Santa Catarina S.A., por meio de suas subsidiárias, atua na geração, transmissão e comercialização de energia elétrica no Brasil. A empresa possui principalmente usinas hidrelétricas. A Centrais Elétricas de Santa Catarina S.A. foi fundada em 1955 e tem sede em Florianópolis, Brasil.",https://www.celesc.com.br,Utilities,Utilidades Públicas,7.3028097,1.2106508,0.18175,0.0555,5013921325.9700775,129.99000549316406,Small Caps,85,17.799999018619378,266.9999852792907,51.31,40.0,Baixo,,🟢,124.01000213623048,4.822194382646878
BBSE3,BBSEGURIDADE ATZ,"A BB Seguridade Participações S.A., por meio de suas subsidiárias, atua nos negócios de seguros, previdência e obrigações no Brasil. A empresa atua por meio de dois segmentos, Seguros e Corretagem. O segmento de Seguros oferece produtos e serviços de seguros, incluindo seguros de vida, patrimonial e de veículos, seguros patrimoniais, rurais, riscos especiais e financeiros, transportes, cascos e habitação, bem como planos de previdência complementar, odontológico e de capitalização. Seu segmento de Corretagem atua na corretagem e administração, implementação, promoção e viabilização de negócios de seguros nos setores básico, vida e capitalização, bem como planos de previdência aberta e planos odontológicos. A empresa foi fundada em 1981 e está sediada em Brasília, Brasil. A BB Seguridade Participações S.A. atua como subsidiária do Banco do Brasil S.A.",https://www.bbseguridaderi.com.br,Financial Services,Serviços Financeiros,7.411393,5.394656,0.75649,0.1484,68196063424.19714,35.130001068115234,Blue Chips,75,4.73999976362274,71.09999645434111,50.59,52.0,Baixo,,🟢,34.849998474121094,0.8034508070411105
BEEF3,MINERVA,"A Minerva S.A. produz e comercializa carne bovina in natura, gado e subprodutos na América do Sul e internacionalmente. A empresa também atua no abate, desossa e processamento de carnes; venda de carnes resfriadas, congeladas e processadas, bem como produtos bovinos, suínos e aves; exportação e venda de gado vivo; e criação e venda de gado vivo, cordeiros, porcos e outros animais vivos. Além disso, comercializa eletricidade; comercializa proteínas e produtos alimentícios; vende marcas de terceiros principalmente produtos Swift; e prepara produtos para animais, que incluem farinha de carne e ossos, sangue e sebo. A Minerva S.A. foi fundada em 1957 e está sediada em Barretos, Brasil.",https://ri.minervafoods.com,Consumer Defensive,Consumo Defensivo,7.4468083,2.7429466,0.83755,0.0356,3456024348.0,3.5,Small Caps,45,0.4700000132942861,7.050000199414291,50.35,40.0,Baixo,,🟢,4.099999904632568,-14.634144355823805
KEPL3,KEPLER WEBER,"A Kepler Weber S.A. fornece equipamentos para armazenamento de grãos e soluções pós-colheita de grãos no Brasil, nas Américas, na África, na Europa e na Ásia. Atua em cinco segmentos: Fazendas, Agroindústria, Portos e Terminais, Reposição e Serviços e Negócios Internacionais. A empresa oferece sistemas de armazenamento e preservação de grãos, como silos, secadores e transportadores, além de máquinas de limpeza. Também fornece equipamentos para commodities agrícolas, como etanol de milho, óleo de soja, ração animal, moinhos de trigo, indústrias de arroz, complexos cooperativos, produtores de cereais e canteiros; equipamentos industriais; e terminais portuários. Além disso, a empresa oferece peças de reposição e serviços de assistência técnica; serviços de engenharia técnica e processamento de dados; serviços de seguros contra riscos de engenharia; e serviços de monitoramento de temperatura e umidade de grãos no processo de processamento e armazenamento. Além disso, importa e exporta matérias-primas e produtos acabados e semiacabados. A empresa foi fundada em 1925 e está sediada em São Paulo, Brasil.",https://www.kepler.com.br,Industrials,Indústria,7.5647054,1.4076183,0.19634001,0.0839,1114523765.745616,6.429999828338623,Small Caps,85,0.8500000315066629,12.750000472599943,49.57,42.0,Baixo,,🟢,8.369999885559082,-23.178017726948568
ISAE4,ISA ENERGIA,"A ISA Energía Brasil S.A. atua no negócio de transmissão de energia elétrica no Brasil. Em 31 de dezembro de 2025, possuía capacidade total instalada de transformação de 84.910 MVA juntamente com linhas de transmissão de 23 mil quilômetros. Atua nos estados da Bahia, Espírito Santo, Minas Gerais, Rio de Janeiro e São Paulo. A ISA Energía Brasil S.A. foi constituída em 1999 e está sediada em São Paulo, Brasil.",https://www.isacteep.com.br,Utilities,Utilidades Públicas,7.724719,0.8566444,0.11273,0.0959,18119290860.0,27.5,Mid Caps,80,3.560000046603637,53.40000069905456,48.5,42.0,Baixo,,🟢,28.770000457763672,-4.414321993592316
SBFG3,GRUPO SBF,"O Grupo SBF S.A. atua na comercialização de artigos esportivos e produtos de lazer no Brasil. A empresa oferece calçados, roupas, entretenimento em geral, equipamentos e acessórios. Também oferece aulas semanais gratuitas de Yoga e FitDance; promove diversos eventos e aulas esportivas gratuitas; atividades gratuitas, como aulas de diversas modalidades e eventos esportivos; e empréstimo de futebol, basquete, vôlei, raquetes e tapetes de ioga. A empresa comercializa seus produtos por meio de loja física, site e aplicativo das marcas Oxer, Nord e Adams, além das marcas das coleções Go Equal, Farm, Asics, Confederação Brasileira de Futebol (CBF). Além disso, atua na prestação de serviços logísticos; e negócios de comércio esportivo e produção de audiovisão. O Grupo SBF S.A. foi fundado em 1981 e está sediado em São Paulo, Brasil.",https://ri.gruposbf.com.br,Consumer Cyclical,Consumo Cíclico,7.875,0.79317343,0.111719996,0.0479,2611213231.8957596,11.34000015258789,Small Caps,50,1.4400000193762401,21.600000290643603,47.5,30.0,Baixo,,🟢,12.3100004196167,-7.879774443249059
