Ticker,Empresa,Resumo,Site,setor_original,Setor,PL,PVP,ROE,DivYield,MarketCap,Preco,Categoria,Score,LucroPorAcao,PrecoJusto,Desconto_%,Ranking,Risco,Risco_num,Farol,Preco_antigo,Variacao_%
CPFE3,CPFL ENERGIA ED,"A CPFL Energia S.A., por meio de suas subsidiárias, atua como empresa de energia no Brasil. Atua nos segmentos de Distribuição, Geração, Transmissão, Comercialização e Serviços. A empresa gera eletricidade por meio de fontes hidrelétricas, solares, eólicas e de biomassa; e presta serviços de gestão e comercialização de energia, eficiência energética, geração distribuída, infraestrutura energética e consultoria. Também atua na construção, operação e manutenção de instalações de transmissão de energia elétrica. Em 31 de dezembro de 2024, a rede de distribuição da empresa era composta por 345.785 quilômetros de linhas de distribuição, incluindo 530.081 transformadores de distribuição, bem como 12.174 quilômetros de linhas de distribuição de alta tensão; e 594 subestações transformadoras de alta e média tensão com capacidade total de transformação de 20.363 MVA. Atendeu 10,7 milhões de clientes dos setores residencial, comercial e industrial em 687 municípios. A empresa foi fundada em 1912 e está sediada em Campinas, Brasil. A CPFL Energia S.A. é uma subsidiária da State Grid Brazil Power Participações S.A.",https://www.cpfl.com.br,Utilities,Utilidades Públicas,10.449579,2.548417,0.25354,0.075,57313137779.62082,49.7400016784668,Blue Chips,50,4.7600005395879394,71.4000080938191,30.34,48.0,Baixo,,🟢,49.869998931884766,-0.2606722602812289
TTEN3,3TENTOS,"A Três Tentos Agroindustrial S/A, em conjunto com suas subsidiárias, atua no setor do agronegócio. Atua por meio de três segmentos: Insumos, Grãos e Industrial. A empresa comercializa e distribui produtos agrícolas, incluindo produtos para proteção e nutrição de cultivos e sementes para soja, milho e trigo. Também se dedica ao armazenamento, comercialização e comércio de produtos agrícolas; e atividades de industrialização de grãos. Além disso, a empresa oferece soluções de digitalização que incluem o 3tentos, aplicativo com foco na comodidade e gestão do produtor rural; App 3tentos + Nota Fiscal Eletrônica; certificado digital; Portal do Parceiro, possibilita certificado digital do agricultor para uso no App 3tentos e consulta relatórios e informações para o manejo da lavoura; e Terra3, plataforma de monitoramento agronômico remoto. Além disso, oferece serviços de assistência técnica. A empresa opera na África, América Central, América do Sul, América do Norte, Ásia e Europa. A Três Tentos Agroindustrial S/A foi fundada em 1954 e está sediada em Santa Bárbara do Sul, Brasil.",https://www.3tentos.com.br,Basic Materials,Materiais Básicos,10.534161,1.8044472,0.18494,0.022000000000000002,8478141523.456627,16.959999084472656,Small Caps,20,1.6099999880837836,24.149999821256756,29.77,20.0,Baixo,,🟢,15.84000015258789,7.070700259442761
CURY3,CURY S/A,"A Cury Construtora e Incorporadora S.A. atua no ramo imobiliário no Brasil. A empresa atua na venda de unidades imobiliárias; serviços de análise de crédito; empreendimentos imobiliários residenciais; aluguel de imóveis próprios; e prestação de serviços relativos a construção, fiscalização, estudos e projetos, além da execução de quaisquer obras de construção e engenharia civil. Também presta serviços de construção, administração, administração imobiliária e instalações elétricas e hidráulicas. A empresa foi fundada em 1963 e está sediada em São Paulo, Brasil.",https://cury.net,Real Estate,Imobiliário,10.563758,7.018952,0.7277,0.16920000000000002,9697338118.107002,31.479999542236328,Small Caps,35,2.9800000664759954,44.70000099713993,29.57,38.0,Baixo,,🟢,36.77999877929688,-14.410003841663729
VIVA3,VIVARA S.A.,"A Vivara Participações S.A. atua na fabricação e comercialização de joias e outros artigos na América Latina. A empresa oferece produtos de joalheria, incluindo anéis, colares, alianças, brinquedos, solitários, brincos, correntes, correntes, pingentes e pulseiras. Também fornece relógios; acessórios, como óculos de sol, carteiras e porta-cartões, porta-passaportes e relógios, porta-joias, perfumes, abotoaduras, chaveiros, canetas e facas; e produtos para presente que incluem kits para presentear, quiz, formatura, infantil, mãe/avó e produtos customizáveis. A empresa vende seus produtos sob as marcas Vivara, Tag Heuer, Victorinox, Movado, Baume and Mercier, Bulova, Akium, Lacoste, Calvin Klein, Hugo Boss, Tommy Hilfiger, Olivia Burton, Festina, Adidas, Life By Vivara, Guess. Marcas Nautica, Porsche Design, Montblanc e Festina. Oferece seus produtos por meio de lojas e quiosques, bem como por meio de e-commerce. A Vivara Participações S.A. foi fundada em 1962 e está sediada em São Paulo, Brasil.",https://www.vivara.com.br,Consumer Cyclical,Consumo Cíclico,10.708333,2.2529488,0.22749001,0.051,6645480317.657337,28.270000457763672,Small Caps,35,2.640000124927351,39.60000187391026,28.61,32.0,Baixo,,🟢,29.670000076293945,-4.718569649242637
CEBR5,CEB A ED,"A Companhia Energética de Brasília - CEB, por meio de suas subsidiárias, gera e distribui energia elétrica e gás no Brasil. A empresa atua nos segmentos de Geração de Energia, Comercialização de Energia Elétrica, Iluminação Pública e Outros. A empresa produz energia elétrica a partir de usinas hidráulicas; distribui gás canalizado; serviços de iluminação pública; e fornece serviços de manutenção e expansão. Atua também na prestação de serviços de elaboração de estudos; projetos de engenharia; execução de obras de implantação, ampliação, reforma ou manutenção de redes aéreas e subterrâneas de transmissão e distribuição de energia elétrica; e instalação de sistemas de iluminação pública e elétrica predial. A empresa era anteriormente conhecida como Companhia de Eletricidade de Brasília e mudou seu nome para Companhia Energética de Brasília CEB em 1992. A Companhia Energética de Brasília CEB foi fundada em 1968 e está sediada em Brasília, Brasil.",https://www.ceb.com.br,Utilities,Utilidades Públicas,11.052631,2.1513002,0.18968001,0.1444,1967836224.5058632,27.299999237060547,Small Caps,35,2.4700000603531005,37.05000090529651,26.32,32.0,Baixo,,🟢,30.06999969482422,-9.211840658051143
BMEB4,MERCANTIL,"O Banco Mercantil do Brasil S.A., em conjunto com suas subsidiárias, presta serviços financeiros a clientes pessoas físicas e jurídicas no Brasil. Atua nos segmentos Financeiro, de Seguros e Intermediação Empresarial, Marketplace e Outros. A empresa oferece produtos de Conta Corrente, Empréstimos, Cartões, Investimentos, Cartões a Receber, Cheque Especial, Previdência Privada, Transferência de Benefícios, Limite Especial e Mercado de Capitais. Também oferece internet, WhatsApp, aplicativo Mercantil e serviços bancários de autoatendimento. Além disso, a empresa atua em atividades imobiliárias, securitização e tecnologia. A empresa era anteriormente conhecida como Banco Industrial de Minas Gerais e mudou seu nome para Banco Mercantil do Brasil S.A. em 1974. O Banco Mercantil do Brasil S.A. foi fundado em 1940 e está sediado em Belo Horizonte, Brasil.",https://bancomercantil.com.br,Financial Services,Serviços Financeiros,11.105829,3.2984107,0.30315,0.0256,8933955375.491516,72.41000366210938,Small Caps,20,6.519999872329151,97.79999808493726,25.96,26.0,Médio,,🟡,87.25,-17.008591791278654
REDE3,REDE ENERGIA,"A Rede Energia Participações S.A. atua na geração, distribuição e comercialização de energia elétrica no Brasil. A empresa atua na construção, operação, manutenção e serviços relacionados à geração e distribuição de energia elétrica. Oferece eletricidade a clientes residenciais, industriais, comerciais, rurais, governamentais e do setor público. A empresa foi constituída em 1929 e está sediada em Cataguases, Brasil.",https://www.energisa.com.br,Utilities,Utilidades Públicas,11.196428,2.6016595,0.25566998,0.0725,16102640529.545391,6.269999980926514,Mid Caps,50,0.5600000268770106,8.400000403155158,25.36,44.0,Baixo,,🟢,6.289999961853027,-0.31796472254066116
MOVI3,MOVIDA,"A Movida Participações S.A. presta serviços de aluguel de automóveis no Brasil. Atua em dois segmentos, Rent-a-Car e Gestão e Terceirização de Frotas (GTF). A empresa oferece serviços de aluguel de veículos leves; e serviços de gestão e terceirização de frotas. Também vende carros usados. A empresa era anteriormente conhecida como H.L.C.S.P.E Empreendimentos e Participações S.A. e mudou seu nome para Movida Participações S.A. em dezembro de 2014. A empresa foi fundada em 2006 e tem sede em São Paulo, Brasil. A Movida Participações S.A. atua como subsidiária da Simpar S.A.",https://ri.movida.com.br,Industrials,Indústria,11.52381,1.3826991,0.12866999,0.0756,4157260099.463539,12.100000381469727,Small Caps,40,1.0499999897143155,15.749999845714733,23.17,26.0,Baixo,,🟢,12.93000030517578,-6.4191794595225975
ENGI4,ENERGISA,"A Energisa S.A., por meio de suas subsidiárias, atua na geração, transmissão e distribuição de energia elétrica no Brasil. A empresa gera eletricidade por meio de projetos hidráulicos, solares e eólicos. Também fornece gás natural para empresas e gás natural veicular, bem como serviços de valor agregado. Além disso, a empresa desenvolve atividades de inspeção termográfica aérea e corretagem de seguros. A empresa foi fundada em 1905 e está sediada em Cataguases, Brasil. A Energisa S.A. atua como subsidiária da Gipar S.A.",https://www.energisa.com.br,Utilities,Utilidades Públicas,11.689655,0.18410906,0.14495,0.0644,25572661554.2026,10.170000076293945,Mid Caps,55,0.8700000193584794,13.050000290377191,22.07,38.0,Baixo,,🟢,10.399999618530272,-2.2115341410832654
FIQE3,UNIFIQUE,"A Unifique Telecomunicações S.A. fornece serviços de telecomunicações no Brasil. A empresa oferece armazenamento de dados, hospedagem de dados e serviços de Internet. Também fornece serviços de comunicação multimídia SCM; acesso a redes de comunicação, portais, provedores de conteúdo e serviços de informação na Internet; TV paga via satélite, cabo e micro-ondas; e serviços de hospedagem de internet e telefonia fixa comutada. Além disso, a empresa atua no comércio varejista de hospedagem de internet e telefonia fixa comutada; equipamentos e suprimentos para informática e telefonia móvel; publicação de livros e venda a retalho de livros; e planos de saúde. A Unifique Telecomunicações S.A. foi constituída em 1997 e está sediada em Timbó, Brasil.",https://unifique.com.br,Communication Services,Comunicação,11.915256,2.4477718,0.18061,0.1234,2736262693.012979,7.03000020980835,Small Caps,35,0.5899999303253199,8.8499989548798,20.56,32.0,Baixo,,🟢,5.510000228881836,27.586205404477322
CEBR3,CEB ED,"A Companhia Energética de Brasília - CEB, por meio de suas subsidiárias, gera e distribui energia elétrica e gás no Brasil. A empresa atua nos segmentos de Geração de Energia, Comercialização de Energia Elétrica, Iluminação Pública e Outros. A empresa produz energia elétrica a partir de usinas hidráulicas; distribui gás canalizado; serviços de iluminação pública; e fornece serviços de manutenção e expansão. Atua também na prestação de serviços de elaboração de estudos; projetos de engenharia; execução de obras de implantação, ampliação, reforma ou manutenção de redes aéreas e subterrâneas de transmissão e distribuição de energia elétrica; e instalação de sistemas de iluminação pública e elétrica predial. A empresa era anteriormente conhecida como Companhia de Eletricidade de Brasília e mudou seu nome para Companhia Energética de Brasília CEB em 1992. A Companhia Energética de Brasília CEB foi fundada em 1968 e está sediada em Brasília, Brasil.",https://www.ceb.com.br,Utilities,Utilidades Públicas,12.012146,2.3380616,0.18968001,0.1328,2138670423.5494137,29.670000076293945,Small Caps,35,2.4699999547369758,37.049999321054635,19.92,32.0,Baixo,,🟢,31.520000457763672,-5.8692904651086515
CEBR6,CEB B ED,"A Companhia Energética de Brasília - CEB, por meio de suas subsidiárias, gera e distribui energia elétrica e gás no Brasil. A empresa atua nos segmentos de Geração de Energia, Comercialização de Energia Elétrica, Iluminação Pública e Outros. A empresa produz energia elétrica a partir de usinas hidráulicas; distribui gás canalizado; serviços de iluminação pública; e fornece serviços de manutenção e expansão. Atua também na prestação de serviços de elaboração de estudos; projetos de engenharia; execução de obras de implantação, ampliação, reforma ou manutenção de redes aéreas e subterrâneas de transmissão e distribuição de energia elétrica; e instalação de sistemas de iluminação pública e elétrica predial. A empresa era anteriormente conhecida como Companhia de Eletricidade de Brasília e mudou seu nome para Companhia Energética de Brasília CEB em 1992. A Companhia Energética de Brasília CEB foi fundada em 1968 e está sediada em Brasília, Brasil.",https://www.ceb.com.br,Utilities,Utilidades Públicas,12.226721,2.3798268,0.18968001,0.1435,2176873887.994137,30.200000762939453,Small Caps,35,2.469999991243724,37.04999986865586,18.49,32.0,Baixo,,🟢,31.200000762939453,-3.205128126752606
CXSE3,CAIXA SEGURI ED,"A Caixa Seguridade Participações S.A., em conjunto com suas subsidiárias, oferece produtos de seguros no Brasil e internacionalmente. A empresa atua em três segmentos: Escoamento/Mar Aberto, Segurança e Distribuição. Oferece produtos de seguros de vida, residencial e habitacional, acidentes pessoais e isenção de dívidas para pessoas físicas; e produtos de seguros de vida, residenciais e habitacionais, automóveis e credores para empresas. A empresa também oferece seguridade social, incluindo planos de previdência privada e corporativa; capitalização; consórcio; e corretagem e intermediação de produtos de segurança. Além disso, atua na aquisição de participação societária ou holding; administração, comercialização e prestação de planos privados de saúde e odontológicos; estruturação, administração e comercialização de cartas de crédito; e operações de resseguro e retrocessão. A empresa foi constituída em 2015 e está sediada em Brasília, Brasil. A Caixa Seguridade Participações S.A. atua como subsidiária da Caixa Econômica Federal.",https://www.caixaseguridade.com.br,Financial Services,Serviços Financeiros,12.3076935,3.8963914,0.32463002,0.0755,52800001144.40918,17.600000381469727,Blue Chips,50,1.4299998924631758,21.449998386947637,17.95,44.0,Baixo,,🟢,18.06999969482422,-2.6009923701831266
BPAC5,BTGP BANCO A,"O Banco BTG Pactual S.A. fornece produtos e serviços financeiros relativos a carteiras comerciais, de investimentos, de crédito, de financiamento, de arrendamento mercantil, de seguros e de câmbio no Brasil e internacionalmente. A empresa também oferece serviços de investimento pessoal para uma carteira de investimentos customizada; serviços de contas bancárias internacionais, incluindo cartão de débito, transferência, pagamento e recebimento, e serviços de suporte ao cliente. Também fornece serviços de gestão de patrimônio, como execução, pesquisa de mercado, recursos e análises educacionais e gestão de relacionamento; gestão do patrimônio familiar; contas correntes e de poupança, certificados de depósito, contas de aposentadoria e contas do mercado monetário; financiamento imobiliário; bem como empréstimos corporativos, empréstimos a prazo, linhas de crédito e financiamento de credores. O Banco BTG Pactual S.A. foi fundado em 1983 e está sediado no Rio de Janeiro, Brasil. O Banco BTG Pactual S.A. opera como subsidiária do BTG Pactual Holding Financeira Ltda.",https://www.btgpactual.com,Financial Services,Serviços Financeiros,12.478571,1.2015957,0.23868,0.0277,202436319058.40897,17.469999313354492,Blue Chips,60,1.399999993056456,20.99999989584684,16.81,38.0,Baixo,,🟢,11.380000114440918,53.51493091098942
UGPA3,ULTRAPAR,"A Ultrapar Participações S.A., por meio de suas subsidiárias, atua nos setores de energia, mobilidade e infraestrutura logística no Brasil, no resto da Europa, nos Estados Unidos, no Canadá, em outros países da América Latina, na Oceania e internacionalmente. Atua nos segmentos Ultragaz, Ipiranga, Ultracargo e Hidrovias. A empresa distribui e vende produtos derivados de petróleo, biocombustíveis, gasolina, etanol, diesel, óleo combustível, querosene, gás natural para veículos e combustíveis aditivos sob a marca Ipimax para transportadoras, revendedores e varejistas; opera postos de abastecimento da marca Ipiranga e lojas de conveniência da marca AmPm; e produz e vende lubrificantes sob a marca ICONIC. Atua também na distribuição de gás liquefeito de petróleo a granel e envasado para os setores residencial, condominial, comércio, serviços, industrial e agronegócio; operação de rede de gasodutos de gás natural; e fornecimento de eletricidade renovável para empresas e residências, bem como gás natural comprimido e biometano para clientes corporativos. Além disso, a empresa opera terminais de armazenamento de granéis líquidos em centros logísticos; infraestrutura hidroviária e multimodal; e operações portuárias. Além disso, a empresa oferece soluções logísticas para movimentação de grãos, minérios e fertilizantes; serviços automotivos através das unidades Jet Oil; e programas de fidelidade da marca Km de Vantagens (KMV). Também exporta seus produtos e serviços. A Ultrapar Participações S.A. foi fundada em 1937 e está sediada em São Paulo, Brasil.",https://www.ultra.com.br,Energy,Energia,12.676597,2.0321987,0.16381,0.059000000000000004,31838579411.495705,29.790000915527344,Mid Caps,50,2.3499998395095583,35.249997592643375,15.49,32.0,Baixo,,🟢,27.229999542236328,9.401400720996007
ENMT4,ENERGISA MT,"Energisa Mato Grosso - Distribuidora de Energia S/A operates as an electricity distributor in Mato Grosso. The company was formerly known as Centrais Elétricas Matogrossenses and changed its name to Energisa Mato Grosso - Distribuidora de Energia S/A in February 2015. The company was founded in 1905 and is headquartered in Cuiabá, Brazil. Energisa Mato Grosso - Distribuidora de Energia S/A is a subsidiary of Rede Energia Participações S.A.",https://www.energisa.com.br,Utilities,Utilidades Públicas,12.721926,2.6489255,0.21270001,0.0641,10417257858.514664,47.58000183105469,Mid Caps,50,3.7399998892506283,56.09999833875943,15.19,44.0,Baixo,,🟢,52.0,-8.499996478740986
ENMT3,ENERGISA MT,"Energisa Mato Grosso - Distribuidora de Energia S/A operates as an electricity distributor in Mato Grosso. The company was formerly known as Centrais Elétricas Matogrossenses and changed its name to Energisa Mato Grosso - Distribuidora de Energia S/A in February 2015. The company was founded in 1905 and is headquartered in Cuiabá, Brazil. Energisa Mato Grosso - Distribuidora de Energia S/A is a subsidiary of Rede Energia Participações S.A.",https://www.energisa.com.br,Utilities,Utilidades Públicas,12.863271,2.6711948,0.21270001,0.0635,10504834132.996334,47.97999954223633,Mid Caps,50,3.72999989988832,55.9499984983248,14.24,40.0,Baixo,,🟢,50.0,-4.040000915527344
VAMO3,VAMOS,"A Vamos Locação de Caminhões, Máquinas e Equipamentos S.A., em conjunto com suas subsidiárias, atua na locação, revenda e venda de caminhões, máquinas, equipamentos e peças no Brasil. A empresa aluga tratores, empilhadeiras, máquinas e implementos agrícolas, ônibus e outros veículos; vende peças e acessórios automotivos; comercializa tratores, máquinas, pneus, câmaras de ar, implementos, veículos automotores e ônibus novos e usados; e presta serviços de manutenção e reparação de automóveis, assistência técnica e serviços correlatos, bem como atua na logística e no transporte rodoviário de cargas. Oferece também construção civil, peças, lubrificantes, prestação de serviços de reparação e manutenção de veículos e similares, transporte rodoviário de cargas em geral, comércio atacadista de máquinas, aparelhos e equipamentos para uso agrícola, partes e peças, e atividades de intermediação e agenciamento de serviços e negócios em geral, exceto imobiliário; representantes comerciais e agentes do comércio de veículos automotores. Além disso, a empresa comercializa fertilizantes, herbicidas e sementes; e presta serviços de engenharia relacionados à customização de caminhões e ônibus, bem como à prestação de atividades agrícolas. Além disso, a empresa fabrica e vende reboques de caminhões, carrocerias de caminhões, implementos rodoviários, cabines e máquinas e equipamentos industriais; e realiza instalação, reforma, reparo e manutenção de equipamentos e veículos; prestação de serviços de logística e transporte rodoviário de cargas; serviços de tecnologia da informação; análises técnicas de veículos automotores; serviços de operador de empilhadeira; e terceirização e gestão de recursos humanos. A Vamos Locação de Caminhões, Máquinas e Equipamentos S.A. foi constituída em 2015 e está sediada em São Paulo, Brasil. A Vamos Locação de Caminhões, Máquinas e Equipamentos S.A. é uma subsidiária da SIMPAR S.A.",https://grupovamos.com.br,Industrials,Indústria,12.935485,1.6687474,0.13136,0.0354,4825861754.729385,4.010000228881836,Small Caps,0,0.3099999906367512,4.649999859551269,13.76,10.0,Baixo,,🟢,4.079999923706055,-1.7156788267935739
MULT3,MULTIPLAN,"A Multiplan Empreendimentos Imobiliários S.A. atua no planejamento, implantação, desenvolvimento e comercialização de empreendimentos imobiliários no Brasil. A empresa desenvolve imóveis residenciais ou comerciais, inclusive shoppings urbanos. Atua também na compra e venda de imóveis, bem como na aquisição e alienação de direitos imobiliários, e na sua operação através de locação. Além disso, a empresa presta serviços de gestão e administração de shopping centers próprios ou de terceiros; serviços de assessoria e suporte técnico relacionados a questões imobiliárias; e construção civil, execução de obras e serviços de engenharia e correlatos. Além disso, atua no planejamento, desenvolvimento, gestão, promoção e intermediação de projetos imobiliários; importação e exportação de bens e serviços relacionados às suas atividades; geração de energia elétrica; serviços de fabricação e estacionamento de veículos; serviços de entretenimento; administrar e operar teatros; e serviços de administração e promoção. Adicionalmente, a empresa atua na promoção, organização, produção, agenciamento, programação e execução de eventos, shows e espetáculos esportivos, artísticos e culturais; administra eventos esportivos, artísticos e culturais; e aluguel de equipamentos de som, luz e quaisquer outros. A Multiplan Empreendimentos Imobiliários S.A. foi fundada em 1974 e está sediada no Rio de Janeiro, Brasil.",https://www.multiplan.com.br,Real Estate,Imobiliário,13.113359,2.516119,0.20018,0.0353,15884309249.598816,32.38999938964844,Mid Caps,35,2.4700002028197683,37.050003042296524,12.58,34.0,Baixo,,🟢,33.130001068115234,-2.233630107482805
TIMS3,TIM,"A TIM S.A. atua no setor de telecomunicações no Brasil. Oferece serviços de telefonia fixa comutada nas modalidades de longa distância local, nacional e internacional, bem como serviços de comunicação pessoal móvel e multimídia. A empresa está sediada no Rio de Janeiro, Brasil. A TIM S.A. é uma subsidiária da TIM Brasil Serviços e Participações S.A.",https://www.tim.com.br,Communication Services,Comunicação,13.730337,2.434748,0.17117001,0.0978,58379055065.366516,24.440000534057617,Blue Chips,50,1.7800000490925763,26.700000736388645,8.46,34.0,Baixo,,🟢,27.26000022888184,-10.344826379848838
ALPA3,ALPARGATAS,"A Alpargatas S.A. fabrica e comercializa calçados e acessórios no Brasil e no exterior. A empresa oferece seus produtos com as marcas Havaianas, ioasys e Rothys. A empresa era anteriormente conhecida como São Paulo Alpargatas S.A. e mudou seu nome para Alpargatas S.A. em 2010. A empresa foi fundada em 1907 e está sediada em São Paulo, Brasil.",https://www.alpargatas.com.br,Consumer Cyclical,Consumo Cíclico,14.151898,2.2797718,0.15432,0.044199999999999996,7581206191.501007,11.180000305175781,Small Caps,20,0.7900000625482025,11.850000938223038,5.65,22.0,Baixo,,🟢,11.020000457763672,1.4519041811780353
