Ticker,Empresa,Resumo,Site,setor_original,Setor,PL,PVP,ROE,DivYield,MarketCap,Preco,Categoria,Score,LucroPorAcao,PrecoJusto,Desconto_%,Ranking,Risco,Risco_num,Farol,Preco_antigo,Variacao_%
<<<<<<< HEAD
BSLI4,BRB BANCO,"O BRB - Banco de Brasília S.A. atua nas atividades de crédito, financiamento e investimento para clientes pessoas físicas e jurídicas no Brasil. A empresa envolvida na distribuição de valores mobiliários e gestão de fundos, cartões de crédito, seguros e prestação de outros serviços relacionados. A empresa era anteriormente conhecida como Banco regional de Brasília SA BRB e mudou seu nome para BRB - Banco de Brasília S.A. em janeiro de 1986. O BRB - Banco de Brasília S.A. foi constituído em 1964 e está sediado em Brasília, Brasil.",https://www.brb.com.br,Financial Services,Serviços Financeiros,1.9504951,0.4807223,0.25134,0.16219999999999998,2029948429.6808577,3.940000057220459,Small Caps,85,2.019999977041962,30.299999655629428,87.0,58.0,Baixo,,🟢,4.300000190734863,-8.37209575688137
BSLI3,BRB BANCO,"O BRB - Banco de Brasília S.A. atua nas atividades de crédito, financiamento e investimento para clientes pessoas físicas e jurídicas no Brasil. A empresa envolvida na distribuição de valores mobiliários e gestão de fundos, cartões de crédito, seguros e prestação de outros serviços relacionados. A empresa era anteriormente conhecida como Banco regional de Brasília SA BRB e mudou seu nome para BRB - Banco de Brasília S.A. em janeiro de 1986. O BRB - Banco de Brasília S.A. foi constituído em 1964 e está sediado em Brasília, Brasil.",https://www.brb.com.br,Financial Services,Serviços Financeiros,1.980198,0.48804295,0.25134,0.1456,1944724348.0,4.0,Small Caps,85,2.0200000202000004,30.300000303000004,86.8,58.0,Baixo,,🟢,4.789999961853027,-16.492692445605222
BNBR3,NORD BRASIL,"O Banco do Nordeste do Brasil S.A. atua como um banco de desenvolvimento regional na América Latina. Atua por meio dos segmentos Carteira Própria e FNE. A empresa oferece contas de poupança, depósitos à vista e a prazo e custódia de títulos; crédito especializado; crédito para infra-estruturas e microfinanciamento urbano e rural; e serviços de cobrança e cartões de crédito. Atua também na estruturação e distribuição de valores mobiliários, como debêntures, notas promissórias, certificados de recebíveis imobiliários, fundos de investimento; administração de recursos de terceiros, consistindo na administração de fundos de investimento; operações cambiais; gestão de carteira e análise de crédito; e transferências eletrônicas. Atende empresas corporativas, grandes, médias, pequenas e microempresas; agroindústria, produtores rurais e agricultura familiar; sectores de microfinanças urbanas e rurais; entidades representativas; indivíduos; e instituições da administração pública direta e indireta. A empresa atua por meio de pontos de atendimento físicos, incluindo agências e unidades de microcrédito. O Banco do Nordeste do Brasil S.A. foi fundado em 1952 e está sediado em Fortaleza, Brasil.",https://www.bnb.gov.br,Financial Services,Serviços Financeiros,3.8892446,0.7464154,0.20545,0.0567,11992019625.0,121.5,Mid Caps,100,31.239999664716382,468.59999497074574,74.07,58.0,Baixo,,🟢,119.75,1.4613778705636742
BAZA3,AMAZIA,"O Banco da Amazônia S.A. fornece produtos e serviços bancários na região amazônica do Brasil. A empresa oferece contas poupança, corrente, simplificada e salário; cartões de crédito; produtos de capitalização; vários empréstimos pessoais e empresariais; planos de pensões; fundos de investimento, certificados de depósitos bancários e recibos de depósitos e cartas de crédito do agronegócio; produtos de seguros; e débito direto e serviços financeiros online. Também oferece programas de financiamento para agricultura familiar, máquinas e equipamentos, atividades rurais e de biodiversidade, caminhões, energia verde, negócios e infraestrutura verdes e investimentos rurais e não rurais, bem como atividades de ciência, tecnologia e inovação; fundo de desenvolvimento e marinha mercante; capital de giro; comércio exterior; e serviços de poupança para pessoas jurídicas, cobrança, adiantamento de cartão, cheque comercial, débito automático, mensagens de celular e domicílio bancário. A empresa foi fundada em 1942 e está sediada em Belém, Brasil.",https://www.bancoamazonia.com.br,Financial Services,Serviços Financeiros,3.9498327,0.6363195,0.15239,0.09699999999999999,4634340798.40416,82.66999816894531,Small Caps,85,20.929999938717735,313.949999080766,73.67,52.0,Baixo,,🟢,85.54000091552734,-3.355158657779561
SUZB3,SUZANO S.A. ATZ,"A Suzano S.A. fabrica e comercializa produtos de celulose e papel no Brasil e internacionalmente. Atua em dois segmentos, Celulose e Papel. A empresa oferece papéis de impressão e escrita revestidos e não revestidos, cartões, papéis tissue e celuloses de mercado e fluff. Também se dedica à pesquisa, desenvolvimento e produção de biocombustíveis; operação de terminais portuários; atividades de pesquisa e desenvolvimento em biotecnologia e polpas nanocristalinas; negócios de geração e distribuição de energia; atividades de transporte rodoviário de cargas; comercialização de equipamentos e peças; pesquisa e desenvolvimento de lignina; industrialização e comercialização de produtos de celulose, microfibras celulósicas, papel e papelão; e industrialização, comercialização e exportação de produtos de celulose. Além disso, a empresa está envolvida em atividades de escritório comercial, capital de risco corporativo e captação de recursos financeiros; produção de bens de consumo através de líquidos à base de celulose; desenvolvimento e produção de fibras, fios e filamentos têxteis à base de celulose; restauração, conservação e preservação de florestas; e pesquisa de matérias-primas para a indústria têxtil. A empresa era anteriormente conhecida como Suzano Papel e Celulose S.A. e mudou seu nome para Suzano S.A. em abril de 2019. A empresa foi fundada em 1924 e está sediada em Salvador, Brasil.",https://www.suzano.com.br,Basic Materials,Materiais Básicos,4.363552,1.3306439,0.35192,0.023799999999999998,58306686151.13907,47.16999816894531,Blue Chips,85,10.810000240387948,162.15000360581922,70.91,46.0,Baixo,,🟢,55.81999969482422,-15.496240725850377
JHSF3,JHSF PART ED,"A JHSF Participações S.A., em conjunto com suas subsidiárias, atua no ramo imobiliário no Brasil e internacionalmente. Atua por meio de cinco segmentos: Renda Recorrente; Negócios Imobiliários; Aeroporto, Hotéis e Restaurantes; e Segurando. A empresa atua na construção e operação de shopping centers; compra e venda de imóveis residenciais e comerciais; varejo de artigos de moda; locação de imóveis comerciais; e desenvolvimento e operação de hotéis, atividades turísticas, hotelaria e gastronomia, incluindo bares, cafés e restaurantes. Também se dedica à prestação de serviços de gestão; e soluções de financiamento, serviços e investimentos imobiliários. A JHSF Participações S.A. foi fundada em 1972 e está sediada em São Paulo, Brasil.",https://jhsf.com.br,Real Estate,Imobiliário,4.4476533,1.3054996,0.28806,0.06570000000000001,8238533570.165245,12.319999694824219,Small Caps,85,2.770000012101712,41.55000018152568,70.35,52.0,Baixo,,🟢,9.260000228881836,33.04534978733887
BRSR6,BANRISUL B,"O Banco do Estado do Rio Grande do Sul S.A., um banco múltiplo, oferece uma gama de produtos e serviços bancários principalmente no Brasil. A empresa atua em atividades bancárias de varejo, empréstimos, financiamento e investimento, empréstimos hipotecários, desenvolvimento, carteira de arrendamento e câmbio. Também oferece corretagem de valores mobiliários, grupos de consórcios, soluções para o setor de pagamentos, seguros e produtos de previdência e títulos de capitalização. O Banco do Estado do Rio Grande do Sul S.A. foi constituído em 1928 e está sediado em Porto Alegre, Brasil.",https://www.banrisul.com.br,Financial Services,Serviços Financeiros,4.4940333,0.6719001,0.1567,0.0495,7700989370.707724,18.829999923706055,Small Caps,70,4.190000088273947,62.8500013241092,70.04,46.0,Baixo,,🟢,18.030000686645508,4.437044961695935
BRSR5,BANRISUL A,"O Banco do Estado do Rio Grande do Sul S.A., um banco múltiplo, oferece uma gama de produtos e serviços bancários principalmente no Brasil. A empresa atua em atividades bancárias de varejo, empréstimos, financiamento e investimento, empréstimos hipotecários, desenvolvimento, carteira de arrendamento e câmbio. Também oferece corretagem de valores mobiliários, grupos de consórcios, soluções para o setor de pagamentos, seguros e produtos de previdência e títulos de capitalização. O Banco do Estado do Rio Grande do Sul S.A. foi constituído em 1928 e está sediado em Porto Alegre, Brasil.",https://www.banrisul.com.br,Financial Services,Serviços Financeiros,4.534606,0.6779661,0.1567,0.049800000000000004,7770515063.0,19.0,Small Caps,70,4.19000018965264,62.8500028447896,69.77,46.0,Baixo,,🟢,18.790000915527344,1.117610826187459
BRSR3,BANRISUL,"O Banco do Estado do Rio Grande do Sul S.A., um banco múltiplo, oferece uma gama de produtos e serviços bancários principalmente no Brasil. A empresa atua em atividades bancárias de varejo, empréstimos, financiamento e investimento, empréstimos hipotecários, desenvolvimento, carteira de arrendamento e câmbio. Também oferece corretagem de valores mobiliários, grupos de consórcios, soluções para o setor de pagamentos, seguros e produtos de previdência e títulos de capitalização. O Banco do Estado do Rio Grande do Sul S.A. foi constituído em 1928 e está sediado em Porto Alegre, Brasil.",https://www.banrisul.com.br,Financial Services,Serviços Financeiros,4.6300716,0.69223905,0.1567,0.0473,7934104697.788618,19.399999618530273,Small Caps,70,4.189999916746487,62.849998751197305,69.13,46.0,Baixo,,🟢,18.799999237060547,3.1914915203131624
AZZA3,AZZAS 2154,"A Azzas 2154 S.A. atua no desenvolvimento e comercialização de calçados, bolsas, acessórios e confecções femininos, masculinos e infantis no Brasil e no exterior. Oferece seus produtos por meio de lojas franqueadas, lojas próprias e canal de web commerce das marcas Arezzo, Schutz, Anacapri, Alexandre Birman, Alme, Vans, Reserva, Reserva Mini, Reserva INK, Reserva Go, Oficina Reserva, Brizza, Troc, Baw, Carol Bassi, ZZMALL, Reversa, Simples Reserva, Paris Texas, Vicenza, Animale, Farm, Farm Global, Fabula, Foxton, Cris Barros, Off Premium, Maria Filo, NV, Marcas Hering e Dzarm. A empresa era anteriormente conhecida como Arezzo Indústria e Comércio S.A. e mudou seu nome para Azzas 2154 S.A. em julho de 2024. Azzas 2154 S.A. foi fundada em 1972 e está sediada em Belo Horizonte, Brasil.",https://ri.azzas2154.com.br,Consumer Cyclical,Consumo Cíclico,4.9232507,0.552068,0.11609,0.11900000000000001,4405027728.824862,21.809999465942383,Small Caps,65,4.42999976944956,66.44999654174339,67.18,40.0,Baixo,,🟢,27.520000457763672,-20.748549770501327
EVEN3,EVEN,"A Even Construtora e Incorporadora S.A. atua como incorporadora e construtora imobiliária no Brasil. A empresa desenvolve e comercializa projetos residenciais, hotéis e centros de arte. Também está envolvida na prospecção de terrenos; incorporação e venda imobiliária; operação do portal da corretora; e atividades de construção de projetos. A empresa foi fundada em 1974 e está sediada em São Paulo, Brasil.",https://www.even.com.br,Real Estate,Imobiliário,5.028169,0.7442927,0.14028,0.10640000000000001,1398133153.9356136,7.139999866485596,Small Caps,65,1.419999977424306,21.299999661364588,66.48,40.0,Baixo,,🟢,7.710000038146973,-7.392998298847885
ABCB4,ABC BRASIL,"O Banco ABC Brasil S.A., um banco comercial, fornece diversos produtos e serviços financeiros para médias e grandes empresas no Brasil. A empresa oferece conta corrente; produtos de crédito e financiamento, como capital de giro, rotativo, recebíveis, antecipação a fornecedores, empréstimo consignado para empregados, sobre empréstimos em moeda estrangeira e empréstimos em moeda estrangeira, bem como para agronegócio, comércio exterior, transferências do fundo de defesa da economia cafeeira e imóveis; questões de garantias, tais como garantia de pagamento emitida, garantia de execução emitida, garantia judicial emitida, carta de crédito stand-by, confirmação de cartas de crédito de exportação, garantia de oferta, garantia de execução e carta de crédito de importação; derivativos, como contratos a termo de não entrega, prazo de mercadorias, swap e opções; serviços de câmbio para exportação e importação de câmbio, câmbio à vista de adiantamentos sobre câmbios entregues e câmbio à vista financeiro de remessas; cédulas de crédito do agronegócio e imobiliário, certificado de depósito bancário, fundos de investimento, certificado de operações estruturadas e debêntures. Também fornece serviços de investimentos em operações de fusões e aquisições, mercado de capitais e financiamento de projetos. Além disso, a empresa oferece produtos de seguros, como seguros de vida, seguros de vida e seguros de propriedades e acidentes; e atua como comercializadora de energia. A empresa era anteriormente conhecida como Banco Roma de Investimentos e mudou seu nome para Banco ABC Brasil S.A. em 1997. A empresa foi constituída em 1983 e está sediada em São Paulo, Brasil. O Banco ABC Brasil S.A. é uma subsidiária da Marsau Uruguai Holdings SA.",https://www.abcbrasil.com.br,Financial Services,Serviços Financeiros,5.054206,0.96485287,0.15463,0.1133,6527372694.445473,27.040000915527344,Small Caps,85,5.349999765646146,80.24999648469219,66.31,52.0,Baixo,,🟢,26.959999084472656,0.2967427068673892
TRIS3,TRISUL,"A Trisul S.A. atua na construção e incorporação de imóveis no Brasil. A empresa atua no loteamento de terrenos; e compra e venda de imóveis. Também desenvolve projetos imobiliários com participação acionária de terceiros. A Trisul S.A. foi fundada em 2007 e está sediada em São Paulo, Brasil.",https://www.trisul-sa.com.br,Real Estate,Imobiliário,5.3027525,0.93120676,0.14368,0.18719999999999998,1350551878.1037111,5.78000020980835,Small Caps,65,1.0899999971351386,16.34999995702708,64.65,40.0,Baixo,,🟢,6.900000095367432,-16.231882175060186
VTRU3,VITRUEDUCA,"A Vitru Educação S.A., em conjunto com suas subsidiárias, presta serviços educacionais no Brasil. Oferece cursos de graduação, pós-graduação e técnicos e profissionalizantes a distância e presenciais, além de serviços de educação digital sob as marcas Uniasselvi e UniCesumar. A empresa era anteriormente conhecida como Vitru Brasil Empreendimentos, Participações e Comércio S.A. e mudou seu nome para Vitru Educação S.A. em dezembro de 2025. A empresa foi constituída em 2014 e está sediada em São Paulo, Brasil.",https://www.vitru.com.br/pt_BR,Consumer Defensive,Consumo Defensivo,5.529412,0.6441003,0.1349,0.19,1884500695.7843933,14.100000381469727,Small Caps,65,2.5499999604785692,38.249999407178535,63.14,40.0,Baixo,,🟢,14.15999984741211,-0.4237250465320333
GMAT3,GRUPO MATEUS,"O Grupo Mateus S.A. opera uma rede de supermercados no Brasil. Atua no atacado, móveis e eletrodomésticos, e-commerce, indústria de panificação e central de fatiamento e porcionamento. A empresa foi fundada em 1986 e está sediada em São Luís, Brasil.",https://www.grupomateus.com.br,Consumer Cyclical,Consumo Cíclico,5.5975614,0.99221796,0.17944999,0.0546,10557218935.939415,4.590000152587891,Mid Caps,100,0.8199999650897783,12.299999476346676,62.68,52.0,Baixo,,🟢,5.460000038146973,-15.934063726753097
CEEB5,COELBA A,"Companhia de Eletricidade do Estado da Bahia - COELBA engages in the distribution of electricity. The company was founded in 1960 and is headquartered in Salvador, Brazil. Companhia de Eletricidade do Estado da Bahia - COELBA operates as a subsidiary of Iberdrola, S.A.",https://www.coelba.com.br,Utilities,Utilidades Públicas,6.0165973,1.4527602,0.25589,0.046,11401179784.5,43.5,Mid Caps,85,7.230000252800699,108.45000379201049,59.89,52.0,Baixo,,🟢,38.0,14.473684210526317
CYRE3,CYRELA REALT,"Cyrela Brazil Realty S.A. Empreendimentos e Participações atua na incorporação e construção de imóveis residenciais no Brasil. Também presta serviços imobiliários, incluindo gestão de obras e serviços de consultoria técnica. Cyrela Brazil Realty S.A. Empreendimentos e Participações foi fundada em 1962 e está sediada em São Paulo, Brasil.",https://www.cyrela.com.br,Consumer Cyclical,Consumo Cíclico,6.050328,0.9903295,0.22374001,0.1366,10129490400.999765,27.649999618530273,Mid Caps,100,4.570000108842078,68.55000163263117,59.66,64.0,Baixo,,🟢,29.0,-4.655173729205954
BMGB4,BANCO BMG,"O Banco BMG S.A. fornece produtos e serviços comerciais e de crédito, financiamento e investimento principalmente no Brasil. A empresa oferece contas digitais; cartão de crédito conta digital e cartão de crédito consignado; consignado e empréstimo pessoal; produtos de seguros, incluindo seguros de prestamistas, de vida, de vida familiar e protegidos pelo FGTS, além dos serviços do Bmg Med e do Consórcio Bmg. Também oferece produtos de investimento, como certificados de depósitos bancários, cartas de crédito do agronegócio e cartas de crédito imobiliário. Além disso, a empresa oferece serviços bancários comerciais; debêntures; financiamento comercial; e capital de giro; e derivativos, como opções a termo não entregáveis, SWAP. A empresa era anteriormente conhecida como BMG Financeira S.A.Crédito, Financiamento e Investimento e mudou seu nome para Banco BMG S.A. em abril de 1989. O Banco BMG S.A. foi fundado em 1930 e está sediado em São Paulo, Brasil.",https://www.bancobmg.com.br,Financial Services,Serviços Financeiros,6.084211,0.74379104,0.12981,0.0781,3732044106.909548,5.78000020980835,Small Caps,65,0.9499999605221366,14.24999940783205,59.44,40.0,Baixo,,🟢,4.949999809265137,16.76768550555626
BEEF3,MINERVA,"A Minerva S.A. produz e comercializa carne bovina in natura, gado e subprodutos na América do Sul e internacionalmente. A empresa também atua no abate, desossa e processamento de carnes; venda de carnes resfriadas, congeladas e processadas, bem como produtos bovinos, suínos e aves; exportação e venda de gado vivo; e criação e venda de gado vivo, cordeiros, porcos e outros animais vivos. Além disso, comercializa eletricidade; comercializa proteínas e produtos alimentícios; vende marcas de terceiros principalmente produtos Swift; e prepara produtos para animais, que incluem farinha de carne e ossos, sangue e sebo. A Minerva S.A. foi fundada em 1957 e está sediada em Barretos, Brasil.",https://ri.minervafoods.com,Consumer Defensive,Consumo Defensivo,6.1159415,3.1753197,0.85664004,0.029300000000000003,4176850559.51383,4.230000019073486,Small Caps,45,0.6916351340302203,10.374527010453304,59.23,34.0,Médio,,🟡,4.099999904632568,3.1707345723113685
EUCA3,EUCATEX,"A Eucatex S.A. Indústria e Comércio produz e comercializa painéis de fibra e madeira no Brasil. A empresa fornece pisos laminados e vinílicos, portas, divisórias, painéis de fibra de média densidade (MDF) e aglomerado de média densidade (MDP), placas de fibra, tintas e vernizes, painéis decorativos, folhas de fibra de madeira, lacas e outros produtos. Produz também mudas de eucalipto e rodapés; e atua em consultoria de gestão empresarial, atividades imobiliárias, florestais, colheita, manejo florestal, transporte, logística de coleta de resíduos, material reciclado e eletricidade. A empresa atende principalmente os setores moveleiro e de construção civil. Também exporta seus produtos para os Estados Unidos e América Latina. A Eucatex S.A. Indústria e Comércio foi constituída em 1951 e está sediada em São Paulo, Brasil.",https://www.eucatex.com.br,Industrials,Indústria,6.213873,0.71578383,0.11956,0.048,1980901984.0,21.5,Small Caps,50,3.4599999066604674,51.89999859990701,58.57,34.0,Baixo,,🟢,21.5,0.0
VLID3,VALID,"A Valid Soluções S.A. fornece soluções de pagamentos digitais no Brasil, Argentina, Estados Unidos, Europa, Oriente Médio, África, Ásia e internacionalmente. Atua por meio de três segmentos: Meio de Pagamento, Identificação e Mobile. O segmento de Meios de Pagamento oferece produtos e soluções integradas, como chips e cartões, tarjas magnéticas, vales-presente, faturas e extratos bancários, além de soluções em identificação por radiofrequência, contactless e cartões, e pagamentos móveis. O segmento de Identificação oferece captura, armazenamento e administração de dados, impressões de segurança, reconhecimento e impressão digital, além de soluções governamentais digitais. Suas soluções são utilizadas na geração de sistemas informatizados para administração de bancos de dados, coleta de dados biométricos, impressão e personalização de documentos oficiais, identificação, soluções para cidades inteligentes, carimbos rastreáveis ​​e serviços de certificação digital. O segmento Mobile oferece serviços de emissão de extratos e tecnologias para uso em celulares; e mobilidade digital, como soluções NFC, TSM e HCE para provedores de serviços móveis. Também desenvolve tecnologias para uso em celulares, como recarga e pagamento, e produção de cartões para telecomunicações. Atende governos estaduais e órgãos públicos, instituições financeiras, empresas de telecomunicações, varejistas, cooperativas agrícolas e profissionais liberais. A empresa era anteriormente conhecida como Valid Soluções e Serviços de Segurança em Meios de Pagamento e Identificação S.A. e mudou seu nome para Valid Soluções S.A. em agosto de 2018. A Valid Soluções S.A. foi constituída em 1957 e está sediada em Sorocaba, Brasil.",https://www.valid.com,Industrials,Indústria,6.23494,0.9515055,0.15168001,0.1555,1620794431.2375832,20.700000762939453,Small Caps,85,3.3199999940559897,49.799999910839844,58.43,52.0,Baixo,,🟢,21.06999969482422,-1.7560462137816486
SAPR4,SANEPAR,"A Companhia de Saneamento do Paraná - SANEPAR presta serviços de saneamento no Brasil. A empresa atua na distribuição de água; coleta e tratamento de esgoto e resíduos sólidos; estudo, projeto e obras de novas instalações; expansão das redes de distribuição de água; e redes de coleta e tratamento de esgoto. Presta ainda serviços de consultoria e assistência técnica nas suas áreas de atuação. A Companhia de Saneamento do Paraná - SANEPAR foi fundada em 1963 e está sediada em Curitiba, Brasil.",https://www.sanepar.com.br,Utilities,Utilidades Públicas,6.310078,0.19924611,0.17944999,0.0258,12301213443.491241,8.140000343322754,Mid Caps,85,1.289999956153118,19.34999934229677,57.93,46.0,Baixo,,🟢,8.100000381469727,0.4938266662867668
EUCA4,EUCATEX,"A Eucatex S.A. Indústria e Comércio produz e comercializa painéis de fibra e madeira no Brasil. A empresa fornece pisos laminados e vinílicos, portas, divisórias, painéis de fibra de média densidade (MDF) e aglomerado de média densidade (MDP), placas de fibra, tintas e vernizes, painéis decorativos, folhas de fibra de madeira, lacas e outros produtos. Produz também mudas de eucalipto e rodapés; e atua em consultoria de gestão empresarial, atividades imobiliárias, florestais, colheita, manejo florestal, transporte, logística de coleta de resíduos, material reciclado e eletricidade. A empresa atende principalmente os setores moveleiro e de construção civil. Também exporta seus produtos para os Estados Unidos e América Latina. A Eucatex S.A. Indústria e Comércio foi constituída em 1951 e está sediada em São Paulo, Brasil.",https://www.eucatex.com.br,Industrials,Indústria,6.3179193,0.7277691,0.11956,0.0527,2014070631.5947266,21.860000610351562,Small Caps,65,3.4599999734646123,51.899999601969185,57.88,34.0,Baixo,,🟢,20.86000061035156,4.793863714000871
POMO3,MARCOPOLO,"A Marcopolo S.A. atua na fabricação e comercialização de ônibus, carrocerias e componentes no Brasil, África do Sul, Austrália, China, México, Argentina e internacionalmente. A empresa oferece ônibus intermunicipais, urbanos e microônibus, ônibus elétricos e ônibus híbridos; e família de microônibus Volare, como ônibus completo, com chassi e carroceria, carroceria para transporte escolar, fretamento executivo, transporte urbano e projetos especiais. Também está envolvida no desenvolvimento e produção de novos modelos sobre trilhos; produção de unidades com propulsão, automóveis de passageiros e fabricação de caixas para transporte de pessoas, TRAMs e EMUs; disponibilização de soluções de crédito para aquisição de ônibus e micro-ônibus; montagem, comercialização, importação e exportação de equipamentos de refrigeração e ar condicionado; e negócios de espuma para assentos. A empresa foi fundada em 1949 e está sediada em Caxias Do Sul, Brasil.",https://www.marcopolo.com.br,Industrials,Indústria,6.336735,2.0103593,0.30973,0.18239999999999998,8033154105.986298,6.210000038146973,Small Caps,60,0.97999995867698,14.699999380154699,57.76,46.0,Baixo,,🟢,6.010000228881836,3.3277837212719508
